age,id,permalink,username,to,text,date,retweets,favorites,mentions,hashtags,geo
62,1251431029933584387,https://twitter.com/raufaregbesola/status/1251431029933584387,raufaregbesola,FemAdesina,"Inna lillahi wa inna ilayhi raji'un. This is shocking, but Allah knows best, may He forgive his shortcomings and grant him the highest place in Aljannah firdaus, ameen.",2020-04-18 08:43:02+00:00,126,598,,,1251431029933584387
62,1250891072319995906,https://twitter.com/raufaregbesola/status/1250891072319995906,raufaregbesola,,Photos from today’s Press Briefing by the Presidential Task Force on Covid-19 : @itsdolapojulius,2020-04-16 20:57:26+00:00,12,50,@itsdolapojulius,,1250891072319995906
62,1241876534295777285,https://twitter.com/northflagay/status/1241876534295777285,northflagay,umwolverineboi,I followed this recipe,2020-03-22 23:56:53+00:00,0,0,,,1241876534295777285
62,1241876416741998597,https://twitter.com/northflagay/status/1241876416741998597,northflagay,swflgay,Of course! I just followed this recipe tonight but the sauce can def be repurposed to go with a different protein https://www.dinneratthezoo.com/teriyaki-pork-stir-fry/,2020-03-22 23:56:25+00:00,0,0,,,1241876416741998597
62,1241861376492044288,https://twitter.com/northflagay/status/1241861376492044288,northflagay,ty4e18,I ended up pairing it with some quinoa!,2020-03-22 22:56:39+00:00,0,1,,,1241861376492044288
62,1241858684206174215,https://twitter.com/northflagay/status/1241858684206174215,northflagay,,Haven’t been to the grocery in over a week and trying to put it off as long as possible so tonight’s creation is a pork tenderloin and veggie stir fry with a homemade teriyaki sauce,2020-03-22 22:45:57+00:00,0,76,,,1241858684206174215
62,1241436293197856771,https://twitter.com/northflagay/status/1241436293197856771,northflagay,,Lucky for me I was just able to pick up beer from my neighborhood brewery’s safe and sanitary curbside pickup!,2020-03-21 18:47:31+00:00,0,11,,,1241436293197856771
62,1241435273784897538,https://twitter.com/northflagay/status/1241435273784897538,northflagay,,Virtual happy hour with the parents and my sister at 4. I probably should start drinking now to prepare myself for this mess,2020-03-21 18:43:28+00:00,0,28,,,1241435273784897538
62,1241370965692514305,https://twitter.com/northflagay/status/1241370965692514305,northflagay,ankh1799,Yup! This one was just at the flowers though,2020-03-21 14:27:56+00:00,0,1,,,1241370965692514305
62,1241367428480798720,https://twitter.com/northflagay/status/1241367428480798720,northflagay,,One piece of good news is that I’ve just spotted the first hummingbird of the spring in my garden,2020-03-21 14:13:53+00:00,0,67,,,1241367428480798720
62,1241318094485835780,https://twitter.com/northflagay/status/1241318094485835780,northflagay,,New things I’ve discovered while self-isolating at home: someone in near proximity to my house has named their WiFi network “Titties”,2020-03-21 10:57:50+00:00,0,18,,,1241318094485835780
62,1241164665318707200,https://twitter.com/northflagay/status/1241164665318707200,northflagay,,So far tonight I’ve consumed 2 beers and cheez-its followed by wine,2020-03-21 00:48:10+00:00,0,29,,,1241164665318707200
62,1254535493515128833,https://twitter.com/GloriaEstefan/status/1254535493515128833,GloriaEstefan,DrBrianWeiss,"Amen, Dr.! Thank you! ",2020-04-26 22:19:04+00:00,10,36,,,1254535493515128833
62,1254223021432340481,https://twitter.com/GloriaEstefan/status/1254223021432340481,GloriaEstefan,bombakat,Thanks for that!,2020-04-26 01:37:25+00:00,0,0,,,1254223021432340481
62,1254222804209328128,https://twitter.com/GloriaEstefan/status/1254222804209328128,GloriaEstefan,Snowbirdwind,Not sure but where’s my “Love & luck”? I have NEVER just signed my name...,2020-04-26 01:36:33+00:00,0,0,,,1254222804209328128
62,1254222501980274688,https://twitter.com/GloriaEstefan/status/1254222501980274688,GloriaEstefan,demetria_c,I’m lovin’ this!!! Let’s take this show on the road!,2020-04-26 01:35:21+00:00,0,19,,,1254222501980274688
62,1253415605090217984,https://twitter.com/GloriaEstefan/status/1253415605090217984,GloriaEstefan,,"HAPPY BIRTHDAY, @LittleBirdErika May your day be full of love &amp; good wishes from the most special people in your life &amp; may this new trip around the sun be better than the ones before! Love &amp; good wishes! ",2020-04-23 20:09:02+00:00,3,27,@LittleBirdErika,,1253415605090217984
62,1253414633056034820,https://twitter.com/GloriaEstefan/status/1253414633056034820,GloriaEstefan,,"HAPPY 80th BIRTHDAY for your wonderful MUM, @davidriley0808 I know she had wonderful plans with you which couldn’t happen so please give her my love &amp; make her day special as you always do! ",2020-04-23 20:05:10+00:00,4,52,@davidriley0808,,1253414633056034820
62,1253352624679682053,https://twitter.com/GloriaEstefan/status/1253352624679682053,GloriaEstefan,,"HAPPY BIRTHDAY, VAL!! @@mumomegan I hope that your pup makes you smile and that you find a way to celebrate this special day with good health &amp; love! Many lovely wishes for beautiful things ahead! ",2020-04-23 15:58:46+00:00,3,34,@mumomegan,,1253352624679682053
62,1253082005744619526,https://twitter.com/GloriaEstefan/status/1253082005744619526,GloriaEstefan,,Earth has me inspired... Inspirada en este Día De La Tierra... https://www.instagram.com/p/B_TJlZglw0_/?igshid=qk0ao1vs9vg1,2020-04-22 22:03:25+00:00,13,78,,,1253082005744619526
62,1253038500246626304,https://twitter.com/GloriaEstefan/status/1253038500246626304,GloriaEstefan,CBSThisMorning,See you all tomorrow on @CBSThisMorning #PutOnYourMask,2020-04-22 19:10:33+00:00,30,118,@CBSThisMorning,#PutOnYourMask,1253038500246626304
62,1252666803253325832,https://twitter.com/GloriaEstefan/status/1252666803253325832,GloriaEstefan,davidjesse26,I’m happy to hear you like them!,2020-04-21 18:33:33+00:00,0,0,,,1252666803253325832
62,1253613389907025921,https://twitter.com/KarzaiH/status/1253613389907025921,KarzaiH,,Ramazan Mubarak! Wishing all good health and peace. HK,2020-04-24 09:14:57+00:00,21,229,,,1253613389907025921
62,1253045586497957888,https://twitter.com/KarzaiH/status/1253045586497957888,KarzaiH,,WISHING A HEALTHY PLANET! 50th ANNIVERSARY of #EARTH DAY: AFGHANISTAN,2020-04-22 19:38:42+00:00,37,356,,#EARTH,1253045586497957888
62,1252562128659070976,https://twitter.com/KarzaiH/status/1252562128659070976,KarzaiH,,"Recent progress in the peace process had raised people's hopes. Unfortunately, the flames of conflict continue to be fueled. I urge both Afghan sides to engage in dialogue, end the bloodshed and bring lasting peace to our beloved country.",2020-04-21 11:37:37+00:00,29,234,,,1252562128659070976
62,1252511034113327104,https://twitter.com/KarzaiH/status/1252511034113327104,KarzaiH,,"“I have said this since the process began. I do hope India will join the peace process in support of a sovereign & united Afghanistan with a strong govt, in keeping with the traditional friendship between India & Afghanistan,” Hamid Karzai told @the_hindu",2020-04-21 08:14:35+00:00,14,62,@the_hindu,,1252511034113327104
62,1252289260696174592,https://twitter.com/KarzaiH/status/1252289260696174592,KarzaiH,,"Former President Hamid Karzai met Mr. Mohammad Ibrahim Tahiryan, Special Representative of Iran, on Monday. Exchanged views on the peace process and regional cooperation. Hamid Karzai thanked Amb. Tahiryan for Iran's offer to help against #Corona pandemic in Afghanistan.",2020-04-20 17:33:20+00:00,6,32,,#Corona,1252289260696174592
62,1251577402662191104,https://twitter.com/KarzaiH/status/1251577402662191104,KarzaiH,,A good meeting with Ambassador Vinay Kumar. Discussed the peace process and the importance of regional cooperation.,2020-04-18 18:24:40+00:00,21,113,,,1251577402662191104
62,1250829647794728962,https://twitter.com/KarzaiH/status/1250829647794728962,KarzaiH,,"Hamid Karzai met Amb. of Iran, Mr. Bahadur Aminian on Thursday. While discussing the peace process, the former President emphasized the importance of an active role in the process of regional countries so peace could be restored at the earliest.",2020-04-16 16:53:21+00:00,5,33,,,1250829647794728962
62,1250373932546265090,https://twitter.com/KarzaiH/status/1250373932546265090,KarzaiH,,"Former President Hamid Karzai met Ambassador of Russia, Alexander Mantytskiy, on Tuesday. Exchanged views on the situation in Afghanistan and the region.",2020-04-15 10:42:31+00:00,5,41,,,1250373932546265090
62,1249747716244045831,https://twitter.com/KarzaiH/status/1249747716244045831,KarzaiH,,"Maharaja Sahib @capt_amarinder, greetings and happy Vaisakhi. With best wishes and regards. HK",2020-04-13 17:14:09+00:00,10,119,@capt_amarinder,,1249747716244045831
62,1248681268805394432,https://twitter.com/KarzaiH/status/1248681268805394432,KarzaiH,,"The killing of civilians in Balkh & Bank employees in Herat by armed groups is extreme criminality against our people and the ongoing efforts for peace. I once again, call on all Afghan sides to join hands for #peace in Afghanistan.",2020-04-10 18:36:28+00:00,35,244,,#peace,1248681268805394432