age,id,permalink,username,to,text,date,retweets,favorites,mentions,hashtags,geo
25,1250888614608699392,https://twitter.com/grantbryant7072/status/1250888614608699392,grantbryant7072,,Turned 20 today but also missing this guy a little ,2020-04-16 20:47:40+00:00,0,24,,,1250888614608699392
25,1250885388043870208,https://twitter.com/grantbryant7072/status/1250885388043870208,grantbryant7072,SketchBot400,Worst feeling ever when you don’t hit the perry ,2020-04-16 20:34:51+00:00,0,1,,,1250885388043870208
25,1250569243059347456,https://twitter.com/grantbryant7072/status/1250569243059347456,grantbryant7072,stephany99_,Bet,2020-04-15 23:38:36+00:00,0,1,,,1250569243059347456
25,1249979956509065221,https://twitter.com/grantbryant7072/status/1249979956509065221,grantbryant7072,tamgracee, ,2020-04-14 08:36:59+00:00,0,1,,,1249979956509065221
25,1246632286440714242,https://twitter.com/grantbryant7072/status/1246632286440714242,grantbryant7072,stephany99_,I still can’t grow a mustache,2020-04-05 02:54:33+00:00,0,1,,,1246632286440714242
25,1246250623198097408,https://twitter.com/grantbryant7072/status/1246250623198097408,grantbryant7072,WillReynolds13,She said your soft ,2020-04-04 01:37:57+00:00,0,1,,,1246250623198097408
25,1244177090854785024,https://twitter.com/grantbryant7072/status/1244177090854785024,grantbryant7072,RyWill13,That’s the rwilly I know,2020-03-29 08:18:28+00:00,0,2,,,1244177090854785024
25,1240903581244375046,https://twitter.com/grantbryant7072/status/1240903581244375046,grantbryant7072,sebaa_314,Happy bday babe ,2020-03-20 07:30:43+00:00,0,1,,,1240903581244375046
25,1240837767820537856,https://twitter.com/grantbryant7072/status/1240837767820537856,grantbryant7072,,Happy 6 years,2020-03-20 03:09:12+00:00,0,0,,,1240837767820537856
25,1252322390823931905,https://twitter.com/_Wordsrweapons/status/1252322390823931905,_Wordsrweapons,,SMOKIN HELLA WEED IM ON THAT ALKAHALLLLLLLLLL,2020-04-20 19:44:59+00:00,0,0,,,1252322390823931905
25,1252046351837192194,https://twitter.com/_Wordsrweapons/status/1252046351837192194,_Wordsrweapons,,In the world of porn are onlyfans girls the equivalent of sound cloud rappers?,2020-04-20 01:28:06+00:00,0,0,,,1252046351837192194
25,1252039079769735169,https://twitter.com/_Wordsrweapons/status/1252039079769735169,_Wordsrweapons,,off the priv feelin’ priv,2020-04-20 00:59:13+00:00,0,0,,,1252039079769735169
25,1252021200462639105,https://twitter.com/_Wordsrweapons/status/1252021200462639105,_Wordsrweapons,bitchim999,Shabba,2020-04-19 23:48:10+00:00,0,7,,,1252021200462639105
25,1250805433540853765,https://twitter.com/_Wordsrweapons/status/1250805433540853765,_Wordsrweapons,,"If your ex hasn't hit you up all quarantine, you were the problem.",2020-04-16 15:17:08+00:00,0,0,,,1250805433540853765
25,1250805252057518080,https://twitter.com/_Wordsrweapons/status/1250805252057518080,_Wordsrweapons,,all though she maybe cute she just a substitute,2020-04-16 15:16:25+00:00,0,0,,,1250805252057518080
25,1250800578025754625,https://twitter.com/_Wordsrweapons/status/1250800578025754625,_Wordsrweapons,,Remember when hos use to say ‘I wouldn’t fuck him if he was the last guy on earth’ well bitch we finna see,2020-04-16 14:57:51+00:00,0,0,,,1250800578025754625
25,1250799408343420928,https://twitter.com/_Wordsrweapons/status/1250799408343420928,_Wordsrweapons,,The one year I want to get my shit together the world wants to end,2020-04-16 14:53:12+00:00,2,0,,,1250799408343420928
25,1250208918933893121,https://twitter.com/_Wordsrweapons/status/1250208918933893121,_Wordsrweapons,ShesMorgan,"Queen, but I ain’t finish it yet",2020-04-14 23:46:48+00:00,1,0,,,1250208918933893121
25,1250075194959384576,https://twitter.com/_Wordsrweapons/status/1250075194959384576,_Wordsrweapons,XXL,All of section80,2020-04-14 14:55:26+00:00,7,191,,,1250075194959384576
25,1253043385625010176,https://twitter.com/danigbay/status/1253043385625010176,danigbay,BW,Can't wait to travel again!,2020-04-22 19:29:58+00:00,0,0,,,1253043385625010176
25,1253022341476433920,https://twitter.com/danigbay/status/1253022341476433920,danigbay,xxjcarr88xx,I think so! He and his wife had a son last year named Oscar ,2020-04-22 18:06:20+00:00,0,0,,,1253022341476433920
25,1253018059578552321,https://twitter.com/danigbay/status/1253018059578552321,danigbay,xxjcarr88xx,I'm positive his baby boy can cook a mean steak ,2020-04-22 17:49:20+00:00,0,2,,,1253018059578552321
25,1252998121874788352,https://twitter.com/danigbay/status/1252998121874788352,danigbay,GordonRamsay,What are you making for dinner?,2020-04-22 16:30:06+00:00,0,4,,,1252998121874788352
25,1252738186880507905,https://twitter.com/danigbay/status/1252738186880507905,danigbay,JeffreeStar,$29dandelions #jeffreestarapproved,2020-04-21 23:17:13+00:00,0,0,,#jeffreestarapproved,1252738186880507905
25,1252512465054646272,https://twitter.com/danigbay/status/1252512465054646272,danigbay,,Tiktok songs are stuck in my head especially that one that goes I see you at the movies or something like that ,2020-04-21 08:20:16+00:00,0,1,,,1252512465054646272
25,1252020478392381443,https://twitter.com/danigbay/status/1252020478392381443,danigbay,,pic.twitter.com/zYVFerZOZ6,2020-04-19 23:45:18+00:00,0,0,,,1252020478392381443
25,1251639681998979072,https://twitter.com/danigbay/status/1251639681998979072,danigbay,WheresTelly_,Alrighty that'll be cool! We'll be passing through kerman in about an hour if it's still available we can pick it up :),2020-04-18 22:32:09+00:00,0,0,,,1251639681998979072
25,1251639443569602560,https://twitter.com/danigbay/status/1251639443569602560,danigbay,L0velyVengeance,No girl I can make as many as you need with it :),2020-04-18 22:31:12+00:00,0,1,,,1251639443569602560
25,1251638638175109120,https://twitter.com/danigbay/status/1251638638175109120,danigbay,L0velyVengeance,Aww you're amazing Amber! You didn't have to!,2020-04-18 22:28:00+00:00,0,1,,,1251638638175109120
25,1252349351986229251,https://twitter.com/Albrown_29/status/1252349351986229251,Albrown_29,Tre4Trey_, ,2020-04-20 21:32:07+00:00,0,2,,,1252349351986229251
25,1250279018353446914,https://twitter.com/Albrown_29/status/1250279018353446914,Albrown_29,teena_thach,Praying for you heavily ,2020-04-15 04:25:21+00:00,0,1,,,1250279018353446914
25,1244433572615688192,https://twitter.com/Albrown_29/status/1244433572615688192,Albrown_29,sarahteeeezy,Thank you Sarah love you ,2020-03-30 01:17:38+00:00,0,1,,,1244433572615688192
25,1244393454274146304,https://twitter.com/Albrown_29/status/1244393454274146304,Albrown_29,Erik_Lowe,Thank you ,2020-03-29 22:38:13+00:00,0,1,,,1244393454274146304
25,1236401417088159744,https://twitter.com/Albrown_29/status/1236401417088159744,Albrown_29,Tre4Trey_,Only the beginning baby ,2020-03-07 21:20:43+00:00,0,5,,,1236401417088159744
25,1235285776587358208,https://twitter.com/Albrown_29/status/1235285776587358208,Albrown_29,stanleyeurope,Babyyy ,2020-03-04 19:27:34+00:00,0,5,,,1235285776587358208
25,1233068546734706688,https://twitter.com/Albrown_29/status/1233068546734706688,Albrown_29,Tre4Trey_,Right!! ,2020-02-27 16:37:05+00:00,0,0,,,1233068546734706688
25,1232924168879927296,https://twitter.com/Albrown_29/status/1232924168879927296,Albrown_29,TheMandyMoore,Favvvvvsss ,2020-02-27 07:03:23+00:00,0,0,,,1232924168879927296
25,1232497247457181696,https://twitter.com/Albrown_29/status/1232497247457181696,Albrown_29,michaelangelbae,.... I know ,2020-02-26 02:46:57+00:00,0,0,,,1232497247457181696
25,1231803537228566545,https://twitter.com/Albrown_29/status/1231803537228566545,Albrown_29,_Kapuaaaa,That damn Renton Chinese ,2020-02-24 04:50:23+00:00,0,1,,,1231803537228566545
25,1253081804518690817,https://twitter.com/clemeent/status/1253081804518690817,clemeent,Til_cara,Je hurle parce que... moi c'est pareil !,2020-04-22 22:02:37+00:00,0,0,,,1253081804518690817
25,1253026219844648961,https://twitter.com/clemeent/status/1253026219844648961,clemeent,ptigwn,Je remets pas les pieds dedans je t’explique !,2020-04-22 18:21:45+00:00,0,5,,,1253026219844648961
25,1252963163533959168,https://twitter.com/clemeent/status/1252963163533959168,clemeent,,Avec #chromatica j'ai l'impression d'avoir deux personnalités qui s'affrontent en permanence en moi : celle qui est surexcitée et celle qui est saoulée,2020-04-22 14:11:11+00:00,0,4,,#chromatica #chromatica,1252963163533959168
25,1252902512639737856,https://twitter.com/clemeent/status/1252902512639737856,clemeent,maximecarbone,Est-ce que je passais ma vie à refaire le défilé Mugler sur le remix de ScheiBe (c'est à dire a faire des allers-retours sur la pointe des pieds dans ma chambre) ? OF COURSE QUE OUI !,2020-04-22 10:10:11+00:00,0,5,,,1252902512639737856
25,1252878213174312963,https://twitter.com/clemeent/status/1252878213174312963,clemeent,,Je viens de me tartiner de crème solaire pour pouvoir bosser au soleil : l'odeur m'a tellement rappelé l'été que j'ai failli pleurer,2020-04-22 08:33:38+00:00,0,6,,,1252878213174312963
25,1252868976461246464,https://twitter.com/clemeent/status/1252868976461246464,clemeent,,La vie d'avant me manque tellement genre même recommencer à dater des loosers qui vont me prendre pour de la merde ça me fait envie là tout de suite,2020-04-22 07:56:55+00:00,1,16,,,1252868976461246464
25,1252866902453448704,https://twitter.com/clemeent/status/1252866902453448704,clemeent,aedlein,"ALRIGHT LONDON, ARE U READY TO RIDE WITH ME ?",2020-04-22 07:48:41+00:00,0,4,,,1252866902453448704
25,1252722254749880320,https://twitter.com/clemeent/status/1252722254749880320,clemeent,Doi_Tao,"Country Taylor is the best Taylor, point barre",2020-04-21 22:13:54+00:00,1,1,,,1252722254749880320
25,1252690877987926017,https://twitter.com/clemeent/status/1252690877987926017,clemeent,SimonCR_,Vivement la semaine pro ,2020-04-21 20:09:13+00:00,0,0,,,1252690877987926017
25,1252690416203431936,https://twitter.com/clemeent/status/1252690416203431936,clemeent,SimonCR_,"TASTE ! Azkaban en livre et film, mon pref pref pref",2020-04-21 20:07:23+00:00,0,1,,,1252690416203431936
25,1251933524895993856,https://twitter.com/bakermayfield/status/1251933524895993856,bakermayfield,,"Never forget the 168 killed, 680 injured and the lives changed forever on this day 25 years ago @OKCNM #WeRemember #oklahomastrong ",2020-04-19 17:59:46+00:00,361,3354,@OKCNM,#WeRemember #oklahomastrong,1251933524895993856
25,1250516498306629632,https://twitter.com/bakermayfield/status/1250516498306629632,bakermayfield,,and other groups who are pivotal in the community year round and serving as role models in the face of significant adversity due to COVID-19. Link: https://shop.clevelandbrowns.com #backtoourroots #giveback,2020-04-15 20:09:01+00:00,630,5626,,#backtoourroots #giveback,1250516498306629632
25,1250515505527447552,https://twitter.com/bakermayfield/status/1250515505527447552,bakermayfield,,"They’re here! New unis are ! What do you think? Comment below &amp; tag your @Browns tailgating crew. All proceeds from jersey sales go to benefit the Browns “Hats off to our Heroes” fund, which will aid health care professionals, first responders, educational professionals...",2020-04-15 20:05:04+00:00,592,10931,@Browns,,1250515505527447552
25,1247982932146388994,https://twitter.com/bakermayfield/status/1247982932146388994,bakermayfield,OU_Football,Tennessee people!! Cmon!!,2020-04-08 20:21:32+00:00,31,610,,,1247982932146388994
25,1247562211343478785,https://twitter.com/bakermayfield/status/1247562211343478785,bakermayfield,,"RIP to the legend - Bobby Mitchell. He was a pioneer, Hall of Famer, husband, son and father and forever a @Browns &amp; @NFL all-time great. #brownsfamily #fastestmanintheleague #RIP",2020-04-07 16:29:44+00:00,295,4388,@Browns @NFL,#brownsfamily #fastestmanintheleague #RIP,1247562211343478785
25,1241109021412614144,https://twitter.com/bakermayfield/status/1241109021412614144,bakermayfield,,Sooner Nation - Let’s do this! #BoomerSooner #GiveBack #EndSeniorHunger @OU_Athletics @OU_Football @mealsonwheelsok,2020-03-20 21:07:04+00:00,507,4455,@OU_Athletics @OU_Football @mealsonwheelsok,#BoomerSooner #GiveBack #EndSeniorHunger,1241109021412614144
25,1240702054231769094,https://twitter.com/bakermayfield/status/1240702054231769094,bakermayfield,,Let’s rally together #CLE. Giving back to the LAND and hope others will too. We’re matching all of your donations up to $50K. Link to donate: http://www.greaterclevelandfoodbank.org/MayfieldMatch #WeFeedCLE,2020-03-19 18:09:55+00:00,1971,16199,,#CLE #WeFeedCLE,1240702054231769094
25,1236128484268707840,https://twitter.com/bakermayfield/status/1236128484268707840,bakermayfield,,"Type 1 Diabetes is no joke. On #FamilyTeamFriday, please help me support @Mandrews_81 &amp; all those diagnosed w T1D to find a cure &amp; beat this disease. Link in Mark’s bio to donate or go to: http://bit.ly/JDRF2020 #jdrfaz #onewalkaz #jdrfonewalk #T1D #beyondtypeone #warriorup",2020-03-07 03:16:11+00:00,282,1656,@Mandrews_81,#FamilyTeamFriday #jdrfaz #onewalkaz #jdrfonewalk #T1D #beyondtypeone #warriorup,1236128484268707840
25,1232025955809390593,https://twitter.com/bakermayfield/status/1232025955809390593,bakermayfield,FranchiseOK,We can make this happen!,2020-02-24 19:34:12+00:00,41,1093,,,1232025955809390593
25,1230711457764896770,https://twitter.com/bakermayfield/status/1230711457764896770,bakermayfield,up2batTony,No?,2020-02-21 04:30:51+00:00,0,86,,,1230711457764896770
25,1253031449705447430,https://twitter.com/theterras/status/1253031449705447430,theterras,, EXCLUSIVE: Manager Mark Molesley gives us his thoughts on the season being cancelled. He also talks about his pride in our achievements and he gives Terras fans advice on staying busy and active #UpTheTerras https://uptheterras.co.uk/2020/04/22/mark-molesley-hard-work-continues/,2020-04-22 18:42:32+00:00,2,26,,#UpTheTerras,1253031449705447430
25,1252991817055981570,https://twitter.com/theterras/status/1252991817055981570,theterras,, TERRAS ABROAD: Chris Bousfield is the latest fan to join our Terras Abroad series. Chris has worked around the world and is currently based in Bangladesh #UpTheTerras https://uptheterras.co.uk/2020/04/22/terras-abroad-chris-bousfield/,2020-04-22 16:05:03+00:00,1,6,,#UpTheTerras,1252991817055981570
25,1252935157822246912,https://twitter.com/theterras/status/1252935157822246912,theterras,, National League Statement: Remaining League Matches To Be Cancelled https://uptheterras.co.uk/2020/04/22/national-league-statement-remaining-matches-cancelled/,2020-04-22 12:19:54+00:00,4,3,,,1252935157822246912
25,1252933586401005570,https://twitter.com/theterras/status/1252933586401005570,theterras,TheVanaramaNL,The resolution to cancel remaining games in the 2019-20 season has been passed. Decisions on promotion & relegation are yet to be made. #UpTheTerras,2020-04-22 12:13:40+00:00,7,18,,#UpTheTerras,1252933586401005570
25,1252886719545970690,https://twitter.com/theterras/status/1252886719545970690,theterras,," Take Two: Saturday 2nd May at 3 pm, we will be showing full 90-minute coverage of our 2018/19 finale with Farnborough, a very special final day of the season! #UpTheTerras https://uptheterras.co.uk/2020/04/22/take-two-weymouth-vs-farnborough/",2020-04-22 09:07:26+00:00,6,21,,#UpTheTerras,1252886719545970690
25,1252606502784901122,https://twitter.com/theterras/status/1252606502784901122,theterras,," After the success of the first quiz, in partnership with Chickerell Primary Academy, we present our second Terras Schools Quiz. This time the questions are focussed on all things Terras #UpTheTerras https://uptheterras.co.uk/2020/04/21/terras-schools-quiz-2/",2020-04-21 14:33:57+00:00,3,8,,#UpTheTerras,1252606502784901122
25,1252311557528334341,https://twitter.com/theterras/status/1252311557528334341,theterras,, ON THIS DAY Last season @C_Brooks_4 popped up with a late equaliser at home to Chesham Utd. A goal that turned out to be crucial in our pursuit of the Southern League title! #UpTheTerras,2020-04-20 19:01:56+00:00,2,25,@C_Brooks_4,#UpTheTerras,1252311557528334341
25,1252241537817337857,https://twitter.com/theterras/status/1252241537817337857,theterras,,Weymouth Football Club are saddened to learn of the passing of former player Dickie Dowsett https://uptheterras.co.uk/2020/04/20/terras-mourn-dickie-dowsett/,2020-04-20 14:23:42+00:00,1,11,,,1252241537817337857
25,1252183327311880192,https://twitter.com/theterras/status/1252183327311880192,theterras,," “I’ve still got the aim to get back into international recognition.” Abdulai Baggie’s desire to return to action for Sierra Leone, the country of his birth, is still burning brighter than ever. https://uptheterras.co.uk/2020/04/20/baggie-sets-sights-on-sierra-leone-games/ #UpTheTerras",2020-04-20 10:32:24+00:00,1,5,,#UpTheTerras,1252183327311880192
25,1252156115552473088,https://twitter.com/theterras/status/1252156115552473088,theterras,, Thank you to everyone who entered our first Terras Schools Quiz in partnership with Chickerell Primary Academy. The winners are listed via the link. #UpTheTerras https://uptheterras.co.uk/2020/04/20/terras-schools-quiz-winners/,2020-04-20 08:44:16+00:00,2,7,,#UpTheTerras,1252156115552473088
25,1253130609024696320,https://twitter.com/doddleoddle/status/1253130609024696320,doddleoddle,AniaMags,Ye,2020-04-23 01:16:33+00:00,0,6,,,1253130609024696320
25,1253130566645559296,https://twitter.com/doddleoddle/status/1253130566645559296,doddleoddle,,treat my brain like a teary baby it goes what about THIS THING AHH and I’m like “nonono shhhh shhh it’s okay it’s okay you don’t have to think about that rn just go to sleep shh shhhh” and it’s soothed and then it’s like buT THIS THING “shh brain shhhh it’s okay it’s okay” etc,2020-04-23 01:16:23+00:00,319,2710,,,1253130566645559296
25,1252942770190323713,https://twitter.com/doddleoddle/status/1252942770190323713,doddleoddle,matthaig1,LOL,2020-04-22 12:50:09+00:00,0,29,,,1252942770190323713
25,1252938174529142785,https://twitter.com/doddleoddle/status/1252938174529142785,doddleoddle,jstodtv,U JUST WAIT,2020-04-22 12:31:53+00:00,0,8,,,1252938174529142785
25,1252937300859904001,https://twitter.com/doddleoddle/status/1252937300859904001,doddleoddle,tyleroakley,BAHHAHAHA,2020-04-22 12:28:25+00:00,1,276,,,1252937300859904001
25,1252741448572768257,https://twitter.com/doddleoddle/status/1252741448572768257,doddleoddle,,what happens next to Bean The Bug?! This may shock you,2020-04-21 23:30:10+00:00,33,960,,,1252741448572768257
25,1252728770638819328,https://twitter.com/doddleoddle/status/1252728770638819328,doddleoddle,,SURPRISE here's a children's story i wrote for u and for for @savechildrenuk #SAVEWITHSTORIES it's about Bean The Bug lol,2020-04-21 22:39:48+00:00,133,1546,@savechildrenuk,#SAVEWITHSTORIES,1252728770638819328
25,1252719155574341634,https://twitter.com/doddleoddle/status/1252719155574341634,doddleoddle,,i've honestly forgotten how many people there'd normally be on a street,2020-04-21 22:01:35+00:00,212,6522,,,1252719155574341634
25,1252701262480621569,https://twitter.com/doddleoddle/status/1252701262480621569,doddleoddle,wt_francesca,This is SO CUTE and u have been robbed of attention,2020-04-21 20:50:29+00:00,0,37,,,1252701262480621569
25,1252698717846745088,https://twitter.com/doddleoddle/status/1252698717846745088,doddleoddle,aaddtsotu,my music against LA LA Land footage rip,2020-04-21 20:40:23+00:00,307,5438,,,1252698717846745088
25,1253091174551699456,https://twitter.com/Jaaxjuinio/status/1253091174551699456,Jaaxjuinio,atienzamariel_,mcdo muna tayo para 2ns subj na pasok hahahahahahahaahahahahha,2020-04-22 22:39:51+00:00,0,1,,,1253091174551699456
25,1253089829560086530,https://twitter.com/Jaaxjuinio/status/1253089829560086530,Jaaxjuinio,,GUSTO KO NA PUMASOK SCHOOL DI PAKO NATUTULOG HUHU DI KO NA KAYA tooooo,2020-04-22 22:34:31+00:00,0,2,,,1253089829560086530
25,1253073361954983936,https://twitter.com/Jaaxjuinio/status/1253073361954983936,Jaaxjuinio,,napaka panget ng sleeping schedule ko huhu ayaw ko na,2020-04-22 21:29:05+00:00,1,4,,,1253073361954983936
25,1252941778761613313,https://twitter.com/Jaaxjuinio/status/1252941778761613313,Jaaxjuinio,TheodOREOS,OMYGHD I CAN’TTT STOP LAUGHING HAHAHAHAHAHAHAHAHAHAAH PLS,2020-04-22 12:46:13+00:00,0,3,,,1252941778761613313
25,1252939492534579200,https://twitter.com/Jaaxjuinio/status/1252939492534579200,Jaaxjuinio,ruwaannn,ANG GALING WATCH NIYO GUYS!,2020-04-22 12:37:08+00:00,0,1,,,1252939492534579200
25,1252935135843868672,https://twitter.com/Jaaxjuinio/status/1252935135843868672,Jaaxjuinio,K4THNIELER, ,2020-04-22 12:19:49+00:00,0,1,,,1252935135843868672
25,1252931575035031553,https://twitter.com/Jaaxjuinio/status/1252931575035031553,Jaaxjuinio,cliffordbanal_,masama yan lalo ngayon ecq dapat stay at home muna saka na dapat yan.,2020-04-22 12:05:40+00:00,0,1,,,1252931575035031553
25,1252721978202394624,https://twitter.com/Jaaxjuinio/status/1252721978202394624,Jaaxjuinio,,wazzzzzuupppp ang hirap maka sleep ,2020-04-21 22:12:48+00:00,0,1,,,1252721978202394624
25,1252702812279980032,https://twitter.com/Jaaxjuinio/status/1252702812279980032,Jaaxjuinio,CGutrrez,fake news ka lumayas ka sa twitter ko,2020-04-21 20:56:39+00:00,0,1,,,1252702812279980032
25,1252697537808498688,https://twitter.com/Jaaxjuinio/status/1252697537808498688,Jaaxjuinio,,napaka epal ,2020-04-21 20:35:41+00:00,0,2,,,1252697537808498688
25,1252999600878899200,https://twitter.com/MeganPlays/status/1252999600878899200,MeganPlays,PlayAdoptMe,Omg it’s so cute! And really creative! I feel all the love put into this one! ,2020-04-22 16:35:59+00:00,9,646,,,1252999600878899200
25,1252805057202065409,https://twitter.com/MeganPlays/status/1252805057202065409,MeganPlays,notlyssy,That’s so insane!! Yes I watch all of their videos. I’m so invested in their family hahaha,2020-04-22 03:42:56+00:00,0,15,,,1252805057202065409
25,1252804678313803776,https://twitter.com/MeganPlays/status/1252804678313803776,MeganPlays,notlyssy,I LOVE THEM!!! ,2020-04-22 03:41:25+00:00,0,24,,,1252804678313803776
25,1252755234490908675,https://twitter.com/MeganPlays/status/1252755234490908675,MeganPlays,,"These past couples days I’ve just been riddled with anxiety and uncertainty about I have no idea what. I wanted to take this time to remind you all that everything is not what it seems on social media, and to be strong and remember you’re enough ",2020-04-22 00:24:57+00:00,29,918,,,1252755234490908675
25,1252734687740678144,https://twitter.com/MeganPlays/status/1252734687740678144,MeganPlays,sunfIowertwink,THANK YOU ,2020-04-21 23:03:18+00:00,0,12,,,1252734687740678144
25,1252734391312359424,https://twitter.com/MeganPlays/status/1252734391312359424,MeganPlays,Koalatea_World,"You’re so sweet, thank you for the kind and uplifting comments! ",2020-04-21 23:02:08+00:00,0,42,,,1252734391312359424
25,1252733927527198721,https://twitter.com/MeganPlays/status/1252733927527198721,MeganPlays,,Always peachy ,2020-04-21 23:00:17+00:00,29,1357,,,1252733927527198721
25,1252709571224895490,https://twitter.com/MeganPlays/status/1252709571224895490,MeganPlays,Jackson28420422,"I don’t ask them for items, I asked them for information about the game! Maybe try not jumping to conclusions? No hate ",2020-04-21 21:23:30+00:00,0,71,,,1252709571224895490
25,1252708426091843587,https://twitter.com/MeganPlays/status/1252708426091843587,MeganPlays,,Casual appreciation post for the Adopt Me team!!! They are always so sweet to me and my silly requests @PlayAdoptMe,2020-04-21 21:18:57+00:00,13,1011,@PlayAdoptMe,,1252708426091843587
25,1252651218872172552,https://twitter.com/MeganPlays/status/1252651218872172552,MeganPlays,,"Roblox group idea: ability to set group ranks on time basis EX: a user must be in the group for 1 week then gets promoted to X rank. If we had this, i think it would really cut down on the spam bots littering group walls! @Roblox",2020-04-21 17:31:38+00:00,15,475,@Roblox,,1252651218872172552
25,1252245807044145157,https://twitter.com/Sosaa_Foreverr/status/1252245807044145157,Sosaa_Foreverr,breeeenana,Yeaa you good fr ,2020-04-20 14:40:40+00:00,0,1,,,1252245807044145157
25,1252240522892111872,https://twitter.com/Sosaa_Foreverr/status/1252240522892111872,Sosaa_Foreverr,breeeenana,Its not gonna hurt as bad as people make it seem,2020-04-20 14:19:40+00:00,0,0,,,1252240522892111872
25,1252163676079038464,https://twitter.com/Sosaa_Foreverr/status/1252163676079038464,Sosaa_Foreverr,weedthotss,Got 6 blunts ready for wen im off work today ,2020-04-20 09:14:19+00:00,0,0,,,1252163676079038464
25,1252163417978351616,https://twitter.com/Sosaa_Foreverr/status/1252163417978351616,Sosaa_Foreverr,breeeenana,Do it sis,2020-04-20 09:13:17+00:00,0,0,,,1252163417978351616
25,1252163054198030336,https://twitter.com/Sosaa_Foreverr/status/1252163054198030336,Sosaa_Foreverr,,4/20 ohhh hey baby ,2020-04-20 09:11:50+00:00,0,1,,,1252163054198030336
25,1252053331096322049,https://twitter.com/Sosaa_Foreverr/status/1252053331096322049,Sosaa_Foreverr,,"Ion expect much anymore , best way to avoid disappointment ",2020-04-20 01:55:50+00:00,0,0,,,1252053331096322049
25,1251862687388139522,https://twitter.com/Sosaa_Foreverr/status/1251862687388139522,Sosaa_Foreverr,,DC Youngfly deadass made this song & its actually lit too ,2020-04-19 13:18:17+00:00,0,1,,,1251862687388139522
25,1251253195969568770,https://twitter.com/Sosaa_Foreverr/status/1251253195969568770,Sosaa_Foreverr,AaliyahLegion,Back N Forth ,2020-04-17 20:56:23+00:00,0,0,,,1251253195969568770
25,1251235848500072448,https://twitter.com/Sosaa_Foreverr/status/1251235848500072448,Sosaa_Foreverr,fay_spiffy,Hennything is possible hennywhere you wanna go ,2020-04-17 19:47:27+00:00,0,1,,,1251235848500072448
25,1250445325522874368,https://twitter.com/Sosaa_Foreverr/status/1250445325522874368,Sosaa_Foreverr,kevon_mcClary,Thats reg shit .,2020-04-15 15:26:12+00:00,0,1,,,1250445325522874368
