age,id,permalink,username,to,text,date,retweets,favorites,mentions,hashtags,geo
25,1253052960722104331,https://twitter.com/Lethamyr_RL/status/1253052960722104331,Lethamyr_RL,,"Hey guys! Going to be doing that $100 Universal Queue within the hour! Just getting my 2nd stream up and running for a live recording, remember you CAN'T expose what rank you are, you have to tell me other reasons why I should pick you up!",2020-04-22 20:08:01+00:00,1,43,,,1253052960722104331
25,1252979985700265984,https://twitter.com/Lethamyr_RL/status/1252979985700265984,Lethamyr_RL,,"Finishing a map I started a year ago, Waverace in @RocketLeague, still worth finishing? https://www.twitch.tv/lethamyr_rl",2020-04-22 15:18:02+00:00,3,189,@RocketLeague,,1252979985700265984
25,1252811704527798274,https://twitter.com/Lethamyr_RL/status/1252811704527798274,Lethamyr_RL,BifkyRL,Memories ,2020-04-22 04:09:21+00:00,3,260,,,1252811704527798274
25,1252777286794915841,https://twitter.com/Lethamyr_RL/status/1252777286794915841,Lethamyr_RL,Gimmickrl,Twinsies!,2020-04-22 01:52:35+00:00,3,187,,,1252777286794915841
25,1252722591023931395,https://twitter.com/Lethamyr_RL/status/1252722591023931395,Lethamyr_RL,,"Sometimes you really do just need to make a pillow fort, get delivery, eat junk food with movies and games, and sometimes you're reminded why you never became an Architect",2020-04-21 22:15:14+00:00,10,400,,,1252722591023931395
25,1252666820273848321,https://twitter.com/Lethamyr_RL/status/1252666820273848321,Lethamyr_RL,CloudFuel,4 years of making everything you touch better for everyone ,2020-04-21 18:33:38+00:00,1,136,,,1252666820273848321
25,1252578010911424515,https://twitter.com/Lethamyr_RL/status/1252578010911424515,Lethamyr_RL,,SHOWCASING ROCKET LEAGUE TETHERBALL w/ @GlenHumphrey https://www.twitch.tv/lethamyr_rl,2020-04-21 12:40:44+00:00,3,50,@GlenHumphrey,,1252578010911424515
25,1252574973178363906,https://twitter.com/Lethamyr_RL/status/1252574973178363906,Lethamyr_RL,,"Also if you make my team win, you get $50 each instead of $33 ;)",2020-04-21 12:28:39+00:00,0,83,,,1252574973178363906
25,1252574713055981569,https://twitter.com/Lethamyr_RL/status/1252574713055981569,Lethamyr_RL,BGsucraM,"Oh I know, I just want it for content. They can't tell me what rank they are! Just why they'd be a good teammate",2020-04-21 12:27:37+00:00,0,21,,,1252574713055981569
25,1252571888703934469,https://twitter.com/Lethamyr_RL/status/1252571888703934469,Lethamyr_RL,,"Hey community! At some point in the next day or so I will be queuing in the @RL6mans Universal Queue (a queue for all ranks) and I will be putting up a prize of $100 for the winning team, I will be doing this with captains and you guys have to pitch why I should pick you up!",2020-04-21 12:16:24+00:00,4,273,@RL6mans,,1252571888703934469
25,1252953948215894018,https://twitter.com/fumfumfum3/status/1252953948215894018,fumfumfum3,,久しぶりにフィリピンの歌歌ってみた Japanese Tries To Sing IVANA by Soulstice - Fumiya https://youtu.be/fuwbHwj2ZwE @YouTubeより,2020-04-22 13:34:34+00:00,87,272,@YouTube,,1252953948215894018
25,1252532995791020032,https://twitter.com/fumfumfum3/status/1252532995791020032,fumfumfum3,,大量ワサビ入りロシアンルーレットやってみたよ。。 https://youtu.be/v-sK_t9g8vA @ytcreatorsjapan,2020-04-21 09:41:51+00:00,136,427,@ytcreatorsjapan,,1252532995791020032
25,1252478287244218374,https://twitter.com/fumfumfum3/status/1252478287244218374,fumfumfum3,,昔よくやってた歌ってみた系の動画やりたいなあ。。。誰かカラオケみたいな簡単なオケ作れる人とかいませんか？？ メロディー作って欲しいです ,2020-04-21 06:04:28+00:00,81,377,,,1252478287244218374
25,1252254739812610048,https://twitter.com/fumfumfum3/status/1252254739812610048,fumfumfum3,fumfumfum3,色々な方からDMをいただいてとてもありがたいです！本当に助かります 他にもできる方がいたらぜひお願いします リンク貼っておきます FumiShun Base(フィリピンチャンネル) https://www.youtube.com/timedtext_cs_panel?c=UCi7Ofw4sJynsacr_i6uk_lA&amp;tab=2 ふみしゅんべーす （日本語チャンネル） https://www.youtube.com/timedtext_cs_panel?c=UCqyeyK2GSFpfp2FAhuEaoPA&amp;tab=2,2020-04-20 15:16:10+00:00,78,239,,,1252254739812610048
25,1251765005512347649,https://twitter.com/fumfumfum3/status/1251765005512347649,fumfumfum3,,フィリピンの方のFumiShun Baseのチャンネルに日本語の翻訳、日本の方のふみしゅべーすチャンネルに英語翻訳つけてくれる方がいたらとても嬉しいです 誰か助けて 特に自分はタグリッシュって言葉を使ってるしペラペラじゃないのでなかなか理解してもらうのが難しい ,2020-04-19 06:50:08+00:00,111,487,,,1251765005512347649
25,1251478215245172736,https://twitter.com/fumfumfum3/status/1251478215245172736,fumfumfum3,itsdredesu,Please cut my hair andre ,2020-04-18 11:50:32+00:00,62,658,,,1251478215245172736
25,1251477755247489026,https://twitter.com/fumfumfum3/status/1251477755247489026,fumfumfum3,,これ最近の動画なんだけどおもしろすぎたから日本語タイトルと翻訳もつけて編集してみた！よかったら見てみてください https://youtu.be/sVI-2okitUw,2020-04-18 11:48:42+00:00,112,348,,,1251477755247489026
25,1251468602097582082,https://twitter.com/fumfumfum3/status/1251468602097582082,fumfumfum3,aichan15bllove,嬉しい！でも俺について書けることなんてあるのかな？ ありがとう ,2020-04-18 11:12:20+00:00,84,297,,,1251468602097582082
25,1251426196807536640,https://twitter.com/fumfumfum3/status/1251426196807536640,fumfumfum3,,これからの状況がすこしでも良くなりますように。自分の為だけじゃなく今は周りの人のことも考えて大切な人の為にstay homeで https://youtu.be/Panfqq4Z43I,2020-04-18 08:23:50+00:00,200,686,,,1251426196807536640
25,1251423743978508288,https://twitter.com/fumfumfum3/status/1251423743978508288,fumfumfum3,,みんなありがとう Stay safe,2020-04-18 08:14:05+00:00,129,443,,,1251423743978508288
25,1251404292822622208,https://twitter.com/Mzelle_Evans/status/1251404292822622208,Mzelle_Evans,, ,2020-04-18 06:56:48+00:00,0,0,,,1251404292822622208
25,1251028086763765765,https://twitter.com/Mzelle_Evans/status/1251028086763765765,Mzelle_Evans,NetflixFR,Guillermo del Toro!,2020-04-17 06:01:53+00:00,0,0,,,1251028086763765765
25,1250672790488915973,https://twitter.com/Mzelle_Evans/status/1250672790488915973,Mzelle_Evans,TheRealLukevans,Happy birthday Luke ,2020-04-16 06:30:04+00:00,0,0,,,1250672790488915973
25,1250668758827491328,https://twitter.com/Mzelle_Evans/status/1250668758827491328,Mzelle_Evans,minxerys,Sweet ,2020-04-16 06:14:03+00:00,0,1,,,1250668758827491328
25,1250049837556473856,https://twitter.com/Mzelle_Evans/status/1250049837556473856,Mzelle_Evans,MrHiboo_,Énorme xD,2020-04-14 13:14:40+00:00,0,0,,,1250049837556473856
25,1250049724285059073,https://twitter.com/Mzelle_Evans/status/1250049724285059073,Mzelle_Evans,didichandouidou,@jb_maltese ,2020-04-14 13:14:13+00:00,0,0,@jb_maltese,,1250049724285059073
25,1250019145288159233,https://twitter.com/Mzelle_Evans/status/1250019145288159233,Mzelle_Evans,Elise_bouu,Pour te rappeler qu'on est en confinement c'est sur !,2020-04-14 11:12:43+00:00,0,0,,,1250019145288159233
25,1250018626444439552,https://twitter.com/Mzelle_Evans/status/1250018626444439552,Mzelle_Evans,ADR51327254,Ton île à l'air magnifique,2020-04-14 11:10:39+00:00,0,1,,,1250018626444439552
25,1250018436584964098,https://twitter.com/Mzelle_Evans/status/1250018436584964098,Mzelle_Evans,KraShe_n,@minxerys,2020-04-14 11:09:54+00:00,0,1,@minxerys,,1250018436584964098
25,1249928681897766917,https://twitter.com/Mzelle_Evans/status/1249928681897766917,Mzelle_Evans,ladygaga,This women... ,2020-04-14 05:13:14+00:00,0,0,,,1249928681897766917
25,1156709195196129285,https://twitter.com/TKaliszewski/status/1156709195196129285,TKaliszewski,,I got a baller gf,2019-07-31 23:32:17+00:00,0,1,,,1156709195196129285
25,617062174758993921,https://twitter.com/TKaliszewski/status/617062174758993921,TKaliszewski,,#UpForWhatever,2015-07-03 20:07:41+00:00,0,4,,#UpForWhatever,617062174758993921
25,536189748214509568,https://twitter.com/TKaliszewski/status/536189748214509568,TKaliszewski,,May be small but 5 down already,2014-11-22 16:09:32+00:00,0,0,,,536189748214509568
25,536126681501954051,https://twitter.com/TKaliszewski/status/536126681501954051,TKaliszewski,,Time to kick off the bear season,2014-11-22 11:58:56+00:00,0,0,,,536126681501954051
25,475049737364967425,https://twitter.com/TKaliszewski/status/475049737364967425,TKaliszewski,,"There are sober kids in Africa, finish your god damn beer! @jschack20",2014-06-06 23:00:58+00:00,1,1,@jschack20,,475049737364967425
25,421513191622209536,https://twitter.com/TKaliszewski/status/421513191622209536,TKaliszewski,ctruchanowicz,@ctruchanowicz14 which iPhone?,2014-01-10 05:25:50+00:00,0,0,,,421513191622209536
25,421512233383124992,https://twitter.com/TKaliszewski/status/421512233383124992,TKaliszewski,ctruchanowicz,@ctruchanowicz14 as in???,2014-01-10 05:22:02+00:00,0,0,,,421512233383124992
25,421510262093799424,https://twitter.com/TKaliszewski/status/421510262093799424,TKaliszewski,rac1121,@rac1121 @ctruchanowicz14 what wrong with your phone???,2014-01-10 05:14:12+00:00,0,0,@rac1121,,421510262093799424
25,384518814786134016,https://twitter.com/TKaliszewski/status/384518814786134016,TKaliszewski,,The replay machine is currently not working,2013-09-30 03:23:24+00:00,0,0,,,384518814786134016
25,375813048285798400,https://twitter.com/TKaliszewski/status/375813048285798400,TKaliszewski,,Rivera is just too good,2013-09-06 02:49:47+00:00,0,2,,,375813048285798400
25,1253037551599841281,https://twitter.com/nottodaynicole/status/1253037551599841281,nottodaynicole,RapSheet,fuck being a pats fan I guess love that for me,2020-04-22 19:06:47+00:00,0,0,,,1253037551599841281
25,1252825072349245441,https://twitter.com/nottodaynicole/status/1252825072349245441,nottodaynicole,,"shout out to my ex walked so thank u, next could run.",2020-04-22 05:02:28+00:00,0,1,,,1252825072349245441
25,1252822735480213505,https://twitter.com/nottodaynicole/status/1252822735480213505,nottodaynicole,johnkrasinski,quesadilla. bacon. steak. cheese. hot sauce. that’s it.,2020-04-22 04:53:11+00:00,0,0,,,1252822735480213505
25,1252798608321032192,https://twitter.com/nottodaynicole/status/1252798608321032192,nottodaynicole,EW,"Cap, Spider-Man, Loki, Rocket & Bucky",2020-04-22 03:17:18+00:00,0,1,,,1252798608321032192
25,1252714019669995520,https://twitter.com/nottodaynicole/status/1252714019669995520,nottodaynicole,jamescuevas,it’s what she deserves !,2020-04-21 21:41:11+00:00,0,2,,,1252714019669995520
25,1252691345036079104,https://twitter.com/nottodaynicole/status/1252691345036079104,nottodaynicole,AdamSchefter,literally wtf I hate football,2020-04-21 20:11:05+00:00,0,0,,,1252691345036079104
25,1252443967758589953,https://twitter.com/nottodaynicole/status/1252443967758589953,nottodaynicole,jamescuevas,right ,2020-04-21 03:48:05+00:00,0,0,,,1252443967758589953
25,1252423560737378313,https://twitter.com/nottodaynicole/status/1252423560737378313,nottodaynicole,,are all these videos that are coming out titled “filmed BEFORE Quarantine!” really filmed before ? jus curious ...,2020-04-21 02:27:00+00:00,0,2,,,1252423560737378313
25,1252400925060132872,https://twitter.com/nottodaynicole/status/1252400925060132872,nottodaynicole,bocasclouds,better not be fibbin me again,2020-04-21 00:57:03+00:00,0,0,,,1252400925060132872
25,1252312771921731584,https://twitter.com/nottodaynicole/status/1252312771921731584,nottodaynicole,michellenh13,SOSOSOSOS ITS WHAT WE DESERVE,2020-04-20 19:06:46+00:00,0,2,,,1252312771921731584
25,1252934751230603265,https://twitter.com/floridaaquarium/status/1252934751230603265,floridaaquarium,,"These adult corals were rescued as part of the @Zoos_Aquariums Florida Reef Tract Rescue Project. Thanks to our partners: @MyFWC, @NOAAFisheries, @FloridaKeysNMS. Research activities occurred within the Florida Keys National Marine Sanctuary and under permit.",2020-04-22 12:18:17+00:00,0,1,@zoos_aquariums @MyFWC @NOAAFisheries @FloridaKeysNMS,,1252934751230603265
25,1252934750072901633,https://twitter.com/floridaaquarium/status/1252934750072901633,floridaaquarium,,The Florida Aquarium is using this breakthrough research to grow and reproduce this coral to eventually restore the Florida Reef Tract! Join us in our mission to protect coral reefs with a donation today at: https://www.facebook.com/donate/236794614299901/. #ConservationNeverCloses,2020-04-22 12:18:17+00:00,0,2,,#ConservationNeverCloses,1252934750072901633
25,1252934749020184577,https://twitter.com/floridaaquarium/status/1252934749020184577,floridaaquarium,,These corals release fully developed larvae that swims immediately after release. This coral population has been severely affected in Florida Reefs due to Stony Coral Tissue Loss Disease. #FloridaAquarium,2020-04-22 12:18:17+00:00,0,1,,#FloridaAquarium,1252934749020184577
25,1252934746549731329,https://twitter.com/floridaaquarium/status/1252934746549731329,floridaaquarium,,"Happy #EarthDay! The Florida Aquarium has made history once again! This time becoming the first in the world to reproduce ridged cactus coral in human care. Until now, the larval release time of this coral had never been recorded.",2020-04-22 12:18:16+00:00,16,42,,#EarthDay #EarthDay,1252934746549731329
25,1252920472657895424,https://twitter.com/floridaaquarium/status/1252920472657895424,floridaaquarium,,There's no better way to celebrate #EarthDay! Thank you to the @TB_Times for sharing the news of our scientific breakthrough. #ConservationNeverCloses #FloridaAquarium,2020-04-22 11:21:33+00:00,5,11,@TB_Times,#EarthDay #EarthDay #ConservationNeverCloses #FloridaAquarium,1252920472657895424
25,1252919236999200768,https://twitter.com/floridaaquarium/status/1252919236999200768,floridaaquarium,,We have made history once again! This time becoming the first in the world to reproduce ridged cactus coral in human care. Thank you to @CNN for sharing our conservation story! #ConservationNeverCloses,2020-04-22 11:16:38+00:00,22,83,@CNN,#ConservationNeverCloses,1252919236999200768
25,1251975476127637504,https://twitter.com/floridaaquarium/status/1251975476127637504,floridaaquarium,,When baby alligator and stingray meet! #FloridaAquarium,2020-04-19 20:46:28+00:00,9,66,,#FloridaAquarium,1251975476127637504
25,1251662756744495106,https://twitter.com/floridaaquarium/status/1251662756744495106,floridaaquarium,,We #LightItBlue for our #HealthCareWorkers! #FloridaAquarium,2020-04-19 00:03:50+00:00,8,46,,#LightItBlue #HealthCareWorkers #FloridaAquarium,1251662756744495106
25,1251191140709212161,https://twitter.com/floridaaquarium/status/1251191140709212161,floridaaquarium,,"An ocean of thanks to our healthcare workers, first responders, grocery store workers, truck drivers and port officials for working so hard for our City during these tough times! #FloridaAquarium",2020-04-17 16:49:48+00:00,11,38,,#FloridaAquarium,1251191140709212161
25,1250874649593950209,https://twitter.com/floridaaquarium/status/1250874649593950209,floridaaquarium,,Round and round we go! #FloridaAquarium #QuarantineLife,2020-04-16 19:52:11+00:00,12,45,,#FloridaAquarium #QuarantineLife,1250874649593950209
25,1248387652295864321,https://twitter.com/GiGiHadid/status/1248387652295864321,GiGiHadid,ceara_howell,I honestly switch it up depending on my daily mood last night I was Roy lolllllll,2020-04-09 23:09:44+00:00,149,2785,,,1248387652295864321
25,1248016601510600704,https://twitter.com/GiGiHadid/status/1248016601510600704,GiGiHadid,cockm0ss,"I know, random that I saw this.... but same. She’s actually the coolest ",2020-04-08 22:35:19+00:00,71,943,,,1248016601510600704
25,1246462006770700289,https://twitter.com/GiGiHadid/status/1246462006770700289,GiGiHadid,hadidsglow,Wild !!!!,2020-04-04 15:37:55+00:00,380,5331,,,1246462006770700289
25,1244423234109485061,https://twitter.com/GiGiHadid/status/1244423234109485061,GiGiHadid,hadidcoeur,"You should be able to use the mix in another pan, just keep checking the center with a knife to see how cooked-through it is, cause the temp/time is prob different depending on the size of the pan! X",2020-03-30 00:36:33+00:00,40,308,,,1244423234109485061
25,1244365491017265153,https://twitter.com/GiGiHadid/status/1244365491017265153,GiGiHadid,,"Banana Muffin Recipe #UCANLEARN at home Here’s a link for guidance on how we can all keep kids learning during these difficult times, via @UNICEFUSA : https://bit.ly/2Wh3cMt",2020-03-29 20:47:06+00:00,329,2709,@UNICEFUSA,#UCANLEARN,1244365491017265153
25,1243666990205673475,https://twitter.com/GiGiHadid/status/1243666990205673475,GiGiHadid,,Registering only takes 2 mins !!!!!!! Pause Netflix and do it real quick ,2020-03-27 22:31:31+00:00,63,776,,,1243666990205673475
25,1243666217665204227,https://twitter.com/GiGiHadid/status/1243666217665204227,GiGiHadid,,Rock the Vote just emailed me to remind me that the New York Presidential Primary Election is on Tues April 28 and the deadline to register to vote in person or by mail is Fri April 3 !!! Link below for all the information you need to vote in your state!,2020-03-27 22:28:27+00:00,121,1137,,,1243666217665204227
25,1241758073397673984,https://twitter.com/GiGiHadid/status/1241758073397673984,GiGiHadid,," my heart was with u all for those few minutes and is with everyone around the world who is suffering right now. Sending light, love, and strength.",2020-03-22 16:06:10+00:00,203,1409,,,1241758073397673984
25,1241755417002356743,https://twitter.com/GiGiHadid/status/1241755417002356743,GiGiHadid,,5 mins from now!!!!!! Wherever you are ! Join in and take part in a GLOBAL PRAYER - 2 mins of consciousness — spread loving and healing thoughts & energy to our brothers and sisters around the world ,2020-03-22 15:55:36+00:00,404,2590,,,1241755417002356743
25,1239190564576342031,https://twitter.com/GiGiHadid/status/1239190564576342031,GiGiHadid,,Please donate what/where you can - support our brothers and sisters across the country!! I’m starting with @FeedingAmerica to help food banks respond to Covid-19. https://www.feedingamerica.org/ It’s important to keep sharing different ways we can help— would love more ideas:) xG,2020-03-15 14:03:48+00:00,420,2965,@FeedingAmerica,,1239190564576342031
25,1253127014107590657,https://twitter.com/nodrohzomono/status/1253127014107590657,nodrohzomono,Bibisback,Legend! ,2020-04-23 01:02:16+00:00,0,0,,,1253127014107590657
25,1253126805705408513,https://twitter.com/nodrohzomono/status/1253126805705408513,nodrohzomono,HollaAtLin,Ish ngada!,2020-04-23 01:01:27+00:00,0,1,,,1253126805705408513
25,1252198120697597952,https://twitter.com/nodrohzomono/status/1252198120697597952,nodrohzomono,Sufie910,Ayyy thanks fam :’),2020-04-20 11:31:11+00:00,0,1,,,1252198120697597952
25,1252181385399414785,https://twitter.com/nodrohzomono/status/1252181385399414785,nodrohzomono,,Fuck I missed 4:20pm 4/20/2020 ,2020-04-20 10:24:41+00:00,32,56,,,1252181385399414785
25,1252049052952379392,https://twitter.com/nodrohzomono/status/1252049052952379392,nodrohzomono,,Wow this week dah start bulan Ramadhan ,2020-04-20 01:38:50+00:00,16,37,,,1252049052952379392
25,1251453021420056576,https://twitter.com/nodrohzomono/status/1251453021420056576,nodrohzomono,zamzlhlmy,I loooooove this so much ugh ,2020-04-18 10:10:25+00:00,1,1,,,1251453021420056576
25,1251214403598315520,https://twitter.com/nodrohzomono/status/1251214403598315520,nodrohzomono,,Ugh so in love with Aquaria from RuPaul’s Drag Race season 10 ,2020-04-17 18:22:14+00:00,0,2,,,1251214403598315520
25,1251136272078221314,https://twitter.com/nodrohzomono/status/1251136272078221314,nodrohzomono,Azfarheri,HAHAHAHAHA AZFAR!!!!!,2020-04-17 13:11:46+00:00,0,0,,,1251136272078221314
25,1251129601020981248,https://twitter.com/nodrohzomono/status/1251129601020981248,nodrohzomono,GYGYVS,Boo vs Me,2020-04-17 12:45:16+00:00,48,110,,,1251129601020981248
25,1251128815209771010,https://twitter.com/nodrohzomono/status/1251128815209771010,nodrohzomono,akmalmfao,Okay I take it back I don’t want it no more,2020-04-17 12:42:09+00:00,0,1,,,1251128815209771010
25,1253052705033064448,https://twitter.com/DemiRoseMawby/status/1253052705033064448,DemiRoseMawby,,Happy Earth day! ,2020-04-22 20:07:00+00:00,49,636,,,1253052705033064448
25,1253052490779688965,https://twitter.com/DemiRoseMawby/status/1253052490779688965,DemiRoseMawby,,It’s a blessing to have lemons and limes here on earth. Absolute fave. ,2020-04-22 20:06:09+00:00,25,350,,,1253052490779688965
25,1252751551682293760,https://twitter.com/DemiRoseMawby/status/1252751551682293760,DemiRoseMawby,, ,2020-04-22 00:10:19+00:00,381,8950,,,1252751551682293760
25,1251122280773681152,https://twitter.com/DemiRoseMawby/status/1251122280773681152,DemiRoseMawby,,All I ever want to eat daily is poke bowls.,2020-04-17 12:16:11+00:00,27,520,,,1251122280773681152
25,1250850264099282944,https://twitter.com/DemiRoseMawby/status/1250850264099282944,DemiRoseMawby,, ,2020-04-16 18:15:17+00:00,433,8863,,,1250850264099282944
25,1250849210402045956,https://twitter.com/DemiRoseMawby/status/1250849210402045956,DemiRoseMawby,, ,2020-04-16 18:11:06+00:00,711,13098,,,1250849210402045956
25,1249084696400736256,https://twitter.com/DemiRoseMawby/status/1249084696400736256,DemiRoseMawby,,Question: When you think of someone do you think that you might pop up in their head too?,2020-04-11 21:19:33+00:00,66,935,,,1249084696400736256
25,1248330083242323969,https://twitter.com/DemiRoseMawby/status/1248330083242323969,DemiRoseMawby,, ,2020-04-09 19:20:59+00:00,770,12252,,,1248330083242323969
25,1247634110195150848,https://twitter.com/DemiRoseMawby/status/1247634110195150848,DemiRoseMawby,,Alexa play Lovely Day - Bill Withers ,2020-04-07 21:15:26+00:00,516,10955,,,1247634110195150848
25,1247513145146572801,https://twitter.com/DemiRoseMawby/status/1247513145146572801,DemiRoseMawby,YasmineChanel,Thank you angel! ,2020-04-07 13:14:46+00:00,5,167,,,1247513145146572801
25,1253114557465272320,https://twitter.com/WilsonOriginal2/status/1253114557465272320,WilsonOriginal2,_Twapewa,Ndee mwati ngoo keko ? Aee ,2020-04-23 00:12:46+00:00,0,1,,,1253114557465272320
25,1253114085966852104,https://twitter.com/WilsonOriginal2/status/1253114085966852104,WilsonOriginal2,_Twapewa,Wow fada Lord .,2020-04-23 00:10:54+00:00,0,0,,,1253114085966852104
25,1253113798204043265,https://twitter.com/WilsonOriginal2/status/1253113798204043265,WilsonOriginal2,GabrielEddy,Wuuka peni ano Bossa ? Talk to me talk to me so I hook you up with contacts .,2020-04-23 00:09:45+00:00,0,0,,,1253113798204043265
25,1253113116101095424,https://twitter.com/WilsonOriginal2/status/1253113116101095424,WilsonOriginal2,etuhole95,*ombuda*,2020-04-23 00:07:03+00:00,0,0,,,1253113116101095424
25,1253113045036998656,https://twitter.com/WilsonOriginal2/status/1253113045036998656,WilsonOriginal2,etuhole95,Ombida tayiteka ,2020-04-23 00:06:46+00:00,0,0,,,1253113045036998656
25,1253112763817361408,https://twitter.com/WilsonOriginal2/status/1253112763817361408,WilsonOriginal2,fonmands,"African parents never cared about shit, not even about your dreams.",2020-04-23 00:05:39+00:00,1,5,,,1253112763817361408
25,1253112431263481861,https://twitter.com/WilsonOriginal2/status/1253112431263481861,WilsonOriginal2,MatNuugulu, Kombwela kakupu.,2020-04-23 00:04:19+00:00,0,1,,,1253112431263481861
25,1253112129189826560,https://twitter.com/WilsonOriginal2/status/1253112129189826560,WilsonOriginal2,asteria_nahole,Ndee owaxwama nena ,2020-04-23 00:03:07+00:00,0,0,,,1253112129189826560
25,1253111909139841025,https://twitter.com/WilsonOriginal2/status/1253111909139841025,WilsonOriginal2,MagdalenaMbute,Eeno ,2020-04-23 00:02:15+00:00,1,2,,,1253111909139841025
25,1253110424532369409,https://twitter.com/WilsonOriginal2/status/1253110424532369409,WilsonOriginal2,Gina_Mbau25,"Osho neh osho, uukoloni waxula nale.",2020-04-22 23:56:21+00:00,0,0,,,1253110424532369409
25,1252040506042916865,https://twitter.com/josh_lewis10/status/1252040506042916865,josh_lewis10,,@ParkerMcCollum how much to play my wedding next July??,2020-04-20 01:04:53+00:00,0,1,@ParkerMcCollum,,1252040506042916865
25,1251715959401836544,https://twitter.com/josh_lewis10/status/1251715959401836544,josh_lewis10,tylertarbox12,That team was so good. Colby Lewis on that staff too #Stud,2020-04-19 03:35:15+00:00,0,2,,#Stud,1251715959401836544
25,1251216719764434945,https://twitter.com/josh_lewis10/status/1251216719764434945,josh_lewis10,DallasStars,We’re in trouble @dlewtx,2020-04-17 18:31:27+00:00,0,0,@dlewtx,,1251216719764434945
25,1250520156486467586,https://twitter.com/josh_lewis10/status/1250520156486467586,josh_lewis10,SCAC_Sports,Austin college,2020-04-15 20:23:33+00:00,0,3,,,1250520156486467586
25,1249894446096961544,https://twitter.com/josh_lewis10/status/1249894446096961544,josh_lewis10,tylertarbox12,Should have never been added in the first place. I said it when it happened too,2020-04-14 02:57:12+00:00,0,1,,,1249894446096961544
25,1249891906072580101,https://twitter.com/josh_lewis10/status/1249891906072580101,josh_lewis10,,@Rangers further embarrassment that you added Josh Hamilton to the Rangers HOF. Not even listed here so laughable,2020-04-14 02:47:06+00:00,0,2,@Rangers,,1249891906072580101
25,1249805342227271683,https://twitter.com/josh_lewis10/status/1249805342227271683,josh_lewis10,FOXSportsSW,"1,4,6",2020-04-13 21:03:08+00:00,0,0,,,1249805342227271683
25,1249470098672410625,https://twitter.com/josh_lewis10/status/1249470098672410625,josh_lewis10,NoLayingUp,"Favorite athlete of all time, he is truly amazing. Father, Sportsman, Icon, all of the above. STUD",2020-04-12 22:51:00+00:00,0,6,,,1249470098672410625
