age,id,permalink,username,to,text,date,retweets,favorites,mentions,hashtags,geo
25,1250969094226087939,https://twitter.com/Straight2vide0/status/1250969094226087939,Straight2vide0,,"#MeAt20 this was only five years ago, but I do have to say that this was one of the best years of my life thus far. For this, I picked my fave selfie from that summer where I looked like a Tumblr girl, and one from the end of the year when I changed my hairstyle",2020-04-17 02:07:28+00:00,0,4,,#MeAt20,1250969094226087939
25,1250934162858663943,https://twitter.com/Straight2vide0/status/1250934162858663943,Straight2vide0,heyits_chelseaa,"Dang, you hella cute tho ",2020-04-16 23:48:40+00:00,0,1,,,1250934162858663943
25,1250927605760524290,https://twitter.com/Straight2vide0/status/1250927605760524290,Straight2vide0,kiersk0alaaa,I've been a fan of their older stuff for years! I just felt like listening to one song and that led to a continuous binge ,2020-04-16 23:22:36+00:00,0,0,,,1250927605760524290
25,1250926569046016000,https://twitter.com/Straight2vide0/status/1250926569046016000,Straight2vide0,kiersk0alaaa,SAME. Some of their songs really hit you in the feels!,2020-04-16 23:18:29+00:00,0,1,,,1250926569046016000
25,1250915441024925702,https://twitter.com/Straight2vide0/status/1250915441024925702,Straight2vide0,,I've been listening to The Veronicas' first two albums for the past day or so because they are pretty damn great and very underappreciated,2020-04-16 22:34:16+00:00,0,1,,,1250915441024925702
25,1250914695814565890,https://twitter.com/Straight2vide0/status/1250914695814565890,Straight2vide0,,Current quarantine mood: not being able to feel my legs because the cat has been sleeping on my lap for the past while and I do not want to disturb her,2020-04-16 22:31:19+00:00,0,4,,,1250914695814565890
25,1251040830468456448,https://twitter.com/diggy_simmons/status/1251040830468456448,diggy_simmons,N_Tony_O,Fried chicken from the Chinese spot hit differently,2020-04-17 06:52:31+00:00,461,1960,,,1251040830468456448
25,1251006851971346432,https://twitter.com/diggy_simmons/status/1251006851971346432,diggy_simmons,,Y’all had the orange Rugrats VHS tapes?,2020-04-17 04:37:30+00:00,9765,39948,,,1251006851971346432
25,1249468269129371648,https://twitter.com/diggy_simmons/status/1249468269129371648,diggy_simmons,, Happy Resurrection ,2020-04-12 22:43:44+00:00,133,778,,,1249468269129371648
25,1249152509559672832,https://twitter.com/diggy_simmons/status/1249152509559672832,diggy_simmons,maurachanz,Big love ,2020-04-12 01:49:01+00:00,0,1,,,1249152509559672832
25,1246320404861337600,https://twitter.com/diggy_simmons/status/1246320404861337600,diggy_simmons,,copped a nutri bullet. Boutta make a smoothie every hour just cause,2020-04-04 06:15:14+00:00,37,802,,,1246320404861337600
25,1244440334819454976,https://twitter.com/diggy_simmons/status/1244440334819454976,diggy_simmons,,Ne-Yo vs Johnta ~ Legendary! ,2020-03-30 01:44:31+00:00,116,334,,,1244440334819454976
25,1242717773718884352,https://twitter.com/diggy_simmons/status/1242717773718884352,diggy_simmons,,Prayers and well wishes to Karl Anthony-Towns and his mother ,2020-03-25 07:39:40+00:00,83,513,,,1242717773718884352
25,1242554365669306368,https://twitter.com/diggy_simmons/status/1242554365669306368,diggy_simmons,,No way I’m running through my candles this fast. Shit,2020-03-24 20:50:20+00:00,192,835,,,1242554365669306368
25,1242535003470221312,https://twitter.com/diggy_simmons/status/1242535003470221312,diggy_simmons,,Can soap get dirty?,2020-03-24 19:33:24+00:00,57,420,,,1242535003470221312
25,1242337247141040130,https://twitter.com/diggy_simmons/status/1242337247141040130,diggy_simmons,,I need a show to get addicted to. Games Of Thrones / Succession type beat,2020-03-24 06:27:35+00:00,32,365,,,1242337247141040130
25,1253020750224568321,https://twitter.com/SuperLeague/status/1253020750224568321,SuperLeague,, HEMMINGS WAY This week Eddie Hemmings reminisces about World Club Challenges gone by and what the future holds for the competition READ https://bit.ly/3aAAz0s,2020-04-22 18:00:01+00:00,0,7,,,1253020750224568321
25,1252950102949408769,https://twitter.com/SuperLeague/status/1252950102949408769,SuperLeague,,Four more of the best for #WallpaperWednesday Who do you want to see next week? #SL25,2020-04-22 13:19:17+00:00,0,15,,#WallpaperWednesday #SL25,1252950102949408769
25,1252899952008654848,https://twitter.com/SuperLeague/status/1252899952008654848,SuperLeague,,On This Day: 22.4.2016 Jonny Lomax marks his comeback with two tries against Leeds as @Saints1890 win by four points #SuperLeague pic.twitter.com/PUZgAE30Es,2020-04-22 10:00:00+00:00,7,28,@Saints1890,#SuperLeague,1252899952008654848
25,1252869752692723714,https://twitter.com/SuperLeague/status/1252869752692723714,SuperLeague,,On This Day: 22.4.2017 Tom Lineham's try in the dying moments secures victory for @WarringtonRLFC #SuperLeague,2020-04-22 08:00:00+00:00,2,55,@WarringtonRLFC,#SuperLeague,1252869752692723714
25,1252677998123331584,https://twitter.com/SuperLeague/status/1252677998123331584,SuperLeague,david_fifita_, This #StayHome,2020-04-21 19:18:03+00:00,0,4,,#StayHome #StayHome,1252677998123331584
25,1252673458925760512,https://twitter.com/SuperLeague/status/1252673458925760512,SuperLeague,, SL Rewind It's a World Club Challenge double this week @warringtonrlfc @brisbanebroncos (Thurs 8:05pm) @wiganwarriorsrl @Cronulla_sharks (Fri 7:45pm) Who you backing? #SLRewind,2020-04-21 19:00:00+00:00,3,18,@WarringtonRLFC @brisbanebroncos @WiganWarriorsRL @Cronulla_Sharks,#SLRewind,1252673458925760512
25,1252522517497085953,https://twitter.com/SuperLeague/status/1252522517497085953,SuperLeague,,Due to the current situation with Covid-19 Dacia Magic Weekend has been postponed DETAILS HERE: https://bit.ly/2zjMym3 #MagicWeekend,2020-04-21 09:00:13+00:00,31,63,,#MagicWeekend,1252522517497085953
25,1252507364516753409,https://twitter.com/SuperLeague/status/1252507364516753409,SuperLeague,,On This Day: 21.4.2017 Patrick Ah Van scores two tries for @WidnesRL who record their first home win of the season #SuperLeague,2020-04-21 08:00:00+00:00,4,48,@WidnesRL,#SuperLeague,1252507364516753409
25,1252261995488804864,https://twitter.com/SuperLeague/status/1252261995488804864,SuperLeague,,This week's #FiveWaystoWellbeing focuses on taking notice and the benefits it can have on mental fitness. Here's @RLCares ambassador &amp; Man of Steel panellist @RHunterPaul to tell you more..... #RugbyLeagueUnited,2020-04-20 15:45:00+00:00,2,8,@RLCares @RHunterPaul,#FiveWaystoWellbeing #RugbyLeagueUnited,1252261995488804864
25,1252221210450104320,https://twitter.com/SuperLeague/status/1252221210450104320,SuperLeague,LamploughJamie, ,2020-04-20 13:02:56+00:00,7,34,,,1252221210450104320
25,1253082758643175424,https://twitter.com/zerowondering/status/1253082758643175424,zerowondering,,"Massive thank you to everyone who is working despite what’s happening globally who help sustain everyone. A lot of people don’t think about the delivery person getting your food or packages, the cashiers who work at necessary supermarkets and especially doctors and nurses.",2020-04-22 22:06:25+00:00,122,1826,,,1253082758643175424
25,1252642468161556486,https://twitter.com/zerowondering/status/1252642468161556486,zerowondering,ActualAero,This is the most dangerous quote a man could ever say in 2020: “Is Mythra from Fire Emblem?”,2020-04-21 16:56:52+00:00,473,5154,,,1252642468161556486
25,1252601861934284800,https://twitter.com/zerowondering/status/1252601861934284800,zerowondering,Anti,"Kaiji. It may seem weird at first, but trust me. It's a gritty, short, intense gambling anime that gets dark.",2020-04-21 14:15:30+00:00,5,378,,,1252601861934284800
25,1252599733119565827,https://twitter.com/zerowondering/status/1252599733119565827,zerowondering,,"Hey, wouldn't it be cool if I played a Pokemon world champion in Smash and then also versed them on Pokemon Sword and got absolutely blown apart? Yeah, well, there's about 45 minutes of that up on the channel right now!",2020-04-21 14:07:03+00:00,39,1189,,,1252599733119565827
25,1252587045970722817,https://twitter.com/zerowondering/status/1252587045970722817,zerowondering,SavinTheBees,Bless,2020-04-21 13:16:38+00:00,0,30,,,1252587045970722817
25,1252459889475158021,https://twitter.com/zerowondering/status/1252459889475158021,zerowondering,Mkleosb,Definitely man!,2020-04-21 04:51:21+00:00,4,965,,,1252459889475158021
25,1252397642052628485,https://twitter.com/zerowondering/status/1252397642052628485,zerowondering,SnorleySSB,We definitely playing again!,2020-04-21 00:44:00+00:00,1,59,,,1252397642052628485
25,1252395845804146689,https://twitter.com/zerowondering/status/1252395845804146689,zerowondering,SavinTheBees, ,2020-04-21 00:36:52+00:00,1,61,,,1252395845804146689
25,1252395456874729475,https://twitter.com/zerowondering/status/1252395456874729475,zerowondering,SalvatoreZomba,Oh am I? Let me check! About to be pinging there!,2020-04-21 00:35:19+00:00,0,16,,,1252395456874729475
25,1252395316587847687,https://twitter.com/zerowondering/status/1252395316587847687,zerowondering,SavinTheBees,Do a notification squad post with Tifa at 3 AM bro.,2020-04-21 00:34:46+00:00,0,61,,,1252395316587847687
25,1251576463339462656,https://twitter.com/HectorBellerin/status/1251576463339462656,HectorBellerin,, ,2020-04-18 18:20:56+00:00,1217,14642,,,1251576463339462656
25,1247978856310624262,https://twitter.com/HectorBellerin/status/1247978856310624262,HectorBellerin,,#PlayersTogether,2020-04-08 20:05:20+00:00,1257,11449,,#PlayersTogether,1247978856310624262
25,1247588705575059457,https://twitter.com/HectorBellerin/status/1247588705575059457,HectorBellerin,,Quarantine garden fits,2020-04-07 18:15:01+00:00,2381,24174,,,1247588705575059457
25,1243592793928486913,https://twitter.com/HectorBellerin/status/1243592793928486913,HectorBellerin,,"Stay home, enjoy the sun.",2020-03-27 17:36:41+00:00,4817,52091,,,1243592793928486913
25,1242868635967897602,https://twitter.com/HectorBellerin/status/1242868635967897602,HectorBellerin,,Link to the campaign can be found here https://www.justgiving.com/fundraising/football-united-official,2020-03-25 17:39:08+00:00,22,132,,,1242868635967897602
25,1242867703808917505,https://twitter.com/HectorBellerin/status/1242867703808917505,HectorBellerin,,In a time of a crisis it's more important than ever for us as society to pull together. One small thing we as football could do was to create a campaign to raise money and awareness for the @NatEmergTrust through our #FootballUnited campaign.,2020-03-25 17:35:26+00:00,205,1438,@NatEmergTrust,#FootballUnited,1242867703808917505
25,1240708835083292673,https://twitter.com/HectorBellerin/status/1240708835083292673,HectorBellerin,,Thank you for all the birthday messages today This pic was taken when I was still 24 and could go play tennis in the park ,2020-03-19 18:36:52+00:00,2270,27906,,,1240708835083292673
25,1234105802455166976,https://twitter.com/HectorBellerin/status/1234105802455166976,HectorBellerin,,Pleasure to shoot & direct the @424onFAIRFAX x @ArsenalWFC shoot.,2020-03-01 13:18:46+00:00,388,3855,@424onFAIRFAX @ArsenalWFC,,1234105802455166976
25,1232656033706860545,https://twitter.com/HectorBellerin/status/1232656033706860545,HectorBellerin,,Slippin',2020-02-26 13:17:54+00:00,5892,47927,,,1232656033706860545
25,1231662922755006464,https://twitter.com/HectorBellerin/status/1231662922755006464,HectorBellerin,,Very nice,2020-02-23 19:31:38+00:00,3075,41429,,,1231662922755006464
25,1253005838693908481,https://twitter.com/CalMacFerries/status/1253005838693908481,CalMacFerries,,Thanks to our wonderful team at Mallaig for spreading the #StayAtHome message huge thanks to Ellen McCauley at Mallaig for sharing this with us #WeAreCalMac #keyworkers,2020-04-22 17:00:46+00:00,3,42,,#StayAtHome #StayAtHome #WeAreCalMac #keyworkers,1253005838693908481
25,1252975674547109891,https://twitter.com/CalMacFerries/status/1252975674547109891,CalMacFerries,,An award from CalMac's Community Fund is set to increase art opportunities for young people living in Cowal. The award to @CowalStudios will support workshops to enable artists to increase children's self-confidence through a range of different media https://calm.ac/3bsCV2p,2020-04-22 15:00:54+00:00,0,5,@CowalStudios,,1252975674547109891
25,1252900028147957761,https://twitter.com/CalMacFerries/status/1252900028147957761,CalMacFerries,,.@Arran_yf @ahsmtbc and Shiskine Primary School Parent Council have all given awards to help them develop projects that will engage the island's young people by the CalMac Community Fund find out more here; https://calm.ac/2yxjB5B,2020-04-22 10:00:19+00:00,1,9,@Arran_yf @ahsmtbc,,1252900028147957761
25,1252698885690208262,https://twitter.com/CalMacFerries/status/1252698885690208262,CalMacFerries,Mcavoy555,Looks delicious ...we’re glad to be able to help out @NewtonPrim with their food parcels #transportheroes,2020-04-21 20:41:03+00:00,2,17,@NewtonPrim,#transportheroes,1252698885690208262
25,1252561961977630721,https://twitter.com/CalMacFerries/status/1252561961977630721,CalMacFerries,colin_mccort,Thanks to @colin_mccort Port Manager at Brodick for handing over a donation of @ARRAN_Sense Hand Sanitising gel to @ArranRNLI donated by @CalMacFerries ,2020-04-21 11:36:57+00:00,1,18,@colin_mccort @ARRAN_Sense @ArranRNLI @CalMacFerries,,1252561961977630721
25,1252554618988617728,https://twitter.com/CalMacFerries/status/1252554618988617728,CalMacFerries,HCMM_UK,Great piece from @HCMM_UK on one of our Masters @byrogriffiths who's helping to keep our communities connected during this time. We are proud to have an outstanding group of Masters and Skippers across the fleet working tirelessly every day #TransportHeroes #KeyWorkers,2020-04-21 11:07:47+00:00,3,34,@HCMM_UK @byrogriffiths,#TransportHeroes #KeyWorkers,1252554618988617728
25,1252318717003915264,https://twitter.com/CalMacFerries/status/1252318717003915264,CalMacFerries,,Missing you North Uist fix? Here's some greetings from our Lochmaddy office basking in the sunshine. Thanks to David MacLean from our Lochmaddy office for sharing #StayAtHome #WeAreCalMac #bringingislandstoyou ,2020-04-20 19:30:23+00:00,0,29,,#StayAtHome #StayAtHome #WeAreCalMac #bringingislandstoyou,1252318717003915264
25,1252305476135596034,https://twitter.com/CalMacFerries/status/1252305476135596034,CalMacFerries,NoahMurny,"Hi Anne, we have sent you a DM. Thanks",2020-04-20 18:37:46+00:00,0,1,,,1252305476135596034
25,1252281070130782209,https://twitter.com/CalMacFerries/status/1252281070130782209,CalMacFerries,,Big thank you to our staff at sunny but very deserted Oban. Proving that the message #StayAtHome is well and truly getting across. They even improvised with some artwork of the MV Isle of Mull well done to Jill McKechnie and all her team #WeAreCalMac,2020-04-20 17:00:48+00:00,11,99,,#StayAtHome #StayAtHome #WeAreCalMac,1252281070130782209
25,1252250838187286528,https://twitter.com/CalMacFerries/status/1252250838187286528,CalMacFerries,,Islay and Jura's young swimmers are getting the chance to train in an Olympic sized pool thanks to CalMac's Community Fund. Find out more here; https://calm.ac/2VomkHm,2020-04-20 15:00:40+00:00,2,18,,,1252250838187286528
25,1252332131134603268,https://twitter.com/KyleMc4/status/1252332131134603268,KyleMc4,sligorovers,The big man @JohnMahon21 ,2020-04-20 20:23:41+00:00,0,9,@JohnMahon21,,1252332131134603268
25,1252214211117223937,https://twitter.com/KyleMc4/status/1252214211117223937,KyleMc4,sligorovers,Thank you !!,2020-04-20 12:35:07+00:00,1,12,,,1252214211117223937
25,1252161890769342467,https://twitter.com/KyleMc4/status/1252161890769342467,KyleMc4,RorysStories, ,2020-04-20 09:07:13+00:00,0,0,,,1252161890769342467
25,1250490057997369344,https://twitter.com/KyleMc4/status/1250490057997369344,KyleMc4,,Thanks @DavidCawley22 @MarkRidgers @Rod8Young .If u are a football person please join the challenge of posting a football pic.Once nominated u have 24hrs to post a pic of yourself as a player or donate £30 to charity. I nominate @Harry_Toffolo @harrisonheathy1 @tmcn93 @AMorgan94,2020-04-15 18:23:57+00:00,0,9,@DavidCawley22 @MarkRidgers @Rod8Young @Harry_Toffolo @harrisonheathy1 @tmcn93 @AMorgan94,,1250490057997369344
25,1249335283600052224,https://twitter.com/KyleMc4/status/1249335283600052224,KyleMc4,MarkRidgers,I’m a changed man now Ridgers ,2020-04-12 13:55:17+00:00,0,2,,,1249335283600052224
25,1246550373676068865,https://twitter.com/KyleMc4/status/1246550373676068865,KyleMc4,amyy_greensitt,Your so bored go to sleep,2020-04-04 21:29:03+00:00,0,1,,,1246550373676068865
25,1244335097462972416,https://twitter.com/KyleMc4/status/1244335097462972416,KyleMc4,amyy_greensitt,"Ohhh lip filler, sorrriiiii ",2020-03-29 18:46:20+00:00,0,2,,,1244335097462972416
25,1244011183755141120,https://twitter.com/KyleMc4/status/1244011183755141120,KyleMc4,BelLiveSport,What a coach he’ll be as well @DarylFordyce ,2020-03-28 21:19:13+00:00,0,14,@DarylFordyce,,1244011183755141120
25,1243592934878056448,https://twitter.com/KyleMc4/status/1243592934878056448,KyleMc4,alanfinn94,No better club to bounce back from this ! For now stay safe folks ,2020-03-27 17:37:15+00:00,1,24,,,1243592934878056448
25,1226969281625313286,https://twitter.com/KyleMc4/status/1226969281625313286,KyleMc4,MarkTimlin11,"All the best Timlin lad , not a bother to you x",2020-02-10 20:40:47+00:00,0,2,,,1226969281625313286
25,1252960657869168641,https://twitter.com/Pharrell/status/1252960657869168641,Pharrell,,"For our shared passion and vision for music, @i_am_OTHER and I are teaming up with @SoundCloud to discover the next creators. Tag #SCxiamOTHER on your SoundCloud track for a chance to be featured on a compilation we're working on. More details: https://blog.soundcloud.com/2020/04/22/were-partnering-with-i-am-other-and-pharrell-williams-on-a-new-compilation-project-and-we-want-you-to-be-part-of-it/",2020-04-22 14:01:14+00:00,105,388,@i_am_OTHER @SoundCloud,#SCxiamOTHER,1252960657869168641
25,1251546917915389952,https://twitter.com/Pharrell/status/1251546917915389952,Pharrell,,.@GlblCtzn’s One World: #TogetherAtHome tonight at 8PM ET https://glblctzn.me/2xFbpj8,2020-04-18 16:23:32+00:00,126,507,@GlblCtzn,#TogetherAtHome #TogetherAtHome,1251546917915389952
25,1250834503603490818,https://twitter.com/Pharrell/status/1250834503603490818,Pharrell,FallonTonight,Thank you @jimmyfallon @FallonTonight for having me on the show ,2020-04-16 17:12:39+00:00,116,855,@jimmyfallon @FallonTonight,,1250834503603490818
25,1250829906805571584,https://twitter.com/Pharrell/status/1250829906805571584,Pharrell,,Joining @glblctzn for One World: #TogetherAtHome — a special event this Sat 4/18 supporting @WHO’s Solidarity Response Fund. http://glblctzn.me/OneWorldTAH,2020-04-16 16:54:23+00:00,80,392,@GlblCtzn @WHO,#TogetherAtHome #TogetherAtHome,1250829906805571584
25,1247907895154442241,https://twitter.com/Pharrell/status/1247907895154442241,Pharrell,Rosembradbury,"nah, it’s facts.. GOD IS THE GREATEST",2020-04-08 15:23:21+00:00,8,70,,,1247907895154442241
25,1247899358621618176,https://twitter.com/Pharrell/status/1247899358621618176,Pharrell,jonny_ex9,"Don’t confuse your freewill, dominion of the earth & hubris for superiority. Everything in the Universe is moving, it’s alive. We are made of stardust It was here before you, you are in it now & it’ll be here after you.THE GREATEST OF ALL TIME IS THE UNIVERSE",2020-04-08 14:49:26+00:00,19,135,,,1247899358621618176
25,1246936864063475719,https://twitter.com/Pharrell/status/1246936864063475719,Pharrell,,GOD IS THE GREATEST,2020-04-05 23:04:50+00:00,62602,184259,,,1246936864063475719
25,1244667493160849409,https://twitter.com/Pharrell/status/1244667493160849409,Pharrell,,*listening,2020-03-30 16:47:09+00:00,301,2770,,,1244667493160849409
25,1243583236162215936,https://twitter.com/Pharrell/status/1243583236162215936,Pharrell,gymleaderanya,So sorry if i wasn’t clear. I of course donated but wanted to make sure my followers had a way to get involved if they needed too,2020-03-27 16:58:42+00:00,10,77,,,1243583236162215936
25,1242820744494477313,https://twitter.com/Pharrell/status/1242820744494477313,Pharrell,,good morning @fyKAWS @AcuteArt,2020-03-25 14:28:50+00:00,255,1991,@fyKAWS @AcuteArt,,1242820744494477313
25,1251535713268404225,https://twitter.com/PedroPascal1/status/1251535713268404225,PedroPascal1,,"@1gracerowe took me to my first rave, lit a real cigarette during her monologue in high school drama class (Frances), and has basically demonstrated how to be a BOSS for the last 30 (holy shit we are old) years.… https://www.instagram.com/p/B_IKaPOj15c/?igshid=13pvhzcttb00h",2020-04-18 15:39:01+00:00,10,155,@1gracerowe,,1251535713268404225
25,1251348842663915521,https://twitter.com/PedroPascal1/status/1251348842663915521,PedroPascal1,tonbotticelli,este é o caminho. Cuidar x,2020-04-18 03:16:27+00:00,109,1332,,,1251348842663915521
25,1250854453344964608,https://twitter.com/PedroPascal1/status/1250854453344964608,PedroPascal1,,"When you know, you know. You know? Happy birthday @ginacarano. Just... SHIT, I’m glad I know you . See you on the other side. https://www.instagram.com/p/B_DUnDsjSoW/?igshid=1iawax86ipnct",2020-04-16 18:31:56+00:00,253,2994,@ginacarano,,1250854453344964608
25,1249465960139902976,https://twitter.com/PedroPascal1/status/1249465960139902976,PedroPascal1,,@PublicTheaterNY #BraveNewShakespeareChallenge honoring all hearts and mind in search of inspiration.,2020-04-12 22:34:33+00:00,36,232,@PublicTheaterNY,#BraveNewShakespeareChallenge,1249465960139902976
25,1248628941432041472,https://twitter.com/PedroPascal1/status/1248628941432041472,PedroPascal1,,"Harassing Nico, A Family Pass Time. Feliz cumple querido hermano mío. https://www.instagram.com/p/B-zgkAZDO6B/?igshid=12lhd4gqlvmxk",2020-04-10 15:08:32+00:00,61,1044,,,1248628941432041472
25,1248392203623268355,https://twitter.com/PedroPascal1/status/1248392203623268355,PedroPascal1,,More jams. Give what you can. #SupportOurCrews gofundme &amp; #CovidRelief for #NYC @robinhoodnyc https://www.instagram.com/p/B-x0550DhjU/?igshid=m1yv40kievvx,2020-04-09 23:27:50+00:00,87,803,@RobinHoodNYC,#SupportOurCrews #CovidRelief #NYC,1248392203623268355
25,1248387476252577792,https://twitter.com/PedroPascal1/status/1248387476252577792,PedroPascal1,,It Takes Our Village to #SupportOurCrews,2020-04-09 23:09:02+00:00,161,1334,,#SupportOurCrews,1248387476252577792
25,1246976979636645888,https://twitter.com/PedroPascal1/status/1246976979636645888,PedroPascal1,MSF_USA, ,2020-04-06 01:44:14+00:00,4,225,,,1246976979636645888
25,1246853611260456968,https://twitter.com/PedroPascal1/status/1246853611260456968,PedroPascal1,,"Siempre mal idea tomarse una foto al lado de alguien tan guapo pero whatever. Feliz cumple, Bette Davis. @ma_silvestre https://www.instagram.com/p/B-m5PG3D_sQ/?igshid=1kpdlpkh5ug2b",2020-04-05 17:34:01+00:00,91,1386,@ma_silvestre,,1246853611260456968
25,1246281213838364673,https://twitter.com/PedroPascal1/status/1246281213838364673,PedroPascal1,bgkelley411,There are too many. But a gun to my head? Just Like Heaven. Swear it just came on. SWEAR! ,2020-04-04 03:39:30+00:00,66,922,,,1246281213838364673
25,1253034780523851776,https://twitter.com/Isaacrochell90/status/1253034780523851776,Isaacrochell90,keyantegreen,Hahahahaha ,2020-04-22 18:55:46+00:00,1,1,,,1253034780523851776
25,1252752220807806976,https://twitter.com/Isaacrochell90/status/1252752220807806976,Isaacrochell90,ABC7,#chargers,2020-04-22 00:12:59+00:00,0,18,,#chargers,1252752220807806976
25,1251264610671276034,https://twitter.com/Isaacrochell90/status/1251264610671276034,Isaacrochell90,,We’re teaming up with @MayorOfLA to remind you to wear a cloth mask when you go outside. We’re in this together! #LAProtects #BoltUp . . QuaranTEAM with us to help provide meals to LA elderly by purchasing a shirt from Local Human http://localhuman.co,2020-04-17 21:41:45+00:00,34,268,@MayorOfLA,#LAProtects #BoltUp,1251264610671276034
25,1250963404061200384,https://twitter.com/Isaacrochell90/status/1250963404061200384,Isaacrochell90,,"Link in bio! Get involved. Local Human creates apparel with intention. We strive to serve and support local communities. For this current campaign, Local Human has partnered with Meals on Wheels with the goal of donating at least 3 meals and a wellness check-in per shirt sold.",2020-04-17 01:44:51+00:00,6,15,,,1250963404061200384
25,1234511794523328516,https://twitter.com/Isaacrochell90/status/1234511794523328516,Isaacrochell90,Hayleylaneee,You don’t mean that,2020-03-02 16:12:02+00:00,0,1,,,1234511794523328516
25,1214399105973153792,https://twitter.com/Isaacrochell90/status/1214399105973153792,Isaacrochell90,,Ever seen a puppy drunk on sleepiness... this is what it looks like ,2020-01-07 04:11:23+00:00,8,124,,,1214399105973153792
25,1193572758073987072,https://twitter.com/Isaacrochell90/status/1193572758073987072,Isaacrochell90,_Colossal18,Lol,2019-11-10 16:54:55+00:00,1,3,,,1193572758073987072
25,1187963582627090432,https://twitter.com/Isaacrochell90/status/1187963582627090432,Isaacrochell90,,Are we going to act like @kanyewest is not the most radical artist of all time... I love it,2019-10-26 05:26:04+00:00,1,12,@kanyewest,,1187963582627090432
25,1187905364664225792,https://twitter.com/Isaacrochell90/status/1187905364664225792,Isaacrochell90,gowrongwrong,Oh my gosh,2019-10-26 01:34:43+00:00,0,12,,,1187905364664225792
25,1184216427361734656,https://twitter.com/Isaacrochell90/status/1184216427361734656,Isaacrochell90,,https://youtu.be/hloqn39dVPo Go check out the full interview w/ @DerekWatt34,2019-10-15 21:16:12+00:00,5,81,@DerekWatt34,,1184216427361734656
25,1252099451180576769,https://twitter.com/grantbryant7072/status/1252099451180576769,grantbryant7072,OfficialAritz,Hey fellow animal crossing player was just wondering if you know any high turnip price lobbies ,2020-04-20 04:59:06+00:00,0,0,,,1252099451180576769
