age,id,permalink,username,to,text,date,retweets,favorites,mentions,hashtags,geo
41,1.21545E+18,https://twitter.com/TimHowardGK/status/1215453933046419456,TimHowardGK,,Proud and Honored to lead @Memphis901FC as it’s new Sporting Director #DefendMemphis,2020-01-10 02:02:54+00:00,78,1048,#NAME?,#DefendMemphis,1.21545E+18
41,1.21067E+18,https://twitter.com/TimHowardGK/status/1210669458080944128,TimHowardGK,,2019 has been a year of unforgettable moments! Let’s make it one to remember for the children and families at @RMHC! Donate today at http://rmhc.org/donate and give them more reasons to smile #KeepingFamiliesClose,2019-12-27 21:11:06+00:00,6,67,#NAME?,#KeepingFamiliesClose,1.21067E+18
41,1.21067E+18,https://twitter.com/TimHowardGK/status/1210669344994119680,TimHowardGK,,2019 has been a year of unforgettable moments! Let’s make it one to remember for the children and families @RMHC! Donate today at http://rmhc.org/donate and give them more reasons to smile #KeepingFamiliesClose,2019-12-27 21:10:39+00:00,2,36,#NAME?,#KeepingFamiliesClose,1.21067E+18
41,1.25363E+18,https://twitter.com/NickyByrne/status/1253633277992280067,NickyByrne,,Alan needs more question folks!! Get them in now ! And I’ll answer at 4pm on his insta live. @alancaw ,2020-04-24 10:33:59+00:00,38,224,#NAME?,,1.25363E+18
41,1.25342E+18,https://twitter.com/NickyByrne/status/1253418995731935233,NickyByrne,alancaw,Send your questions to @alancaw now and we shall chat at 4pm tmrw. ,2020-04-23 20:22:30+00:00,46,240,#NAME?,,1.25342E+18
41,1.25291E+18,https://twitter.com/NickyByrne/status/1252908906352959488,NickyByrne,,"It’s with great sadness everybody, but Health safety and enjoyment have always been of up most importance to everyone attending our shows. We will all come back stronger next year. On the plus side it gives us an extra year to get our dance moves right ! #staysafe",2020-04-22 10:35:35+00:00,182,1265,,#staysafe,1.25291E+18
41,1.25271E+18,https://twitter.com/NickyByrne/status/1252714365331144704,NickyByrne,,I caught up with @brianofficial on his podcast #deathbecomeshim chatting about the loss of both my dad and his mom. It’s a tough listen but made me smile aswell recalling my dad in great detail. If you have a spare few minutes have a listen,2020-04-21 21:42:33+00:00,63,371,#NAME?,#deathbecomeshim,1.25271E+18
41,1.25228E+18,https://twitter.com/NickyByrne/status/1252282313825804290,NickyByrne,,Teenagers today ,2020-04-20 17:05:44+00:00,94,1471,,,1.25228E+18
41,1.25228E+18,https://twitter.com/NickyByrne/status/1252278808981487617,NickyByrne,,Today our boys Rocco & Jay turned into Teenagers! We are so proud of the handsome talented and funny young men that they are growing into. Happy 13th Birthday boys “Live your dreams” ,2020-04-20 16:51:48+00:00,98,1684,,,1.25228E+18
41,1.25127E+18,https://twitter.com/NickyByrne/status/1251274157003866118,NickyByrne,Jackie_Mc4,"Great to see you healthy Jackie, well done pal ",2020-04-17 22:19:41+00:00,3,41,,,1.25127E+18
41,1.24825E+18,https://twitter.com/NickyByrne/status/1248248466217652227,NickyByrne,gardainfo,Amazing work from all the local Gardaí @gardainfo @GardaTraffic,2020-04-09 13:56:40+00:00,27,268,#NAME?,,1.24825E+18
41,1.24612E+18,https://twitter.com/NickyByrne/status/1246118107904716800,NickyByrne,socceraid,I’m Knitting with Diego Maradona!,2020-04-03 16:51:23+00:00,33,306,,,1.24612E+18
41,1.24585E+18,https://twitter.com/NickyByrne/status/1245851435222405124,NickyByrne,levs11,"All good here thx, chat soon pal ",2020-04-02 23:11:43+00:00,1,2,,,1.24585E+18
41,1.2531E+18,https://twitter.com/DanneelHarris/status/1253100372270305280,DanneelHarris,,"Happy Earth Day! Taking a walk in our neighborhood or watching our baby hop plants grow these have become the highlights of our days in quarantine. The warmth of the sunlight feels more healing, the wind more… https://www.instagram.com/p/B_TR7tQgvjQ/?igshid=19084vd6ii3pw",2020-04-22 23:16:24+00:00,315,3180,,,1.2531E+18
41,1.2513E+18,https://twitter.com/DanneelHarris/status/1251296310583537664,DanneelHarris,AMC_TV,Don’t miss this tonight! Thank you @HilarieBurton and @JDMorgan for hosting us! We love you guys!,2020-04-17 23:47:43+00:00,403,4549,#NAME?,,1.2513E+18
41,1.25017E+18,https://twitter.com/DanneelHarris/status/1250172106463236108,DanneelHarris,BetoORourke,Thank you @BetoORourke and @WillieNelson for helping to spread the word and powering people to volunteer and help our local food banks! #poweredxpeople,2020-04-14 21:20:31+00:00,207,2057,#NAME?,#poweredxpeople,1.25017E+18
41,1.24913E+18,https://twitter.com/DanneelHarris/status/1249132660183752704,DanneelHarris,,"I missed national siblings day yesterday....But, I don’t need a day to remind me to celebrate the best brother in the entire world. @ginograul you will always be the OG VIP courtesy of mom going through old videos… https://www.instagram.com/p/B-3EgtNgKfP/?igshid=185dqmmf3t2r6",2020-04-12 00:30:08+00:00,198,2796,#NAME?,,1.24913E+18
41,1.24716E+18,https://twitter.com/DanneelHarris/status/1247158127457419264,DanneelHarris,,Killing Demons and Blasting Sabbath: 15 Years of Supernatural http://www.austinchronicle.com/screens/2020-04-03/killing-demons-and-blasting-sabbath-15-years-of-supernatural/ via @AustinChronicle,2020-04-06 13:44:03+00:00,657,5011,#NAME?,,1.24716E+18
41,1.24662E+18,https://twitter.com/DanneelHarris/status/1246621971137298432,DanneelHarris,,"We want to take a moment to thank the Healthcare Workers and Essential Workers throughout the world and especially here at home! We hear your stories, we are humbled by your sacrifices, we are saddened by your losses… https://www.instagram.com/p/B-lP5d4gNYw/?igshid=7lhljvstkm18",2020-04-05 02:13:33+00:00,664,5841,,,1.24662E+18
41,1.24613E+18,https://twitter.com/DanneelHarris/status/1246133927246520320,DanneelHarris,,Quarantine family complete! Icarus came home yesterday after recovering from ACL surgery. The old guy got a little too excited to see @jensenackles when he returned from work a couple weeks ago. He tore his ACL on… https://www.instagram.com/p/B-hx9mzgYBC/?igshid=iorgluqrtp0b,2020-04-03 17:54:14+00:00,477,5528,#NAME?,,1.24613E+18
41,1.24184E+18,https://twitter.com/DanneelHarris/status/1241837195805294592,DanneelHarris,,"Just in case anyone needed any ideas of things to do with the kids.... How about a dance class?! I know what some of you are going to say.... “Danneel, we don’t all live with a professional dancer!!!”To that I say… https://www.instagram.com/p/B-DQCMUA0Fg/?igshid=1h04ayt7dsnwe",2020-03-22 21:20:34+00:00,616,5412,,,1.24184E+18
41,1.24181E+18,https://twitter.com/DanneelHarris/status/1241809638036668416,DanneelHarris,,We love watching all of the virtual concerts lately! @jensenackles couldn’t help but play along with our dear friend and @radiocomusic musician @stevecarlson during his show today! So sweet! #friendship #quarantine… https://www.instagram.com/p/B-DCo11g5Z3/?igshid=1o2oqw5c8yxsp,2020-03-22 19:31:04+00:00,415,3533,#NAME?,#friendship #quarantine,1.24181E+18
41,1.24149E+18,https://twitter.com/DanneelHarris/status/1241487325294743555,DanneelHarris,,"It’s Saturday night y’all! Let’s go to a concert together! Join my friend @jeweljk for her ‘Live From San Quarantine’ livestream concert benefiting families in need. Her goal is to get 5,000 people to donate a $1 a… https://www.instagram.com/p/B-Aw7ixJcrn/?igshid=9k98o48goa6p",2020-03-21 22:10:18+00:00,216,2189,#NAME?,,1.24149E+18
41,1.25355E+18,https://twitter.com/virendersehwag/status/1253553957764395009,virendersehwag,,True that the great man could stop time in India when batting. But the biggest inspiration @sachin_rt Paaji’s career is summed up is in these two pictures. Much needed to remember especially in these difficult times that after every adversity comes victory #HappyBirthdaySachin ,2020-04-24 05:18:48+00:00,4783,52256,#NAME?,#HappyBirthdaySachin,1.25355E+18
41,1.25286E+18,https://twitter.com/virendersehwag/status/1252855634644459526,virendersehwag,,"These photos are just a reminder how hum donon Ek doosre ke gale padey. Thank you @AartiSehwag , 16 years of married life. Because of you, Feel like an archaeologist , the older we get the more interested I become in you. Happy Welding Anni Barsi Biwi ji !",2020-04-22 07:03:54+00:00,2801,70007,#NAME?,,1.25286E+18
41,1.25215E+18,https://twitter.com/virendersehwag/status/1252146456653369345,virendersehwag,,Let's Unite to Ignite the Fire in their homes… Again. @PhoolVersha #FeedTheHungry,2020-04-20 08:05:53+00:00,185,2868,#NAME?,#FeedTheHungry,1.25215E+18
41,1.25135E+18,https://twitter.com/virendersehwag/status/1251351558706479105,virendersehwag,,#MeAt20,2020-04-18 03:27:15+00:00,2558,74084,,#MeAt20,1.25135E+18
41,1.24999E+18,https://twitter.com/virendersehwag/status/1249991379838595072,virendersehwag,,"Just like in the game of cricket, technology plays a significant role in education, as well, and our teachers have adapted admirably to this new environment of online classes. Register your child with us today. For Online Admissions, call 09711188700, 8930059111, 8930059222",2020-04-14 09:22:23+00:00,267,5708,,,1.24999E+18
41,1.24991E+18,https://twitter.com/virendersehwag/status/1249906651278094336,virendersehwag,,"Humble tributes to the architect of Indian Constitution, Bharat Ratna Dr Bhimrao Ambedkar on his birth anniversary. May his ideals continue to inspire. #AmbedkarJayanti",2020-04-14 03:45:42+00:00,1552,20614,,#AmbedkarJayanti,1.24991E+18
41,1.2494E+18,https://twitter.com/virendersehwag/status/1249403006652518400,virendersehwag,,"So here is where i took my batting inspiration from :) Pair hilana mushkil hi nahi , namumkin hai . #Angad ji Rocks",2020-04-12 18:24:24+00:00,7800,94020,,#Angad,1.2494E+18
41,1.24925E+18,https://twitter.com/virendersehwag/status/1249252620419530755,virendersehwag,,Gratitude to all the Corona Warriors who have committed at offering themselves completely for the well being of others. Please follow the directives from the state and central government sincerely and we shall overcome this soon. #StaySafe #SambhalJaao,2020-04-12 08:26:49+00:00,447,7029,,#StaySafe #SambhalJaao,1.24925E+18
41,1.2492E+18,https://twitter.com/virendersehwag/status/1249204082058936320,virendersehwag,,Sri #GuruTegBahadur ji de Prakash Purab diyan Vadaian. May His blessings be upon all !,2020-04-12 05:13:56+00:00,811,17058,,#GuruTegBahadur,1.2492E+18
41,1.24786E+18,https://twitter.com/virendersehwag/status/1247858138138599425,virendersehwag,,"Bhole Ke Bhakt, Hanuman ji Ke Chele , Sab kuch Jeet lenge Akele. Sankat Katai Mite Sab Peeda, Jo Sumire Hanumat Balbeera ! Jai Bajrangbali ! #HanumanJanamUtsav ki hardik shubhkamnayein",2020-04-08 12:05:38+00:00,1162,19905,,#HanumanJanamUtsav,1.24786E+18
41,1.22128E+18,https://twitter.com/kobebryant/status/1221276426164269056,kobebryant,,Continuing to move the game forward @KingJames. Much respect my brother #33644,2020-01-26 03:39:24+00:00,520832,2728461,#NAME?,,1.22128E+18
41,1.2204E+18,https://twitter.com/kobebryant/status/1220404437002280962,kobebryant,,Welcome to retirement @Alanabeard20 well deserved after an amazing career ,2020-01-23 17:54:26+00:00,1172,23461,#NAME?,,1.2204E+18
41,1.22039E+18,https://twitter.com/kobebryant/status/1220393421702983681,kobebryant,king__pill,Yes sirrr!!,2020-01-23 17:10:40+00:00,731,10726,,,1.22039E+18
41,1.2194E+18,https://twitter.com/kobebryant/status/1219399357201448960,kobebryant,,"The best way to honor the legacy of Dr. Martin Luther King Jr. is to ensure kids understand his purpose, message and impact so that they can carry it forward. This is a great way to start teaching them. #MLKDay",2020-01-20 23:20:36+00:00,5560,29270,,#MLKDay,1.2194E+18
41,1.21859E+18,https://twitter.com/kobebryant/status/1218587008387272707,kobebryant,sim_one_one,Amazing job!! ,2020-01-18 17:32:37+00:00,457,5271,,,1.21859E+18
41,1.21802E+18,https://twitter.com/kobebryant/status/1218020971346444288,kobebryant,, @sabrina_i20,2020-01-17 04:03:23+00:00,1740,12555,#NAME?,,1.21802E+18
41,1.21683E+18,https://twitter.com/kobebryant/status/1216832248613228544,kobebryant,KelleyLCarter,Let’s go!! ,2020-01-13 21:19:50+00:00,492,5751,,,1.21683E+18
41,1.21506E+18,https://twitter.com/kobebryant/status/1215057861950214144,kobebryant,,"PHILLY! @JustMercyFilm is a powerful film starring my friends @michaelb4jordan, @iamjamiefoxx, @OsheaJacksonJr &amp; @brielarson. Everyone should absorb its msg, so I bought out the @regalmovies UA Riverview Plaza on Sat. Jan 11 @1pm. Claim ur ticket here - http://www.wbtickets.com/JustMercyKobeBryant",2020-01-08 23:49:03+00:00,720,5876,#NAME?,,1.21506E+18
41,1.21404E+18,https://twitter.com/kobebryant/status/1214036299155267584,kobebryant,jaylenk4,Picked you up and then you dropped a 3 on us haha great job this weekend kiddo ,2020-01-06 04:09:44+00:00,590,7414,,,1.21404E+18
41,1.21397E+18,https://twitter.com/kobebryant/status/1213967618782060550,kobebryant,partlightskin15,All love my brother #beatcancer #NeverGiveUp,2020-01-05 23:36:49+00:00,4921,38532,,#beatcancer #NeverGiveUp,1.21397E+18
41,1.23602E+18,https://twitter.com/Geremi20Njitap/status/1236015823267016705,Geremi20Njitap,,Tokyo 2020 : La liste des 19 joueuses qui représenteront le #Cameroun contre la Zambie le 06 mars prochain est connue...,2020-03-06 19:48:30+00:00,1,5,,#Cameroun,1.23602E+18
41,1.17754E+18,https://twitter.com/Geremi20Njitap/status/1177540192930082816,Geremi20Njitap,paulwilkesfooty,Hi Paul,2019-09-27 11:07:14+00:00,0,0,,,1.17754E+18
41,1.11992E+18,https://twitter.com/Geremi20Njitap/status/1119918374920781824,Geremi20Njitap,infosynafoc,#NAME?,2019-04-21 10:58:42+00:00,0,0,#NAME?,,1.11992E+18
41,1.06754E+18,https://twitter.com/Geremi20Njitap/status/1067536679630774278,Geremi20Njitap,,Visite de clubs : La délégation de @infosynafoc est également passé par le centre d'entraînement de Dragon FC ce jour; qui était en amical contre Yaoundé II FC...,2018-11-27 21:52:32+00:00,7,13,#NAME?,,1.06754E+18
41,1.06457E+18,https://twitter.com/Geremi20Njitap/status/1064567548690223105,Geremi20Njitap,,"Hellooo guys, Rigobert Song has the must number of caps with the cameroon national team.",2018-11-19 17:14:16+00:00,1,9,,,1.06457E+18
41,1.06425E+18,https://twitter.com/Geremi20Njitap/status/1064247356693102592,Geremi20Njitap,,Miam,2018-11-18 20:01:57+00:00,1,8,,,1.06425E+18
41,1.06424E+18,https://twitter.com/Geremi20Njitap/status/1064235233447428097,Geremi20Njitap,,,2018-11-18 19:13:46+00:00,1,14,,,1.06424E+18
41,1.06423E+18,https://twitter.com/Geremi20Njitap/status/1064229830810587138,Geremi20Njitap,,Je suis au restaurant chinois,2018-11-18 18:52:18+00:00,1,11,,,1.06423E+18
41,1.0642E+18,https://twitter.com/Geremi20Njitap/status/1064202209804656640,Geremi20Njitap,,Which player has themost caps in Cameroon's national team?,2018-11-18 17:02:33+00:00,5,10,,,1.0642E+18
41,1.00687E+18,https://twitter.com/Geremi20Njitap/status/1006865488511733760,Geremi20Njitap,,"Triste nouvelle pour l’Afrique lors du 68e Congrès de @fifa.com, ce jour en direct de Moscou : le Maroc n’organisera pas la Coupe du monde 2026 ! Malgré la déception de voir le Maroc recalé, bonne chance aux USA,Mexique,Canada qui auront la charge d’organiser en 2026 à 48 !",2018-06-13 11:46:53+00:00,3,9,#NAME?,,1.00687E+18
41,1.25339E+18,https://twitter.com/ValeYellow46/status/1253392723895365632,ValeYellow46,,Now I’m ready for all the challenges! Thanks guys for the new Rig @Tavullia https://www.instagram.com/p/B_VW4WnDggl/?igshid=131m3mbpxidsu,2020-04-23 18:38:06+00:00,212,2088,,,1.25339E+18
41,1.25041E+18,https://twitter.com/ValeYellow46/status/1250411722277601281,ValeYellow46,,Ulisse mi spiega la sua teoria sul lockdown in riva al laghetto by francescasofianovello @Tavullia https://www.instagram.com/p/B_ALRxqjtR7/?igshid=tb2b4rt2pgr3,2020-04-15 13:12:40+00:00,194,1862,,,1.25041E+18
41,1.23374E+18,https://twitter.com/ValeYellow46/status/1233736110645231617,ValeYellow46,,"Losail international circuit,Qatar MotoGp test,day3 @motogp @falex79 @gigisoldano @Losail Circuit Sports Club - نادي حلبة لوسيل الرياضي https://www.instagram.com/p/B9JsFGeK7le/?igshid=1as2z04zfa5on",2020-02-29 12:49:45+00:00,177,1587,#NAME?,,1.23374E+18
41,1.23239E+18,https://twitter.com/ValeYellow46/status/1232390642648653824,ValeYellow46,,"Losail circuit,Qatar MotoGp test,day3 @falex79 @gigisoldano @Losail Circuit Sports Club - نادي حلبة لوسيل الرياضي https://www.instagram.com/p/B9AIO0rK4cE/?igshid=1vrkobvxuj3ih",2020-02-25 19:43:20+00:00,163,1343,#NAME?,,1.23239E+18
41,1.23187E+18,https://twitter.com/ValeYellow46/status/1231867898651643904,ValeYellow46,,"Losail circuit,Qatar MotoGp test,day2 @gigisoldano @falex79 @Losail Circuit Sports Club - نادي حلبة لوسيل الرياضي https://www.instagram.com/p/B88ahAhKE2I/?igshid=156uqq2bggrjx",2020-02-24 09:06:08+00:00,134,1136,#NAME?,,1.23187E+18
41,1.23187E+18,https://twitter.com/ValeYellow46/status/1231866987808264192,ValeYellow46,,"Losail circuit,Qatar MotoGp test,day2 @falex79 @gigisoldano @Losail Circuit Sports Club - نادي حلبة لوسيل الرياضي https://www.instagram.com/p/B88aGkQK0aS/?igshid=1aekip3np4obk",2020-02-24 09:02:31+00:00,121,1166,#NAME?,,1.23187E+18
41,1.23134E+18,https://twitter.com/ValeYellow46/status/1231341326022717441,ValeYellow46,,"Losail circuit,Qatar MotoGp test,day1 @gigisoldano @falex79 @Losail Circuit Sports Club - نادي حلبة لوسيل الرياضي https://www.instagram.com/p/B84rDmvqflZ/?igshid=qlp46x80lp2d",2020-02-22 22:13:43+00:00,137,1304,#NAME?,,1.23134E+18
41,1.23134E+18,https://twitter.com/ValeYellow46/status/1231340661011468289,ValeYellow46,,"Losail circuit,Qatar MotoGp test,day1 @falex79 @gigisoldano @Losail Circuit Sports Club - نادي حلبة لوسيل الرياضي https://www.instagram.com/p/B84qwQWq1QO/?igshid=17bemzgg2ox6b",2020-02-22 22:11:05+00:00,122,1141,#NAME?,,1.23134E+18
41,1.23017E+18,https://twitter.com/ValeYellow46/status/1230174398205878272,ValeYellow46,,"Mx training at Fermignano with the @VRRidersAcademy MotoGp version.great track,great fun! @camilss @Crossodromo La Ginestra Fermignano https://www.instagram.com/p/B8wYZYzqKgc/?igshid=zd2z6az6hyxw",2020-02-19 16:56:46+00:00,171,1371,#NAME?,,1.23017E+18
41,1.22969E+18,https://twitter.com/ValeYellow46/status/1229688887687204864,ValeYellow46,,Training at the MotoRanch with the @VRRidersAcademy by @camilss @Motor VR 46 Ranch https://www.instagram.com/p/B8s7nRoq0Bh/?igshid=bhgvgtb3ugel,2020-02-18 08:47:31+00:00,146,1428,#NAME?,,1.22969E+18
41,1.25381E+18,https://twitter.com/iansomerhalder/status/1253808536758321152,iansomerhalder,,Hello... Twitterverse,2020-04-24 22:10:24+00:00,771,14459,,,1.25381E+18
41,1.25381E+18,https://twitter.com/iansomerhalder/status/1253808484044292097,iansomerhalder,,Earth Day Video for those of you on Facebook ;) Please watch and share! Xo Ian,2020-04-24 22:10:11+00:00,86,975,,,1.25381E+18
41,1.25381E+18,https://twitter.com/iansomerhalder/status/1253807644994723841,iansomerhalder,,Earth Day Video Instagram ;) please watch of your on IG https://www.instagram.com/tv/B_UI9E3JZSO/?igshid=274thumfs50u,2020-04-24 22:06:51+00:00,98,1154,,,1.25381E+18
41,1.25353E+18,https://twitter.com/iansomerhalder/status/1253534660006572032,iansomerhalder,,https://instagram.com/stories/iansomerhalder/2293710358921508716?utm_source=ig_story_item_share&amp;igshid=1bkfhcgiq5jgy ,2020-04-24 04:02:07+00:00,111,2368,,,1.25353E+18
41,1.25335E+18,https://twitter.com/iansomerhalder/status/1253349365311328260,iansomerhalder,,Hello... Twitterverse https://www.instagram.com/p/B_U4ldcpaDI/?igshid=zjum63cawgf6,2020-04-23 15:45:49+00:00,174,2943,,,1.25335E+18
41,1.25322E+18,https://twitter.com/iansomerhalder/status/1253221856951144448,iansomerhalder,,https://www.instagram.com/tv/B_UI9E3JZSO/?igshid=qwjws6pm52o,2020-04-23 07:19:09+00:00,169,2362,,,1.25322E+18
41,1.25308E+18,https://twitter.com/iansomerhalder/status/1253081010729672705,iansomerhalder,,Happy Earth Day! https://www.instagram.com/p/B_TG5iqpdTg/?igshid=1f6ojv392hlf6,2020-04-22 21:59:28+00:00,273,3445,,,1.25308E+18
41,1.2509E+18,https://twitter.com/iansomerhalder/status/1250901079035744257,iansomerhalder,,https://www.instagram.com/tv/B_DRyfIpDMe/?igshid=snn094nay664 a friendly message from my Airstream ;) @Airstream_Inc I’m so grateful to be able to broadcast from my silver think pod! Xo,2020-04-16 21:37:12+00:00,198,2786,#NAME?,,1.2509E+18
41,1.24813E+18,https://twitter.com/iansomerhalder/status/1248128535543164935,iansomerhalder,,In this time of darkness... here is a post that I’m proud to have on my page. I wish I could sit with this man. Just one conversation. But we have this and so much more from him. This with worth watching https://www.instagram.com/tv/B7VWeRkpr8Y/?igshid=173ngbttj4y31,2020-04-09 06:00:06+00:00,293,4086,,,1.24813E+18
41,1.24763E+18,https://twitter.com/iansomerhalder/status/1247633066450767872,iansomerhalder,,Please share this https://www.instagram.com/tv/B-sQNTHpQM3/?igshid=1boajbddsoh3y,2020-04-07 21:11:17+00:00,346,2371,,,1.24763E+18
41,1.2534E+18,https://twitter.com/ivokarlovic/status/1253403700250456064,ivokarlovic,neiltyson,Tectonic plates move 0.5cm per year so it’s not zero ,2020-04-23 19:21:43+00:00,1,37,,,1.2534E+18
41,1.25159E+18,https://twitter.com/ivokarlovic/status/1251591577920778242,ivokarlovic,,Sorry guys. My 2 yo son said enough of Twitter. Thanks everyone and talk to you next time,2020-04-18 19:21:00+00:00,7,204,,,1.25159E+18
41,1.25159E+18,https://twitter.com/ivokarlovic/status/1251590682499842050,ivokarlovic,TheMarxMachine,Great. How about you?,2020-04-18 19:17:26+00:00,0,9,,,1.25159E+18
41,1.25159E+18,https://twitter.com/ivokarlovic/status/1251590001885958147,ivokarlovic,Axelis0598,Have no idea,2020-04-18 19:14:44+00:00,0,6,,,1.25159E+18
41,1.25159E+18,https://twitter.com/ivokarlovic/status/1251588911538810882,ivokarlovic,manyu216,Lots of body serves,2020-04-18 19:10:24+00:00,0,37,,,1.25159E+18
41,1.25159E+18,https://twitter.com/ivokarlovic/status/1251588395375230979,ivokarlovic,seudri444,Feli have very good backhand,2020-04-18 19:08:21+00:00,0,9,,,1.25159E+18
41,1.25159E+18,https://twitter.com/ivokarlovic/status/1251588283882225666,ivokarlovic,nico_seccio,Yes. Total discrimination,2020-04-18 19:07:54+00:00,8,115,,,1.25159E+18
41,1.25159E+18,https://twitter.com/ivokarlovic/status/1251585956152586240,ivokarlovic,holyschick,Weaker serve,2020-04-18 18:58:39+00:00,0,12,,,1.25159E+18
41,1.25159E+18,https://twitter.com/ivokarlovic/status/1251585181628141568,ivokarlovic,108InThe5th,Nope,2020-04-18 18:55:35+00:00,0,6,,,1.25159E+18
41,1.25158E+18,https://twitter.com/ivokarlovic/status/1251584781579702273,ivokarlovic,ChicharitoRus,Definitely,2020-04-18 18:53:59+00:00,1,23,,,1.25158E+18
41,1.2346E+18,https://twitter.com/adamlevine/status/1234601584656441344,adamlevine,,LET IT RAIN!!!! SÃO PAULO!!!!! The fucking BEST. Maybe the best show we have ever had. Thank you isn’t enough. You truly blew us away. ,2020-03-02 22:08:50+00:00,673,5841,,,1.2346E+18
41,1.21764E+18,https://twitter.com/adamlevine/status/1217641579076128769,adamlevine,,"While you’re at it, follow @taylorlockemusic for insane celebrity Deep Fakes!",2020-01-16 02:55:49+00:00,77,561,,,1.21764E+18
41,1.21764E+18,https://twitter.com/adamlevine/status/1217640850978529280,adamlevine,,"Hey, do yourselves a favor and go see @dontstopthemusical on Feb. 1st @largolosangeles!! Some very old friends of mine wrote and created this hilarious show. Its selling out fast at http://largo-la.com. Guest starring my pal Ray Romano.",2020-01-16 02:52:56+00:00,97,1101,#NAME?,,1.21764E+18
41,1.21749E+18,https://twitter.com/adamlevine/status/1217488416306151424,adamlevine,,I may be available. Best kept secret in celeb basketball circuit. #SASCelebteam,2020-01-15 16:47:12+00:00,343,3996,,#SASCelebteam,1.21749E+18
41,1.21749E+18,https://twitter.com/adamlevine/status/1217488368096792576,adamlevine,,#SASCelebteam,2020-01-15 16:47:01+00:00,214,2298,,#SASCelebteam,1.21749E+18
41,1.20917E+18,https://twitter.com/adamlevine/status/1209171542682288128,adamlevine,,Y Live Yves Saint Laurent @yslbeauty #YSLbeauty #thatsY,2019-12-23 17:58:55+00:00,520,4869,#NAME?,#YSLbeauty #thatsY,1.20917E+18
41,1.20297E+18,https://twitter.com/adamlevine/status/1202973373992583169,adamlevine,,This is what makes it all worth while. Speechless. • @PS22Chorus https://www.instagram.com/tv/B5t0-mkDKEA/?igshid=1te8a8jdgxk2q,2019-12-06 15:29:37+00:00,137,1368,#NAME?,,1.20297E+18
41,1.20049E+18,https://twitter.com/adamlevine/status/1200490645502058496,adamlevine,,"When I first heard Joe Pesci sing, I was astonished. I begged him to let me produce a record with him. He finally let me. I’m so happy his musical talent is no longer the best kept secret in town. Congrats Mr. Pesci. https://music.apple.com/us/album/pesci-still-singing/1484015665",2019-11-29 19:04:08+00:00,448,4741,,,1.20049E+18
41,1.20046E+18,https://twitter.com/adamlevine/status/1200459436902322177,adamlevine,,Y Live Yves Saint Laurent @yslbeauty #YSLbeauty #thatsY,2019-11-29 17:00:07+00:00,574,4824,#NAME?,#YSLbeauty #thatsY,1.20046E+18
41,1.18162E+18,https://twitter.com/adamlevine/status/1181621672597544960,adamlevine,,#Memories video out now. https://smarturl.it/M5MemoriesVideo,2019-10-08 17:25:34+00:00,2246,9870,,#Memories,1.18162E+18
41,1.25311E+18,https://twitter.com/johansantana/status/1253108088992944129,johansantana,MeridianoTV,Nos vemos en 15 minutos ,2020-04-22 23:47:04+00:00,9,54,,,1.25311E+18
41,1.24946E+18,https://twitter.com/johansantana/status/1249462072817201153,johansantana,,Happy Easter!! Felices Pascuas!!,2020-04-12 22:19:06+00:00,4,110,,,1.24946E+18
