age,id,permalink,username,to,text,date,retweets,favorites,mentions,hashtags,geo
45,1.24152E+18,https://twitter.com/mikebelk/status/1241521802242899969,mikebelk,WinstonKelley,That’s racers need a driveway commentary,2020-03-22 00:27:18+00:00,0,2,,,1.24152E+18
45,1.22632E+18,https://twitter.com/mikebelk/status/1226319011006341120,mikebelk,,So @pizzahut not sure this qualifies as a supreme pizza. Little skimpy on the toppings. Plus you run out of white sauce and don’t call - just send a regular pizza with no credit. Not Cool.,2020-02-09 01:36:50+00:00,0,1,#NAME?,,1.22632E+18
45,1.22631E+18,https://twitter.com/mikebelk/status/1226306896644186112,mikebelk,ElijahWhosoever,So they’re everywhere,2020-02-09 00:48:42+00:00,0,0,,,1.22631E+18
45,1.2165E+18,https://twitter.com/mikebelk/status/1216495769840164866,mikebelk,C_Rice1,That was pretty heartbreaking to know all the hard work that went into that car in a short period of time,2020-01-12 23:02:47+00:00,0,1,,,1.2165E+18
45,1.21224E+18,https://twitter.com/mikebelk/status/1212238804066668545,mikebelk,You_Jam_Right,Happy New Year,2020-01-01 05:07:07+00:00,0,1,,,1.21224E+18
45,1.25379E+18,https://twitter.com/mishacollins/status/1253789646934294528,mishacollins,,"Reality bites. Show me your #QuarantineDisappointments, guys!",2020-04-24 20:55:20+00:00,193,2997,,#QuarantineDisappointments,1.25379E+18
45,1.25374E+18,https://twitter.com/mishacollins/status/1253738372901638145,mishacollins,Earthangel0609,"Hey, Hani. Sending you my love & support right now. We’re with you through this!!!",2020-04-24 17:31:36+00:00,432,6061,,,1.25374E+18
45,1.25355E+18,https://twitter.com/mishacollins/status/1253551553937436673,mishacollins,,"I made this dinner for the kids. And very sweetly, Maison said, “If I had to choose between this and nothing, I guess I would choose this.” #QuarantineGratitude #IsItTooLateToPutThemUpForAdoption?",2020-04-24 05:09:14+00:00,477,8914,,#QuarantineGratitude #IsItTooLateToPutThemUpForAdoption,1.25355E+18
45,1.25345E+18,https://twitter.com/mishacollins/status/1253449215537147904,mishacollins,,"Parenting tip: To establish trust, give your children sharp instruments and full control over your appearance. #ChildrenOfTheComb",2020-04-23 22:22:35+00:00,1736,13214,,#ChildrenOfTheComb,1.25345E+18
45,1.253E+18,https://twitter.com/mishacollins/status/1252996436716732417,mishacollins,RandomActsOrg,"Hats off to @robhayter for donating this #SPN stunt department cap to @RandomActsOrg — and to @jarpad, @JensenAckles &amp; @Alex8Calvert for signing it with me. Thanks, guys. Want it? http://bit.ly/RAAuction_MC",2020-04-22 16:23:24+00:00,335,3484,#NAME?,#SPN,1.253E+18
45,1.25298E+18,https://twitter.com/mishacollins/status/1252981078433751040,mishacollins,,Hey @seanhannity! Nice work killer!,2020-04-22 15:22:23+00:00,272,2793,#NAME?,,1.25298E+18
45,1.25273E+18,https://twitter.com/mishacollins/status/1252729691011571712,mishacollins,,"Way to go, Gishers! I’m so proud of you all. Thank you.",2020-04-21 22:43:27+00:00,409,4751,,,1.25273E+18
45,1.25243E+18,https://twitter.com/mishacollins/status/1252427518889488391,mishacollins,,"The dog peed on the porch, so I got a bucket and soap. My wife saw me mopping and said, “That’s the sexiest thing you’ve done this year.” I’m killing it...",2020-04-21 02:42:44+00:00,865,13582,,,1.25243E+18
45,1.25241E+18,https://twitter.com/mishacollins/status/1252409373290147841,mishacollins,,Licks speak louder than words. http://gish.com,2020-04-21 01:30:37+00:00,843,8146,,,1.25241E+18
45,1.25237E+18,https://twitter.com/mishacollins/status/1252365961543344130,mishacollins,,"I picked up something lovely for @RuthieConnell's birthday, but I'm not sure if I should ship it. Let me know, guys. (And happy bday, Ruthie.)",2020-04-20 22:38:07+00:00,1020,12678,#NAME?,,1.25237E+18
45,9.71823E+17,https://twitter.com/DrewBarrymore/status/971823413458296835,DrewBarrymore,,I always loved that @Barbie is a role model who is professional and fun at the same time! It shows a girl you could be anything you dream of being. #Internationalwomensday #MoreRoleModels #ad,2018-03-08 19:02:12+00:00,196,1555,#NAME?,#Internationalwomensday #MoreRoleModels #ad,9.71823E+17
45,6.0324E+17,https://twitter.com/DrewBarrymore/status/603239792944381952,DrewBarrymore,,@KnifeFightESQ is back TONIGHT on @ESQTV! Watch Lipson vs Talde and Mitgang vs Aguilar in the 1st round of Season 3!,2015-05-26 16:42:28+00:00,99,400,#NAME?,,6.0324E+17
45,5.39115E+17,https://twitter.com/DrewBarrymore/status/539114694187819008,DrewBarrymore,,Find It In Everything is back @BNBuzz #stockingstuffer Check out our amazing Instagram feed @http://instagram.com/finditineverything,2014-11-30 17:52:14+00:00,689,3815,#NAME?,#stockingstuffer,5.39115E+17
45,5.38093E+17,https://twitter.com/DrewBarrymore/status/538093441255624704,DrewBarrymore,,Enjoy the @flowerbeauty Fragrance Story! I hope finds you full of joy this holiday season. http://bit.ly/107h6jl,2014-11-27 22:14:08+00:00,440,2134,#NAME?,,5.38093E+17
45,5.3628E+17,https://twitter.com/DrewBarrymore/status/536280423853068288,DrewBarrymore,,Loved this! Enjoy!,2014-11-22 22:09:51+00:00,381,1092,,,5.3628E+17
45,5.24597E+17,https://twitter.com/DrewBarrymore/status/524596968417656834,DrewBarrymore,,"O Canada...We're thrilled to be in your stores! Love, Drew. @flowerbeauty",2014-10-21 16:23:58+00:00,248,1286,#NAME?,,5.24597E+17
45,5.19579E+17,https://twitter.com/DrewBarrymore/status/519578643824009216,DrewBarrymore,,Excited for tonights Season 2 Finale of @KnifeFightESQ and can't wait for Season 3 in NYC! http://bit.ly/1BNN5kI,2014-10-07 20:02:56+00:00,95,404,#NAME?,,5.19579E+17
45,5.10185E+17,https://twitter.com/DrewBarrymore/status/510184811559124992,DrewBarrymore,,"Biggest honor and highest thrill! @flowerbeauty Won @Allure_magazine ""Best Beauty Steals"" category! Thank you!",2014-09-11 21:55:12+00:00,109,600,#NAME?,,5.10185E+17
45,5.05093E+17,https://twitter.com/DrewBarrymore/status/505092940772163584,DrewBarrymore,,Check out my latest story on Refinery29 about the suitcase that changed my life and the one you must know about!!...,2014-08-28 20:41:55+00:00,121,541,,,5.05093E+17
45,5.03973E+17,https://twitter.com/DrewBarrymore/status/503972613891559424,DrewBarrymore,,Pictures of people looking miserable at Disney World...very funny... http://www.mizneyworld.com/,2014-08-25 18:30:09+00:00,171,648,,,5.03973E+17
45,1.25278E+18,https://twitter.com/TikiBarber/status/1252781378380402690,TikiBarber,,"Every influencer needs to check out @TsuSocial!! Great chatting to you, @GregPatuto",2020-04-22 02:08:50+00:00,3,6,#NAME?,,1.25278E+18
45,1.25015E+18,https://twitter.com/TikiBarber/status/1250147149372850176,TikiBarber,,I’ve accepted the #ALLINCHALLENGE. Go to http://AllInChallenge.com and watch the video below to see what I’ve auctioned off. Let’s come together to feed the hungry during this challenging time. I challenge @CC_Sabathia @michaelstrahan @dennyhamlin,2020-04-14 19:41:21+00:00,16,76,#NAME?,#ALLINCHALLENGE,1.25015E+18
45,1.25013E+18,https://twitter.com/TikiBarber/status/1250134993193644033,TikiBarber,,"“How you do anything, is how you do everything.” Great quote by @AntoineWJr11 on @jimrome #PJFleckism",2020-04-14 18:53:03+00:00,0,5,#NAME?,#PJFleckism,1.25013E+18
45,1.24877E+18,https://twitter.com/TikiBarber/status/1248767723464732672,TikiBarber,,HBO... #007 ,2020-04-11 00:20:00+00:00,0,3,,,1.24877E+18
45,1.24874E+18,https://twitter.com/TikiBarber/status/1248738394609455106,TikiBarber,darrenrovell,I love stats ,2020-04-10 22:23:28+00:00,0,7,,,1.24874E+18
45,1.24873E+18,https://twitter.com/TikiBarber/status/1248728019897901058,TikiBarber,TikiAndTierney,Great stuff from Darius Leonard on the Colts QB competition!,2020-04-10 21:42:14+00:00,1,5,,,1.24873E+18
45,1.24826E+18,https://twitter.com/TikiBarber/status/1248260394021457925,TikiBarber,,"NFL Draft is remote this year! I’m talking draft, virtual appearances and the need for sports @Varneyco now. @Thuzio",2020-04-09 14:44:04+00:00,2,5,#NAME?,,1.24826E+18
45,1.24798E+18,https://twitter.com/TikiBarber/status/1247978224795222021,TikiBarber,JColombo54,"This was my favorite piece written about my 6 1/2 weeks on Broadway. Appreciate you, Justin!!",2020-04-08 20:02:49+00:00,0,0,,,1.24798E+18
45,1.24798E+18,https://twitter.com/TikiBarber/status/1247978051830460417,TikiBarber,thomasqjones,"Much love, my friend! ",2020-04-08 20:02:08+00:00,0,1,,,1.24798E+18
45,1.24724E+18,https://twitter.com/TikiBarber/status/1247237532875661315,TikiBarber,AdamSchefter,Hmmm... Microsoft Teams or Zoom?? ,2020-04-06 18:59:35+00:00,1,4,,,1.24724E+18
45,1.25333E+18,https://twitter.com/CarrickTravel/status/1253332726129672192,CarrickTravel,,Join us in clapping for carers tonight! #stayhomestaysafe,2020-04-23 14:39:42+00:00,1,2,,#stayhomestaysafe,1.25333E+18
45,1.25324E+18,https://twitter.com/CarrickTravel/status/1253238504055869440,CarrickTravel,,Happy St George’s Day to all of our clients and travel colleagues!,2020-04-23 08:25:18+00:00,2,6,,,1.25324E+18
45,1.25304E+18,https://twitter.com/CarrickTravel/status/1253035390132510721,CarrickTravel,DanielPearce,Thank you,2020-04-22 18:58:11+00:00,0,1,,,1.25304E+18
45,1.25258E+18,https://twitter.com/CarrickTravel/status/1252584845554974720,CarrickTravel,,** Please read this letter from our governing body ABTA. **,2020-04-21 13:07:53+00:00,1,0,,,1.25258E+18
45,1.25216E+18,https://twitter.com/CarrickTravel/status/1252162604837060608,CarrickTravel,,#MondayMotivation #lovetravel #travelspecialists #TeamCarrickTravel,2020-04-20 09:10:03+00:00,2,7,,#MondayMotivation #lovetravel #travelspecialists #TeamCarrickTravel,1.25216E+18
45,1.25146E+18,https://twitter.com/CarrickTravel/status/1251459245096210433,CarrickTravel,SunvilTeam,All of Carrick Travel send you all our best wishes at this terribly sad time.,2020-04-18 10:35:09+00:00,0,1,,,1.25146E+18
45,1.2511E+18,https://twitter.com/CarrickTravel/status/1251096836204572675,CarrickTravel,,"Where will you visit first? When the world reopens, what destination is on your must visit list? #makememories #lovetravel #travelspecialists",2020-04-17 10:35:04+00:00,2,3,,#makememories #lovetravel #travelspecialists,1.2511E+18
45,1.25036E+18,https://twitter.com/CarrickTravel/status/1250361998736412674,CarrickTravel,,Now is a perfect opportunity to start planning your next holiday. Use our fabulous website to research your dream destination. #travelspecialists #lovetravel,2020-04-15 09:55:05+00:00,3,6,,#travelspecialists #lovetravel,1.25036E+18
45,1.24968E+18,https://twitter.com/CarrickTravel/status/1249681254901067777,CarrickTravel,,Dreaming of all the amazing places we have visited.. #wheredoesyourmindwanderto #lovetravel #makememories,2020-04-13 12:50:03+00:00,2,4,,#wheredoesyourmindwanderto #lovetravel #makememories,1.24968E+18
45,1.24898E+18,https://twitter.com/CarrickTravel/status/1248984853435072512,CarrickTravel,, ,2020-04-11 14:42:48+00:00,1,2,,,1.24898E+18
45,1.25317E+18,https://twitter.com/_lorenwebb_/status/1253166561722011648,_lorenwebb_,MrD2You1914," love you, brother!",2020-04-23 03:39:25+00:00,0,0,,,1.25317E+18
45,1.252E+18,https://twitter.com/_lorenwebb_/status/1252002001082253312,_lorenwebb_,,Can’t remember the last time I wore a pair of jeans.,2020-04-19 22:31:52+00:00,0,2,,,1.252E+18
45,1.25143E+18,https://twitter.com/_lorenwebb_/status/1251433729748320256,_lorenwebb_,blanchej85,Lies & Fairytales!!,2020-04-18 08:53:46+00:00,0,0,,,1.25143E+18
45,1.24916E+18,https://twitter.com/_lorenwebb_/status/1249164208761159687,_lorenwebb_,, ,2020-04-12 02:35:30+00:00,0,0,,,1.24916E+18
45,1.24916E+18,https://twitter.com/_lorenwebb_/status/1249159119942098944,_lorenwebb_,AMImusic_,Yess!!!!,2020-04-12 02:15:17+00:00,0,1,,,1.24916E+18
45,1.2488E+18,https://twitter.com/_lorenwebb_/status/1248802019839705089,_lorenwebb_,sheistyler,Honestly,2020-04-11 02:36:17+00:00,0,1,,,1.2488E+18
45,1.2488E+18,https://twitter.com/_lorenwebb_/status/1248801220703256579,_lorenwebb_,cjmercer06,"I was literally just looking at mine in the mirror like “Oh, Dear God!”",2020-04-11 02:33:07+00:00,0,0,,,1.2488E+18
45,1.24847E+18,https://twitter.com/_lorenwebb_/status/1248470689515851779,_lorenwebb_,NarkeliaCarr,"Oh dis me 2moro, baby!",2020-04-10 04:39:42+00:00,0,1,,,1.24847E+18
45,1.24847E+18,https://twitter.com/_lorenwebb_/status/1248465403736518658,_lorenwebb_,TamaraJadeMusic,Only Twin knows how proud I am to RT this lolol,2020-04-10 04:18:42+00:00,0,3,,,1.24847E+18
45,1.24847E+18,https://twitter.com/_lorenwebb_/status/1248465143593177088,_lorenwebb_,Only1Shana_MUA, ,2020-04-10 04:17:40+00:00,0,1,,,1.24847E+18
45,1.2517E+18,https://twitter.com/RyunTheobald/status/1251704807058018306,RyunTheobald,c_hudson5,Maybe that was what I was seeing. All equally spaced moving from SW to NE.,2020-04-19 02:50:56+00:00,0,1,,,1.2517E+18
45,1.2517E+18,https://twitter.com/RyunTheobald/status/1251701762500825088,RyunTheobald,bmowinkel,25 plus heading northeast of Geneva.,2020-04-19 02:38:50+00:00,0,2,,,1.2517E+18
45,1.24222E+18,https://twitter.com/RyunTheobald/status/1242222463930548224,RyunTheobald,NE4UGA,Tommy Gunz - GI Acreage Steakhouse - Hubbell Hungry Horse Saloon - Erickson The Speakeasy - Holdrege Coppermill - McCook Orange Coach in Axtell before it burned down was excellent.,2020-03-23 22:51:29+00:00,0,1,,,1.24222E+18
45,1.23247E+18,https://twitter.com/RyunTheobald/status/1232470765657702400,RyunTheobald,,"Final Score: Adams Central 65, Fillmore Central 27. #nebpreps",2020-02-26 01:01:43+00:00,0,5,,#nebpreps,1.23247E+18
45,1.23247E+18,https://twitter.com/RyunTheobald/status/1232468424770539522,RyunTheobald,,"End of 3, Adams Central leads Fillmore Central 57-18. #nebpreps",2020-02-26 00:52:25+00:00,0,0,,#nebpreps,1.23247E+18
45,1.23246E+18,https://twitter.com/RyunTheobald/status/1232463505929826304,RyunTheobald,,"At the half, Adams Central leads Fillmore Central 43-11. #nebpreps",2020-02-26 00:32:52+00:00,0,0,,#nebpreps,1.23246E+18
45,1.23246E+18,https://twitter.com/RyunTheobald/status/1232459629248024576,RyunTheobald,,"BBB sub, end of 1, Adams Central leads Fillmore Central 21-9. #nebpreps",2020-02-26 00:17:28+00:00,0,0,,#nebpreps,1.23246E+18
45,1.23104E+18,https://twitter.com/RyunTheobald/status/1231042938739752960,RyunTheobald,,"Final Score: Thayer Central 59, Fillmore Central 52. #nebpreps",2020-02-22 02:28:02+00:00,0,4,,#nebpreps,1.23104E+18
45,1.23104E+18,https://twitter.com/RyunTheobald/status/1231036194777108485,RyunTheobald,,"End of 3, Fillmore Central leads Thayer Central 39-29. #nebpreps",2020-02-22 02:01:15+00:00,1,5,,#nebpreps,1.23104E+18
45,1.23103E+18,https://twitter.com/RyunTheobald/status/1231030054806794240,RyunTheobald,,"At the half, Fillmore Central leads Thayer Central 26-18. #nebpreps",2020-02-22 01:36:51+00:00,1,6,,#nebpreps,1.23103E+18
45,1.25382E+18,https://twitter.com/Boom_likean808/status/1253815721601236992,Boom_likean808,____Kollin,They are so uncultured,2020-04-24 22:38:57+00:00,0,1,,,1.25382E+18
45,1.25375E+18,https://twitter.com/Boom_likean808/status/1253745182417342464,Boom_likean808,OnlyTheBishop,U get the cap which is $500 plus an extra $600 from the bail out,2020-04-24 17:58:39+00:00,0,0,,,1.25375E+18
45,1.25374E+18,https://twitter.com/Boom_likean808/status/1253744842301231106,Boom_likean808,OnlyTheBishop,They letting anyone apply for unemployment. Niggas ain’t worked in 2 years getting unemployment. 1100 weekly.,2020-04-24 17:57:18+00:00,0,0,,,1.25374E+18
45,1.25374E+18,https://twitter.com/Boom_likean808/status/1253744356193861634,Boom_likean808,brianmdunn_,I’m tired.,2020-04-24 17:55:22+00:00,0,0,,,1.25374E+18
45,1.25374E+18,https://twitter.com/Boom_likean808/status/1253744273519972352,Boom_likean808,OnlyTheBishop,Listen they better go get this free money NYC is giving to them.,2020-04-24 17:55:02+00:00,0,0,,,1.25374E+18
45,1.25374E+18,https://twitter.com/Boom_likean808/status/1253742307192561667,Boom_likean808,isaiahreese_,,2020-04-24 17:47:14+00:00,1,6,,,1.25374E+18
45,1.25373E+18,https://twitter.com/Boom_likean808/status/1253733743048744961,Boom_likean808,KalikYork,He told me he needs to buy masks and soap.,2020-04-24 17:13:12+00:00,0,2,,,1.25373E+18
45,1.25373E+18,https://twitter.com/Boom_likean808/status/1253733098027712512,Boom_likean808,,I hate this app so much. Why u begging within the first three messages?,2020-04-24 17:10:38+00:00,0,1,,,1.25373E+18
45,1.25358E+18,https://twitter.com/Boom_likean808/status/1253575731118067712,Boom_likean808,,Screen saver,2020-04-24 06:45:19+00:00,0,2,,,1.25358E+18
45,1.25358E+18,https://twitter.com/Boom_likean808/status/1253575484375531520,Boom_likean808,tenderoniTONY,Lol I’m fucking w u,2020-04-24 06:44:20+00:00,0,1,,,1.25358E+18
45,1.25386E+18,https://twitter.com/MATTHARDYBRAND/status/1253859405289881607,MATTHARDYBRAND,,"Got lots of tweets that I was ""reluctantly"" on TV tonight. It’s all good - They know I was there. Catch me now at @AEWrestling &amp; pick your favorite flavor of Matt Hardy.. pic.twitter.com/ivIvdCcfBv",2020-04-25 01:32:32+00:00,21,163,#NAME?,,1.25386E+18
45,1.25383E+18,https://twitter.com/MATTHARDYBRAND/status/1253834357397164032,MATTHARDYBRAND,thejtdunn,"I’m CRESTFALLEN & so sorry about your unfortunate Twist of Fate(s), @thejtdunn.",2020-04-24 23:53:00+00:00,18,168,#NAME?,,1.25383E+18
45,1.25383E+18,https://twitter.com/MATTHARDYBRAND/status/1253825101608505351,MATTHARDYBRAND,,Wolfie & I got to go ON SET & WATCH the behind the scenes magic of King Maxel’s new hit YouTube show! What an honor. http://YouTube.com/c/KingMaxel @BABYHARDYBRAND @WolfieHardy THE VIDEO OF THIS—-&gt; https://youtu.be/pLxEZutQJYw,2020-04-24 23:16:13+00:00,18,146,#NAME?,,1.25383E+18
45,1.25374E+18,https://twitter.com/MATTHARDYBRAND/status/1253738585616011264,MATTHARDYBRAND,,"Our latest check-in video came from the set on Maxel’s YT show http://YouTube.com/c/KingMaxel - Today, we want to know what your favorite YouTube channel is.",2020-04-24 17:32:26+00:00,25,209,,,1.25374E+18
45,1.25367E+18,https://twitter.com/MATTHARDYBRAND/status/1253667394834313216,MATTHARDYBRAND,,The most wholesome video you’ll watch today..,2020-04-24 12:49:33+00:00,55,528,,,1.25367E+18
45,1.25367E+18,https://twitter.com/MATTHARDYBRAND/status/1253666814674055169,MATTHARDYBRAND,WWEotd,Paving the way for Gronk 20 years ago..,2020-04-24 12:47:15+00:00,207,2512,,,1.25367E+18
45,1.25367E+18,https://twitter.com/MATTHARDYBRAND/status/1253665124633772032,MATTHARDYBRAND,GrappleClips,Can you guys track down the footage of the dark match I had with Jason Ahrndt (Joey Abs) which ended with me doing a 450 splash? We did a lot.,2020-04-24 12:40:32+00:00,9,412,,,1.25367E+18
45,1.25351E+18,https://twitter.com/MATTHARDYBRAND/status/1253510868962357248,MATTHARDYBRAND,,"IN THIS TOGETHER - Day 20, 4/23/20 https://twitter.com/matthardybrand/status/1253149881306398723",2020-04-24 02:27:34+00:00,33,177,,,1.25351E+18
45,1.25349E+18,https://twitter.com/MATTHARDYBRAND/status/1253489986873294854,MATTHARDYBRAND,ChefFlores256,MARAVILLOSO! Muchas gracias.,2020-04-24 01:04:36+00:00,1,21,,,1.25349E+18
45,1.25349E+18,https://twitter.com/MATTHARDYBRAND/status/1253485864409235457,MATTHARDYBRAND,BrianGreenstr16,"As long as this isn’t a #FlimFlam, I positively love it.",2020-04-24 00:48:13+00:00,9,87,,#FlimFlam,1.25349E+18
45,1.25366E+18,https://twitter.com/GNev2/status/1253655609519542274,GNev2,Kristian_Walsh, ,2020-04-24 12:02:43+00:00,1,78,,,1.25366E+18
45,1.25366E+18,https://twitter.com/GNev2/status/1253655076914237440,GNev2,Carra23,The desperation of teams at the top is equally nauseating as the noises from the teams at the bottom!,2020-04-24 12:00:36+00:00,482,5242,,,1.25366E+18
45,1.2536E+18,https://twitter.com/GNev2/status/1253600950931132416,GNev2,SkySportsPL,Feel so strongly on this !!,2020-04-24 08:25:32+00:00,316,3115,,,1.2536E+18
45,1.25343E+18,https://twitter.com/GNev2/status/1253426115151949824,GNev2,LeaveEUOfficial, ,2020-04-23 20:50:48+00:00,142,6302,,,1.25343E+18
45,1.25302E+18,https://twitter.com/GNev2/status/1253016288449957894,GNev2,LisaLatona_,Great work coach ,2020-04-22 17:42:17+00:00,0,3,,,1.25302E+18
45,1.25298E+18,https://twitter.com/GNev2/status/1252978692747407362,GNev2,,"It was great to take part in the @UA92mcr Virtual Event today – if you want to find out more about their game-changing approach to higher education, then book your place at the next event on 29 April at https://bit.ly/2VtTZhP",2020-04-22 15:12:54+00:00,8,64,#NAME?,,1.25298E+18
45,1.2523E+18,https://twitter.com/GNev2/status/1252301033595863047,GNev2,Ry_b8,Lovely Story,2020-04-20 18:20:07+00:00,0,40,,,1.2523E+18
45,1.25221E+18,https://twitter.com/GNev2/status/1252214723287953408,GNev2,DVATW,Don’t meet David.,2020-04-20 12:37:09+00:00,111,2944,,,1.25221E+18
45,1.25221E+18,https://twitter.com/GNev2/status/1252210451947163649,GNev2,DVATW,An intellect just looking down on everyone because you swallowed a dictionary .,2020-04-20 12:20:11+00:00,6,311,,,1.25221E+18
45,1.25221E+18,https://twitter.com/GNev2/status/1252208239380480000,GNev2,LisaLatona_,Easy that today ,2020-04-20 12:11:23+00:00,0,6,,,1.25221E+18
45,1.14427E+18,https://twitter.com/DavidEckstein22/status/1144272866092998657,DavidEckstein22,applejedi,"Yes!! We need EVERYONE to join the re-BELL-ion, even you, @RealFPJr!! Every vote counts!! We are down to the final hours! @Pirates",2019-06-27 15:54:45+00:00,13,93,#NAME?,,1.14427E+18
45,1.14427E+18,https://twitter.com/DavidEckstein22/status/1144269058252185600,DavidEckstein22,,.@HerUniverse @starwars We need your help!!! Please join the re-BELL-ion and vote @JBell_19 https://atmlb.com/2RyYtkX #BELLieve @mlb @Pirates,2019-06-27 15:39:37+00:00,17,50,#NAME?,#BELLieve,1.14427E+18
45,1.1421E+18,https://twitter.com/DavidEckstein22/status/1142104886533922816,DavidEckstein22,,Loving my new @netflix @Stranger_Things @Nike kicks! Ready for #StangerThings night @Pirates,2019-06-21 16:19:58+00:00,10,108,#NAME?,#StangerThings,1.1421E+18
45,1.1421E+18,https://twitter.com/DavidEckstein22/status/1142104552776318978,DavidEckstein22,,Ready for @netflix @Stranger_Things night at Pittsburgh @Pirates in my new #StrangerThings @Nike and shirt from @HotTopic Show me your best Eleven impression! My wife @HerUniverse and I are big fans but she says I should stick to baseball ,2019-06-21 16:18:39+00:00,29,292,#NAME?,#StrangerThings,1.1421E+18
45,1.13999E+18,https://twitter.com/DavidEckstein22/status/1139994930561146880,DavidEckstein22,,Thank you @ATT and @NCAACWS for having me today! It was an honor to be back at the #CWS My wife @HerUniverse and I are enjoying the game! #ATT,2019-06-15 20:35:46+00:00,8,150,#NAME?,#CWS #ATT,1.13999E+18
45,1.13972E+18,https://twitter.com/DavidEckstein22/status/1139720958699298826,DavidEckstein22,,Thank you to everyone who came to my signing at #CWS in Omaha today! I was thrilled to partner with @CocaCola Fun fact: I used to drink a Coke before every single @MLB game. It was part of my pre-game routine. #enjoy #cocacola,2019-06-15 02:27:06+00:00,8,215,#NAME?,#CWS #enjoy #cocacola,1.13972E+18
45,1.13927E+18,https://twitter.com/DavidEckstein22/status/1139268854679580672,DavidEckstein22,,"Hey baseball fans - I’m coming to Omaha with @CocaCola! Come snag a pic &amp; an autograph...I can’t wait to see everyone! #CWS #ad @NCAACWS @CocaCola Experience 6/14, 6:45 - 7:45 PM CT",2019-06-13 20:30:36+00:00,1,37,#NAME?,#CWS #ad,1.13927E+18
45,1.13679E+18,https://twitter.com/DavidEckstein22/status/1136794370424725504,DavidEckstein22,,Raise The Jolly Roger and Light the Bat-Signal we need help! Today was super hero day @Pirates Baseball &amp; our very own Caped Crusader Josh Bell @JBell_19 needs votes for the All-Star Game! @heruniverse @DCComics http://pirates.com/vote #BELLieve #MLB,2019-06-07 00:37:53+00:00,49,339,#NAME?,#BELLieve #MLB,1.13679E+18
45,1.08167E+18,https://twitter.com/DavidEckstein22/status/1081668822254452737,DavidEckstein22,Pirates,I’m honored and excited to be joining the @Pirates Organization! I’m looking forward to working on the same team as my brother @RickEckstein57 and this is what my Dad always wished for us.,2019-01-05 21:48:38+00:00,157,2041,#NAME?,,1.08167E+18
45,1.06724E+18,https://twitter.com/DavidEckstein22/status/1067237261207642112,DavidEckstein22,JRod3510,"Thank you for having me @JRod3510 and @RockLakeMiddle Once again, I was so impressed by your amazing students!",2018-11-27 02:02:46+00:00,3,68,#NAME?,,1.06724E+18
45,1.25384E+18,https://twitter.com/KillerMike/status/1253838144610480128,KillerMike,MissLofton,Salutes,2020-04-25 00:08:03+00:00,4,63,,,1.25384E+18
45,1.25384E+18,https://twitter.com/KillerMike/status/1253838082002104327,KillerMike,AndyDerer,Absolutely,2020-04-25 00:07:48+00:00,1,53,,,1.25384E+18
45,1.25384E+18,https://twitter.com/KillerMike/status/1253837350964277249,KillerMike,CoreyTheTru87,@me on my Black planet account and get off the white mans tweet’ER LoL .,2020-04-25 00:04:54+00:00,2,28,,,1.25384E+18
45,1.25384E+18,https://twitter.com/KillerMike/status/1253836426992422912,KillerMike,,Roll one up and grab your crayons @runjewels https://runthejewels.com/art-the-jewels/activity-center/,2020-04-25 00:01:14+00:00,42,210,#NAME?,,1.25384E+18
45,1.25342E+18,https://twitter.com/KillerMike/status/1253418587663986689,KillerMike,,#Happy420 thank the lord and my ancestors I’m healthy and here! https://www.instagram.com/p/B_VipFun8oT/?igshid=mfmuqt1ga21k,2020-04-23 20:20:53+00:00,6,90,,#Happy420,1.25342E+18
45,1.25334E+18,https://twitter.com/KillerMike/status/1253337520651112449,KillerMike,,hawkofthetown Thank u bro! Love and Respect. ! Steel Sharpens Steel so being mentioned with my genius ass potna @lilduval was an honor. Be well and y’all have a dope day! https://www.instagram.com/p/B_U9xu7HmDx/?igshid=xzubwhg0p1mn,2020-04-23 14:58:45+00:00,3,25,#NAME?,,1.25334E+18
