age,id,permalink,username,to,text,date,retweets,favorites,mentions,hashtags,geo
53,1247667325408546817,https://twitter.com/KirkdaleBooks/status/1247667325408546817,KirkdaleBooks,rhallwriter,Thank you Mr Hall !,2020-04-07 23:27:25+00:00,0,0,,,1247667325408546817
53,1247632663411818496,https://twitter.com/KirkdaleBooks/status/1247632663411818496,KirkdaleBooks,RolandBates12,"Temporary, I hope. Hey I've got 0 followers, that's fun",2020-04-07 21:09:41+00:00,0,3,,,1247632663411818496
53,1247632332489719810,https://twitter.com/KirkdaleBooks/status/1247632332489719810,KirkdaleBooks,,"News just in... I can't do Twitter and claim to be furloughed here. OOH! So I have set up @RolandBates12 you can see it's me in the picture. That's not work. Or something. Anyway, this Twitter account needs to be SHUT DOWN so contact me on the other one! For now. Get it?",2020-04-07 21:08:22+00:00,7,33,@RolandBates12,,1247632332489719810
53,1247621965466292224,https://twitter.com/KirkdaleBooks/status/1247621965466292224,KirkdaleBooks,SamBeckerMusic,"Ha Ha! Yes, I don't know what I am doing. I cut off the beginning, without meaning to. Also there are a few lines missing in the middle. But what a poem it is!! I heard it on the radio as I was travelling back from Cornwall about ten years ago... I was absolutely stunned.",2020-04-07 20:27:10+00:00,0,1,,,1247621965466292224
53,1247618606298472452,https://twitter.com/KirkdaleBooks/status/1247618606298472452,KirkdaleBooks,,,2020-04-07 20:13:50+00:00,0,1,,,1247618606298472452
53,1247615196157394945,https://twitter.com/KirkdaleBooks/status/1247615196157394945,KirkdaleBooks,,,2020-04-07 20:00:16+00:00,0,2,,,1247615196157394945
53,1247612766778785792,https://twitter.com/KirkdaleBooks/status/1247612766778785792,KirkdaleBooks,,,2020-04-07 19:50:37+00:00,0,1,,,1247612766778785792
53,1247610824098799624,https://twitter.com/KirkdaleBooks/status/1247610824098799624,KirkdaleBooks,,,2020-04-07 19:42:54+00:00,0,2,,,1247610824098799624
53,1247606266198921216,https://twitter.com/KirkdaleBooks/status/1247606266198921216,KirkdaleBooks,,,2020-04-07 19:24:47+00:00,0,6,,,1247606266198921216
53,1247602481175179269,https://twitter.com/KirkdaleBooks/status/1247602481175179269,KirkdaleBooks,,,2020-04-07 19:09:45+00:00,2,19,,,1247602481175179269
53,1254095460886872064,https://twitter.com/JVoigtBaseball/status/1254095460886872064,JVoigtBaseball,,Hope everyone is well and staying safe! Please check out my daughter Noelia's platform as Miss Collegiate Alabama! Great project and dear to her heart. Thx! https://www.facebook.com/100012008920111/posts/851680245242265/,2020-04-25 17:10:32+00:00,0,1,,,1254095460886872064
53,1247229619129987076,https://twitter.com/JVoigtBaseball/status/1247229619129987076,JVoigtBaseball,MetsDaddy2013,"He minimized movement, increased his recognition time, got barrel shorter/more direct to ball = better barrel accuracy, faster barrel speed and hit balls harder and more consistently. He worked hard to learn himself, what he had to do to get better, and did it. He deserved it. ",2020-04-06 18:28:08+00:00,2,3,,,1247229619129987076
53,1216528648167198720,https://twitter.com/JVoigtBaseball/status/1216528648167198720,JVoigtBaseball,MarkCHealey,Thx Mark. Continued success for you.,2020-01-13 01:13:26+00:00,0,1,,,1216528648167198720
53,1216524600642867207,https://twitter.com/JVoigtBaseball/status/1216524600642867207,JVoigtBaseball,,"Congratulations to Noelia Voigt for winning her 1st ""Miss"" division pageant today! She is now the new Miss Collegiate Alabama!! National competition will be in Little Rock, Arkansas in June. Here we come, Arkansas!!! Thanks to all of you and our family for support.",2020-01-13 00:57:21+00:00,0,20,,,1216524600642867207
53,1216193000054906880,https://twitter.com/JVoigtBaseball/status/1216193000054906880,JVoigtBaseball,,"Good luck to Noelia Voigt in the Miss Alabama Collegiate Pageant tomorrow. You killed the interview process today, now do your thing tomorrow! So many people are supporting you! Love you.",2020-01-12 02:59:41+00:00,0,10,,,1216193000054906880
53,1215831731548368896,https://twitter.com/JVoigtBaseball/status/1215831731548368896,JVoigtBaseball,,https://missalhighschoolam.wixsite.com/mysite-2/people-s-choice?fbclid=IwAR1Y8W63WCFQlXmjTH5PaCkGRIaUyOr_nPHAWCMpcxHyPghl0Uz4CWL7TrE,2020-01-11 03:04:08+00:00,0,1,,,1215831731548368896
53,1215831542947373056,https://twitter.com/JVoigtBaseball/status/1215831542947373056,JVoigtBaseball,,https://missalhighschoolam.wixsite.com/mysite-2/people-s-choice?fbclid=IwAR1Y8W63WCFQlXmjTH5PaCkGRIaUyOr_nPHAWCMpcxHyPghl0Uz4CWL7TrE,2020-01-11 03:03:23+00:00,1,0,,,1215831542947373056
53,1215831143725109253,https://twitter.com/JVoigtBaseball/status/1215831143725109253,JVoigtBaseball,,Only 1 hour left to vote for Noelia Voigt for the 2020 Miss Alabama Collegiate-Peoples Choice winner. Please support if you can.,2020-01-11 03:01:48+00:00,0,3,,,1215831143725109253
53,1188194716841664524,https://twitter.com/JVoigtBaseball/status/1188194716841664524,JVoigtBaseball,BNightengale,"RIP Chuck. Had him behind the plate in Nashville (American Association '91). Big brawl started on field. Nashville GM came to dugout and said ""what can I do to help?"" Chuck said ""I got it down here, you take care of your business up in the stands!"" RIP Always a respected pro.",2019-10-26 20:44:30+00:00,0,1,,,1188194716841664524
53,1188193078227668992,https://twitter.com/JVoigtBaseball/status/1188193078227668992,JVoigtBaseball,BNightengale,"RIP Chuck. Had him behind the plate in Nashville (American Association, '91). Big brawl started on field, Nashville GM came to dugout and said ""what can I do to help?"" Chuck said ""I got it down here on the field...you just take care of your business up there in the stands!"" RIP",2019-10-26 20:38:00+00:00,0,6,,,1188193078227668992
53,1254429169854881800,https://twitter.com/Raybar180/status/1254429169854881800,Raybar180,BenNicholson180,I agree! But I think the family of Eric need to decide if they want to.,2020-04-26 15:16:34+00:00,0,2,,,1254429169854881800
53,1254373762738401280,https://twitter.com/Raybar180/status/1254373762738401280,Raybar180,Wayne501Mardle,Welcome Wayne !!! Yours look amazing !! I wonder who is gonna be the next player to be revealed....,2020-04-26 11:36:24+00:00,2,76,,,1254373762738401280
53,1253984881681588224,https://twitter.com/Raybar180/status/1253984881681588224,Raybar180,Wayne501Mardle,Hahah Wayne I saw your card and I have to say one thing : !!! Sorry pal you have to wait until tomorrow Who should also have his own Ultimate Darts Card ??,2020-04-25 09:51:08+00:00,8,82,,,1253984881681588224
53,1252362698098016261,https://twitter.com/Raybar180/status/1252362698098016261,Raybar180,PhilTaylor,Thanks Buddy We can always do one in the virtual world ,2020-04-20 22:25:09+00:00,3,227,,,1252362698098016261
53,1252260568397950989,https://twitter.com/Raybar180/status/1252260568397950989,Raybar180,,Hahaha the great ⁦@Wayne501Mardle⁩ also getting his own Ultimate Darts Card !!! https://www.instagram.com/p/B_NRCCVBqGl/?igshid=urn2u3g25hk0,2020-04-20 15:39:20+00:00,2,61,@Wayne501Mardle,,1252260568397950989
53,1251817366679433218,https://twitter.com/Raybar180/status/1251817366679433218,Raybar180,,The new Ultimate Dart Card Player is ⁦@Duzza180⁩ !!! Welcome Glen !!! https://www.instagram.com/p/B_KIuUshX58/?igshid=tcf9eg240ajm,2020-04-19 10:18:12+00:00,6,82,@Duzza180,,1251817366679433218
53,1250452779820351488,https://twitter.com/Raybar180/status/1250452779820351488,Raybar180,,Come watch me again tomorrow during the History Making Home Live League and free to watch on http://dartshop.tv @ModusDarts180,2020-04-15 15:55:49+00:00,5,46,@ModusDarts180,,1250452779820351488
53,1249459145356595201,https://twitter.com/Raybar180/status/1249459145356595201,Raybar180,,We go again tomorrow !!! Really looking forward and hoping I can do better. #IconsofDarts,2020-04-12 22:07:28+00:00,7,128,,#IconsofDarts,1249459145356595201
53,1248982879566168064,https://twitter.com/Raybar180/status/1248982879566168064,Raybar180,,Felt a little under the weather today but tried my best and happy to get a win in the end. Tomorrow day of rest and start all over next week !! Really love playing in the #iconsofdarts @ModusDarts180,2020-04-11 14:34:58+00:00,5,198,@ModusDarts180,#iconsofdarts,1248982879566168064
53,1248341064462880768,https://twitter.com/Raybar180/status/1248341064462880768,Raybar180,charlie_hazlett,You can buy at http://www.ultimatedarts.com,2020-04-09 20:04:37+00:00,0,4,,,1248341064462880768
53,1254458848582094851,https://twitter.com/GordonRamsay/status/1254458848582094851,GordonRamsay,,Miss my Live #Ramsayin10 Yesterday ??? See how I did making #FishandChips in just 10 Miutes and 45 Seconds ;),2020-04-26 17:14:30+00:00,42,552,,#Ramsayin10 #FishandChips,1254458848582094851
53,1254077631814758400,https://twitter.com/GordonRamsay/status/1254077631814758400,GordonRamsay,,Who’s ready for some #FishandChips ??? Head to Insta now !,2020-04-25 15:59:41+00:00,123,2902,,#FishandChips,1254077631814758400
53,1253733515247534081,https://twitter.com/GordonRamsay/status/1253733515247534081,GordonRamsay,,#FishandChips. Live. Tomorrow. In 10 Minutes. Are you ready ??? See you tomorrow at 5 PM (UK)/12 PM EST (US) on my @Instagram Stories to make Fish and Chips in just 10 minutes on #Ramsayin10 !!,2020-04-24 17:12:17+00:00,135,1662,@instagram,#FishandChips #Ramsayin10,1253733515247534081
53,1253429812208652288,https://twitter.com/GordonRamsay/status/1253429812208652288,GordonRamsay,,Thank you to everyone who watched #GordonGinoandFred this season !!! Till next time Gx And if you missed any episodes...watch it here: https://bit.ly/2VUccFk,2020-04-23 21:05:29+00:00,297,9976,,#GordonGinoandFred,1253429812208652288
53,1253426953282924547,https://twitter.com/GordonRamsay/status/1253426953282924547,GordonRamsay,jimmyhall,Amazing ! Thx so much Gx #GordonGinoandFred,2020-04-23 20:54:07+00:00,15,390,,#GordonGinoandFred,1253426953282924547
53,1253426671580897285,https://twitter.com/GordonRamsay/status/1253426671580897285,GordonRamsay,Taypot22,Hope you didn't spill the glass ! #GordonGinoandFred,2020-04-23 20:53:00+00:00,12,260,,#GordonGinoandFred,1253426671580897285
53,1253424893493825539,https://twitter.com/GordonRamsay/status/1253424893493825539,GordonRamsay,kat_kat___,Doing our best ! #GordonGinoandFred,2020-04-23 20:45:56+00:00,17,504,,#GordonGinoandFred,1253424893493825539
53,1253423738797748226,https://twitter.com/GordonRamsay/status/1253423738797748226,GordonRamsay,TheYOLOArtist,Thx Daniel #GordonGinoandFred,2020-04-23 20:41:21+00:00,12,268,,#GordonGinoandFred,1253423738797748226
53,1253423185132785666,https://twitter.com/GordonRamsay/status/1253423185132785666,GordonRamsay,jasonennis3,Anywhere !!! #GordonGinoandFred,2020-04-23 20:39:09+00:00,11,312,,#GordonGinoandFred,1253423185132785666
53,1253422592104382464,https://twitter.com/GordonRamsay/status/1253422592104382464,GordonRamsay,s13vyh,There's still plenty more !!,2020-04-23 20:36:48+00:00,9,262,,,1253422592104382464
53,1254182670432710664,https://twitter.com/dariusrucker/status/1254182670432710664,dariusrucker,bullyray5150,Brute Bernard,2020-04-25 22:57:04+00:00,3,30,,,1254182670432710664
53,1253863486188335104,https://twitter.com/dariusrucker/status/1253863486188335104,dariusrucker,JavonKinlaw,Go continue being a beast!!!!!,2020-04-25 01:48:45+00:00,19,433,,,1253863486188335104
53,1253795553571373058,https://twitter.com/dariusrucker/status/1253795553571373058,dariusrucker,,"Tonight at 10PM EST, I am joining the @NFL #DraftAThon Live Steam with @RichEisen, players, musicians, Hollywood stars, gamers &amp; more to chat about quarantine life while raising awareness for six great causes for COVID-19 relief. Stream right here on the NFL Twitter and more!",2020-04-24 21:18:49+00:00,14,95,@NFL @richeisen,#DraftAThon,1253795553571373058
53,1253698816341151750,https://twitter.com/dariusrucker/status/1253698816341151750,dariusrucker,mgcsports,Go get it!!!,2020-04-24 14:54:25+00:00,4,16,,,1253698816341151750
53,1253694706866966528,https://twitter.com/dariusrucker/status/1253694706866966528,dariusrucker,NDmom,Easy Chris. Haters gonna hate!!,2020-04-24 14:38:05+00:00,2,38,,,1253694706866966528
53,1253642234639126528,https://twitter.com/dariusrucker/status/1253642234639126528,dariusrucker,Niro4Niro,No!!,2020-04-24 11:09:34+00:00,8,207,,,1253642234639126528
53,1253487800105795595,https://twitter.com/dariusrucker/status/1253487800105795595,dariusrucker,,@MiamiDolphins suoerbowl bound!!!,2020-04-24 00:55:54+00:00,67,498,@MiamiDolphins,,1253487800105795595
53,1253098422221123586,https://twitter.com/dariusrucker/status/1253098422221123586,dariusrucker,JoshCohenRadio,Super bowl journey begins,2020-04-22 23:08:39+00:00,10,114,,,1253098422221123586
53,1252265821751201794,https://twitter.com/dariusrucker/status/1252265821751201794,dariusrucker,MrTommyLand,I absolutely agree with this statement. Hahahhhaahahahhhah!!!!! And I was that guy!!!,2020-04-20 16:00:12+00:00,87,739,,,1252265821751201794
53,1251275848625291264,https://twitter.com/dariusrucker/status/1251275848625291264,dariusrucker,,"It was an honor to perform for patients, families & staff at @MUSCKids today thanks to @MusiciansOnCall and #JustBeYou. And a big THANK YOU to all our healthcare professionals - you're incredible! #WashYourHands",2020-04-17 22:26:24+00:00,40,530,@MUSCkids @musiciansoncall,#JustBeYou #WashYourHands #WashYourHands,1251275848625291264
53,1253832955367051266,https://twitter.com/AdamSandler/status/1253832955367051266,AdamSandler,,"You guys can get refunds wherever you purchased your tickets. Keep washing your hands and see you when the time is right. Love, Sandler",2020-04-24 23:47:26+00:00,52,1860,,,1253832955367051266
53,1253832953949347840,https://twitter.com/AdamSandler/status/1253832953949347840,AdamSandler,,"Hey you all. Hope you’re staying healthy. Due to the uncertainty surrounding when it will be safe to reschedule my postponed March and April tour dates, we have decided to cancel them.",2020-04-24 23:47:25+00:00,70,1870,,,1253832953949347840
53,1252635544187596803,https://twitter.com/AdamSandler/status/1252635544187596803,AdamSandler,,So let's go,2020-04-21 16:29:21+00:00,1305,12701,,,1252635544187596803
53,1251134052511256586,https://twitter.com/AdamSandler/status/1251134052511256586,AdamSandler,,Miss you all,2020-04-17 13:02:57+00:00,6351,37978,,,1251134052511256586
53,1248324542159675392,https://twitter.com/AdamSandler/status/1248324542159675392,AdamSandler,KevinJames,KJ bringing the funnnnny,2020-04-09 18:58:58+00:00,298,2458,,,1248324542159675392
53,1248127461402923008,https://twitter.com/AdamSandler/status/1248127461402923008,AdamSandler,ArianaGrande,A tough day for Bobby...Vicki...and Mama.,2020-04-09 05:55:50+00:00,11134,106167,,,1248127461402923008
53,1248008137950388225,https://twitter.com/AdamSandler/status/1248008137950388225,AdamSandler,,Happy Passover! Love to all!,2020-04-08 22:01:41+00:00,980,13780,,,1248008137950388225
53,1247672834819624960,https://twitter.com/AdamSandler/status/1247672834819624960,AdamSandler,,RIP VIC HENLEY. Such a funny man. Loved him. Thoughts and prayers to his family.,2020-04-07 23:49:19+00:00,152,3162,,,1247672834819624960
53,1247655791072407552,https://twitter.com/AdamSandler/status/1247655791072407552,AdamSandler,,RIP HAL WILLNER. An incredible person who so many of us will miss. Love u pal.,2020-04-07 22:41:35+00:00,121,3374,,,1247655791072407552
53,1247262730836258818,https://twitter.com/AdamSandler/status/1247262730836258818,AdamSandler,ArianaGrande,Bobby Boucher approves of this message,2020-04-06 20:39:42+00:00,15340,151378,,,1247262730836258818
53,1254415057061986305,https://twitter.com/ErnestJaaann/status/1254415057061986305,ErnestJaaann,angeloxperalta,HAHAHAHAAHAHAHAHAHAHAHA GORILLAPEEK SOUNDTRIP,2020-04-26 14:20:30+00:00,0,1,,,1254415057061986305
53,1254071403076186112,https://twitter.com/ErnestJaaann/status/1254071403076186112,ErnestJaaann,,adios muchachos,2020-04-25 15:34:56+00:00,0,0,,,1254071403076186112
53,1253986970616750082,https://twitter.com/ErnestJaaann/status/1253986970616750082,ErnestJaaann,,b y e,2020-04-25 09:59:26+00:00,0,0,,,1253986970616750082
53,1253894271272251392,https://twitter.com/ErnestJaaann/status/1253894271272251392,ErnestJaaann,,bzzzt,2020-04-25 03:51:05+00:00,0,0,,,1253894271272251392
53,1253534993235578880,https://twitter.com/ErnestJaaann/status/1253534993235578880,ErnestJaaann,,bitches i taylor ganged that!~,2020-04-24 04:03:26+00:00,0,0,,,1253534993235578880
53,1253259947921399809,https://twitter.com/ErnestJaaann/status/1253259947921399809,ErnestJaaann,,yawyaw kaayong mga hinay ay way kaya sa bigaon HAHAHAHAHAHAHA,2020-04-23 09:50:30+00:00,0,1,,,1253259947921399809
53,1253146773259866112,https://twitter.com/ErnestJaaann/status/1253146773259866112,ErnestJaaann,,na ol nay ermat sulods balay,2020-04-23 02:20:47+00:00,0,6,,,1253146773259866112
53,1252969936378421248,https://twitter.com/ErnestJaaann/status/1252969936378421248,ErnestJaaann,endzaeeee,@miggyjuson alingogngog dotes,2020-04-22 14:38:06+00:00,0,0,@miggyjuson,,1252969936378421248
53,1252854823801679874,https://twitter.com/ErnestJaaann/status/1252854823801679874,ErnestJaaann,EdwxrdT,HAHAHAHAAHHAHAA MISS U BOG KASUMBAGON NA KAAYO KO SAIMOHA BOG ,2020-04-22 07:00:41+00:00,0,1,,,1252854823801679874
53,1252852346968629249,https://twitter.com/ErnestJaaann/status/1252852346968629249,ErnestJaaann,EdwxrdT,62 #neverforget ,2020-04-22 06:50:51+00:00,0,2,,#neverforget,1252852346968629249
53,967065274250878976,https://twitter.com/fountain/status/967065274250878976,fountain,,Thanks to all the @alexadevs for an amazing workshop last night. Terrific insight into creating skills with Alexa. @TheOnlyAkersh @SleepyDeveloper @cwillycs,2018-02-23 15:55:03+00:00,0,3,@alexadevs @TheOnlyAkersh @SleepyDeveloper @cwillycs,,967065274250878976
53,925767961939410944,https://twitter.com/fountain/status/925767961939410944,fountain,TechnicallyBK,Please help spread the word!,2017-11-01 16:54:16+00:00,1,0,,,925767961939410944
53,901163319507251200,https://twitter.com/fountain/status/901163319507251200,fountain,,Last call for votes! Log into #PanelPicker and vote on my #SXSWEDU idea: http://panelpicker.sxsw.com/vote/77277 #CompetencyEd,2017-08-25 19:24:12+00:00,0,0,,#PanelPicker #SXSWEDU #CompetencyEd,901163319507251200
53,899313648774111237,https://twitter.com/fountain/status/899313648774111237,fountain,icopythat,I think so.,2017-08-20 16:54:16+00:00,0,0,,,899313648774111237
53,899000279949086720,https://twitter.com/fountain/status/899000279949086720,fountain,,Do you remember when you joined Twitter? I do! #MyTwitterAnniversary,2017-08-19 20:09:04+00:00,0,1,,#MyTwitterAnniversary #MyTwitterAnniversary,899000279949086720
53,897499520241614848,https://twitter.com/fountain/status/897499520241614848,fountain,,"I dig this online course. Great production, promotion and an innovative approach to the subject! #edtech #edchat",2017-08-15 16:45:35+00:00,0,0,,#edtech #edchat,897499520241614848
53,894648813847273473,https://twitter.com/fountain/status/894648813847273473,fountain,,I want to build a database to accelerate the adoption of competency-based education. #edtech #SXSWEdu #edchat http://panelpicker.sxsw.com/vote/77277,2017-08-07 19:57:53+00:00,1,2,,#edtech #SXSWEdu #edchat,894648813847273473
53,892535836226531329,https://twitter.com/fountain/status/892535836226531329,fountain,,I love the gym. I'm just not IN love with the gym.,2017-08-02 00:01:40+00:00,0,0,,,892535836226531329
53,870309229130903556,https://twitter.com/fountain/status/870309229130903556,fountain,,Great opportunity for female entrepreneurs! Get a desk for $100/month,2017-06-01 16:01:04+00:00,1,2,,,870309229130903556
53,867446112084520963,https://twitter.com/fountain/status/867446112084520963,fountain,,"Just updated my @LinkedIn headline to ""I HAVE A VERY GOOD BRAIN"" Jobs should start rolling in now.",2017-05-24 18:24:04+00:00,0,2,@LinkedIn,,867446112084520963
53,1254514405431226379,https://twitter.com/Timothy40311086/status/1254514405431226379,Timothy40311086,TerranceTucker1,Appreciate it... ,2020-04-26 20:55:16+00:00,0,0,,,1254514405431226379
53,1254455545559486467,https://twitter.com/Timothy40311086/status/1254455545559486467,Timothy40311086,dclarkmitchell,GOMAB...,2020-04-26 17:01:23+00:00,0,0,,,1254455545559486467
53,1254454782363865089,https://twitter.com/Timothy40311086/status/1254454782363865089,Timothy40311086,monroe1973,My...,2020-04-26 16:58:21+00:00,0,0,,,1254454782363865089
53,1254454622334451714,https://twitter.com/Timothy40311086/status/1254454622334451714,Timothy40311086,monroe1973,Thank You May Brother... ,2020-04-26 16:57:43+00:00,0,0,,,1254454622334451714
53,1240794913672957956,https://twitter.com/Timothy40311086/status/1240794913672957956,Timothy40311086,t_bear_,He looks lost... ,2020-03-20 00:18:54+00:00,0,0,,,1240794913672957956
53,1233598471195758592,https://twitter.com/Timothy40311086/status/1233598471195758592,Timothy40311086,rwellmanncshs,"There’s been a lot of sprinters come through College Station, but distance runners put us on the map. I wish I could’ve been there to see that one..",2020-02-29 03:42:49+00:00,0,5,,,1233598471195758592
53,1219095980844429314,https://twitter.com/Timothy40311086/status/1219095980844429314,Timothy40311086,,"Me and the family had a great time at the Houston Rockets vs LA Lakers game on yesterday. My team didn’t win, but it was good to see Consol product Alex Caruso in action for the Lakers..",2020-01-20 03:15:06+00:00,1,6,,,1219095980844429314
53,1195510885940449280,https://twitter.com/Timothy40311086/status/1195510885940449280,Timothy40311086,ApollosDaily,Ain’t nothing to it but to do it... ,2019-11-16 01:16:21+00:00,0,1,,,1195510885940449280
53,1193588225954201600,https://twitter.com/Timothy40311086/status/1193588225954201600,Timothy40311086,monroe1973,I listen to the game on the radio . What a great win. Your son was all over the field. His future looks promising. ,2019-11-10 17:56:23+00:00,0,1,,,1193588225954201600
53,1179523168152817664,https://twitter.com/Timothy40311086/status/1179523168152817664,Timothy40311086,CBSNews, ,2019-10-02 22:26:52+00:00,0,0,,,1179523168152817664
53,1241056246351802368,https://twitter.com/salmahayek/status/1241056246351802368,salmahayek,,Bee is very serious about this social distancing thing! Hope you all are getting to spend quality time with your pets and loved ones Mi Bee se a tomado muy en serio lo del distanciamiento social. Espero que todos estén disfrutando pasar tiempo con sus mascotas. ,2020-03-20 17:37:21+00:00,77,1439,,,1241056246351802368
53,1239638045965484034,https://twitter.com/salmahayek/status/1239638045965484034,salmahayek,,"Sé que la mayoría de nosotros estamos haciendo todo lo posible para permanecer adentro y distanciarnos, pero al menos estamos en esto juntos y pensando en las personas más vulnerables.",2020-03-16 19:41:56+00:00,39,510,,,1239638045965484034
53,1239638044728156160,https://twitter.com/salmahayek/status/1239638044728156160,salmahayek,,"I know most of us are doing our best to stay inside and distance ourselves, but at least we are going through this together and thinking of the people who are most vulnerable.",2020-03-16 19:41:55+00:00,219,6226,,,1239638044728156160
53,1238551115177684992,https://twitter.com/salmahayek/status/1238551115177684992,salmahayek,,"In the corners of his mind between memory & regret lies Dolores, his first great love. En los rincones de su mente entre la memoria y el arrepentimiento se encuentra Dolores, su primer gran amor. #TheRoadsNotTaken, now playing in theaters. @BardemAntarctic @BleeckerStFilms",2020-03-13 19:42:51+00:00,42,695,@BardemAntarctic @bleeckerstfilms,#TheRoadsNotTaken,1238551115177684992
53,1238147027973730304,https://twitter.com/salmahayek/status/1238147027973730304,salmahayek,,Fake Fur Piel Falsa #TBT,2020-03-12 16:57:09+00:00,116,4140,,#TBT,1238147027973730304
53,1237429014484017153,https://twitter.com/salmahayek/status/1237429014484017153,salmahayek,,Proceeds from all onlines sales throughout March from Bella’s #SheSaid collection will be donated to the The Prince’s Trust to support young women and girls. Bella’s inspiration behind the shirt is that “When a woman speaks it’s good to listen” ,2020-03-10 17:24:02+00:00,48,1205,,#SheSaid,1237429014484017153
53,1237429007735558150,https://twitter.com/salmahayek/status/1237429007735558150,salmahayek,,Proudly wearing my @Bella_Freud jumper in support of the #ChangeAGirlsLife campaign in partnership with with Prince Charles’ @PrincesTrust ,2020-03-10 17:24:00+00:00,114,4203,@bella_freud @PrincesTrust,#ChangeAGirlsLife,1237429007735558150
53,1253724978702409736,https://twitter.com/DavidSchwimmer/status/1253724978702409736,DavidSchwimmer,,Check out my buddy Tom’s award winning short film premiering TONIGHT on YouTube at 8pm EST! So funny... congrats Tommy! @mynameislars HOMECOMING https://bit.ly/HomecomingFilm And congrats @RomyRosemont @Spencer_Curnutt @findyourjenjoy @tlabella @thisiselbert !!,2020-04-24 16:38:22+00:00,22,454,@mynameislars @RomyRosemont @Spencer_Curnutt @findyourjenjoy @tlabella @thisiselbert,,1253724978702409736
53,1236007162087956486,https://twitter.com/DavidSchwimmer/status/1236007162087956486,DavidSchwimmer,skytv,"Indeed, who IS Clint?! (played by the crazy talented @kingslotty) #Intelligence concludes tonight on Sky One at 9pm with another double-bill. Feel free to keep watching on loop via @skytv or @NOWTV",2020-03-06 19:14:06+00:00,30,646,@kingslotty @skytv @NOWTV,#Intelligence,1236007162087956486
53,1230869802782162945,https://twitter.com/DavidSchwimmer/status/1230869802782162945,DavidSchwimmer,,"They’ve arrived! All episodes of #Intelligence, created and written by my partner in (cyber) crime @nickmohammed, available now on @skytv #gregwilliamsphotography",2020-02-21 15:00:04+00:00,91,2346,@nickmohammed @skytv,#Intelligence #gregwilliamsphotography,1230869802782162945
