age,id,permalink,username,to,text,date,retweets,favorites,mentions,hashtags,geo
73,1243561527476699138,https://twitter.com/thekikidee/status/1243561527476699138,thekikidee,MikeNaylorbbc,"Fairly , so lovely and an authentic artist",2020-03-27 15:32:27+00:00,0,1,,,1243561527476699138
73,1243560775467380740,https://twitter.com/thekikidee/status/1243560775467380740,thekikidee,MikeNaylorbbc,"Yes , carmelo produced for Julie album kx",2020-03-27 15:29:27+00:00,0,1,,,1243560775467380740
73,1243534096627912704,https://twitter.com/thekikidee/status/1243534096627912704,thekikidee,MikeNaylorbbc,Will let you know .. Kiki ..,2020-03-27 13:43:27+00:00,0,0,,,1243534096627912704
73,1243521441473212417,https://twitter.com/thekikidee/status/1243521441473212417,thekikidee,,Oriduced bt Carmelo . Our Julie singing plus me 2002x,2020-03-27 12:53:09+00:00,0,8,,,1243521441473212417
73,1243520336773238784,https://twitter.com/thekikidee/status/1243520336773238784,thekikidee,,@HAIKU_filmdoc I hope allis well and all the family are doing okay . Best kiki. Xxxx,2020-03-27 12:48:46+00:00,0,0,@HAIKU_filmdoc,,1243520336773238784
73,1243519893905051649,https://twitter.com/thekikidee/status/1243519893905051649,thekikidee,,@HAIKU_filmdoc,2020-03-27 12:47:00+00:00,0,0,@HAIKU_filmdoc,,1243519893905051649
73,1242883386928246786,https://twitter.com/thekikidee/status/1242883386928246786,thekikidee,,"I dont tweet much , not sure why but here I am ......... Be well , you all out in twitter land ! K x",2020-03-25 18:37:45+00:00,5,80,,,1242883386928246786
73,1242865404554477568,https://twitter.com/thekikidee/status/1242865404554477568,thekikidee,,"Something to listen to, to pass the time Greatest by Kiki Dee https://open.spotify.com/album/5lwptDfiB2PrIpMrvkpZFK?si=b1mOQm6ySVGO2l8wKWAjIg #NowPlaying",2020-03-25 17:26:18+00:00,0,21,,#NowPlaying,1242865404554477568
73,1228327761804218369,https://twitter.com/thekikidee/status/1228327761804218369,thekikidee,vicderbyshire,I hope you keep the programme . Stupid idea to take it off TV. Best Kiki Dee,2020-02-14 14:38:54+00:00,0,0,,,1228327761804218369
73,1228280479301931012,https://twitter.com/thekikidee/status/1228280479301931012,thekikidee,PamelaStephensn,Looking well and happy !!! Kiki x,2020-02-14 11:31:01+00:00,0,0,,,1228280479301931012
73,1200021584058224640,https://twitter.com/thekikidee/status/1200021584058224640,thekikidee,Tom_Ovens,Hello Heart felt lady ...... k xx,2019-11-28 12:00:15+00:00,0,2,,,1200021584058224640
73,1200019383281733634,https://twitter.com/thekikidee/status/1200019383281733634,thekikidee,PamelaStephensn,Cute .... and the dog ! Kiki XX,2019-11-28 11:51:30+00:00,0,1,,,1200019383281733634
73,1198218725297704965,https://twitter.com/thekikidee/status/1198218725297704965,thekikidee,DavidGraaff,Thanks David .... knee is okay,2019-11-23 12:36:20+00:00,0,0,,,1198218725297704965
73,1194236153798508544,https://twitter.com/thekikidee/status/1194236153798508544,thekikidee,,@JeffLynnesELO Hi Jeff Love your music ! Kiki ( Dee) x,2019-11-12 12:51:01+00:00,0,1,@JeffLynnesELO,,1194236153798508544
73,1194189060778053632,https://twitter.com/thekikidee/status/1194189060778053632,thekikidee,,,2019-11-12 09:43:53+00:00,3,17,,,1194189060778053632
73,1253362772693225473,https://twitter.com/akshaykumar/status/1253362772693225473,akshaykumar,,Looks like you’re totally enjoying yourself @LaraDutta and hence I’m sure it’s going to be an enjoyable watch. Don’t forget to catch #HotstarSpecialsHundred,2020-04-23 16:39:06+00:00,977,8386,@LaraDutta,#HotstarSpecialsHundred,1253362772693225473
73,1253217762240954368,https://twitter.com/akshaykumar/status/1253217762240954368,akshaykumar,,@ParineetiChopra @SinghAnurag79 @karanjohar @apoorvamehta18 @SunirKheterpal @bpraak @arkopravo19 @manojmuntashir @azeem2112 @adityadevmusic @DharmaMovies #CapeOfGoodFilms @iAmAzure @ZeeStudios_ @ZeeMusicCompany @JagranNews,2020-04-23 07:02:52+00:00,446,4157,@ParineetiChopra @SinghAnurag79 @karanjohar @apoorvamehta18 @SunirKheterpal @BPraak @ArkoPravo19 @manojmuntashir @azeem2112 @adityadevmusic @DharmaMovies @iAmAzure @ZeeStudios_ @ZeeMusicCompany @JagranNews,#CapeOfGoodFilms,1253217762240954368
73,1253217684755329024,https://twitter.com/akshaykumar/status/1253217684755329024,akshaykumar,,"किसी ने सही कहा है, मुश्किल के समय सिर्फ अपने साथ देते है और हमारे साथ इस मुश्किल में सबसे आगे है हमारे अपने डॉक्टर्स जो सफ़ेद कोट में सैनिको से कम नहीं है. देखिये #TeriMitti - Tribute कल 12.30 pm हमारी तरफ से ख़ास उनके लिए #DirectDilSe ",2020-04-23 07:02:34+00:00,5866,41177,,#TeriMitti #DirectDilSe,1253217684755329024
73,1248574839176065030,https://twitter.com/akshaykumar/status/1248574839176065030,akshaykumar,,"Privileged to host the stalwarts of Indian Music on @SangeetSetu_IN initiated by @isracopyright to aid #PMCARESFund. Please tune-in from 10th - 12th April, 8 PM onwards across DD, Aajtak OTT, DTH &amp; on YouTube: https://linktr.ee/SangeetSetu #IndiaFightsCorona #SangeetSetu",2020-04-10 11:33:33+00:00,2897,21264,@SangeetSetu_IN @isracopyright,#PMCARESFund #IndiaFightsCorona #SangeetSetu,1248574839176065030
73,1248490720270274560,https://twitter.com/akshaykumar/status/1248490720270274560,akshaykumar,,"#ThankYouDilSe @RajkumarHirani for being an integral part of this beautiful initiative to thank our Heroes who toil outside their homes, day and night so that we can stay comfortably in our homes with our families.",2020-04-10 05:59:18+00:00,2719,32291,@RajkumarHirani,#ThankYouDilSe,1248490720270274560
73,1248243543337873410,https://twitter.com/akshaykumar/status/1248243543337873410,akshaykumar,,सन् 1965 में आज के दिन खुद से कई गुना बड़ी दुश्मन ब्रिगेड को @crpfindia की छोटी सी टुकड़ी ने गुजरात की सरदार पोस्ट पर पराजित कर मिसाल बनाई l वीरगाथा की स्मृति में मनाए जाने वाले 'शौर्य दिवस' पर आप सबको बधाई व वीर शहीदों को श्रद्धांजलि।,2020-04-09 13:37:06+00:00,10314,97862,@crpfindia,,1248243543337873410
73,1248172655166930944,https://twitter.com/akshaykumar/status/1248172655166930944,akshaykumar,,"Name : Akshay Kumar City : Mumbai Mere aur mere parivaar ki taraf se... Police, Nagar Nigam ke workers, doctors, nurses, NGOs, volunteers, government officials, vendors, building ke guards ko #DilSeThankYou ",2020-04-09 08:55:25+00:00,14852,137775,,#DilSeThankYou,1248172655166930944
73,1248172532735201280,https://twitter.com/akshaykumar/status/1248172532735201280,akshaykumar,,"There’s an army of people working day and night to keep us safe, our families safe. Lets together say #DilSeThankYou to them because that’s the least we can do. @mybmc @MumbaiPolice",2020-04-09 08:54:56+00:00,8777,65031,@mybmc @MumbaiPolice,#DilSeThankYou,1248172532735201280
73,1247139528218824704,https://twitter.com/akshaykumar/status/1247139528218824704,akshaykumar,,All we need is a united stand. Aur phir #MuskurayegaIndia! Do share with your family and friends http://bit.ly/MuskurayegaIndia @jackkybhagnani @VishalMMishra #CapeOfGoodFilms @Jjust_Music,2020-04-06 12:30:08+00:00,4793,27628,@jackkybhagnani @VishalMMishra @Jjust_Music,#MuskurayegaIndia #CapeOfGoodFilms,1247139528218824704
73,1247081610207473664,https://twitter.com/akshaykumar/status/1247081610207473664,akshaykumar,,"At a time like this when our days are clouded with uncertainty and life has come to a standstill, bringing you a song of hope. #MuskurayegaIndia song out at 6 PM today. @Jjust_Music #CapeOfGoodFilms @VishalMMishra @jackkybhagnani",2020-04-06 08:40:00+00:00,2821,23397,@Jjust_Music @VishalMMishra @jackkybhagnani,#MuskurayegaIndia #CapeOfGoodFilms,1247081610207473664
73,1246828861934854145,https://twitter.com/akshaykumar/status/1246828861934854145,akshaykumar,,"Together we stand and together we will come out of this dark phase. Till then stay strong, stay safe #9Baje9Minute",2020-04-05 15:55:40+00:00,19136,191920,,#9Baje9Minute,1246828861934854145
73,1245953320864198657,https://twitter.com/akshaykumar/status/1245953320864198657,akshaykumar,,"Put your distress to rest. The government of Maharashtra, BMC and Mpower 1on1 have created a free helpline to ensure that you don’t feel alone. Call 1800-120-820-050 to speak to a mental health professional. #LetsTalk1on1 @mybmc",2020-04-03 05:56:35+00:00,2364,22416,@mybmc,#LetsTalk1on1,1245953320864198657
73,1243867585294131201,https://twitter.com/akshaykumar/status/1243867585294131201,akshaykumar,narendramodi,"This is that time when all that matters is the lives of our people. And we need to do anything and everything it takes. I pledge to contribute Rs 25 crores from my savings to @narendramodi ji’s PM-CARES Fund. Let’s save lives, Jaan hai toh jahaan hai. ",2020-03-28 11:48:36+00:00,76729,301044,@narendramodi,,1243867585294131201
73,1243053853987074049,https://twitter.com/akshaykumar/status/1243053853987074049,akshaykumar,Tutejajoginder,"Absolutely in agreement with you on this Joginder, @iTIGERSHROFF is going great guns but at this time the one and only superstar is the one who will stay at home ensuring his and his family’s safety. Urging each one of you to be a superstar ",2020-03-26 05:55:08+00:00,2331,23139,@iTIGERSHROFF,,1243053853987074049
73,1242403136867713024,https://twitter.com/akshaykumar/status/1242403136867713024,akshaykumar,,"At the risk of sounding repetitive, sharing my thoughts...there is a lockdown for a reason. Please don’t be selfish and venture out, you’re putting others lives at risk #StayAtHomeSaveLives. @mybmc",2020-03-24 10:49:25+00:00,19295,113283,@mybmc,#StayAtHomeSaveLives #StayAtHomeSaveLives,1242403136867713024
73,1253476276083531777,https://twitter.com/UNICEF/status/1253476276083531777,UNICEF,,#COVID19 reveals what is at stake when we don't have the protective shield of immunization. It’s not yet available for coronavirus but we do have vaccines to prevent other serious diseases like measles and polio. Let’s use them to protect every child. #VaccinesWork,2020-04-24 00:10:07+00:00,52,209,,#COVID19 #VaccinesWork,1253476276083531777
73,1253418116882677761,https://twitter.com/UNICEF/status/1253418116882677761,UNICEF,,"It’s #WorldBookDay! Listen to a story read by author, human rights activist and UNICEF Goodwill Ambassador @IshmaelBeah. #HealthyAtHome #ReadTheWorld",2020-04-23 20:19:01+00:00,35,155,@IshmaelBeah,#WorldBookDay #HealthyAtHome #HealthyAtHome #ReadTheWorld,1253418116882677761
73,1253389831482290176,https://twitter.com/UNICEF/status/1253389831482290176,UNICEF,,"LIVE: Find out how #COVID19 is affecting school children across the globe. Join our Chief of Education, @RobertG_Jenkins on @Reddit now.",2020-04-23 18:26:37+00:00,25,94,@RobertG_Jenkins @reddit,#COVID19,1253389831482290176
73,1253356744509739013,https://twitter.com/UNICEF/status/1253356744509739013,UNICEF,,So much has changed. Some things never will. #MeAt20 UNICEF was about 20 years old when we helped this nurse in Indonesia to protect and support a young child with a disability. We've been proud to stand by health workers and children every day since - and now more than ever.,2020-04-23 16:15:08+00:00,58,253,,#MeAt20,1253356744509739013
73,1253326540437217286,https://twitter.com/UNICEF/status/1253326540437217286,UNICEF,,"""These games on the tablets have taught us that there are no differences between boys and girls, and now we play football together as one."" Juliet, 16, is one of the Burundian girls living in a refugee camp in Rwanda participating in UNICEF's e-learning activities. #GirlsinICT",2020-04-23 14:15:07+00:00,36,147,,#GirlsinICT,1253326540437217286
73,1253318938810880002,https://twitter.com/UNICEF/status/1253318938810880002,UNICEF,,"On #GirlsinICT Day, head over to @EQUALS to join a Twitter chat with mentors and programme experts helping girls to learn and thrive online.",2020-04-23 13:44:55+00:00,45,250,@equals,#GirlsinICT,1253318938810880002
73,1253307131857719296,https://twitter.com/UNICEF/status/1253307131857719296,UNICEF,,On the frontline of #COVID19 and a brutal conflict. The children of eastern Ukraine need peace now.,2020-04-23 12:58:00+00:00,64,276,,#COVID19,1253307131857719296
73,1253270893272285185,https://twitter.com/UNICEF/status/1253270893272285185,UNICEF,,"For ourselves, for our families. Vladimir’s message to young people facing #COVID19 in Bulgaria and around the world.",2020-04-23 10:34:00+00:00,32,183,,#COVID19,1253270893272285185
73,1253235947132592129,https://twitter.com/UNICEF/status/1253235947132592129,UNICEF,,"Take a moment to make a memory. We all have memories of life before lockdown, school closures and physical distancing. Through acts of kindness, we can help each other get through this. Take a screenshot , share it with someone and encourage them to do the same. #COVID19",2020-04-23 08:15:08+00:00,109,402,,#COVID19,1253235947132592129
73,1253173017863217152,https://twitter.com/UNICEF/status/1253173017863217152,UNICEF,,"How do you keep your family healthy and happy during the #COVID19 pandemic? @PiaBritto, our chief of early childhood development, shares helpful tips in this new podcast. #EarlyMomentsMatter",2020-04-23 04:05:04+00:00,49,155,@PiaBritto,#COVID19 #EarlyMomentsMatter,1253173017863217152
73,1253125448504152065,https://twitter.com/UNICEF/status/1253125448504152065,UNICEF,,"“We all know what needs to be done, but we also know how much communities are suffering. Pata Pata has always been there for people at a time of struggle. I hope it helps once more. And I hope from our confined spaces we can dance once more.” @angeliquekidjo #HealthyAtHome",2020-04-23 00:56:03+00:00,58,221,@angeliquekidjo,#HealthyAtHome #HealthyAtHome,1253125448504152065
73,1253100033748107267,https://twitter.com/UNICEF/status/1253100033748107267,UNICEF,,"Over 3,100 cases of measles have been reported in North Kivu, DR Congo, since January. This is how critical vaccinations can continue during the #COVID19 pandemic. #VaccinesWork",2020-04-22 23:15:04+00:00,44,158,,#COVID19 #VaccinesWork,1253100033748107267
73,1253077405922725889,https://twitter.com/UNICEF/status/1253077405922725889,UNICEF,,"Even as we practise physical distancing due to #COVID19, it's important to remember nature is there for us, waiting. How are you staying #HealthyatHome and connected to nature this #EarthDay?",2020-04-22 21:45:09+00:00,101,354,,#COVID19 #HealthyatHome #HealthyatHome #EarthDay #EarthDay,1253077405922725889
73,1253067330789269504,https://twitter.com/UNICEF/status/1253067330789269504,UNICEF,,"The world needs you! On #EarthDay, learn about the different ways countries can take climate action by playing this game.",2020-04-22 21:05:07+00:00,37,124,,#EarthDay #EarthDay,1253067330789269504
73,1253032069401174022,https://twitter.com/UNICEF/status/1253032069401174022,UNICEF,,"The right to a clean future. Even as young people stay at home due to #COVID19, they are taking climate action online. Find out how you can too. #EarthDay",2020-04-22 18:45:00+00:00,152,439,,#COVID19 #EarthDay #EarthDay,1253032069401174022
73,1253474303275757571,https://twitter.com/drmikemurdock/status/1253474303275757571,drmikemurdock,,"Thu, Apr. 23 - Family Night",2020-04-24 00:02:16+00:00,4,11,,,1253474303275757571
73,1253449158561681409,https://twitter.com/drmikemurdock/status/1253449158561681409,drmikemurdock,,My Testimony..!,2020-04-23 22:22:22+00:00,11,12,,,1253449158561681409
73,1253445040212447234,https://twitter.com/drmikemurdock/status/1253445040212447234,drmikemurdock,,Please Don't Miss Today's Teaching.!! Live With @PastorAnaSweet.! Very Special Teaching.!! Join Us In 5 Minutes.!!! #drMM,2020-04-23 22:06:00+00:00,5,13,@PastorAnaSweet,#drMM,1253445040212447234
73,1253368402179026945,https://twitter.com/drmikemurdock/status/1253368402179026945,drmikemurdock,,"Thurs, Apr 23 - Live With DrMM..!",2020-04-23 17:01:28+00:00,16,19,,,1253368402179026945
73,1253217070814081024,https://twitter.com/drmikemurdock/status/1253217070814081024,drmikemurdock,,"Thurs, Apr 23 - Live With DrMM..! Re-Air",2020-04-23 07:00:07+00:00,5,18,,,1253217070814081024
73,1253170393403273217,https://twitter.com/drmikemurdock/status/1253170393403273217,drmikemurdock,,Until you establish a specific goal… You cannot taste the pleasure of a completion. #drMM #fb,2020-04-23 03:54:39+00:00,39,135,,#drMM #fb,1253170393403273217
73,1253087705933778944,https://twitter.com/drmikemurdock/status/1253087705933778944,drmikemurdock,,5:25p cst Joining Ps Ana LIVE Now! Facebook Instagram Periscope YouTube,2020-04-22 22:26:04+00:00,5,11,,,1253087705933778944
73,1253081167537991680,https://twitter.com/drmikemurdock/status/1253081167537991680,drmikemurdock,,"Wed, Apr 22 - How To Create Changes In Your Life..!",2020-04-22 22:00:06+00:00,15,19,,,1253081167537991680
73,1253069891344707591,https://twitter.com/drmikemurdock/status/1253069891344707591,drmikemurdock,Mike_Pence,Hehe.,2020-04-22 21:15:17+00:00,8,17,,,1253069891344707591
73,1253069795987259400,https://twitter.com/drmikemurdock/status/1253069795987259400,drmikemurdock,,#ANGER ...Is The Door To CHANGE. #drMM #fb,2020-04-22 21:14:54+00:00,14,36,,#ANGER #drMM #fb,1253069795987259400
73,1253069641334882312,https://twitter.com/drmikemurdock/status/1253069641334882312,drmikemurdock,,#ANGER ...Is The Seed for Solutions. #drMM #fb #politics,2020-04-22 21:14:18+00:00,12,19,,#ANGER #drMM #fb #politics,1253069641334882312
73,1253067203756412930,https://twitter.com/drmikemurdock/status/1253067203756412930,drmikemurdock,ApFrancisFais,Thanks so much!,2020-04-22 21:04:36+00:00,0,1,,,1253067203756412930
73,1253065438516387841,https://twitter.com/drmikemurdock/status/1253065438516387841,drmikemurdock,SaniyaKeer,Love this... Retweet!,2020-04-22 20:57:36+00:00,9,12,,,1253065438516387841
73,1253063597837647872,https://twitter.com/drmikemurdock/status/1253063597837647872,drmikemurdock,drmikemurdock,MY ANGER IS UNSPEAKABLE OVER THIS. POLICE. MAYORS. GOVERNORS. MY ANGER...IS UNSPEAKABLE. A GOVERNMENT WITHOUT A CONSCIENCE....,2020-04-22 20:50:17+00:00,8,16,,,1253063597837647872
73,1253054134116323328,https://twitter.com/drmikemurdock/status/1253054134116323328,drmikemurdock,DC_Draino,SICKENING... PRESIDENT TRUMP....PLEASE STOP THIS INSANITY... INSANITY INSANITY INSANITY ,2020-04-22 20:12:40+00:00,14,19,,,1253054134116323328
73,1226612593072017408,https://twitter.com/MatthewPerry/status/1226612593072017408,MatthewPerry,,You can now finally find me on Instagram. @mattyperry4,2020-02-09 21:03:26+00:00,2738,43772,@Mattyperry4,,1226612593072017408
73,1224901133618933760,https://twitter.com/MatthewPerry/status/1224901133618933760,MatthewPerry,,Big news coming...,2020-02-05 03:42:42+00:00,9600,95770,,,1224901133618933760
73,1221843323242999810,https://twitter.com/MatthewPerry/status/1221843323242999810,MatthewPerry,,Why do bad things have to happen? Rip Kobe.,2020-01-27 17:12:03+00:00,2547,38777,,,1221843323242999810
73,1195773426889154560,https://twitter.com/MatthewPerry/status/1195773426889154560,MatthewPerry,,"Sorry I don’t know who made the image, but bravo.",2019-11-16 18:39:36+00:00,1738,40223,,,1195773426889154560
73,1195773108017172480,https://twitter.com/MatthewPerry/status/1195773108017172480,MatthewPerry,,You’re welcome.,2019-11-16 18:38:19+00:00,58699,253955,,,1195773108017172480
73,1191905370760871936,https://twitter.com/MatthewPerry/status/1191905370760871936,MatthewPerry,,Please help if you can —,2019-11-06 02:29:19+00:00,493,5239,,,1191905370760871936
73,1190817800845062145,https://twitter.com/MatthewPerry/status/1190817800845062145,MatthewPerry,,“Have you had any work done?” Compliment? Or put down? You tell me.,2019-11-03 02:27:42+00:00,1776,32013,,,1190817800845062145
73,1174885728066498560,https://twitter.com/MatthewPerry/status/1174885728066498560,MatthewPerry,,file:///var/mobile/Library/SMS/Attachments/00/00/626C3E02-2499-4301-AEEE-DC8B30B396A4/Image-1.jpeg,2019-09-20 03:19:20+00:00,1021,13524,,,1174885728066498560
73,1168541380685238274,https://twitter.com/MatthewPerry/status/1168541380685238274,MatthewPerry,,Christian Bale has slightly more control over his body weight than I do.,2019-09-02 15:09:10+00:00,2297,36583,,,1168541380685238274
73,1168141212022431746,https://twitter.com/MatthewPerry/status/1168141212022431746,MatthewPerry,,"A new Top Gun movie is coming out I wonder if Tom Cruise will run, jump, or swim in this one.",2019-09-01 12:39:02+00:00,1154,22507,,,1168141212022431746
73,1167069660132585473,https://twitter.com/MatthewPerry/status/1167069660132585473,MatthewPerry,,Storms coming...,2019-08-29 13:41:04+00:00,1003,17786,,,1167069660132585473
73,1165521995997569024,https://twitter.com/MatthewPerry/status/1165521995997569024,MatthewPerry,,Not being able to sleep is one of the worst things that can happen to a person.,2019-08-25 07:11:12+00:00,12045,74058,,,1165521995997569024
73,1165249347887542273,https://twitter.com/MatthewPerry/status/1165249347887542273,MatthewPerry,,I built the Friends lego set. I made myself Batman. But that’s neither here nor there. I’m Batman.,2019-08-24 13:07:48+00:00,11060,119593,,,1165249347887542273
73,1163455010669076481,https://twitter.com/MatthewPerry/status/1163455010669076481,MatthewPerry,,50.,2019-08-19 14:17:45+00:00,5429,62951,,,1163455010669076481
73,1163179316810698752,https://twitter.com/MatthewPerry/status/1163179316810698752,MatthewPerry,,"On an unrelated note, I would very much like to look like Bradley Cooper. Thanks much.",2019-08-18 20:02:14+00:00,2096,38399,,,1163179316810698752
73,1253505513741901825,https://twitter.com/KTLA/status/1253505513741901825,KTLA,,"A team of NASA engineers at Southern California’s Jet Propulsion Laboratory have designed, built and shipped out a prototype of a new type of ventilator specially designed for COVID-19 patients in 37 days, officials said Thursday.",2020-04-24 02:06:18+00:00,34,120,,,1253505513741901825
73,1253504117164498944,https://twitter.com/KTLA/status/1253504117164498944,KTLA,,"As California tries to ramp up coronavirus testing as an essential step toward lifting stay-at-home restrictions, it faces hurdles that have been a problem from the start: Bottlenecks in the supply chain, delayed results and areas with no testing sites",2020-04-24 02:00:45+00:00,6,10,,,1253504117164498944
73,1253499186617520134,https://twitter.com/KTLA/status/1253499186617520134,KTLA,,"Louis C.K., who has acknowledged and apologized for sexually harassing five women, made the donation early last month as Biden was picking up steam in the primary elections",2020-04-24 01:41:09+00:00,6,41,,,1253499186617520134
73,1253495916268380162,https://twitter.com/KTLA/status/1253495916268380162,KTLA,,"U.S. District Judge Roger Benitez in San Diego ruled in favor of the California Rifle & Pistol Association, which asked him to stop the checks and related restrictions on ammo sales",2020-04-24 01:28:09+00:00,14,44,,,1253495916268380162
73,1253488830155558912,https://twitter.com/KTLA/status/1253488830155558912,KTLA,,Watch the KTLA 5 News at 6 with @chercalvin and @MicahKTLA live right here:,2020-04-24 01:00:00+00:00,2,3,@chercalvin @MicahKTLA,,1253488830155558912
73,1253487992271855616,https://twitter.com/KTLA/status/1253487992271855616,KTLA,,Los Angeles County residents who already receive CalFresh benefits can use their EBT card to make online food purchases at Amazon and Walmart starting April 28,2020-04-24 00:56:40+00:00,25,65,,,1253487992271855616
73,1253483630174724096,https://twitter.com/KTLA/status/1253483630174724096,KTLA,,"Garcetti: Free, walk-up testing is being offered to people on Skid Row who have been contacted by outreach team; so far, fewer than 500 homeless individuals tested. Watch live:",2020-04-24 00:39:20+00:00,3,9,,,1253483630174724096
73,1253482531573227521,https://twitter.com/KTLA/status/1253482531573227521,KTLA,,"Mayor announces nation of Qatar donated $5 million toward Mayor's Fund, which will provide another 15,000 Angeleno Cards. Watch live: https://ktla.com/news/local-news/l-a-mayor-provides-update-on-covid-19-outbreak-2/",2020-04-24 00:34:58+00:00,6,33,,,1253482531573227521
73,1253482278908391424,https://twitter.com/KTLA/status/1253482278908391424,KTLA,,"Garcetti says 1,146 Angeleno Cards issued, out of more than 500,000 applications received; more than 3,000 individuals currently benefitting. Watch live: https://ktla.com/news/local-news/l-a-mayor-provides-update-on-covid-19-outbreak-2/",2020-04-24 00:33:58+00:00,0,5,,,1253482278908391424
73,1253482132531380229,https://twitter.com/KTLA/status/1253482132531380229,KTLA,,"For the past 55 years, the Armenian community of L.A. has marched the streets of Hollywood to commemorate the memory of the Armenian Genocide. This year, amid the pandemic, they’re switching gears to help American families affected by the crisis",2020-04-24 00:33:23+00:00,18,48,,,1253482132531380229
73,1253479023910375424,https://twitter.com/KTLA/status/1253479023910375424,KTLA,,"Garcetti: In city of L.A., 471 new cases were reported today for total of 8,022; figure is a 6.3% increase from yesterday. Live: https://ktla.com/news/local-news/l-a-mayor-provides-update-on-covid-19-outbreak-2/",2020-04-24 00:21:02+00:00,5,6,,,1253479023910375424
73,1253478350628114432,https://twitter.com/KTLA/status/1253478350628114432,KTLA,,"Mayor Garcetti addresses Ramadan; says L.A. Muslims won't be able to gather on holiday, but can still observe it together. Watch live: https://ktla.com/news/local-news/l-a-mayor-provides-update-on-covid-19-outbreak-2/",2020-04-24 00:18:21+00:00,7,13,,,1253478350628114432
