age,id,permalink,username,to,text,date,retweets,favorites,mentions,hashtags,geo
73,1252945250663845893,https://twitter.com/incmnszmx/status/1252945250663845893,incmnszmx,,"Además de llevar una #Alimentaciónsaludable recuerda incluir una rutina de actividad física diariamente, aumentando los días y tiempo de realización. Se recomienda 30 min/día.",2020-04-22 13:00:01+00:00,8,33,,#Alimentaci,1252945250663845893
73,1252688557631844355,https://twitter.com/incmnszmx/status/1252688557631844355,incmnszmx,,El servicio de Orientación Nutricional no incluye programas individualizados ya que para esto se requiere una evaluación clínica que no es posible hacer vía telefónica.,2020-04-21 20:00:00+00:00,15,31,,,1252688557631844355
73,1252673460561739776,https://twitter.com/incmnszmx/status/1252673460561739776,incmnszmx,,Información que nos puede ayudar a todos. Por favor comparte. #COVID19 #CAIPaDi #NutriciónInforma #SanaDistancia,2020-04-21 19:00:01+00:00,65,75,,#COVID19 #CAIPaDi #Nutrici #SanaDistancia #SanaDistancia,1252673460561739776
73,1252628163341045763,https://twitter.com/incmnszmx/status/1252628163341045763,incmnszmx,,"Te invitamos a donar, para dar atención exclusiva a pacientes con COVID-19. Para más información ir a: http://www.funsaed.com",2020-04-21 16:00:01+00:00,24,19,,,1252628163341045763
73,1252582864769564673,https://twitter.com/incmnszmx/status/1252582864769564673,incmnszmx,,"Para llevar una #Alimentaciónsaludable recuerda que los alimentos enlatados y embutidos (salchicha, jamón, salami, chorizo, mortadela) son altos en sal (sodio) por ello debes evitarlos.",2020-04-21 13:00:01+00:00,28,48,,#Alimentaci,1252582864769564673
73,1252326170575552512,https://twitter.com/incmnszmx/status/1252326170575552512,incmnszmx,,"Para llevar una #Alimentaciónsaludable recuerde planear tus comida previamente y comprar solo lo necesario para evitar improvisar con alimentos no sugeridos (altos en calorías, grasas, azúcar).",2020-04-20 20:00:00+00:00,19,28,,#Alimentaci,1252326170575552512
73,1252311068916891648,https://twitter.com/incmnszmx/status/1252311068916891648,incmnszmx,,TIEMPO DE CUIDARNOS Y CUIDAR A OTROS #TiempoDeCuidarnos #COVID19 #INCMNSZseguridad #ComunicacionINCMNSZ,2020-04-20 19:00:00+00:00,4,16,,#TiempoDeCuidarnos #COVID19 #INCMNSZseguridad #ComunicacionINCMNSZ,1252311068916891648
73,1252273408869576705,https://twitter.com/incmnszmx/status/1252273408869576705,incmnszmx,,Para llevar una #Alimentaciónsaludable recuerda mantener horarios regulares de comida y evita pasar muchas horas sin consumir alimentos durante el día.,2020-04-20 16:30:21+00:00,28,47,,#Alimentaci,1252273408869576705
73,1251510420004917260,https://twitter.com/BroEliSoriano/status/1251510420004917260,BroEliSoriano,,Embracing God’s Purpose for Being a Godly Husband and Wife https://www.controversyextraordinary.com/2020/04/christian-relationship-advice.html #LetLovePrevail,2020-04-18 13:58:30+00:00,350,752,,#LetLovePrevail,1251510420004917260
73,1244829086331043840,https://twitter.com/BroEliSoriano/status/1244829086331043840,BroEliSoriano,Rogen83173094,magbalik loob ka! may awa ang Panginoon!,2020-03-31 03:29:16+00:00,7,27,,,1244829086331043840
73,1243854296556462080,https://twitter.com/BroEliSoriano/status/1243854296556462080,BroEliSoriano,,Discovering God’s Purpose for Giving Life https://www.controversyextraordinary.com/2020/03/Gods-purpose-for-giving-life.html #LifeIsPrecious,2020-03-28 10:55:48+00:00,453,800,,#LifeIsPrecious,1243854296556462080
73,1241348670123126786,https://twitter.com/BroEliSoriano/status/1241348670123126786,BroEliSoriano,,The Pale Horse and the Plagues It Brings https://bit.ly/PaleHorseInApocalypse #TurnBackToGod,2020-03-21 12:59:20+00:00,505,773,,#TurnBackToGod,1241348670123126786
73,1238796119561375746,https://twitter.com/BroEliSoriano/status/1238796119561375746,BroEliSoriano,,Coronavirus Pandemic Fears: How Should Christians Prepare? https://www.controversyextraordinary.com/2020/03/Christians-on-corona-pandemic.html #TimeToReflect,2020-03-14 11:56:25+00:00,612,886,,#TimeToReflect,1238796119561375746
73,1236271920741601280,https://twitter.com/BroEliSoriano/status/1236271920741601280,BroEliSoriano,,Never Enough: How Man's Greed Can Lead to God's Wrath http://bit.ly/MansGreedAngersGod #GodIsEnough,2020-03-07 12:46:09+00:00,325,516,,#GodIsEnough,1236271920741601280
73,1233729712784056320,https://twitter.com/BroEliSoriano/status/1233729712784056320,BroEliSoriano,,The Truth About Tithing http://bit.ly/TithingIsNotForChristians #TithingIsNotForChristians,2020-02-29 12:24:19+00:00,248,432,,#TithingIsNotForChristians,1233729712784056320
73,1231207986300948481,https://twitter.com/BroEliSoriano/status/1231207986300948481,BroEliSoriano,,"On Wedding Rings, Traditions of Man, and Obeying God http://bit.ly/ObeyGodFirst #ObeyGodFirst",2020-02-22 13:23:53+00:00,247,416,,#ObeyGodFirst,1231207986300948481
73,1228697455153295367,https://twitter.com/BroEliSoriano/status/1228697455153295367,BroEliSoriano,,Is It True Love? Finding the ‘One’ Without Looking for Them http://bit.ly/GodgivenPartner #GodgivenPartner,2020-02-15 15:07:56+00:00,316,629,,#GodgivenPartner,1228697455153295367
73,1226120251756118017,https://twitter.com/BroEliSoriano/status/1226120251756118017,BroEliSoriano,,Baptism Washes Away Sins http://bit.ly/ForgivenessInBaptism #ForgivenessInBaptism,2020-02-08 12:27:02+00:00,244,505,,#ForgivenessInBaptism,1226120251756118017
73,1223590646155501570,https://twitter.com/BroEliSoriano/status/1223590646155501570,BroEliSoriano,,Why Does God Allow Suffering? http://bit.ly/UnderstandingSufferings #UnderstandingSufferings,2020-02-01 12:55:17+00:00,291,470,,#UnderstandingSufferings,1223590646155501570
73,1221067364084731904,https://twitter.com/BroEliSoriano/status/1221067364084731904,BroEliSoriano,,Not Grudge but Love and Gratefulness to Parents http://bit.ly/GratitudeForParents #GratitudeForParents,2020-01-25 13:48:40+00:00,214,457,,#GratitudeForParents,1221067364084731904
73,1218504061659635712,https://twitter.com/BroEliSoriano/status/1218504061659635712,BroEliSoriano,,Be Prayerful: Christians Pray Without Ceasing http://bit.ly/PrayersCanDoMiracles #PrayersCanDoMiracles,2020-01-18 12:03:01+00:00,346,639,,#PrayersCanDoMiracles,1218504061659635712
73,1215976812335058945,https://twitter.com/BroEliSoriano/status/1215976812335058945,BroEliSoriano,,God Tests His Servants http://bit.ly/TheBeautyInTrials #TheBeautyInTrials,2020-01-11 12:40:38+00:00,343,565,,#TheBeautyInTrials,1215976812335058945
73,1213446238210838528,https://twitter.com/BroEliSoriano/status/1213446238210838528,BroEliSoriano,,'Missing Years of Jesus Christ Mystery' Solved http://bit.ly/FullStoryOfChrist #FullStoryOfChrist,2020-01-04 13:05:02+00:00,260,453,,#FullStoryOfChrist,1213446238210838528
73,1253429267402125313,https://twitter.com/BumbleCricket/status/1253429267402125313,BumbleCricket,,"Fancy a laugh ? All YouTube I think Wealdstone Raider Chip Cobb , Deaf Stuntman (Fast Show) Mick Miller - Noddy Rheem Water recorded message Have fun !! ",2020-04-23 21:03:19+00:00,1,17,,,1253429267402125313
73,1253419987487752195,https://twitter.com/BumbleCricket/status/1253419987487752195,BumbleCricket,Benedict_B,No ‘s in the game so far but it looks as if this pitch is flattening out ... it ain’t over yet,2020-04-23 20:26:27+00:00,1,22,,,1253419987487752195
73,1253419255925665792,https://twitter.com/BumbleCricket/status/1253419255925665792,BumbleCricket,RachelKirbyR,Need to see the hits !! ,2020-04-23 20:23:32+00:00,0,6,,,1253419255925665792
73,1253418715795742720,https://twitter.com/BumbleCricket/status/1253418715795742720,BumbleCricket,RachelKirbyR,260 hits on the way ... watch this space !,2020-04-23 20:21:23+00:00,0,9,,,1253418715795742720
73,1253418233740193797,https://twitter.com/BumbleCricket/status/1253418233740193797,BumbleCricket,No1Villan,Very trim,2020-04-23 20:19:28+00:00,0,4,,,1253418233740193797
73,1253417419277611008,https://twitter.com/BumbleCricket/status/1253417419277611008,BumbleCricket,,Bush of the day,2020-04-23 20:16:14+00:00,6,94,,,1253417419277611008
73,1253415394963906561,https://twitter.com/BumbleCricket/status/1253415394963906561,BumbleCricket,LancsCricketWMN,Good this ....,2020-04-23 20:08:12+00:00,1,38,,,1253415394963906561
73,1253415246456217600,https://twitter.com/BumbleCricket/status/1253415246456217600,BumbleCricket,LancsCricketWMN,Nice Alice ...sharp,2020-04-23 20:07:36+00:00,2,28,,,1253415246456217600
73,1253224898262114310,https://twitter.com/BumbleCricket/status/1253224898262114310,BumbleCricket,DeanoSHM,Lovely to see people walking by . Vast majority appreciating the lovely views .. Odd one or two ...??? #dogpoo,2020-04-23 07:31:14+00:00,2,10,,#dogpoo,1253224898262114310
73,1253224294190141440,https://twitter.com/BumbleCricket/status/1253224294190141440,BumbleCricket,thebrigadier1,Got one for 12 sovs... Dubai,2020-04-23 07:28:50+00:00,1,6,,,1253224294190141440
73,1253223429546926080,https://twitter.com/BumbleCricket/status/1253223429546926080,BumbleCricket,sarahlou_ent,It’s a great day out ! ,2020-04-23 07:25:24+00:00,0,6,,,1253223429546926080
73,1253223224026058752,https://twitter.com/BumbleCricket/status/1253223224026058752,BumbleCricket,paul_gtastic,Terrace to the right of stand leads to pie hut,2020-04-23 07:24:35+00:00,2,47,,,1253223224026058752
73,1253223058766209025,https://twitter.com/BumbleCricket/status/1253223058766209025,BumbleCricket,Rob_Bernard,No ... very nice,2020-04-23 07:23:55+00:00,1,6,,,1253223058766209025
73,1253063741719150598,https://twitter.com/BumbleCricket/status/1253063741719150598,BumbleCricket,SkyBet,Cracking day ....wrong result ... ,2020-04-22 20:50:51+00:00,7,71,,,1253063741719150598
73,1253063297563320322,https://twitter.com/BumbleCricket/status/1253063297563320322,BumbleCricket,TrevorSteven63,Trevor Steven !!! Well I never !!! ,2020-04-22 20:49:05+00:00,0,20,,,1253063297563320322
73,1251342576222904322,https://twitter.com/yungsc0tt/status/1251342576222904322,yungsc0tt,RedRogue64, ,2020-04-18 02:51:33+00:00,0,0,,,1251342576222904322
73,1248144889759576066,https://twitter.com/yungsc0tt/status/1248144889759576066,yungsc0tt,,"Like grandpa used to say if you shake it more than twice, you’re just playin with it",2020-04-09 07:05:05+00:00,0,0,,,1248144889759576066
73,1248134683600322560,https://twitter.com/yungsc0tt/status/1248134683600322560,yungsc0tt,,Idk if I can bring myself to vote for Biden. Why is this so shitty..,2020-04-09 06:24:32+00:00,0,0,,,1248134683600322560
73,1247997678836944898,https://twitter.com/yungsc0tt/status/1247997678836944898,yungsc0tt,,I’m almost out.,2020-04-08 21:20:07+00:00,0,1,,,1247997678836944898
73,1247997422359449600,https://twitter.com/yungsc0tt/status/1247997422359449600,yungsc0tt,olivia_treee,It is u know it’s true,2020-04-08 21:19:06+00:00,0,0,,,1247997422359449600
73,1246971670503489538,https://twitter.com/yungsc0tt/status/1246971670503489538,yungsc0tt,,,2020-04-06 01:23:08+00:00,0,0,,,1246971670503489538
73,1245930536968675328,https://twitter.com/yungsc0tt/status/1245930536968675328,yungsc0tt,ashleytoearth,I mean personally I’m more upset about the ok boomer chick she’s pretty hot,2020-04-03 04:26:02+00:00,0,0,,,1245930536968675328
73,1245880534275969026,https://twitter.com/yungsc0tt/status/1245880534275969026,yungsc0tt,ashleytoearth,Great poll ,2020-04-03 01:07:21+00:00,0,0,,,1245880534275969026
73,1245644546806968321,https://twitter.com/yungsc0tt/status/1245644546806968321,yungsc0tt,,"Ever think you found your wife and then she doesn’t reply to your first tinder messege, in which you call her a dude and a bro",2020-04-02 09:29:37+00:00,0,3,,,1245644546806968321
73,1245503844571688960,https://twitter.com/yungsc0tt/status/1245503844571688960,yungsc0tt,Malokhi2,I mean that’s the overall trend in any subreddit I’ve found,2020-04-02 00:10:31+00:00,0,0,,,1245503844571688960
73,1245503406464274435,https://twitter.com/yungsc0tt/status/1245503406464274435,yungsc0tt,Malokhi2,Reddit is like %2 funny original content and the rest is an overused version of the original memes,2020-04-02 00:08:47+00:00,0,0,,,1245503406464274435
73,1245094473253732354,https://twitter.com/yungsc0tt/status/1245094473253732354,yungsc0tt,,Three weeks still no unemployment check..,2020-03-31 21:03:49+00:00,0,1,,,1245094473253732354
73,1244931538325831681,https://twitter.com/yungsc0tt/status/1244931538325831681,yungsc0tt,,"Also the office isn’t funny at all, That also goes for parks and rec, that 70s show and any other stupid fuckin sitcom.",2020-03-31 10:16:23+00:00,0,0,,,1244931538325831681
73,1244929595788460034,https://twitter.com/yungsc0tt/status/1244929595788460034,yungsc0tt,,Reddit memes suck 97% of the time I’m puttin my foot down,2020-03-31 10:08:39+00:00,0,0,,,1244929595788460034
73,1244911390722347008,https://twitter.com/yungsc0tt/status/1244911390722347008,yungsc0tt,,I’ve been so bored even simping is getting old,2020-03-31 08:56:19+00:00,0,4,,,1244911390722347008
73,1253429580049735693,https://twitter.com/TheSlyStallone/status/1253429580049735693,TheSlyStallone,,Inferno… stalloneartwork https://www.instagram.com/p/B_VnmIhJ979/?igshid=1j5jce0clx3sm,2020-04-23 21:04:34+00:00,48,354,,,1253429580049735693
73,1253057024964739073,https://twitter.com/TheSlyStallone/status/1253057024964739073,TheSlyStallone,,Always searching for the ART IN LIFE ! stalloneartwork https://www.instagram.com/p/B_S-OGdJzqq/?igshid=dqfyc8ymjtkp,2020-04-22 20:24:10+00:00,63,601,,,1253057024964739073
73,1252771824263294976,https://twitter.com/TheSlyStallone/status/1252771824263294976,TheSlyStallone,JohnnyBerchtold,I’m very flattered and humbled by your energetic response. That is the beauty of youth ... so keep punching Casey and Big John!,2020-04-22 01:30:52+00:00,49,2452,,,1252771824263294976
73,1252700933852737536,https://twitter.com/TheSlyStallone/status/1252700933852737536,TheSlyStallone,,"Hanging out outdoors, is the best. Never take it for granted again. I want to do a Q&A tomorrow so get your questions ready. Keep punching https://www.instagram.com/p/B_QcSkiJk1x/?igshid=18t752ywbq87c",2020-04-21 20:49:11+00:00,98,993,,,1252700933852737536
73,1250876458047864833,https://twitter.com/TheSlyStallone/status/1250876458047864833,TheSlyStallone,,The great actor Brian Dennehy has passed away. He simply was a great actor ... He also was a Vietnam vet that helped me very much building the character of RAMBO The world has lost a great artist. #First Blood https://www.instagram.com/p/B_DenWsJ2Wi/?igshid=1dizuwyvjmzef,2020-04-16 19:59:22+00:00,1151,5817,,#First,1250876458047864833
73,1250560512510889986,https://twitter.com/TheSlyStallone/status/1250560512510889986,TheSlyStallone,,"People have asked me what does YO! mean? Well, it means something in between”YES and “NO!” But Rocky turned it into something more meaningful like “REALLY?“. slystalloneshop https://www.instagram.com/p/B_BOmNXJbm5/?igshid=1odnk55kllubo",2020-04-15 23:03:55+00:00,151,1327,,,1250560512510889986
73,1249450441370468355,https://twitter.com/TheSlyStallone/status/1249450441370468355,TheSlyStallone,,Moments later I’m getting mugged on Easter and telling my story to Arnold! https://www.instagram.com/p/B-5WI0QpSeX/?igshid=wet5mjhqu2g9,2020-04-12 21:32:53+00:00,99,1085,,,1249450441370468355
73,1249439518622732288,https://twitter.com/TheSlyStallone/status/1249439518622732288,TheSlyStallone,,Best to All !!! https://www.instagram.com/p/B-5RK9BpLLP/?igshid=phfoxu5jd77z,2020-04-12 20:49:29+00:00,80,773,,,1249439518622732288
73,1249122075350089735,https://twitter.com/TheSlyStallone/status/1249122075350089735,TheSlyStallone,,"Coloring my world with Paint... It’s a wonderful way to express yourself when words fall short. Keep punching, missing all the people that I’ve been so supportive in my life! https://www.instagram.com/p/B-3Az-fp1s7/?igshid=731jl41jpivt",2020-04-11 23:48:04+00:00,106,1021,,,1249122075350089735
73,1248438147974696961,https://twitter.com/TheSlyStallone/status/1248438147974696961,TheSlyStallone,,More Life in the rearview mirror. https://www.instagram.com/p/B-yJzMGJVoo/?igshid=16totasrjh07z,2020-04-10 02:30:23+00:00,56,617,,,1248438147974696961
73,1248437528035811329,https://twitter.com/TheSlyStallone/status/1248437528035811329,TheSlyStallone,,The walk down memory lane. https://www.instagram.com/p/B-yJhBYJQ5M/?igshid=88kx2ieaoujc,2020-04-10 02:27:56+00:00,34,361,,,1248437528035811329
73,1248433121453723649,https://twitter.com/TheSlyStallone/status/1248433121453723649,TheSlyStallone,,Time for a little flashback! https://www.instagram.com/p/B-yHg5LpSRn/?igshid=wxy1gjgpz9on,2020-04-10 02:10:25+00:00,65,681,,,1248433121453723649
73,1247996058954878984,https://twitter.com/TheSlyStallone/status/1247996058954878984,TheSlyStallone,,"My friend,Claude Van dam on the set of expendables two , it’s very sad that I had to kill him three hours later, oh well, that SHOWBIZ! @jcvd https://www.instagram.com/p/B-vAwihpzRS/?igshid=1sxuzr8csl4pi",2020-04-08 21:13:41+00:00,113,1423,@JCVD,,1247996058954878984
73,1247650601019662336,https://twitter.com/TheSlyStallone/status/1247650601019662336,TheSlyStallone,,"This is a painting called LIFE ... The image is CLUBBER LANG , aka mr t. stalloneartwork https://www.instagram.com/p/B-sjqgUp4u_/?igshid=codj9ad8bmkk",2020-04-07 22:20:58+00:00,81,717,,,1247650601019662336
73,1247230430270586882,https://twitter.com/TheSlyStallone/status/1247230430270586882,TheSlyStallone,,A painting I did of the legendary Steve Reeves. He played in the Hercules movies. When I saw him in HERCULES UNCHAINED when I was 12 years old and change the course of my life. stalloneartwork https://www.instagram.com/p/B-pkmDCJUwq/?igshid=1fzdua5exfphj,2020-04-06 18:31:21+00:00,85,760,,,1247230430270586882
73,1251647124812562437,https://twitter.com/DavidBowieReal/status/1251647124812562437,DavidBowieReal,,That's 31st March 1995!,2020-04-18 23:01:43+00:00,17,160,,,1251647124812562437
73,1251646804099305477,https://twitter.com/DavidBowieReal/status/1251646804099305477,DavidBowieReal,,"31st March saw the announcement of a Bowie solo exhibition of his art, running from 18th April, to 29th April, 1995, at the Gallery in Cork Street, London. This was to be the first solo exhibition of his work: New Afro Pagan and Work: 1975-1995. More here: https://smarturl.it/BowieAfroPaganDBFB",2020-04-18 23:00:27+00:00,101,624,,,1251646804099305477
73,1251297696125763585,https://twitter.com/DavidBowieReal/status/1251297696125763585,DavidBowieReal,,"With a theme of STAY HOME (“David Bowie turned isolation into an art form""), and in celebration of TASCHEN’s reissue of @TheRealMickRock’s superb The Rise of David Bowie 1972-1973, Robin Murray interviews the photographer for Issue #115 of @ClashMagazine - https://smarturl.it/CLASH115BowieRock",2020-04-17 23:53:13+00:00,110,583,@TheRealMickRock @ClashMagazine,,1251297696125763585
73,1250767385692459008,https://twitter.com/DavidBowieReal/status/1250767385692459008,DavidBowieReal,,"As April 16th turns to the 17th, Parlophone are making the 9-track CHANGESNOWBOWIE LP available for streaming: https://lnk.to/DavidBowie-CNB Originally broadcast by the BBC for his 50th birthday in 1997, CHANGESNOWBOWIE features acoustic versions of some of David’s own favourite songs.",2020-04-16 12:45:57+00:00,303,1017,,,1250767385692459008
73,1248219671117078529,https://twitter.com/DavidBowieReal/status/1248219671117078529,DavidBowieReal,,"As promised last week, as Thursday 09th April turns to Friday 10th April (which it already has in some parts of the world), Parlophone makes available the Repetition ’97 video for streaming and download along with the Repetition ’97 CHANGESNOWBOWIE audio: https://lnk.to/DavidBowie-Repetition",2020-04-09 12:02:15+00:00,184,737,,,1248219671117078529
73,1246864986661625859,https://twitter.com/DavidBowieReal/status/1246864986661625859,DavidBowieReal,,"Labyrinth promo shots of David Bowie as Jareth and Jennifer Connelly as Sarah. Sarah’s younger brother, Toby, is nowhere to be seen as evil Jareth kidnapped him while Sarah was distracted. Social Services have now been informed https://smarturl.it/LabyrinthDBFB #RandomBowie #BowieLabyrinth",2020-04-05 18:19:13+00:00,495,1977,,#RandomBowie #BowieLabyrinth,1246864986661625859
73,1246013512238989312,https://twitter.com/DavidBowieReal/status/1246013512238989312,DavidBowieReal,,"You’ll no doubt be pleased to learn that @dekmagazine’s creator, Chris Jones, has been in touch again with an exclusive first look at the John Scarisbrick DEK cover and a sneak preview of some of the content of the premiere issue of the magazine. Pre-order https://smarturl.it/DEKmagazine",2020-04-03 09:55:45+00:00,87,469,@DEKmagazine,,1246013512238989312
73,1245350373067546625,https://twitter.com/DavidBowieReal/status/1245350373067546625,DavidBowieReal,,★ Friday 10th April: Repetition ’97 video available for streaming and download. ★ Friday 10th April: Repetition ’97 CHANGESNOWBOWIE version audio available for streaming. ★ Friday 17h April: CHANGESNOWBOWIE available for streaming. Full press release: https://smarturl.it/CNBandRep97PRonBNet,2020-04-01 14:00:41+00:00,188,816,,,1245350373067546625
73,1245122646024560642,https://twitter.com/DavidBowieReal/status/1245122646024560642,DavidBowieReal,,"The CHANGESBOWIE LP hit the top spot in the UK 30 years ago today, promoted by Bowie’s SOUND + VISION World Tour which kicked off in Canada, on 4th March. It included 16 UK Top 20 hits, of which10 were Top 5 and 6 US Top 20 hits of which 2 made the Top 5. https://smarturl.it/CHANGESBOWIEonDBFB",2020-03-31 22:55:46+00:00,126,661,,,1245122646024560642
73,1244760972927131649,https://twitter.com/DavidBowieReal/status/1244760972927131649,DavidBowieReal,,"Melody Maker 28th March, 1970, and Bowie is interviewed for a piece by Raymond Telford, titled: “HYPE AND DAVID BOWIE'S FUTURE”. Two days later a gig at the Star Hotel in West Croydon, would be drummer John Cambridge’s last gig with the band. More here: https://smarturl.it/HypeOverDBFB",2020-03-30 22:58:37+00:00,96,537,,,1244760972927131649
73,1244394487868243971,https://twitter.com/DavidBowieReal/status/1244394487868243971,DavidBowieReal,,"Throughout David Bowie’s professional career, Japanese photographer, Masayoshi Sukita, managed to capture an indefinable quality and spirit present in every studio session the two collaborated on. These particular images were taken in New York in 2002. #RandomBowie #BowieSukita",2020-03-29 22:42:20+00:00,410,2343,,#RandomBowie #BowieSukita,1244394487868243971
73,1243592579108810755,https://twitter.com/DavidBowieReal/status/1243592579108810755,DavidBowieReal,,"Following its release last Friday, the Is It Any Wonder? EP has entered the UK album chart at #10, This from the @OfficialCharts: “Previously unreleased David Bowie EP Is It Any Wonder? enters at Number 10 following its release on vinyl - the week’s biggest seller on black wax.”",2020-03-27 17:35:50+00:00,126,705,@officialcharts,,1243592579108810755
73,1243325893348659201,https://twitter.com/DavidBowieReal/status/1243325893348659201,DavidBowieReal,,"Fame 90 was released as a single in the UK on 26th March 1990, the very day that David Bowie’s SOUND + VISION World Tour continued its globe trot with a 3-day stint at the London Arena. Watch the video over on the official David Bowie YouTube channel now: https://smarturl.it/Fame90VidYT",2020-03-26 23:56:07+00:00,124,654,,,1243325893348659201
73,1242131173486276608,https://twitter.com/DavidBowieReal/status/1242131173486276608,DavidBowieReal,,"35 years ago today at Tina Turner's NEC gig in Birmingham, Bowie and Tina performed the songs Tonight and Let’s Dance. The live duet of Tonight was released as a single in 1988, becoming a #1 hit in the Netherlands. Watch it now on Tina’s official YouTube: https://smarturl.it/BowieTurnerTonightYT",2020-03-23 16:48:44+00:00,227,1083,,,1242131173486276608
73,1241348682726944768,https://twitter.com/DavidBowieReal/status/1241348682726944768,DavidBowieReal,,"""AND THEN, THERE WAS RAMONA, COMING OUT IN THESE CRAZY SHOES AND CRAZY OUTFIT. WE WERE LAUGHING, WE WERE LIKE, ‘YOU LOOK LIKE A FUCKING OUT OF CONTROL MANIAC!’"" - JOHN SCARISBRICK - @DEKmagazine Outside shoot special on the way, sign up here: https://smarturl.it/DEKmagazine #DEKmagazine",2020-03-21 12:59:23+00:00,141,794,@DEKmagazine,#DEKmagazine,1241348682726944768
73,1253293356173623298,https://twitter.com/eltonofficial/status/1253293356173623298,eltonofficial,,Elton promises to continue performing live for all his dedicated fans around the world again and thanks you for your endless support.,2020-04-23 12:03:15+00:00,40,586,,,1253293356173623298
73,1253293355045392385,https://twitter.com/eltonofficial/status/1253293355045392385,eltonofficial,,Ticketholders of all 2020 postponed performances should hold onto their original tickets as new show date information for 2021 will be announced soon. All original tickets will be honored at the rescheduled performances.,2020-04-23 12:03:15+00:00,34,436,,,1253293355045392385
73,1253293353854218240,https://twitter.com/eltonofficial/status/1253293353854218240,eltonofficial,,This tough decision has been made with the continued safety and well-being of his fans at a time when health services are under increased pressure and with the concern that these gatherings continue to risk accelerating the spread of the Coronavirus [COVID-19].,2020-04-23 12:03:15+00:00,23,245,,,1253293353854218240
73,1253293352763752453,https://twitter.com/eltonofficial/status/1253293352763752453,eltonofficial,,"It is with deep regret that Elton John must postpone the remainder of his upcoming North American 2020 dates on his Farewell Yellow Brick Road tour from May 22 through July 8. Previously postponed performances were from March 26 through May 2, 2020.",2020-04-23 12:03:15+00:00,168,1575,,,1253293352763752453
