age,id,permalink,username,to,text,date,retweets,favorites,mentions,hashtags,geo
73,1253477370087960576,https://twitter.com/KTLA/status/1253477370087960576,KTLA,,Los Angeles Mayor Eric Garcetti is providing his nightly update on the COVID-19 pandemic and the city's response to it. https://ktla.com/news/local-news/l-a-mayor-provides-update-on-covid-19-outbreak-2/,2020-04-24 00:14:28+00:00,8,30,,,1253477370087960576
73,1253473730858061826,https://twitter.com/KTLA/status/1253473730858061826,KTLA,,"Beginning now: Our four-hour NFL draft special featuring sports journalists from across the country, including our very own @DavidPingalore. Watch live here: https://ktla.com/sports/nfl-draft/",2020-04-24 00:00:00+00:00,1,7,@DavidPingalore,,1253473730858061826
73,1253466031676260352,https://twitter.com/KTLA/status/1253466031676260352,KTLA,,"Samples collected from about 3,000 people in New York showed nearly 14% had developed antibodies to fight a coronavirus infection, Cuomo said. But questions remain about the accuracy of such tests, including the one use in L.A. and Santa Clara counties",2020-04-23 23:29:24+00:00,6,19,,,1253466031676260352
73,1252962611999768576,https://twitter.com/jimmybuffett/status/1252962611999768576,jimmybuffett,,BROADCASTING TONIGHT live from BORA BORA Tune in 8pm Eastern / 7pm Central (with an encore at 8pm Pacific) Tune in at http://www.margaritaville.tv or Radio Margaritaville Check out the full schedule at link below https://www.margaritaville.tv/cabin-fever-2020,2020-04-22 14:09:00+00:00,38,211,,,1252962611999768576
73,1252746965202300928,https://twitter.com/jimmybuffett/status/1252746965202300928,jimmybuffett,,Ever wondered what it looks like inside Shrimpboat studio in Key West? Little promo video that gives you a peek. It's small and we like it that way. http://smarturl.it/lifeontheflipside #lifeontheflipside,2020-04-21 23:52:06+00:00,54,473,,#lifeontheflipside,1252746965202300928
73,1252746051582218242,https://twitter.com/jimmybuffett/status/1252746051582218242,jimmybuffett,LeDoctor,flashbacks!,2020-04-21 23:48:28+00:00,4,52,,,1252746051582218242
73,1251912996386832384,https://twitter.com/jimmybuffett/status/1251912996386832384,jimmybuffett,LeDoctor,,2020-04-19 16:38:12+00:00,3,38,,,1251912996386832384
73,1251912303236141056,https://twitter.com/jimmybuffett/status/1251912303236141056,jimmybuffett,radiomville,And for UK time zone peeps - Sunday 7pm GMT ! Tune in tonight ,2020-04-19 16:35:27+00:00,17,95,,,1251912303236141056
73,1251911378161393666,https://twitter.com/jimmybuffett/status/1251911378161393666,jimmybuffett,,Thanks for all the songs and stories! Stay tuned,2020-04-19 16:31:46+00:00,44,597,,,1251911378161393666
73,1251587282047393792,https://twitter.com/jimmybuffett/status/1251587282047393792,jimmybuffett,,Follow JB on Instagram if you don’t already. Stories you can’t find anywhere else.,2020-04-18 19:03:56+00:00,17,151,,,1251587282047393792
73,1251513312057016322,https://twitter.com/jimmybuffett/status/1251513312057016322,jimmybuffett,,"BROADCASTING TONIGHT Saturday April 18th - 1994 live from Great Woods, MA (1994) Tune in 8pm Eastern / 7pm Central (with an encore at 8pm Pacific) Tune in at http://www.margaritaville.tv or Radio Margaritaville Check out the full schedule at link below https://www.margaritaville.tv/cabin-fever-2020",2020-04-18 14:10:00+00:00,48,232,,,1251513312057016322
73,1251260518708338689,https://twitter.com/jimmybuffett/status/1251260518708338689,jimmybuffett,,‘Oceans of Time’ is the latest track from #lifeontheflipside ! @paulbradysongs Available at all digital outlets with album preorder. And listen this weekend on @radiomville http://smarturl.it/lifeontheflipside,2020-04-17 21:25:29+00:00,45,254,@paulbradysongs @radiomville,#lifeontheflipside,1251260518708338689
73,1250840532722446341,https://twitter.com/jimmybuffett/status/1250840532722446341,jimmybuffett,, ,2020-04-16 17:36:37+00:00,53,388,,,1250840532722446341
73,1250486391676350465,https://twitter.com/jimmybuffett/status/1250486391676350465,jimmybuffett,,Continue to stay safe. #stayhome #normanrockwell,2020-04-15 18:09:23+00:00,38,347,,#stayhome #stayhome #normanrockwell,1250486391676350465
73,1250430678279348224,https://twitter.com/jimmybuffett/status/1250430678279348224,jimmybuffett,,BROADCASTING TONIGHT April 15th - from Australia (2011) Tune in 8pm Eastern / 7pm Central (with an encore at 8pm Pacific) Tune in at http://www.margaritaville.tv or Radio Margaritaville Check out the full schedule at link below https://www.margaritaville.tv/cabin-fever-2020,2020-04-15 14:28:00+00:00,44,176,,,1250430678279348224
73,1250137844565196800,https://twitter.com/jimmybuffett/status/1250137844565196800,jimmybuffett,,Keep the 'votes' coming! We're making our lists. Thanks @Newsweek for spreading the word No Margaritaville? Jimmy Buffett fans give their top songs to waste away to during the coronavirus,2020-04-14 19:04:23+00:00,49,343,@Newsweek,,1250137844565196800
73,1249838549836283906,https://twitter.com/jimmybuffett/status/1249838549836283906,jimmybuffett,,While we've got JB in one place for an extended period of time - with a bad case of cabin fever -a question: What is the song we don't all know by heart that you'd love to hear Jimmy revisit? And if there is special reason please share that too.,2020-04-13 23:15:05+00:00,66,1005,,,1249838549836283906
73,1249436997111799809,https://twitter.com/jimmybuffett/status/1249436997111799809,jimmybuffett,,"Tonight on A&E - set your DVRs. “Willie Nelson: American Outlaw” tribute to Nelson’s seven-decade long career."" What a night. Don't miss it https://youtu.be/4TkNIanu5p0",2020-04-12 20:39:28+00:00,31,258,,,1249436997111799809
73,1253055292910088197,https://twitter.com/kaj33/status/1253055292910088197,kaj33,,"Tonight at 8/7c, tune in to the @BET ‘Saving OurSelves’ COVID-19 Benefit Show for special musical performances and to learn how you can support the communities most impacted by coronavirus. #NBATogether",2020-04-22 20:17:17+00:00,28,244,@BET,#NBATogether #NBATogether,1253055292910088197
73,1250852211346661376,https://twitter.com/kaj33/status/1250852211346661376,kaj33,JoshRebholz,I bleed Bruin Blue! But I’m an LA man - best memories @Lakers vs @celtics tonite on NBA TV !!!! Relive the purple &amp; gold showtime !,2020-04-16 18:23:01+00:00,6,38,@Lakers @celtics,,1250852211346661376
73,1250800422744240129,https://twitter.com/kaj33/status/1250800422744240129,kaj33,Bucks,Missin’ the hook!!! Thanks for the great memories they will always be with me and so will @Bucks and all Bucks fans... let’s remember the good ol’ days !,2020-04-16 14:57:14+00:00,389,3608,@Bucks,,1250800422744240129
73,1250799870593716228,https://twitter.com/kaj33/status/1250799870593716228,kaj33,,,2020-04-16 14:55:02+00:00,10,97,,,1250799870593716228
73,1250524125195460608,https://twitter.com/kaj33/status/1250524125195460608,kaj33,,"The coronavirus is disproportionately impacting communities of color. We must focus response efforts on health economic equity & acknowledge the root causes driving these disparities. Join me, Ernie Johnson & @NatUrbanLeague’s @marcmorial @NBA Twitter 7pm ET tonite #NBATogether",2020-04-15 20:39:19+00:00,139,801,@NatUrbanLeague @MARCMORIAL @NBA,#NBATogether #NBATogether,1250524125195460608
73,1248287686894338053,https://twitter.com/kaj33/status/1248287686894338053,kaj33,,My thoughts on Hollywood and Covid-19 for @THR,2020-04-09 16:32:31+00:00,77,372,@THR,,1248287686894338053
73,1247637485045215232,https://twitter.com/kaj33/status/1247637485045215232,kaj33,UCLAHealth,I’m a Bruin through and through and I’m glad to lend any help that I can to the medical community who is doing everything they can to save lives - we appreciate you & we are with you !!!,2020-04-07 21:28:51+00:00,16,127,,,1247637485045215232
73,1247538954523443203,https://twitter.com/kaj33/status/1247538954523443203,kaj33,Bucks,Wow ! Wayback machine brought back a flood of memories!,2020-04-07 14:57:19+00:00,11,313,,,1247538954523443203
73,1245738778750095360,https://twitter.com/kaj33/status/1245738778750095360,kaj33,,LMAO!!!’,2020-04-02 15:44:04+00:00,1486,10680,,,1245738778750095360
73,1245184844713189377,https://twitter.com/kaj33/status/1245184844713189377,kaj33,MagicJohnson,Hey Earvin - I would have to agree as my college years were incredible but playing for The Lakers and having you as my teammate was a G.O.A.T friendship.,2020-04-01 03:02:56+00:00,2117,17113,,,1245184844713189377
73,1244374303514038272,https://twitter.com/kaj33/status/1244374303514038272,kaj33,,Let’s work on improving ourselves and focus on staying positive and healthy. I’m proud to represent ⁦@UCLAHealth⁩ and I want to share some advice Coach use to give us. Coach Wooden used to always say: “Do not let what you cannot do interfere with what you can do”,2020-03-29 21:22:07+00:00,255,1302,@UCLAHealth,,1244374303514038272
73,1243582776500088837,https://twitter.com/kaj33/status/1243582776500088837,kaj33,,Thought I would try to help pass the time with an article I wrote for @THR - for sports fans suffering withdrawal,2020-03-27 16:56:53+00:00,43,208,@THR,,1243582776500088837
73,1242855440414699520,https://twitter.com/kaj33/status/1242855440414699520,kaj33,,Bruin nation we are in this together! Tell me what your doing to stay healthy @UCLAHealth,2020-03-25 16:46:42+00:00,69,537,@UCLAHealth,,1242855440414699520
73,1242260315838054405,https://twitter.com/kaj33/status/1242260315838054405,kaj33,Lady_ofMischief,The best memory was that we won !,2020-03-24 01:21:54+00:00,21,409,,,1242260315838054405
73,1242260076259229698,https://twitter.com/kaj33/status/1242260076259229698,kaj33,goduckscity,My first NBA Finals we didn't lose a game. We swept the Baltimore Bullets so we never got to a point of being anxious because we won every game.,2020-03-24 01:20:56+00:00,89,1232,,,1242260076259229698
73,1253509719765004290,https://twitter.com/Lord_Sugar/status/1253509719765004290,Lord_Sugar,,"rt: @piersmorgan BREAKING: There were 638 more UK deaths reported in past 24hrs - DOWN on previous 2 days. This takes UK total to 18,738, but does not include 1000s more who've died with COVID-19 in care homes &amp; community. THANKS FOR THAT, JUST TO SAY WE ALL HAVE TELLY'S.",2020-04-24 02:23:00+00:00,2,19,@piersmorgan,,1253509719765004290
73,1253508828685099015,https://twitter.com/Lord_Sugar/status/1253508828685099015,Lord_Sugar,,"RT : @piersmorgan I want to say a massive thank you to all staff in prisons, probation &amp; youth justice, serving the country by working tirelessly in very difficult circumstances. THANK YOU YOUR MAJESTY......THE BLOKE ACTUALLY THINKS HE'S THE KING NOW RECORDING PUBLIC MESSAGES.",2020-04-24 02:19:28+00:00,8,48,@piersmorgan,,1253508828685099015
73,1253505592037179392,https://twitter.com/Lord_Sugar/status/1253505592037179392,Lord_Sugar,Lord_Sugar,Ok seen it now 19,2020-04-24 02:06:36+00:00,0,12,,,1253505592037179392
73,1253505353213530122,https://twitter.com/Lord_Sugar/status/1253505353213530122,Lord_Sugar,Pckildare,Of course what an idiot .,2020-04-24 02:05:39+00:00,0,9,,,1253505353213530122
73,1253499846218190849,https://twitter.com/Lord_Sugar/status/1253499846218190849,Lord_Sugar,AndrewBloch,Is it 11 as you have to 2 for 88,2020-04-24 01:43:46+00:00,5,15,,,1253499846218190849
73,1253465011168706560,https://twitter.com/Lord_Sugar/status/1253465011168706560,Lord_Sugar,,Trump: Hilarious again. He should get an Oscar. 1) We did more testing than any other country. BS. 2) Kim Jung is sick. He goes off saying thanks to me we are not at war with N.Korea. 3) We have too many ventilators now. 4) I told you months ago hot weather kills the virus,2020-04-23 23:25:21+00:00,53,489,,,1253465011168706560
73,1253412508762640385,https://twitter.com/Lord_Sugar/status/1253412508762640385,Lord_Sugar,TheSun,How cheery that just what we need.,2020-04-23 19:56:44+00:00,11,188,,,1253412508762640385
73,1253410129703079938,https://twitter.com/Lord_Sugar/status/1253410129703079938,Lord_Sugar,Davidthegrumps,Well according to your twit pic of 2 dots. I would say People in glass houses....,2020-04-23 19:47:16+00:00,0,80,,,1253410129703079938
73,1253409148282105856,https://twitter.com/Lord_Sugar/status/1253409148282105856,Lord_Sugar,NoirMJ,Yes a few thousand who I employed and paid well so they could support their families. Go back to Moscow,2020-04-23 19:43:22+00:00,20,404,,,1253409148282105856
73,1253407065638387718,https://twitter.com/Lord_Sugar/status/1253407065638387718,Lord_Sugar,saradriscoll111,This woman unprompted used a vile expletive to describe me. Not very lady like. So I gave it back to her. Ok with you ?,2020-04-23 19:35:06+00:00,10,361,,,1253407065638387718
73,1253406649634742272,https://twitter.com/Lord_Sugar/status/1253406649634742272,Lord_Sugar,nige_co,correct go tell her,2020-04-23 19:33:27+00:00,0,93,,,1253406649634742272
73,1253405805191278592,https://twitter.com/Lord_Sugar/status/1253405805191278592,Lord_Sugar,Hape9999,Snob.... hah,2020-04-23 19:30:05+00:00,0,25,,,1253405805191278592
73,1253405690879774722,https://twitter.com/Lord_Sugar/status/1253405690879774722,Lord_Sugar,taximan2002,cheers thanks for that,2020-04-23 19:29:38+00:00,0,51,,,1253405690879774722
73,1253405569081368576,https://twitter.com/Lord_Sugar/status/1253405569081368576,Lord_Sugar,mick_howe,Made 100's of thousands of them in Essex.,2020-04-23 19:29:09+00:00,2,107,,,1253405569081368576
73,1253405043820244992,https://twitter.com/Lord_Sugar/status/1253405043820244992,Lord_Sugar,acmarkd,"How does do that. It was analogue, transmission went digital ages ago.",2020-04-23 19:27:04+00:00,3,87,,,1253405043820244992
73,1068565544008384512,https://twitter.com/S_C_/status/1068565544008384512,S_C_,,The line clearly meant don’t pit me against my brothers no matter what our differences are (red hat) now go pick up Meek album . Drake and Meek on there together .,2018-11-30 18:00:53+00:00,51276,143738,,,1068565544008384512
73,875532022847909889,https://twitter.com/S_C_/status/875532022847909889,S_C_,,"Too many ..Fab , black people really magic . Mac Miller nice too though .",2017-06-16 01:54:35+00:00,55431,118822,,,875532022847909889
73,875531029896769536,https://twitter.com/S_C_/status/875531029896769536,S_C_,,Wait . Slick fucking Rick . Pimp C and bun . Wow . I just realized how many fresh people the culture has . Big Sean . Sauce money .,2017-06-16 01:50:38+00:00,17229,42130,,,875531029896769536
73,875524967856611328,https://twitter.com/S_C_/status/875524967856611328,S_C_,,And the greatest rapper of all time OBAMA . Thank you 44,2017-06-16 01:26:33+00:00,15412,37871,,,875524967856611328
73,875524516931227648,https://twitter.com/S_C_/status/875524516931227648,S_C_,,"I promise I'm not drunk . Lord Pusha . Carti (Magnolia incredible)ASAP Sean P , Mobb , cudi . Tyler , earl, Snoop!!( almost played myself)",2017-06-16 01:24:45+00:00,30383,66358,,,875524516931227648
73,875520327928827904,https://twitter.com/S_C_/status/875520327928827904,S_C_,,Fuck haa. Naw for real .Pastor Jeezy my partner . Okay I'm done . I'm deleting this app in the morning . Shit is impossible to get right.,2017-06-16 01:08:07+00:00,18199,39398,,,875520327928827904
73,875519084602859521,https://twitter.com/S_C_/status/875519084602859521,S_C_,,Fuck ..50 cent big L sho ag nice and smooth Joe and pun . diggable butterfly esp...beanie young chris freeway SP okay for real this time .,2017-06-16 01:03:10+00:00,15644,30854,,,875519084602859521
73,875517102458757120,https://twitter.com/S_C_/status/875517102458757120,S_C_,S_C_,"Thank you, this way",2017-06-16 00:55:18+00:00,9113,22306,,,875517102458757120
73,875516039617929216,https://twitter.com/S_C_/status/875516039617929216,S_C_,,Somebody find that reply I just hit please . I'm new on this . Anyway salute to anybody who made a song to feed their family or just vent .,2017-06-16 00:51:04+00:00,19711,43620,,,875516039617929216
73,875515549723131905,https://twitter.com/S_C_/status/875515549723131905,S_C_,S_C_,"Shit ...Wayne , Juve BG Nipsey . Kim . Slaughterhouse (yes mouse too ha) Folarin MC eiht . Short . 40 . Mac dre this shit hard .Never mind",2017-06-16 00:49:08+00:00,19502,35156,,,875515549723131905
73,875513445344460800,https://twitter.com/S_C_/status/875513445344460800,S_C_,S_C_,Shit did I say redman ? Ghost and Rae . Wu tang I beat Genius in a rap battle I think ha . Busta (him too) Treach . Thug . B a rapper too!,2017-06-16 00:40:46+00:00,20023,39349,,,875513445344460800
73,875512619137814528,https://twitter.com/S_C_/status/875512619137814528,S_C_,,G Rap .Mel . Kurupt . Lox. X . Q. Ab lupe. Mos. Foxy. Boss . Ross. Quavo Future Travis too many fuck this. All you!T grizzley song best out,2017-06-16 00:37:29+00:00,22650,42267,,,875512619137814528
73,875510146671099905,https://twitter.com/S_C_/status/875510146671099905,S_C_,,"Lauryn Nicki lite latifah common ye drake and meek . Run caz LL chainz cam tip (both of them) thought pharaoh , face . De la . Ice T. Wait",2017-06-16 00:27:39+00:00,23047,42168,,,875510146671099905
73,875508904431501312,https://twitter.com/S_C_/status/875508904431501312,S_C_,,"Thank you to all the people that have inspired me . Rakim KANE KRS chuck cube Jaz Em Andre Nas big PAC cole kendrick chance jayE ..wait,",2017-06-16 00:22:43+00:00,32758,64023,,,875508904431501312
73,847938195421446144,https://twitter.com/S_C_/status/847938195421446144,S_C_,,Kalief is a prophet. His story will save lives . You guys watching and your compassion made this happen. Thank you .,2017-03-31 22:26:34+00:00,9686,19894,,,847938195421446144
73,1253476276083531777,https://twitter.com/UNICEF/status/1253476276083531777,UNICEF,,#COVID19 reveals what is at stake when we don't have the protective shield of immunization. It’s not yet available for coronavirus but we do have vaccines to prevent other serious diseases like measles and polio. Let’s use them to protect every child. #VaccinesWork,2020-04-24 00:10:07+00:00,52,209,,#COVID19 #VaccinesWork,1253476276083531777
73,1253418116882677761,https://twitter.com/UNICEF/status/1253418116882677761,UNICEF,,"It’s #WorldBookDay! Listen to a story read by author, human rights activist and UNICEF Goodwill Ambassador @IshmaelBeah. #HealthyAtHome #ReadTheWorld",2020-04-23 20:19:01+00:00,35,155,@IshmaelBeah,#WorldBookDay #HealthyAtHome #HealthyAtHome #ReadTheWorld,1253418116882677761
73,1253389831482290176,https://twitter.com/UNICEF/status/1253389831482290176,UNICEF,,"LIVE: Find out how #COVID19 is affecting school children across the globe. Join our Chief of Education, @RobertG_Jenkins on @Reddit now.",2020-04-23 18:26:37+00:00,25,94,@RobertG_Jenkins @reddit,#COVID19,1253389831482290176
73,1253356744509739013,https://twitter.com/UNICEF/status/1253356744509739013,UNICEF,,So much has changed. Some things never will. #MeAt20 UNICEF was about 20 years old when we helped this nurse in Indonesia to protect and support a young child with a disability. We've been proud to stand by health workers and children every day since - and now more than ever.,2020-04-23 16:15:08+00:00,58,253,,#MeAt20,1253356744509739013
73,1253326540437217286,https://twitter.com/UNICEF/status/1253326540437217286,UNICEF,,"""These games on the tablets have taught us that there are no differences between boys and girls, and now we play football together as one."" Juliet, 16, is one of the Burundian girls living in a refugee camp in Rwanda participating in UNICEF's e-learning activities. #GirlsinICT",2020-04-23 14:15:07+00:00,36,147,,#GirlsinICT,1253326540437217286
73,1253318938810880002,https://twitter.com/UNICEF/status/1253318938810880002,UNICEF,,"On #GirlsinICT Day, head over to @EQUALS to join a Twitter chat with mentors and programme experts helping girls to learn and thrive online.",2020-04-23 13:44:55+00:00,45,250,@equals,#GirlsinICT,1253318938810880002
73,1253307131857719296,https://twitter.com/UNICEF/status/1253307131857719296,UNICEF,,On the frontline of #COVID19 and a brutal conflict. The children of eastern Ukraine need peace now.,2020-04-23 12:58:00+00:00,64,276,,#COVID19,1253307131857719296
73,1253270893272285185,https://twitter.com/UNICEF/status/1253270893272285185,UNICEF,,"For ourselves, for our families. Vladimir’s message to young people facing #COVID19 in Bulgaria and around the world.",2020-04-23 10:34:00+00:00,32,183,,#COVID19,1253270893272285185
73,1253235947132592129,https://twitter.com/UNICEF/status/1253235947132592129,UNICEF,,"Take a moment to make a memory. We all have memories of life before lockdown, school closures and physical distancing. Through acts of kindness, we can help each other get through this. Take a screenshot , share it with someone and encourage them to do the same. #COVID19",2020-04-23 08:15:08+00:00,109,402,,#COVID19,1253235947132592129
73,1253173017863217152,https://twitter.com/UNICEF/status/1253173017863217152,UNICEF,,"How do you keep your family healthy and happy during the #COVID19 pandemic? @PiaBritto, our chief of early childhood development, shares helpful tips in this new podcast. #EarlyMomentsMatter",2020-04-23 04:05:04+00:00,49,155,@PiaBritto,#COVID19 #EarlyMomentsMatter,1253173017863217152
73,1253125448504152065,https://twitter.com/UNICEF/status/1253125448504152065,UNICEF,,"“We all know what needs to be done, but we also know how much communities are suffering. Pata Pata has always been there for people at a time of struggle. I hope it helps once more. And I hope from our confined spaces we can dance once more.” @angeliquekidjo #HealthyAtHome",2020-04-23 00:56:03+00:00,58,221,@angeliquekidjo,#HealthyAtHome #HealthyAtHome,1253125448504152065
73,1253100033748107267,https://twitter.com/UNICEF/status/1253100033748107267,UNICEF,,"Over 3,100 cases of measles have been reported in North Kivu, DR Congo, since January. This is how critical vaccinations can continue during the #COVID19 pandemic. #VaccinesWork",2020-04-22 23:15:04+00:00,44,158,,#COVID19 #VaccinesWork,1253100033748107267
73,1253077405922725889,https://twitter.com/UNICEF/status/1253077405922725889,UNICEF,,"Even as we practise physical distancing due to #COVID19, it's important to remember nature is there for us, waiting. How are you staying #HealthyatHome and connected to nature this #EarthDay?",2020-04-22 21:45:09+00:00,101,354,,#COVID19 #HealthyatHome #HealthyatHome #EarthDay #EarthDay,1253077405922725889
73,1253067330789269504,https://twitter.com/UNICEF/status/1253067330789269504,UNICEF,,"The world needs you! On #EarthDay, learn about the different ways countries can take climate action by playing this game.",2020-04-22 21:05:07+00:00,37,124,,#EarthDay #EarthDay,1253067330789269504
73,1253032069401174022,https://twitter.com/UNICEF/status/1253032069401174022,UNICEF,,"The right to a clean future. Even as young people stay at home due to #COVID19, they are taking climate action online. Find out how you can too. #EarthDay",2020-04-22 18:45:00+00:00,152,439,,#COVID19 #EarthDay #EarthDay,1253032069401174022
73,1253413459254849537,https://twitter.com/incmnszmx/status/1253413459254849537,incmnszmx,,Tiempo de Cuidarnos Información para adultos mayores Tenemos disponible una línea telefónica (y whats) para orientar a las personas mayores (o a sus cuidadores) durante la pandemia de #COVID19 NO necesitan ser pacientes #QuedateEnCasa #SanaDistancia #CuarentenaNacional,2020-04-23 20:00:30+00:00,6,7,,#COVID19 #QuedateEnCasa #QuedateEnCasa #SanaDistancia #SanaDistancia #CuarentenaNacional,1253413459254849537
73,1253398235663806467,https://twitter.com/incmnszmx/status/1253398235663806467,incmnszmx,,Tiempo de Cuidarnos Información que nos puede ayudar a todos. Por favor comparte. #COVID19 #CAIPaDi #NutriciónInforma #SanaDistancia,2020-04-23 19:00:01+00:00,11,17,,#COVID19 #CAIPaDi #Nutrici #SanaDistancia #SanaDistancia,1253398235663806467
73,1253352935364403203,https://twitter.com/incmnszmx/status/1253352935364403203,incmnszmx,,Tiempo de Cuidarnos * * * AVISO IMPORTANTE * * * FAVOR DE COMPARTIR #COVID19 #INCMNSZseguridad #ComunicacionINCMNSZ Esta misma información la podrá encontrar en la página institucional. http://www.innsz.mx/opencms/index.html,2020-04-23 16:00:00+00:00,4,5,,#COVID19 #INCMNSZseguridad #ComunicacionINCMNSZ,1253352935364403203
73,1253307639288774660,https://twitter.com/incmnszmx/status/1253307639288774660,incmnszmx,,Además de llevar una #Alimentaciónsaludable asegúrate de estar consumiendo suficientes líquidos a lo largo del día. La recomendación es de 1.5 – 2 litros al día.,2020-04-23 13:00:01+00:00,13,32,,#Alimentaci,1253307639288774660
73,1253050944469839872,https://twitter.com/incmnszmx/status/1253050944469839872,incmnszmx,,"Ante una crisis se debe recordar que los cambios nos permiten ver de una forma diferente el futuro, entender los riesgos y enfrentarse a ellos, encontrando una oportunidad para crecer y redefinirnos, Ver mas... http://www.incmnsz.mx/…/C…/boletines/boletinAbril2020-3.html",2020-04-22 20:00:00+00:00,11,28,,,1253050944469839872
73,1253035846497787904,https://twitter.com/incmnszmx/status/1253035846497787904,incmnszmx,,TIEMPO DE CUIDARNOS Y CUIDAR A OTROS #TiempoDeCuidarnos #COVID19 #INCMNSZseguridad #ComunicacionINCMNSZ,2020-04-22 19:00:00+00:00,2,10,,#TiempoDeCuidarnos #COVID19 #INCMNSZseguridad #ComunicacionINCMNSZ,1253035846497787904
73,1252998551895851008,https://twitter.com/incmnszmx/status/1252998551895851008,incmnszmx,,* * * AVISO IMPORTANTE * * * FAVOR DE COMPARTIR #COVID19 #INCMNSZseguridad #ComunicacionINCMNSZ Esta misma información la podrá encontrar en la página institucional en el botón de Comunicados a Pacientes INCMNSZ http://www.incmnsz.mx/opencms/contenido/COVID-19.html,2020-04-22 16:31:49+00:00,29,40,,#COVID19 #INCMNSZseguridad #ComunicacionINCMNSZ,1252998551895851008
