age,id,permalink,username,to,text,date,retweets,favorites,mentions,hashtags,geo
73,1251913586227716101,https://twitter.com/eltonofficial/status/1251913586227716101,eltonofficial,,"If you missed it, go to http://globalcitizen.org/togetherathome to watch the stream and for those of you in the UK, tune in to BBC1 at 19.15 tonight to see the show. Elton xx",2020-04-19 16:40:33+00:00,92,560,,,1251913586227716101
73,1251913581903388674,https://twitter.com/eltonofficial/status/1251913581903388674,eltonofficial,,"I hope everyone enjoyed One World: #TogetherAtHome last night as much as we did at home! Huge thanks to @ladygaga, who has done such a tremendous job pulling this whole thing together and raising almost $128 million to support the #COVID19 crisis.",2020-04-19 16:40:32+00:00,793,8353,@ladygaga,#TogetherAtHome #TogetherAtHome #COVID19,1251913581903388674
73,1251568569189621760,https://twitter.com/eltonofficial/status/1251568569189621760,eltonofficial,,"Tune in at 8pm ET for performances from fantastic artists and stories from workers on the frontline of the crisis who need our support. Elton xx For more info on how to watch, visit http://globalcitizen.org/togetherathome Take part in the conversation on Twitter:",2020-04-18 17:49:34+00:00,127,559,,,1251568569189621760
73,1251568566228389888,https://twitter.com/eltonofficial/status/1251568566228389888,eltonofficial,,"I’m going to be sitting down tonight with David and the boys to watch One World: #TogetherAtHome, a global display of unity to support the @WHO in the fight against #COVID19",2020-04-18 17:49:33+00:00,893,9127,@WHO,#TogetherAtHome #TogetherAtHome #COVID19,1251568566228389888
73,1251493495359012867,https://twitter.com/eltonofficial/status/1251493495359012867,eltonofficial,,"I recently watched the new film about @BrianWilsonLive, Long Promised Road, one of the most brilliant music documentaries I've ever seen. Tune in to #RocketHour on @Beats1 where I'll be discussing the film and playing some of my favourite music. Elton xx http://apple.co/elton",2020-04-18 12:51:15+00:00,44,462,@BrianWilsonLive @Beats1,#RocketHour,1251493495359012867
73,1250105174078697479,https://twitter.com/eltonofficial/status/1250105174078697479,eltonofficial,zamportini,This is great! Has anyone else been working on Elton art while we're all staying at home? - Team EJ,2020-04-14 16:54:33+00:00,89,1736,,,1250105174078697479
73,1250096228421025794,https://twitter.com/eltonofficial/status/1250096228421025794,eltonofficial,eltonofficial,I’m so excited to join @glblctzn for One World: #TogetherAtHome this Saturday. Find out where and when to tune in here http://glblctzn.me/OneWorldTAH Elton x,2020-04-14 16:19:01+00:00,105,865,@GlblCtzn,#TogetherAtHome #TogetherAtHome,1250096228421025794
73,1248928784952094727,https://twitter.com/eltonofficial/status/1248928784952094727,eltonofficial,,"Tune in to the next episode of #RocketHour, where I'll be sharing music from @theweeknd, @billieeilish, @brightlightx2 and @SIX60, a hugely successful band in New Zealand. I love them, and can't wait for their album. Elton xx http://apple.co/elton",2020-04-11 11:00:00+00:00,55,383,@theweeknd @billieeilish @brightlightx2 @SIX60,#RocketHour,1248928784952094727
73,1248662879232053249,https://twitter.com/eltonofficial/status/1248662879232053249,eltonofficial,,Read the full story of how this classic album came to be at,2020-04-10 17:23:24+00:00,68,466,,,1248662879232053249
73,1248662738680926209,https://twitter.com/eltonofficial/status/1248662738680926209,eltonofficial,,#OnThisDay Elton John released his classic self-titled album in the UK. Celebrate the album that brought ‘Your Song’ to the world and listen now https://EltonJohn.lnk.to/EJ50,2020-04-10 17:22:50+00:00,264,1502,,#OnThisDay,1248662738680926209
73,1247556913107271682,https://twitter.com/eltonofficial/status/1247556913107271682,eltonofficial,eltonofficial,"One World: #TogetherAtHome makes its global debut starting from April 18 at 8 p.m. ET. For more info, head to https://glblctzn.me/2xFbpj8",2020-04-07 16:08:41+00:00,100,736,,#TogetherAtHome #TogetherAtHome,1247556913107271682
73,1253472446377873409,https://twitter.com/realDonaldTrump/status/1253472446377873409,realDonaldTrump,,"Governor @JimJusticeWV is a tremendous fighter for the incredible people of West Virginia. Big Jim is strong on Life, the Second Amendment, and Building the Wall! With Governors like Jim, America will recover and get back to business. Jim has my Complete and Total Endorsement!",2020-04-23 23:54:54+00:00,7765,31479,@JimJusticeWV,,1253472446377873409
73,1253467642431705091,https://twitter.com/realDonaldTrump/status/1253467642431705091,realDonaldTrump,,"Congressman @SteveStivers is doing a terrific job for the People of Ohio! He defends our Borders, Supports our Veterans, Strong on Crime, and the Second Amendment. Steve has my Complete and Total Endorsement!",2020-04-23 23:35:48+00:00,4405,15739,@stevestivers,,1253467642431705091
73,1253467417482801154,https://twitter.com/realDonaldTrump/status/1253467417482801154,realDonaldTrump,,"Congressman Bill Posey is a tremendous fighter for the Great State of Florida. He is a big supporter of our #MAGA Agenda – Strong on Crime, the Second Amendment, and Loves our Veterans and Law Enforcement. Bill has my Complete and Total Endorsement!",2020-04-23 23:34:55+00:00,8123,32895,,#MAGA,1253467417482801154
73,1253466787829735425,https://twitter.com/realDonaldTrump/status/1253466787829735425,realDonaldTrump,,"Congressman @MikeTurnerOH is a strong supporter and fighter for the People of Ohio! He will help us #MAGA! He’s Strong on the Border, Tough on Crime, will Protect our Vets, and our GREAT Second Amendment. Mike has my Complete and Total Endorsement!",2020-04-23 23:32:25+00:00,4243,14533,@MikeTurnerOH,#MAGA,1253466787829735425
73,1253465846376280066,https://twitter.com/realDonaldTrump/status/1253465846376280066,realDonaldTrump,,"Congressman @Troy_Balderson is doing a GREAT job for the People of Ohio! He will always Protect your #2A, Defend our Borders, and Support Small Business – a great supporter of the #MAGA Agenda. Troy has my Complete and Total Endorsement!",2020-04-23 23:28:40+00:00,3955,13545,@Troy_Balderson,#2A #MAGA,1253465846376280066
73,1253465581413597184,https://twitter.com/realDonaldTrump/status/1253465581413597184,realDonaldTrump,,"Congressman @DaveJoyceOH14 is a tremendous fighter for the Great State of Ohio! He is Tough on Crime, our Border, Second Amendment, and helps us Combat Illegal Drugs! David has my Complete and Total Endorsement! https://secure.winred.com/davejoyce/donate",2020-04-23 23:27:37+00:00,3947,13821,@DaveJoyceOH14,,1253465581413597184
73,1253465418263605249,https://twitter.com/realDonaldTrump/status/1253465418263605249,realDonaldTrump,,"Congressman @BradWenstrup is doing a tremendous job for the People of Ohio! He’s a proud Veteran and is Strong on the Border, Tough on Crime, the Second Amendment, and Supports Small Business. Brad has my Complete and Total Endorsement! https://secure.winred.com/usabrad/donate",2020-04-23 23:26:58+00:00,3938,13753,@bradwenstrup,,1253465418263605249
73,1253464153530011650,https://twitter.com/realDonaldTrump/status/1253464153530011650,realDonaldTrump,,....My co-chair in Utah and a really great guy. Sean has my Complete and Total Endorsement!,2020-04-23 23:21:57+00:00,3402,15448,,,1253464153530011650
73,1253464152233906178,https://twitter.com/realDonaldTrump/status/1253464152233906178,realDonaldTrump,,"Utah Attorney General Sean Reyes (@SeanReyesUT) is a fighter and hard worker for the Great State of Utah. He is a big supporter of our #MAGA Agenda – Strong on Crime, the Second Amendment, and Loves our Law Enforcement....",2020-04-23 23:21:56+00:00,5462,22761,@SeanReyesUT,#MAGA,1253464152233906178
73,1253463853645606918,https://twitter.com/realDonaldTrump/status/1253463853645606918,realDonaldTrump,,"Congressman John Curtis (@CurtisUT) gets things done for Utah! John fights for Small Businesses, will Lower your Taxes, and will protect your Second Amendment. He has my Complete and Total Endorsement!",2020-04-23 23:20:45+00:00,5365,21045,@CurtisUT,,1253463853645606918
73,1253463521876217856,https://twitter.com/realDonaldTrump/status/1253463521876217856,realDonaldTrump,,"....He’s 100% pro-life, strong on #2A and Loves our Military and Vets. Chris has my Complete and Total Endorsement!",2020-04-23 23:19:26+00:00,3226,12042,,#2A,1253463521876217856
73,1253463520940822538,https://twitter.com/realDonaldTrump/status/1253463520940822538,realDonaldTrump,,"Congressman Chris Stewart (@StewartforUtah) is a tremendous fighter for Utah. He served our Country in the U.S. Air Force, and has been a strong supporter of our #MAGA Agenda....",2020-04-23 23:19:26+00:00,4492,17311,@StewartforUtah,#MAGA,1253463520940822538
73,1253463098050129923,https://twitter.com/realDonaldTrump/status/1253463098050129923,realDonaldTrump,,"Congressman Warren Davidson (@Vote_Davidson) is working very hard for the people of Ohio! He’s a strong supporter of our Military, Vets, Second Amendment, and #MAGA Agenda. Warren has my Complete and Total Endorsement! https://secure.winred.com/davidson/donate",2020-04-23 23:17:45+00:00,3918,13788,@Vote_Davidson,#MAGA,1253463098050129923
73,1253462557010124807,https://twitter.com/realDonaldTrump/status/1253462557010124807,realDonaldTrump,,....Bill has my Complete and Total Endorsement! https://secure.winred.com/johnson-for-congress/donate,2020-04-23 23:15:36+00:00,2746,10144,,,1253462557010124807
73,1253462554803920902,https://twitter.com/realDonaldTrump/status/1253462554803920902,realDonaldTrump,,"Congressman Bill Johnson (@JohnsonLeads) is an incredible fighter for the Great State of Ohio! He’s a proud Veteran and a hard worker who Cares for our Veterans, Supports Small Business, and is Strong on the Border and Second Amendment....",2020-04-23 23:15:35+00:00,5488,21687,@JohnsonLeads,,1253462554803920902
73,1252748543141400576,https://twitter.com/spc_cps/status/1252748543141400576,spc_cps,,#Pacific to #Pacific disaster response was a clear focus of the recent #PIEMA consultations in Suva to develop a regional plan to strengthen coordinated disaster response in the Pacific. #GEMDiv #PIEMA Hear more about it here: https://www.spc.int/updates/blog/2020/04/pacific-countries-consulted-to-help-strengthen-regional-approaches-to-disaster,2020-04-21 23:58:22+00:00,4,14,,#Pacific #Pacific #PIEMA #GEMDiv #PIEMA,1252748543141400576
73,1252403898976878602,https://twitter.com/spc_cps/status/1252403898976878602,spc_cps,ColinTukuitonga,And #Fiji has been a proud member since 1971. Lots of regional action already taking place:,2020-04-21 01:08:52+00:00,1,5,,#Fiji,1252403898976878602
73,1252311218242621440,https://twitter.com/spc_cps/status/1252311218242621440,spc_cps,,#Pacific to #Pacific disaster response was a clear focus of the recent #PIEMA consultations in Suva to develop a regional plan to strengthen coordinated disaster response in the #Pacific. Thks to partners @dfat @MFATNZ @ForumSEC More here https://tinyurl.com/y7a5bae4 #GEMDiv,2020-04-20 19:00:35+00:00,2,9,@dfat @MFATNZ @ForumSEC,#Pacific #Pacific #PIEMA #Pacific #GEMDiv,1252311218242621440
73,1251692180717965319,https://twitter.com/spc_cps/status/1251692180717965319,spc_cps,,"The arrival of COVID-19 in the Pacific is changing the way the region works. In this edition of the Podcast we hear how SPC is adjusting to the crisis, while ensuring that its core work continues to progress. #PublicHealth",2020-04-19 02:00:45+00:00,2,7,,#PublicHealth,1251692180717965319
73,1251028244968566786,https://twitter.com/spc_cps/status/1251028244968566786,spc_cps,,"Understanding #disaster risk in real-time was critical during the devastation caused by last week’s #TCHarold. The #Fiji wave-buoy showed 6m waves at its peak. This helps better inform communities before, during &amp; after disaster now #GEMDiv : Kelepi Saukitoga, Narikoso Fiji.",2020-04-17 06:02:31+00:00,12,21,,#disaster #TCHarold #Fiji #GEMDiv,1251028244968566786
73,1250678888851791872,https://twitter.com/spc_cps/status/1250678888851791872,spc_cps,,"The #COVID19 crisis is affecting the #fisheries and #aquaculture sectors in the #Pacific. Neville Smith, Director of the Fisheries, Aquaculture and Marine Ecosystems (FAME) division discusses these challenges and how they are being addressed. https://bit.ly/3ckabZR #tuna",2020-04-16 06:54:18+00:00,16,34,,#COVID19 #fisheries #aquaculture #Pacific #tuna,1250678888851791872
73,1249547885097684995,https://twitter.com/spc_cps/status/1249547885097684995,spc_cps,,"Despite the challenges of #COVID19 crisis, climate action must continue. Sylvie Goyet, director of SPC's #ClimateChange and Environmental Sustainability division, discusses the risks associated with this situation and the measures that are implemented.",2020-04-13 04:00:05+00:00,10,26,,#COVID19 #ClimateChange,1249547885097684995
73,1249121027126366210,https://twitter.com/spc_cps/status/1249121027126366210,spc_cps,,"This month, SPC's Educational Quality and Assessment Programme (#EQAP) will launch its South Pacific Form Seven Certificate (SPFSC) Moodle online learning platform for SPFSC students - in response to the closure of schools due to COVID-19.",2020-04-11 23:43:55+00:00,4,12,,#EQAP,1249121027126366210
73,1248492894979117057,https://twitter.com/spc_cps/status/1248492894979117057,spc_cps,,"Accès aux soins limité, dépistage externalisé, activité économique ralentie... @Cameron_Diver, Directeur général adjoint de la CPS, évoque les difficultés que rencontre le #Pacifique face à la crise du #COVID19 :",2020-04-10 06:07:56+00:00,3,7,@Cameron_Diver,#Pacifique #COVID19,1248492894979117057
73,1248400382079856641,https://twitter.com/spc_cps/status/1248400382079856641,spc_cps,,#COVID19 As we continue to practise hand washing and hygiene it is also important to stay healthy and look after your health and the health of your family. Visit https://bit.ly/2V0x3bb for more updates! #pacifichealth #publichealth,2020-04-10 00:00:19+00:00,4,6,,#COVID19 #pacifichealth #publichealth,1248400382079856641
73,1248068148894535680,https://twitter.com/spc_cps/status/1248068148894535680,spc_cps,,We are currently recruiting a Team Leader – Policy and Governance to join our Georesources and Energy Programme. Detailed job ad on the link below: http://careers.spc.int #energyefficiency #policies #governance #pacificregion #pacificcareers,2020-04-09 02:00:09+00:00,3,3,,#energyefficiency #policies #governance #pacificregion #pacificcareers,1248068148894535680
73,1247690679435788293,https://twitter.com/spc_cps/status/1247690679435788293,spc_cps,,"With many countries going into lockdown during #COVID19 crisis, risks of domestic violence are increasing dramatically. SPC is working with its partner organizations to reduce #ViolenceAgainstWomen. Full story: https://bit.ly/2yyMqP0 #domesticviolence #humanrights",2020-04-08 01:00:13+00:00,3,9,,#COVID19 #ViolenceAgainstWomen #domesticviolence #humanrights,1247690679435788293
73,1247690672691466243,https://twitter.com/spc_cps/status/1247690672691466243,spc_cps,,"Face aux mesures de confinement de la crise du #COVID19, les risques de #ViolencesConjugales augmentent considérablement. La CPS oeuvre avec ses organisations partenaires dans la lutte contre ce fléau dans le #Pacifique. Lire l'article :",2020-04-08 01:00:11+00:00,0,0,,#COVID19 #ViolencesConjugales #Pacifique,1247690672691466243
73,1247600159963389953,https://twitter.com/spc_cps/status/1247600159963389953,spc_cps,,Scientific leadership opportunity for a Team Leader – Earth Observation and Remote Sensing. Check out our careers website for more details: http://careers.spc.int #earthobservation #remotesensing,2020-04-07 19:00:32+00:00,1,1,,#earthobservation #remotesensing,1247600159963389953
73,1247388981584629761,https://twitter.com/spc_cps/status/1247388981584629761,spc_cps,,Accurate information is critical during natural disasters. You can monitor sea level & weather from 19 sites around the #Pacific in near real-time data https://bit.ly/39N7QVB @dfat @BOM_au @GeoscienceAus @FJMETservice @TongaMetService @vmgdVU #COSPPac,2020-04-07 05:01:23+00:00,11,14,@dfat @BOM_au @GeoscienceAus @FJMETservice @TongaMetService @vmgdVU,#Pacific #COSPPac,1247388981584629761
73,1253338472288407563,https://twitter.com/freddie_mercury/status/1253338472288407563,freddie_mercury,,#TBT Freddie Mercury - 'The Great Pretender' now in 4K! Check out the latest in the series of remastered Freddie solo videos Watch the full video over at Freddie’s YouTube Channel https://youtu.be/mLRjFWDGs1g #FreddieMercury,2020-04-23 15:02:32+00:00,288,1648,,#TBT #FreddieMercury,1253338472288407563
73,1252975671019810816,https://twitter.com/freddie_mercury/status/1252975671019810816,freddie_mercury,,Can anyone match Freddie Mercury’s legendary voice? We're challenging fans to find out! Take on the #FreddieChallenge now http://freddiemeter.withyoutube.com #DontStopUsNow,2020-04-22 15:00:53+00:00,141,1115,,#FreddieChallenge #DontStopUsNow,1252975671019810816
73,1252250533320183814,https://twitter.com/freddie_mercury/status/1252250533320183814,freddie_mercury,,So You Think You Know Freddie Mercury? Time to play https://udiscovermusic.com/quizzes/freddie-mercury-quiz/ #Quiz #DontStopUsNow,2020-04-20 14:59:27+00:00,80,762,,#Quiz #DontStopUsNow,1252250533320183814
73,1251812612721033218,https://twitter.com/freddie_mercury/status/1251812612721033218,freddie_mercury,,"“A lot of my songs are fantasy, I can dream up all kinds of things...” - Freddie Mercury uDiscover have picked 20 of their best Freddie Mercury songs, with a view of his work both with Queen and as a solo artist ",2020-04-19 09:59:19+00:00,176,1483,,,1251812612721033218
73,1251450204362092545,https://twitter.com/freddie_mercury/status/1251450204362092545,freddie_mercury,,Freddie Produced Peter Straker Album 'This One's On Me' Reissue http://www.freddiemercury.com/en/news/freddie-produced-peter-straker-album-this-ones-on-me-reissued,2020-04-18 09:59:14+00:00,119,1290,,,1251450204362092545
73,1251163632269791234,https://twitter.com/freddie_mercury/status/1251163632269791234,freddie_mercury,, Finding Freddie: Episode 8 - Freddie at the Ballet! Dancer and Choreographer Wayne Sleep explains how a shared love of Ballet led to a friendship with Freddie that was full of surprises! Full Video here https://youtu.be/DJXNAPiF-sw,2020-04-17 15:00:30+00:00,70,681,,,1251163632269791234
73,1250800915864576005,https://twitter.com/freddie_mercury/status/1250800915864576005,freddie_mercury,,#TBT Freddie Mercury 'Made In Heaven' Part of the remastered Freddie video series The faithfully re-created video &amp; audio mix are part of the ‘Never Boring’ deluxe box set http://FreddieMercury.lnk.to/NeverBoringDeluxe,2020-04-16 14:59:11+00:00,75,558,,#TBT,1250800915864576005
73,1250364953946730496,https://twitter.com/freddie_mercury/status/1250364953946730496,freddie_mercury,," Finding Freddie: Episode 7 - Making Barcelona Part 4! Video director David Mallet &amp; Composer Mike Moran share memories of Freddie on the video for Barcelona, including a near disastrous start to the filming! Watch Here https://youtu.be/nSDH_SVgrMY ",2020-04-15 10:06:50+00:00,80,713,,,1250364953946730496
73,1250363135728529410,https://twitter.com/freddie_mercury/status/1250363135728529410,freddie_mercury,," Finding Freddie: Episode 7 - Making Barcelona Part 4! Video director David Mallet &amp; Composer Mike Moran share memories of Freddie on the video for Barcelona, including a near disastrous start to the filming! Watch Here https://youtu.be/mLRjFWDGs1g ",2020-04-15 09:59:36+00:00,48,397,,,1250363135728529410
73,1249638339529134080,https://twitter.com/freddie_mercury/status/1249638339529134080,freddie_mercury,,"Start the week with some Freddie Mercury Listen to 'Never Boring' https://open.spotify.com/album/6O4QGVvoPCkCoQ582FVEia?si=8LPur6qgSLO6nUKB1rc0lg""",2020-04-13 09:59:31+00:00,92,861,,,1249638339529134080
73,1249275896638382081,https://twitter.com/freddie_mercury/status/1249275896638382081,freddie_mercury,,So You Think You Know Freddie Mercury? Time to play https://www.udiscovermusic.com/quizzes/freddie-mercury-quiz/ #Quiz #DontStopUsNow https://www.udiscovermusic.com/quizzes/freddie-mercury-quiz/,2020-04-12 09:59:18+00:00,111,1007,,#Quiz #DontStopUsNow,1249275896638382081
73,1248913483846103040,https://twitter.com/freddie_mercury/status/1248913483846103040,freddie_mercury,,"""What I loved about Freddie was that he was so forward-thinking."" - Dave Clark tells uDiscover Music the story of 'Time Waits For No-One', and working with the Queen star! ",2020-04-11 09:59:12+00:00,139,1386,,,1248913483846103040
73,1248626663287443460,https://twitter.com/freddie_mercury/status/1248626663287443460,freddie_mercury,," Finding Freddie: Episode 7 - Making Barcelona Part 4! Video director David Mallet &amp; Composer Mike Moran share memories of Freddie on the video for Barcelona, including a near disastrous start to the filming! Watch here https://youtu.be/mLRjFWDGs1g",2020-04-10 14:59:29+00:00,73,660,,,1248626663287443460
73,1248233977644748800,https://twitter.com/freddie_mercury/status/1248233977644748800,freddie_mercury,,“I want to break free..” #Queen #DontStopUsNow #StayHome ,2020-04-09 12:59:05+00:00,253,1534,,#Queen #DontStopUsNow #StayHome #StayHome,1248233977644748800
73,1247481161678495744,https://twitter.com/freddie_mercury/status/1247481161678495744,freddie_mercury,,Watch Finding Freddie: Making Barcelona Part 3. Come back on Friday for Part 4! Composer Mike Moran describes the memorable night in Ibiza when Freddie &amp; Montserrat performed songs from their newly completed Barcelona album. Full episode here: https://youtu.be/e-rkZW8Usjo,2020-04-07 11:07:40+00:00,63,635,,,1247481161678495744
73,1253509719765004290,https://twitter.com/Lord_Sugar/status/1253509719765004290,Lord_Sugar,,"rt: @piersmorgan BREAKING: There were 638 more UK deaths reported in past 24hrs - DOWN on previous 2 days. This takes UK total to 18,738, but does not include 1000s more who've died with COVID-19 in care homes &amp; community. THANKS FOR THAT, JUST TO SAY WE ALL HAVE TELLY'S.",2020-04-24 02:23:00+00:00,2,20,@piersmorgan,,1253509719765004290
73,1253508828685099015,https://twitter.com/Lord_Sugar/status/1253508828685099015,Lord_Sugar,,"RT : @piersmorgan I want to say a massive thank you to all staff in prisons, probation &amp; youth justice, serving the country by working tirelessly in very difficult circumstances. THANK YOU YOUR MAJESTY......THE BLOKE ACTUALLY THINKS HE'S THE KING NOW RECORDING PUBLIC MESSAGES.",2020-04-24 02:19:28+00:00,8,48,@piersmorgan,,1253508828685099015
73,1253505592037179392,https://twitter.com/Lord_Sugar/status/1253505592037179392,Lord_Sugar,Lord_Sugar,Ok seen it now 19,2020-04-24 02:06:36+00:00,0,12,,,1253505592037179392
73,1253505353213530122,https://twitter.com/Lord_Sugar/status/1253505353213530122,Lord_Sugar,Pckildare,Of course what an idiot .,2020-04-24 02:05:39+00:00,0,9,,,1253505353213530122
73,1253499846218190849,https://twitter.com/Lord_Sugar/status/1253499846218190849,Lord_Sugar,AndrewBloch,Is it 11 as you have to 2 for 88,2020-04-24 01:43:46+00:00,5,15,,,1253499846218190849
73,1253465011168706560,https://twitter.com/Lord_Sugar/status/1253465011168706560,Lord_Sugar,,Trump: Hilarious again. He should get an Oscar. 1) We did more testing than any other country. BS. 2) Kim Jung is sick. He goes off saying thanks to me we are not at war with N.Korea. 3) We have too many ventilators now. 4) I told you months ago hot weather kills the virus,2020-04-23 23:25:21+00:00,53,489,,,1253465011168706560
73,1253412508762640385,https://twitter.com/Lord_Sugar/status/1253412508762640385,Lord_Sugar,TheSun,How cheery that just what we need.,2020-04-23 19:56:44+00:00,11,188,,,1253412508762640385
73,1253410129703079938,https://twitter.com/Lord_Sugar/status/1253410129703079938,Lord_Sugar,Davidthegrumps,Well according to your twit pic of 2 dots. I would say People in glass houses....,2020-04-23 19:47:16+00:00,0,80,,,1253410129703079938
73,1253409148282105856,https://twitter.com/Lord_Sugar/status/1253409148282105856,Lord_Sugar,NoirMJ,Yes a few thousand who I employed and paid well so they could support their families. Go back to Moscow,2020-04-23 19:43:22+00:00,20,405,,,1253409148282105856
73,1253407065638387718,https://twitter.com/Lord_Sugar/status/1253407065638387718,Lord_Sugar,saradriscoll111,This woman unprompted used a vile expletive to describe me. Not very lady like. So I gave it back to her. Ok with you ?,2020-04-23 19:35:06+00:00,10,361,,,1253407065638387718
73,1253406649634742272,https://twitter.com/Lord_Sugar/status/1253406649634742272,Lord_Sugar,nige_co,correct go tell her,2020-04-23 19:33:27+00:00,0,93,,,1253406649634742272
73,1253405805191278592,https://twitter.com/Lord_Sugar/status/1253405805191278592,Lord_Sugar,Hape9999,Snob.... hah,2020-04-23 19:30:05+00:00,0,25,,,1253405805191278592
73,1253405690879774722,https://twitter.com/Lord_Sugar/status/1253405690879774722,Lord_Sugar,taximan2002,cheers thanks for that,2020-04-23 19:29:38+00:00,0,51,,,1253405690879774722
73,1253405569081368576,https://twitter.com/Lord_Sugar/status/1253405569081368576,Lord_Sugar,mick_howe,Made 100's of thousands of them in Essex.,2020-04-23 19:29:09+00:00,2,107,,,1253405569081368576
73,1253405043820244992,https://twitter.com/Lord_Sugar/status/1253405043820244992,Lord_Sugar,acmarkd,"How does do that. It was analogue, transmission went digital ages ago.",2020-04-23 19:27:04+00:00,3,87,,,1253405043820244992
