age,id,permalink,username,to,text,date,retweets,favorites,mentions,hashtags,geo
75,1250199114836373504,https://twitter.com/floridapress/status/1250199114836373504,floridapress,,"Read our April e-newsletter for a roundup of our #quarantine activities, featuring the pets of the press: https://conta.cc/2K7pQiZ Want our monthly e-newsletters delivered to your inbox? Subscribe at http://upress.ufl.edu/subscribe.",2020-04-14 23:07:51+00:00,0,1,,#quarantine,1250199114836373504
75,1251981722134228996,https://twitter.com/Baglan6079/status/1251981722134228996,Baglan6079,colinmanning9,Thank you Colin,2020-04-19 21:11:17+00:00,0,0,,,1251981722134228996
75,1251966439352827908,https://twitter.com/Baglan6079/status/1251966439352827908,Baglan6079,SouthWalesSec,Thank you Ben,2020-04-19 20:10:34+00:00,0,0,,,1251966439352827908
75,1251966340291792896,https://twitter.com/Baglan6079/status/1251966340291792896,Baglan6079,BourneEnd7943,Thank you,2020-04-19 20:10:10+00:00,0,0,,,1251966340291792896
75,1251966148976967680,https://twitter.com/Baglan6079/status/1251966148976967680,Baglan6079,,Several of our members had a virtual get together this evening to celebrate our 75th anniversary and to also raise a glass to #absentbrethren #TimetoToast,2020-04-19 20:09:24+00:00,3,14,,#absentbrethren #TimetoToast,1251966148976967680
75,1251965327237353476,https://twitter.com/Baglan6079/status/1251965327237353476,Baglan6079,ClwbColonnade,Thank you,2020-04-19 20:06:09+00:00,1,2,,,1251965327237353476
75,1251843958684221441,https://twitter.com/Baglan6079/status/1251843958684221441,Baglan6079,,Today Marks a major milestone in the history of our Lodge as we celebrate its 75th anniversary. Obviously we cannot celebrate this as intended but we do plan on having a virtual get together this evening and raising a glass to the health of the Lodge and absent brethren.,2020-04-19 12:03:52+00:00,4,22,,,1251843958684221441
75,1250478290541973504,https://twitter.com/Baglan6079/status/1250478290541973504,Baglan6079,,Our Lodge Secretary W.Bro John Bamsey making a fantastic delivery of £250 worth of refreshments on behalf of the Royal British Legion to the nurses and staff of Neath/Port Talbot Hospital ,2020-04-15 17:37:11+00:00,4,19,,,1250478290541973504
75,1248362482323816448,https://twitter.com/Baglan6079/status/1248362482323816448,Baglan6079,,"On what should have been our installation meeting this evening the current WM, IPM, Master Elect and JW had a little virtual get together on Zoom and also to toast all #absentbrethren",2020-04-09 21:29:43+00:00,1,9,,#absentbrethren,1248362482323816448
75,1246528872625160196,https://twitter.com/Baglan6079/status/1246528872625160196,Baglan6079,,Saturday night and the hands are on the square here's to you all #TimetoToast #absentbrethren,2020-04-04 20:03:37+00:00,4,11,,#TimetoToast #absentbrethren,1246528872625160196
75,1244009978022842368,https://twitter.com/Baglan6079/status/1244009978022842368,Baglan6079,,"Congratulations to our WM @RLT83 on being declared as chairman of @ClwbColonnade tonight, we wish you all the best, and the club is definitely in safe hands for the next 12 months @NYMC_UK",2020-03-28 21:14:26+00:00,3,11,@RLT83 @ClwbColonnade @NYMC_UK,,1244009978022842368
75,1244006869947027457,https://twitter.com/Baglan6079/status/1244006869947027457,Baglan6079,,The hands are on the square #TimetoToast #absentbrethren,2020-03-28 21:02:04+00:00,4,27,,#TimetoToast #absentbrethren,1244006869947027457
75,1242199138508431368,https://twitter.com/Baglan6079/status/1242199138508431368,Baglan6079,,Thinking of all the #nhsworkers at these testing times. Stay safe #TimetoToast,2020-03-23 21:18:48+00:00,2,7,,#nhsworkers #TimetoToast,1242199138508431368
75,1241835062779416578,https://twitter.com/Baglan6079/status/1241835062779416578,Baglan6079,,#TimetoToast absent brethren,2020-03-22 21:12:05+00:00,4,15,,#TimetoToast,1241835062779416578
75,1238399043375697920,https://twitter.com/Baglan6079/status/1238399043375697920,Baglan6079,,Congratulations to our Senior Warden and now Master Elect Bro Lyn Jones. It was a fantastic night and we wish you all the very best for your year in the chair of King Solomon,2020-03-13 09:38:34+00:00,2,10,,,1238399043375697920
75,1234454277550170112,https://twitter.com/Baglan6079/status/1234454277550170112,Baglan6079,,If you have a thirst for knowledge or are hungry to learn more then we have just what your looking for @MargamAbbey5257 @AfanLodge833 @SouthWalesMason,2020-03-02 12:23:29+00:00,3,4,@MargamAbbey5257 @AfanLodge833 @SouthWalesMason,,1234454277550170112
75,1252901985478569985,https://twitter.com/imyourkikoo/status/1252901985478569985,imyourkikoo,,TINIRA KO SA PWET SI KUMPARE PRANK! GONE WRONG ( ISA PA DAW),2020-04-22 10:08:05+00:00,0,2,,,1252901985478569985
75,1252565670274859009,https://twitter.com/imyourkikoo/status/1252565670274859009,imyourkikoo,ildavefonso,Nako reason HSHSHAHAHAHA,2020-04-21 11:51:41+00:00,0,0,,,1252565670274859009
75,1252354496383946755,https://twitter.com/imyourkikoo/status/1252354496383946755,imyourkikoo,crystalsheyn,hi ate dancerist fback pampaganda ng umaga ko:>,2020-04-20 21:52:34+00:00,0,0,,,1252354496383946755
75,1252139127669055488,https://twitter.com/imyourkikoo/status/1252139127669055488,imyourkikoo,KevinArman,pogi talaga nung nasa gitna,2020-04-20 07:36:46+00:00,0,1,,,1252139127669055488
75,1252139018801737728,https://twitter.com/imyourkikoo/status/1252139018801737728,imyourkikoo,pewdsygerwin,Stay safe HAHAHAGAGAGG,2020-04-20 07:36:20+00:00,0,1,,,1252139018801737728
75,1251281715441500160,https://twitter.com/imyourkikoo/status/1251281715441500160,imyourkikoo,itsyourhaime,Papansin si james amp kunyare magaling kumanta,2020-04-17 22:49:43+00:00,0,3,,,1251281715441500160
75,1251187749333241857,https://twitter.com/imyourkikoo/status/1251187749333241857,imyourkikoo,,Trankaso na naman pota,2020-04-17 16:36:20+00:00,0,0,,,1251187749333241857
75,1251187655284420610,https://twitter.com/imyourkikoo/status/1251187655284420610,imyourkikoo,lnnadrnn,told you taasan mo lang pride mo HAHAHAHSHSHSHS,2020-04-17 16:35:57+00:00,0,0,,,1251187655284420610
75,1251092824461701121,https://twitter.com/imyourkikoo/status/1251092824461701121,imyourkikoo,,Road to 6k na sige pa tigasan nyo pa ulo nyo sabihin nyo lang kung ayaw nyo ko makita HAHAHAGAGAG,2020-04-17 10:19:08+00:00,0,0,,,1251092824461701121
75,1250805871027732486,https://twitter.com/imyourkikoo/status/1250805871027732486,imyourkikoo,itsyourhaime,Pass masama yun ,2020-04-16 15:18:53+00:00,0,0,,,1250805871027732486
75,1250803633584631808,https://twitter.com/imyourkikoo/status/1250803633584631808,imyourkikoo,,Send malboro..,2020-04-16 15:09:59+00:00,1,3,,,1250803633584631808
75,1250803487945846790,https://twitter.com/imyourkikoo/status/1250803487945846790,imyourkikoo,nquesada36,Ako miss kita di mo naman ako nanotice eh,2020-04-16 15:09:24+00:00,0,1,,,1250803487945846790
75,1250794673624330240,https://twitter.com/imyourkikoo/status/1250794673624330240,imyourkikoo,,Kulang isang stick,2020-04-16 14:34:23+00:00,0,0,,,1250794673624330240
75,1250792248922513408,https://twitter.com/imyourkikoo/status/1250792248922513408,imyourkikoo,,Di ko kinaya human centipede ebarg!,2020-04-16 14:24:45+00:00,0,1,,,1250792248922513408
75,1250734719651549185,https://twitter.com/imyourkikoo/status/1250734719651549185,imyourkikoo,annikamarieg,Galing naman sumayaw ni daddy crush:),2020-04-16 10:36:09+00:00,0,1,,,1250734719651549185
