age,id,permalink,username,to,text,date,retweets,favorites,mentions,hashtags,geo
78,1206488426783969280,https://twitter.com/IMPaulWilliams/status/1206488426783969280,IMPaulWilliams,,Oooh ... I just heard about Danny Aiello passing. .he was all heart. We met on a mini series called “People like us” in 1990. Newly sober it was my first sober acting job. Danny took care of me. And Ben Gazarra. Kindness and humor are powerful medicine. A soulful man. ,2019-12-16 08:17:11+00:00,53,638,,,1206488426783969280
78,1203752350990516224,https://twitter.com/IMPaulWilliams/status/1203752350990516224,IMPaulWilliams,,@ASCAP... home. And a creative guardian in so many ways for me. As a member. As a songwriter. https://www.instagram.com/p/B5so--0gcRK/?igshid=1xwm2z8fkw6im,2019-12-08 19:04:59+00:00,1,10,@ASCAP,,1203752350990516224
78,1191031729701523456,https://twitter.com/IMPaulWilliams/status/1191031729701523456,IMPaulWilliams,,An extra hour of sleep. What a good idea. Grateful. Happy Sunday everyone. ,2019-11-03 16:37:47+00:00,12,337,,,1191031729701523456
78,1190496236781989888,https://twitter.com/IMPaulWilliams/status/1190496236781989888,IMPaulWilliams,im2b,I do feel that way. It’s crazy but ... Sweeter souls did not survive and I take none of it for granted. Grateful.Thank you,2019-11-02 05:09:55+00:00,0,3,,,1190496236781989888
78,1190030683307159553,https://twitter.com/IMPaulWilliams/status/1190030683307159553,IMPaulWilliams,,Amphetamines and Exfoliants ... Bad combination! Happy Halloween my friends. ,2019-10-31 22:19:59+00:00,75,520,,,1190030683307159553
78,1189988656859111424,https://twitter.com/IMPaulWilliams/status/1189988656859111424,IMPaulWilliams,,https://www.billboard.com/articles/news/8541588/paul-williams-phantom-of-the-paradise-music 45 years ago today Phantom of the Paradise was released. Almost no one noticed. To steal a Sam Goldwyn quote ... “They stayed away in droves!” Many thanks to Katherine Turman and Billboard For this kindness. ,2019-10-31 19:32:59+00:00,400,1853,,,1189988656859111424
78,1185731739097763841,https://twitter.com/IMPaulWilliams/status/1185731739097763841,IMPaulWilliams,im2b, ,2019-10-20 01:37:31+00:00,0,4,,,1185731739097763841
78,1250997848616964096,https://twitter.com/bobdylan/status/1250997848616964096,bobdylan,,"#today and #tomorrow, #skeletons and #nudes, #sparkle and #flash, #AnneFrank and #IndianaJones, #fastcars and #fastfood, #bluejeans and #queens, #Beethoven and #Chopin, #life and #death.",2020-04-17 04:01:44+00:00,1271,4030,,#today #tomorrow #skeletons #nudes #sparkle #flash #AnneFrank #IndianaJones #fastcars #fastfood #bluejeans #queens #Beethoven #Chopin #life #death,1250997848616964096
78,1250913270933917709,https://twitter.com/bobdylan/status/1250913270933917709,bobdylan,,#IContainMultitudes,2020-04-16 22:25:39+00:00,613,2434,,#IContainMultitudes,1250913270933917709
78,1243389605451198465,https://twitter.com/bobdylan/status/1243389605451198465,bobdylan,,"Greetings to my fans and followers with gratitude for all your support and loyalty across the years. This is an unreleased song we recorded a while back that you might find interesting. Stay safe, stay observant and may God be with you. Bob Dylan",2020-03-27 04:09:17+00:00,12806,33451,,,1243389605451198465
78,1219341272411967490,https://twitter.com/bobdylan/status/1219341272411967490,bobdylan,,Blood on the Tracks was released on this day 45 years ago. Shop the Anniversary Collection now! http://bit.ly/38gazXi,2020-01-20 19:29:48+00:00,163,1010,,,1219341272411967490
78,1210647377700212736,https://twitter.com/bobdylan/status/1210647377700212736,bobdylan,,"Start off 2020 with Official Bob Dylan merchandise. Discounts end 1/1, shop now: http://bit.ly/2PvewRd",2019-12-27 19:43:22+00:00,40,194,,,1210647377700212736
78,1190290504677777409,https://twitter.com/bobdylan/status/1190290504677777409,bobdylan,,"‘Travelin’ Thru, 1967-1969: The Bootleg Series Vol. 15’ is available now. Rediscover Dylan’s journey to Nashville through three discs of previously unreleased outtakes, including the legendary session with Johnny Cash.",2019-11-01 15:32:25+00:00,226,737,,,1190290504677777409
78,1184424568208969729,https://twitter.com/bobdylan/status/1184424568208969729,bobdylan,,"Bob Dylan’s #Tarantula will be published as an audiobook for the first time ever, read by award-winning actor/narrator Will Patton on Tuesday, December 3, 2019, by @SimonAudio. Pre-order this incredible collection of prose, lyrics, and poetry today: http://bit.ly/2nOK4qq",2019-10-16 11:03:17+00:00,154,597,@SimonAudio,#Tarantula,1184424568208969729
78,1181517065506754562,https://twitter.com/bobdylan/status/1181517065506754562,bobdylan,,New York City design label @barkingironsny just released a 16-pc limited edition collection echoing Bob Dylan’s iconic style. Pre-order now. #dylanrollingthunder #barkingirons See the entire collection: https://barkingirons.com/collections/bob-dylan-rolling-thunder,2019-10-08 10:29:54+00:00,60,255,@barkingironsny,#dylanrollingthunder #barkingirons,1181517065506754562
78,1177611315482943488,https://twitter.com/bobdylan/status/1177611315482943488,bobdylan,,Bob Dylan and his Band: Ten (10) Nights at the Beacon Theatre in New York! Now on sale...Don't you dare miss it! http://bobdylan.com/on-tour/,2019-09-27 15:49:51+00:00,93,397,,,1177611315482943488
78,1176865944750166016,https://twitter.com/bobdylan/status/1176865944750166016,bobdylan,,Bob Dylan’s iconic songbook heads to Broadway this February It’s time to #DiscoverTheNorthCountry with @northcountrybroadway Advance access to Bob Dylan fans on http://bobdylan.com begins now through September 27th,2019-09-25 14:28:00+00:00,92,268,,#DiscoverTheNorthCountry,1176865944750166016
78,1174682799170904064,https://twitter.com/bobdylan/status/1174682799170904064,bobdylan,,"‘Travelin’ Thru, 1967-1969: The Bootleg Series Vol. 15,’ available 11/01, revisits Bob Dylan’s pivotal musical journey to Nashville. This 3CD or 3LP set features 47 unreleased recordings, including previously unavailable recordings made with Johnny Cash. https://BobDylan.lnk.to/travelinthruTA!0919",2019-09-19 13:52:58+00:00,342,1084,,,1174682799170904064
78,1167760933432844289,https://twitter.com/bobdylan/status/1167760933432844289,bobdylan,,"Happy Labor Day, take 20% off now through Monday. http://bit.ly/2zrbHrB",2019-08-31 11:27:57+00:00,52,156,,,1167760933432844289
78,1146616099225722880,https://twitter.com/bobdylan/status/1146616099225722880,bobdylan,,"4th of July Sale, Shop now: http://bit.ly/2FLJUWo",2019-07-04 03:05:55+00:00,62,207,,,1146616099225722880
78,1144975000778280965,https://twitter.com/bobdylan/status/1144975000778280965,bobdylan,,,2019-06-29 14:24:47+00:00,126,481,,,1144975000778280965
78,1141370835925688320,https://twitter.com/bobdylan/status/1141370835925688320,bobdylan,,"After sold-out, hit engagements at The Public in NYC and in London, GIRL FROM THE NORTH COUNTRY comes to Broadway February 2020. Stay updated at http://northcountryonbroadway.com or on social at @NorthCountryBroadway. #DiscoverTheNorthCountry",2019-06-19 15:43:07+00:00,101,331,,#DiscoverTheNorthCountry,1141370835925688320
78,1250997848616964096,https://twitter.com/bobdylan/status/1250997848616964096,bobdylan,,"#today and #tomorrow, #skeletons and #nudes, #sparkle and #flash, #AnneFrank and #IndianaJones, #fastcars and #fastfood, #bluejeans and #queens, #Beethoven and #Chopin, #life and #death.",2020-04-17 04:01:44+00:00,1271,4030,,#today #tomorrow #skeletons #nudes #sparkle #flash #AnneFrank #IndianaJones #fastcars #fastfood #bluejeans #queens #Beethoven #Chopin #life #death,1250997848616964096
78,1250913270933917709,https://twitter.com/bobdylan/status/1250913270933917709,bobdylan,,#IContainMultitudes,2020-04-16 22:25:39+00:00,613,2434,,#IContainMultitudes,1250913270933917709
78,1243389605451198465,https://twitter.com/bobdylan/status/1243389605451198465,bobdylan,,"Greetings to my fans and followers with gratitude for all your support and loyalty across the years. This is an unreleased song we recorded a while back that you might find interesting. Stay safe, stay observant and may God be with you. Bob Dylan",2020-03-27 04:09:17+00:00,12806,33451,,,1243389605451198465
78,1219341272411967490,https://twitter.com/bobdylan/status/1219341272411967490,bobdylan,,Blood on the Tracks was released on this day 45 years ago. Shop the Anniversary Collection now! http://bit.ly/38gazXi,2020-01-20 19:29:48+00:00,163,1010,,,1219341272411967490
78,1210647377700212736,https://twitter.com/bobdylan/status/1210647377700212736,bobdylan,,"Start off 2020 with Official Bob Dylan merchandise. Discounts end 1/1, shop now: http://bit.ly/2PvewRd",2019-12-27 19:43:22+00:00,40,194,,,1210647377700212736
78,1190290504677777409,https://twitter.com/bobdylan/status/1190290504677777409,bobdylan,,"‘Travelin’ Thru, 1967-1969: The Bootleg Series Vol. 15’ is available now. Rediscover Dylan’s journey to Nashville through three discs of previously unreleased outtakes, including the legendary session with Johnny Cash.",2019-11-01 15:32:25+00:00,226,737,,,1190290504677777409
78,1184424568208969729,https://twitter.com/bobdylan/status/1184424568208969729,bobdylan,,"Bob Dylan’s #Tarantula will be published as an audiobook for the first time ever, read by award-winning actor/narrator Will Patton on Tuesday, December 3, 2019, by @SimonAudio. Pre-order this incredible collection of prose, lyrics, and poetry today: http://bit.ly/2nOK4qq",2019-10-16 11:03:17+00:00,154,597,@SimonAudio,#Tarantula,1184424568208969729
78,1181517065506754562,https://twitter.com/bobdylan/status/1181517065506754562,bobdylan,,New York City design label @barkingironsny just released a 16-pc limited edition collection echoing Bob Dylan’s iconic style. Pre-order now. #dylanrollingthunder #barkingirons See the entire collection: https://barkingirons.com/collections/bob-dylan-rolling-thunder,2019-10-08 10:29:54+00:00,60,255,@barkingironsny,#dylanrollingthunder #barkingirons,1181517065506754562
78,1177611315482943488,https://twitter.com/bobdylan/status/1177611315482943488,bobdylan,,Bob Dylan and his Band: Ten (10) Nights at the Beacon Theatre in New York! Now on sale...Don't you dare miss it! http://bobdylan.com/on-tour/,2019-09-27 15:49:51+00:00,93,397,,,1177611315482943488
78,1176865944750166016,https://twitter.com/bobdylan/status/1176865944750166016,bobdylan,,Bob Dylan’s iconic songbook heads to Broadway this February It’s time to #DiscoverTheNorthCountry with @northcountrybroadway Advance access to Bob Dylan fans on http://bobdylan.com begins now through September 27th,2019-09-25 14:28:00+00:00,92,268,,#DiscoverTheNorthCountry,1176865944750166016
78,1174682799170904064,https://twitter.com/bobdylan/status/1174682799170904064,bobdylan,,"‘Travelin’ Thru, 1967-1969: The Bootleg Series Vol. 15,’ available 11/01, revisits Bob Dylan’s pivotal musical journey to Nashville. This 3CD or 3LP set features 47 unreleased recordings, including previously unavailable recordings made with Johnny Cash. https://BobDylan.lnk.to/travelinthruTA!0919",2019-09-19 13:52:58+00:00,342,1084,,,1174682799170904064
78,1167760933432844289,https://twitter.com/bobdylan/status/1167760933432844289,bobdylan,,"Happy Labor Day, take 20% off now through Monday. http://bit.ly/2zrbHrB",2019-08-31 11:27:57+00:00,52,156,,,1167760933432844289
78,1146616099225722880,https://twitter.com/bobdylan/status/1146616099225722880,bobdylan,,"4th of July Sale, Shop now: http://bit.ly/2FLJUWo",2019-07-04 03:05:55+00:00,62,207,,,1146616099225722880
78,1144975000778280965,https://twitter.com/bobdylan/status/1144975000778280965,bobdylan,,,2019-06-29 14:24:47+00:00,126,481,,,1144975000778280965
78,1141370835925688320,https://twitter.com/bobdylan/status/1141370835925688320,bobdylan,,"After sold-out, hit engagements at The Public in NYC and in London, GIRL FROM THE NORTH COUNTRY comes to Broadway February 2020. Stay updated at http://northcountryonbroadway.com or on social at @NorthCountryBroadway. #DiscoverTheNorthCountry",2019-06-19 15:43:07+00:00,101,331,,#DiscoverTheNorthCountry,1141370835925688320
78,1253480377970122752,https://twitter.com/ringostarrmusic/status/1253480377970122752,ringostarrmusic,,https://youtu.be/QLELtdrRyhs. How great is this The Buddhist monk practicing for Saturday’s get together I hope you are too peace and love b ,2020-04-24 00:26:25+00:00,120,718,,,1253480377970122752
78,1252690401544114176,https://twitter.com/ringostarrmusic/status/1252690401544114176,ringostarrmusic,,Peace and love I am just giving you all a heads up if you tune in to the Beatles YouTube channel on Saturday the 25th at 9 AM Pacific 12 noon Eastern you are in for a big surprise and fun and peace and love ,2020-04-21 20:07:20+00:00,2204,12586,,,1252690401544114176
78,1249069222862315521,https://twitter.com/ringostarrmusic/status/1249069222862315521,ringostarrmusic,,Life is good peace and love. ,2020-04-11 20:18:03+00:00,1547,12951,,,1249069222862315521
78,1248853068550004737,https://twitter.com/ringostarrmusic/status/1248853068550004737,ringostarrmusic,,Peace and love Saturday ,2020-04-11 05:59:08+00:00,3010,20540,,,1248853068550004737
78,1248069705606131713,https://twitter.com/ringostarrmusic/status/1248069705606131713,ringostarrmusic,,Peace remember peace is how we make it peace and love everybody stay well. ,2020-04-09 02:06:20+00:00,1024,7907,,,1248069705606131713
78,1247404918601744384,https://twitter.com/ringostarrmusic/status/1247404918601744384,ringostarrmusic,,On this day remembering the great Ravi Shankar he was a beautiful human being and an incredible musician. peace and love .,2020-04-07 06:04:42+00:00,699,8230,,,1247404918601744384
78,1245093133609619456,https://twitter.com/ringostarrmusic/status/1245093133609619456,ringostarrmusic,,Let’s come together. Come together. Right now peace and love ,2020-03-31 20:58:30+00:00,1457,9391,,,1245093133609619456
78,1243296435287642112,https://twitter.com/ringostarrmusic/status/1243296435287642112,ringostarrmusic,thebeatles,"I am sending Peace and Love to everyone and hope you are staying healthy and safe. I want to thank and support Dhani and Olivia for this great campaign to help to fight Covid 19. Peace and love, Ringo ",2020-03-26 21:59:04+00:00,1073,6852,,,1243296435287642112
78,1238131378002079744,https://twitter.com/ringostarrmusic/status/1238131378002079744,ringostarrmusic,,Peace and love take care of everybody. ,2020-03-12 15:54:58+00:00,4263,20410,,,1238131378002079744
78,1237857249671831553,https://twitter.com/ringostarrmusic/status/1237857249671831553,ringostarrmusic,,Mr. Moonlight peace and love ,2020-03-11 21:45:41+00:00,625,5876,,,1237857249671831553
78,1232386005287587840,https://twitter.com/ringostarrmusic/status/1232386005287587840,ringostarrmusic,,Happy birthday George I miss you man peace and love ,2020-02-25 19:24:54+00:00,5636,29906,,,1232386005287587840
78,1230722556438515712,https://twitter.com/ringostarrmusic/status/1230722556438515712,ringostarrmusic,,Are you ready for I feel fine Friday peace and love ,2020-02-21 05:14:57+00:00,1684,12334,,,1230722556438515712
78,1229131743514390528,https://twitter.com/ringostarrmusic/status/1229131743514390528,ringostarrmusic,,,2020-02-16 19:53:38+00:00,899,7735,,,1229131743514390528
78,1229095174791294976,https://twitter.com/ringostarrmusic/status/1229095174791294976,ringostarrmusic,,Peace and love Sunday peace and love ,2020-02-16 17:28:19+00:00,3533,23983,,,1229095174791294976
78,1225929366762246145,https://twitter.com/ringostarrmusic/status/1225929366762246145,ringostarrmusic,,What’s up is it it’s all happening peace and love yeah peace and love. ,2020-02-07 23:48:32+00:00,2642,18003,,,1225929366762246145
78,1253346802918711299,https://twitter.com/MuhammadAli/status/1253346802918711299,MuhammadAli,,"“My wealth is in my knowledge of self, love, and spirituality.” - Muhammad Ali Today we celebrate with those who are practicing their faith with reflection, self-improvement, worship. #Ramadan #MuhammadAli",2020-04-23 15:35:38+00:00,335,1116,,#Ramadan #Ramadan #MuhammadAli,1253346802918711299
78,1252974430323535872,https://twitter.com/MuhammadAli/status/1252974430323535872,MuhammadAli,,"“The only religion that matters, is the real religion - love.” - #MuhammadAli",2020-04-22 14:55:57+00:00,185,738,,#MuhammadAli,1252974430323535872
78,1251890851233427458,https://twitter.com/MuhammadAli/status/1251890851233427458,MuhammadAli,,Want some #MuhammadAli SWAG of your own? Visit the link in our bio to shop these awesome graphic tees! ,2020-04-19 15:10:12+00:00,34,335,,#MuhammadAli,1251890851233427458
78,1251528654485504006,https://twitter.com/MuhammadAli/status/1251528654485504006,MuhammadAli,,"For the first time in nearly 30 years, you get to watch the epic trilogy - Ali vs Frazier. Tune in to @espn tonight, 7-10 PM/ET #MuhammadAli",2020-04-18 15:10:58+00:00,365,1256,@espn,#MuhammadAli,1251528654485504006
78,1251268876765138950,https://twitter.com/MuhammadAli/status/1251268876765138950,MuhammadAli,,"Tune in to @espn tomorrow night, Saturday, April 18, for the Ali-Frazier trilogy starting at 7pm EST. Ali-Frazier has not aired on U.S. television in nearly 30 years (August 1991)! #MuhammadAli",2020-04-17 21:58:42+00:00,189,566,@espn,#MuhammadAli,1251268876765138950
78,1251161042677141505,https://twitter.com/MuhammadAli/status/1251161042677141505,MuhammadAli,,“He who is not courageous enough to take risks will accomplish nothing in life.” - #MuhammadAli #TheGreatest #Courage #Champion,2020-04-17 14:50:12+00:00,345,1136,,#MuhammadAli #TheGreatest #Courage #Champion,1251161042677141505
78,1250439605708447753,https://twitter.com/MuhammadAli/status/1250439605708447753,MuhammadAli,,“I wish people would love everybody else the way they love me. It would be a better world.” - #MuhammadAli ,2020-04-15 15:03:28+00:00,248,1029,,#MuhammadAli,1250439605708447753
78,1249712753331163137,https://twitter.com/MuhammadAli/status/1249712753331163137,MuhammadAli,,"“Allah will protect me. Besides, I’m too fast to be hit by a bullet.” - #MuhammadAli @joey_paints #Spirituality #Faith",2020-04-13 14:55:13+00:00,192,787,@Joey_Paints,#MuhammadAli #Spirituality #Faith,1249712753331163137
78,1248991886657728512,https://twitter.com/MuhammadAli/status/1248991886657728512,MuhammadAli,,“God don’t want me to go down for standing up!” - #MuhammadAli #LoudAndProud #GenerationAli #Strong #Faith #Spirituality,2020-04-11 15:10:45+00:00,268,1184,,#MuhammadAli #LoudAndProud #GenerationAli #Strong #Faith #Spirituality,1248991886657728512
78,1245033118358110214,https://twitter.com/MuhammadAli/status/1245033118358110214,MuhammadAli,,"#KenNorton was victorious in the ring, #MuhammadAli humbly accepted his defeat. Fight wins the battle, but respect wins the war. #KenRegan #TheGreatest #Boxing #Fight",2020-03-31 17:00:01+00:00,85,494,,#KenNorton #MuhammadAli #KenRegan #TheGreatest #Boxing #Fight,1245033118358110214
78,1244655866436915200,https://twitter.com/MuhammadAli/status/1244655866436915200,MuhammadAli,,Step into the light. #MuhammadAli #Respect #Equality,2020-03-30 16:00:57+00:00,56,284,,#MuhammadAli #Respect #Equality,1244655866436915200
78,1244293355007135746,https://twitter.com/MuhammadAli/status/1244293355007135746,MuhammadAli,,"One win wasn’t enough, had to do it twice. #NiceTry #KenRegan #GeorgeChuvalo #TheGreatest #AllIDoIsWin #BoxingChampion",2020-03-29 16:00:28+00:00,124,661,,#NiceTry #KenRegan #GeorgeChuvalo #TheGreatest #AllIDoIsWin #BoxingChampion,1244293355007135746
78,1243538519211020297,https://twitter.com/MuhammadAli/status/1243538519211020297,MuhammadAli,,"“I know where I'm going and I know the truth, and I don't have to be what you want me to be. I'm free to be what I want.” - #MuhammadAli #KenRegan #TheGreatest #Freedom #Respect",2020-03-27 14:01:01+00:00,383,1385,,#MuhammadAli #KenRegan #TheGreatest #Freedom #Respect,1243538519211020297
78,1243191237726748678,https://twitter.com/MuhammadAli/status/1243191237726748678,MuhammadAli,,"“Ali’s got a left, Ali’s got a right, if he hits you once, you’re asleep for the night.” - #MuhammadAli #Respect #BoxingChampion #Goodnight",2020-03-26 15:01:03+00:00,191,706,,#MuhammadAli #Respect #BoxingChampion #Goodnight,1243191237726748678
78,1242496576628506625,https://twitter.com/MuhammadAli/status/1242496576628506625,MuhammadAli,,"By the looks of it, you already know. KO #ChuckWepner #KenRegan #MuhammadAli #TheGreatest #Unstoppable #BoxingChampion #NightNight",2020-03-24 17:00:42+00:00,73,455,,#ChuckWepner #KenRegan #MuhammadAli #TheGreatest #Unstoppable #BoxingChampion #NightNight,1242496576628506625
78,1253379773075722242,https://twitter.com/John_Merrow/status/1253379773075722242,John_Merrow,,HHS Secretary Azar turned over the management of the coronavirus crisis to inexperienced dog breeder,2020-04-23 17:46:39+00:00,1,2,,,1253379773075722242
78,1253046580074201089,https://twitter.com/John_Merrow/status/1253046580074201089,John_Merrow,,The Liar Tweets Tonight https://youtu.be/TkU1ob_lHCw via @YouTube,2020-04-22 19:42:39+00:00,1,1,@YouTube,,1253046580074201089
78,1252596793071763456,https://twitter.com/John_Merrow/status/1252596793071763456,John_Merrow,MikeGrunwald,Please don’t hold back. Tell us how you REALLY feel,2020-04-21 13:55:22+00:00,1,1,,,1252596793071763456
78,1252305944698130436,https://twitter.com/John_Merrow/status/1252305944698130436,John_Merrow,JamesFallows,#RememberInNovember,2020-04-20 18:39:38+00:00,0,2,,#RememberInNovember,1252305944698130436
78,1252287160708927491,https://twitter.com/John_Merrow/status/1252287160708927491,John_Merrow,JuddLegum,Retweet if you agree you will NEVER patronize Ruth Chris again.,2020-04-20 17:25:00+00:00,0,0,,,1252287160708927491
78,1252271285578670086,https://twitter.com/John_Merrow/status/1252271285578670086,John_Merrow,JoeBiden,Excellent!! #REMEMBERINNOVEMBER,2020-04-20 16:21:55+00:00,2,2,,#REMEMBERINNOVEMBER,1252271285578670086
78,1252247245296152577,https://twitter.com/John_Merrow/status/1252247245296152577,John_Merrow,Fitz_ly,"I'd like to read the rest of this to determine if it is as mindless and unimaginative and insulting as this excerpt. This is the time to rethink the basics. See http://Themerrowreport.com, please",2020-04-20 14:46:23+00:00,0,0,,,1252247245296152577
78,1252246047210049539,https://twitter.com/John_Merrow/status/1252246047210049539,John_Merrow,JoeNBC,Please share widely....,2020-04-20 14:41:37+00:00,1,1,,,1252246047210049539
78,1252054840064331776,https://twitter.com/John_Merrow/status/1252054840064331776,John_Merrow,stevesilberman,"41,000",2020-04-20 02:01:50+00:00,0,0,,,1252054840064331776
78,1252053314180710400,https://twitter.com/John_Merrow/status/1252053314180710400,John_Merrow,jaketapper,“Good people on both sides”,2020-04-20 01:55:46+00:00,0,0,,,1252053314180710400
78,1251887659565416454,https://twitter.com/John_Merrow/status/1251887659565416454,John_Merrow,gtconway3d,notice that there are more Trump signs than face masks!,2020-04-19 14:57:31+00:00,1,1,,,1251887659565416454
78,1251887398658748416,https://twitter.com/John_Merrow/status/1251887398658748416,John_Merrow,KevinMKruse,"And at this rate, everyone will have been tested by 2027. Way to go, Trump!!",2020-04-19 14:56:29+00:00,0,0,,,1251887398658748416
78,1251486984482312192,https://twitter.com/John_Merrow/status/1251486984482312192,John_Merrow,DavidCornDC,What an embarrassment,2020-04-18 12:25:23+00:00,0,1,,,1251486984482312192
78,1251484489076879362,https://twitter.com/John_Merrow/status/1251484489076879362,John_Merrow,Bill_Gross,It’s Obama’s fault!!,2020-04-18 12:15:28+00:00,0,0,,,1251484489076879362
78,1251276311655563266,https://twitter.com/John_Merrow/status/1251276311655563266,John_Merrow,AmyMcGrathKY,Dump Mitch!,2020-04-17 22:28:14+00:00,0,1,,,1251276311655563266
78,1030855446884696065,https://twitter.com/TheAnnMargret/status/1030855446884696065,TheAnnMargret,GRIMREAPEROFROC,Thanks,2018-08-18 16:34:25+00:00,0,1,,,1030855446884696065
78,1030855028683296768,https://twitter.com/TheAnnMargret/status/1030855028683296768,TheAnnMargret,TheMitziGaynor,@TheMitziGaynor I love you Please like this tweet and follow me. ,2018-08-18 16:32:45+00:00,0,3,@TheMitziGaynor,,1030855028683296768
78,945329166014124032,https://twitter.com/TheAnnMargret/status/945329166014124032,TheAnnMargret,Tobolowsky,#MerryChristmas,2017-12-25 16:23:31+00:00,1,0,,#MerryChristmas,945329166014124032
78,945328759078641664,https://twitter.com/TheAnnMargret/status/945328759078641664,TheAnnMargret,BobbyRydell,#MerryChristmas Bobby,2017-12-25 16:21:54+00:00,1,1,,#MerryChristmas,945328759078641664
78,945328628300177408,https://twitter.com/TheAnnMargret/status/945328628300177408,TheAnnMargret,_BetteDavis,Come Follow Me,2017-12-25 16:21:23+00:00,1,1,,,945328628300177408
78,945325922755870721,https://twitter.com/TheAnnMargret/status/945325922755870721,TheAnnMargret,TheRealSonyaEd,So sorry I left Twitter but now I am back and following you again. #MerryChristmasEveryone #MerryChristmas,2017-12-25 16:10:37+00:00,1,0,,#MerryChristmasEveryone #MerryChristmas,945325922755870721
78,945324705510289409,https://twitter.com/TheAnnMargret/status/945324705510289409,TheAnnMargret,chloepaigecarp,You look so cute.,2017-12-25 16:05:47+00:00,1,0,,,945324705510289409
78,945323837104775168,https://twitter.com/TheAnnMargret/status/945323837104775168,TheAnnMargret,_BetteDavis,#MerryChristmasEveryone #MerryChristmas #ilovebettedavis Merry Christmas @_BetteDavis I love you!!!,2017-12-25 16:02:20+00:00,1,1,@_BetteDavis,#MerryChristmasEveryone #MerryChristmas #ilovebettedavis,945323837104775168
