age,id,permalink,username,to,text,date,retweets,favorites,mentions,hashtags,geo
78,941080777823014912,https://twitter.com/TheAnnMargret/status/941080777823014912,TheAnnMargret,,"Below are congratulatory photos with Ann-Margret's costars from Law & Order: SVU, @Chris_Meloni and @Mariska on her announcement of her @TheEmmys nomination for Outstanding Guest Actress In A Drama Series for her role as 'Rita Wills' in the episode entitled 'Bedtime'.",2017-12-13 23:01:56+00:00,1,3,@Chris_Meloni @Mariska @TheEmmys,,941080777823014912
78,941078449048948736,https://twitter.com/TheAnnMargret/status/941078449048948736,TheAnnMargret,,"@goldenglobes and @TheEmmys winner @TheAnnMargret guest stars as Margot Wilton, a legendary icon of the Vegas strip who survives an attack by a serial killer. Photo: Sonja Flemming/@CBS ©2010 @CBS Broadcasting Inc. All Rights Reserved.",2017-12-13 22:52:41+00:00,3,4,@goldenglobes @TheEmmys @TheAnnMargret @CBS @CBS,,941078449048948736
78,941069846292377600,https://twitter.com/TheAnnMargret/status/941069846292377600,TheAnnMargret,,"@TheAnnMargret Makes The Cheers &amp; Jeers Column Of The @TVGuide @TheAnnMargret makes the Cheers &amp; Jeers column by @brucefretts in the Oct. 25-31, 2010 issue of @TVGuide. ""CHEERS: to @CSI_CBS for bringing @TheAnnMargret back to the Strip...",2017-12-13 22:18:30+00:00,1,0,@TheAnnMargret @TVGuide @TheAnnMargret @brucefretts @TVGuide @CSI_CBS @TheAnnMargret,,941069846292377600
78,941069157453451265,https://twitter.com/TheAnnMargret/status/941069157453451265,TheAnnMargret,,http://www.careertransition.org,2017-12-13 22:15:46+00:00,1,0,,,941069157453451265
78,941068825923129344,https://twitter.com/TheAnnMargret/status/941068825923129344,TheAnnMargret,,"@TheAnnMargret is currently filming “@GoingInStyle,” directed by @zachbraff and also starring @realalanarkin, @themichaelcaine and @morgan_frreeman. Here are some photos from the set. For more info, please visit: http://www.thewrap.com",2017-12-13 22:14:26+00:00,2,1,@TheAnnMargret @GoingInStyle @zachbraff @realalanarkin @themichaelcaine,,941068825923129344
78,941068167740317696,https://twitter.com/TheAnnMargret/status/941068167740317696,TheAnnMargret,,"to entertain deployed troops, including two trips to Vietnam in 1965 and 1966. During the breakfast, letters to @TheAnnMargret from @VVMF veterans who still remember her performances there were read. (U.S. Army photo by Sgt. 1st Class Alexandra Hays)",2017-12-13 22:11:50+00:00,1,2,@TheAnnMargret @VVMF,,941068167740317696
78,941067485037678592,https://twitter.com/TheAnnMargret/status/941067485037678592,TheAnnMargret,,"Actress @TheAnnMargret accepts the @Chuckdurning patriotism award at the #DisabledVeteransBusinessAllianceSalutetoVeteransDay breakfast Nov. 13, 2015, in @CityofBevHills, @california. @TheAnnMargret participated in several @the_USO tours...",2017-12-13 22:09:07+00:00,1,0,@TheAnnMargret @Chuckdurning @CityofBevHills @california @TheAnnMargret @the_USO,#DisabledVeteransBusinessAllianceSalutetoVeteransDay,941067485037678592
78,1253025309693112321,https://twitter.com/Oski/status/1253025309693112321,Oski,CalAthletics,"Oh my gosh, oh my gosh.... Is it Stinson?",2020-04-22 18:18:08+00:00,0,0,,,1253025309693112321
78,1253024858050420737,https://twitter.com/Oski/status/1253024858050420737,Oski,CalAthletics,That's a sunset over water so we KNOW it's a West facing beach... I just can't remember when we took this photo ,2020-04-22 18:16:20+00:00,0,2,,,1253024858050420737
78,1253024643503370240,https://twitter.com/Oski/status/1253024643503370240,Oski,CalAthletics,Cabo San Lucas!,2020-04-22 18:15:29+00:00,0,1,,,1253024643503370240
78,1253024606920667138,https://twitter.com/Oski/status/1253024606920667138,Oski,CalAthletics,Ocean Beach!,2020-04-22 18:15:21+00:00,0,0,,,1253024606920667138
78,1252735189622460418,https://twitter.com/Oski/status/1252735189622460418,Oski,CalAthletics,This is my angle. #vogue,2020-04-21 23:05:18+00:00,6,58,,#vogue,1252735189622460418
78,1252399824718069765,https://twitter.com/Oski/status/1252399824718069765,Oski,CalBand,"Xoxo, Gossip Bear",2020-04-21 00:52:41+00:00,2,39,,,1252399824718069765
78,1247280307138519041,https://twitter.com/Oski/status/1247280307138519041,Oski,,The UC South Campus is nice I guess https://twitter.com/SXMCollege/status/1247192612131540993,2020-04-06 21:49:33+00:00,6,75,,,1247280307138519041
78,1247204088296562688,https://twitter.com/Oski/status/1247204088296562688,Oski,SXMCollege,#CalFamily the poll is open! Help me out and #GoBears,2020-04-06 16:46:41+00:00,13,27,,#CalFamily #GoBears,1247204088296562688
78,1246198725883523073,https://twitter.com/Oski/status/1246198725883523073,Oski,FollowJoeBruin,Very cute little brother. The ORIGINAL UC will win.,2020-04-03 22:11:44+00:00,13,94,,,1246198725883523073
78,1246177844989853696,https://twitter.com/Oski/status/1246177844989853696,Oski,SXMCollege,#CalFamily I’m going to need your help starting on Monday #GoBears,2020-04-03 20:48:45+00:00,24,102,,#CalFamily #GoBears,1246177844989853696
78,1242593215443644416,https://twitter.com/Oski/status/1242593215443644416,Oski,LSJUMBtoobz,"Sorry, I'm doing my part to #flatenthecurve",2020-03-24 23:24:43+00:00,3,20,,#flatenthecurve,1242593215443644416
78,1242172621174661120,https://twitter.com/Oski/status/1242172621174661120,Oski,CalAthletics,One of these options looks better than the rest... just me?,2020-03-23 19:33:25+00:00,7,67,,,1242172621174661120
78,1238265499516985345,https://twitter.com/Oski/status/1238265499516985345,Oski,,IT'S BIG GIVE! Help support your favorite Undeclared-and-Undecided-double-major eternal sophomore continue his education at UC Berkeley with donation at https://give.berkeley.edu/fund/?f=FW7728000,2020-03-13 00:47:55+00:00,2,18,,,1238265499516985345
78,1228448325805854722,https://twitter.com/Oski/status/1228448325805854722,Oski,CalAthletics,Happy #ValentinesDay #CalFamily ,2020-02-14 22:37:58+00:00,8,73,,#ValentinesDay #CalFamily,1228448325805854722
78,1208093430053605376,https://twitter.com/Oski/status/1208093430053605376,Oski,CalAthletics,Here’s to repeating sophomore year again #EarnIt,2019-12-20 18:34:53+00:00,5,72,,#EarnIt,1208093430053605376
78,1252598357492727809,https://twitter.com/paulanka/status/1252598357492727809,paulanka,,Hold me till the morning comes· It’s #tiktoktuesdays.. Great play along by Wayne thank you! #paulankatour,2020-04-21 14:01:35+00:00,0,18,,#tiktoktuesdays #paulankatour,1252598357492727809
78,1252239630768001024,https://twitter.com/paulanka/status/1252239630768001024,paulanka,,Its #musicmonday … great playing by @baimGuitar on IG thank you! #pyhoms #ankasingssinatra #paulankatour,2020-04-20 14:16:08+00:00,1,12,@baimGuitar,#musicmonday #pyhoms #ankasingssinatra #paulankatour,1252239630768001024
78,1251237604298764290,https://twitter.com/paulanka/status/1251237604298764290,paulanka,,"The @ASPCA is urgently seeking donations for their COVID-19 Relief and Recovery Initiative to help pets, pet owners, and animal welfare organizations impacted by the pandemic. Please consider supporting their lifesaving efforts: http://www.ASPCA.org/COVID19Fund",2020-04-17 19:54:26+00:00,4,32,@ASPCA,,1251237604298764290
78,1251149082338328578,https://twitter.com/paulanka/status/1251149082338328578,paulanka,,Blown away with your amazing drawing! Thank you @mrs.flameigo on IG #fanfriday,2020-04-17 14:02:41+00:00,0,15,,#fanfriday,1251149082338328578
78,1250786633647087619,https://twitter.com/paulanka/status/1250786633647087619,paulanka,,This photo was taken at the Olympia in 1958! #tbt #paulankatour #ankasingssinatra,2020-04-16 14:02:26+00:00,8,104,,#tbt #paulankatour #ankasingssinatra,1250786633647087619
78,1249698927059894272,https://twitter.com/paulanka/status/1249698927059894272,paulanka,,Such a beautiful cover of #pyhoms by @yt_reannaw on IG! #musicmonday #ankasingssinatra #paulankatour,2020-04-13 14:00:17+00:00,2,24,,#pyhoms #musicmonday #ankasingssinatra #paulankatour,1249698927059894272
78,1248625001965563909,https://twitter.com/paulanka/status/1248625001965563909,paulanka,TheNotoriousNIK,Thank you for having me,2020-04-10 14:52:53+00:00,0,6,,,1248625001965563909
78,1248624880884436992,https://twitter.com/paulanka/status/1248624880884436992,paulanka,GMA,Thank you all for having me!,2020-04-10 14:52:24+00:00,2,31,,,1248624880884436992
78,1248624699652722693,https://twitter.com/paulanka/status/1248624699652722693,paulanka,SavvyAuntie,I am trying to figure it out myself ,2020-04-10 14:51:41+00:00,0,5,,,1248624699652722693
78,1248249935629189121,https://twitter.com/paulanka/status/1248249935629189121,paulanka,,"In honor of #tbt here’s a photo of Frankie Avalon, Bobby Darin, Pat Boone and I! #paulankatour #ankasingssinatra",2020-04-09 14:02:30+00:00,4,52,,#tbt #paulankatour #ankasingssinatra,1248249935629189121
78,1247573623877128192,https://twitter.com/paulanka/status/1247573623877128192,paulanka,,A message from Paul . .,2020-04-07 17:15:05+00:00,0,15,,,1247573623877128192
78,1246075532694953984,https://twitter.com/paulanka/status/1246075532694953984,paulanka,,You’re talented… I love it! Thanks @ecmsketches on IG #fanfriday,2020-04-03 14:02:12+00:00,2,35,,#fanfriday,1246075532694953984
78,1245852800120008704,https://twitter.com/paulanka/status/1245852800120008704,paulanka,Tiffjones2002,Thank you love !,2020-04-02 23:17:09+00:00,3,26,,,1245852800120008704
78,1245852582091735040,https://twitter.com/paulanka/status/1245852582091735040,paulanka,alaerrebhi_tv,Thank you Ala ,2020-04-02 23:16:17+00:00,0,1,,,1245852582091735040
78,1245852370166116359,https://twitter.com/paulanka/status/1245852370166116359,paulanka,JessicaEby,This is why I did it! Be encouraged and tell your husband speedy recovery! i would love to hear how he is when he is all better!,2020-04-02 23:15:26+00:00,1,11,,,1245852370166116359
78,1252680879991926787,https://twitter.com/CivilAirPatrol/status/1252680879991926787,CivilAirPatrol,,"Since the COVID-19 pandemic began, CAP members have delivered 1.4 million meals to communities in need. Thank you to our members and community partners who made these deliveries possible! #civilairpatrol #COVID19 #CovidCantStopGOOD #makeadifference",2020-04-21 19:29:30+00:00,21,42,,#civilairpatrol #COVID19 #CovidCantStopGOOD #makeadifference,1252680879991926787
78,1252315112356151296,https://twitter.com/CivilAirPatrol/status/1252315112356151296,CivilAirPatrol,,"Shoutout to @NJWGCAP for breaking a 45-year record at the @CFBNJ Hillside location for most meals packed in one day (and for surpassing it TWICE)! Members prepared 875 cartons on April 2, 1,030 the next day and 1,141 on April 14.",2020-04-20 19:16:04+00:00,11,28,@NJWGCAP @CFBNJ,,1252315112356151296
78,1250583470851710983,https://twitter.com/CivilAirPatrol/status/1250583470851710983,CivilAirPatrol,TennesseeCAP,#RT @CAPNationalCC: Well done Tennessee Wing! Great example of @CivilAirPatrol volunteers' spirit of service.,2020-04-16 00:35:08+00:00,7,29,@CAPNationalCC @CivilAirPatrol,#RT,1250583470851710983
78,1250569294557204482,https://twitter.com/CivilAirPatrol/status/1250569294557204482,CivilAirPatrol,tnwingcap,Awesome job guys!! Thank you for making a difference.,2020-04-15 23:38:48+00:00,0,4,,,1250569294557204482
78,1248312627509579776,https://twitter.com/CivilAirPatrol/status/1248312627509579776,CivilAirPatrol,,"Civil Air Patrol is 66,000 members strong and our mission continues! Virtual trainings allow CAP members to maintain operational readiness from home. Learn more at http://GoCivilAirPatrol.com #CivilAirPatrol #COVIDー19 #virtuallearning",2020-04-09 18:11:37+00:00,8,15,,#CivilAirPatrol #COVID #virtuallearning,1248312627509579776
78,1247742533708349440,https://twitter.com/CivilAirPatrol/status/1247742533708349440,CivilAirPatrol,,"#RT @CAPNationalCC: @CivilAirPatrol @OregonWingCAP @AirForceAssoc @StellarXplorer Well done @CivilAirPatrol @OregonWingCAP Aurora Composite Squadron team on your ""stellar"" performance in the @StellarXplorer competition. Well done!",2020-04-08 04:26:16+00:00,1,9,@CAPNationalCC @CivilAirPatrol @OregonWingCAP @AirForceAssoc @StellarXplorer @CivilAirPatrol @OregonWingCAP @StellarXplorer,#RT,1247742533708349440
78,1247605749519396865,https://twitter.com/CivilAirPatrol/status/1247605749519396865,CivilAirPatrol,,Congratulations to the @OregonWingCAP's Aurora Composite Squadron cadet team for placing 2nd nationally in the @AirForceAssoc's @StellarXplorer STEM competition finals.,2020-04-07 19:22:44+00:00,4,19,@OregonWingCAP @AirForceAssoc @StellarXplorer,,1247605749519396865
78,1247154404312088576,https://twitter.com/CivilAirPatrol/status/1247154404312088576,CivilAirPatrol,LITHFlyer,Thank you for sharing your story. What a wonderful way to honor your father.,2020-04-06 13:29:15+00:00,0,6,,,1247154404312088576
78,1246475782173667329,https://twitter.com/CivilAirPatrol/status/1246475782173667329,CivilAirPatrol,,"In response to the #CoronavirusPandemic, Civil Air Patrol is helping to provide relief and stop the spread ! Thanks to our members for making a difference all across the U.S. #CivilAirPatrol #GoMakeaDifference #VolunteersAgainstCovid19",2020-04-04 16:32:39+00:00,30,78,,#CoronavirusPandemic #CivilAirPatrol #GoMakeaDifference #VolunteersAgainstCovid19,1246475782173667329
78,1246095097319641090,https://twitter.com/CivilAirPatrol/status/1246095097319641090,CivilAirPatrol,KolibriForensic,No. But here is our COVID-19 info page:,2020-04-03 15:19:57+00:00,0,0,,,1246095097319641090
78,1245384146618404869,https://twitter.com/CivilAirPatrol/status/1245384146618404869,CivilAirPatrol,,CAP Communication Traffic Soars Amid Social Distancing,2020-04-01 16:14:53+00:00,9,15,,,1245384146618404869
78,1244416581377105921,https://twitter.com/CivilAirPatrol/status/1244416581377105921,CivilAirPatrol,,"Mo. Members Assist with Protective Equipment Transport, Warehousing",2020-03-30 00:10:07+00:00,12,33,,,1244416581377105921
78,1242225147345502208,https://twitter.com/CivilAirPatrol/status/1242225147345502208,CivilAirPatrol,,Kan. Wing Assisting State with Lab Specimen Transport,2020-03-23 23:02:09+00:00,14,34,,,1242225147345502208
78,1241463005096927236,https://twitter.com/CivilAirPatrol/status/1241463005096927236,CivilAirPatrol,,Md. Wing Provides Mock-Up Testing Site Photos for HHS,2020-03-21 20:33:40+00:00,9,20,,,1241463005096927236
78,1241068072640942080,https://twitter.com/CivilAirPatrol/status/1241068072640942080,CivilAirPatrol,,Calif. Members Helping Distribute Food to Needy Students,2020-03-20 18:24:21+00:00,16,27,,,1241068072640942080
78,1225092034018652161,https://twitter.com/PresJGZuma/status/1225092034018652161,PresJGZuma,,,2020-02-05 16:21:16+00:00,5216,24481,,,1225092034018652161
78,1211283500625780736,https://twitter.com/PresJGZuma/status/1211283500625780736,PresJGZuma,,Happy Holidays.. From myself and the Umlazi Gospel Choir,2019-12-29 13:51:05+00:00,2543,11791,,,1211283500625780736
78,1194238732590878727,https://twitter.com/PresJGZuma/status/1194238732590878727,PresJGZuma,,"It must be known that I have nothing to hide. If the @PublicProtector wants to see my SARS records she is free to do so. We should not make the job of the PP difficult. If she wants my records, she must have them.",2019-11-12 13:01:16+00:00,1101,2612,@PublicProtector,,1194238732590878727
78,1194238730355269632,https://twitter.com/PresJGZuma/status/1194238730355269632,PresJGZuma,,"I never refused nor hid anything she wanted to investigate. Even where I personally thought she was going beyond her mandate and powers, I still obliged because I respect the office of the @PublicProtector and therefore I am not part of the contestation of my tax records.",2019-11-12 13:01:15+00:00,679,1604,@PublicProtector,,1194238730355269632
78,1194238728178413568,https://twitter.com/PresJGZuma/status/1194238728178413568,PresJGZuma,,I need to clarify that I have never refused the office of the PP access to investigate my affairs. This country knows very well that the former PP @ThuliMadonsela3 investigated me on a number of occasions and made findings against me.,2019-11-12 13:01:15+00:00,543,1122,@ThuliMadonsela3,,1194238728178413568
78,1194238717801771014,https://twitter.com/PresJGZuma/status/1194238717801771014,PresJGZuma,,"I hear that my SARS records are being contested in court by Kieswetter. No one has consulted me about this matter. Furthermore, I have been informed that the office requesting these records is the office of the @PublicProtector (PP) @AdvBMkhwebane",2019-11-12 13:01:12+00:00,1858,3878,@PublicProtector @AdvBMkhwebane,,1194238717801771014
78,1193165507928698880,https://twitter.com/PresJGZuma/status/1193165507928698880,PresJGZuma,,Thank you all for the well wishes. Your messages have been overwhelming during this difficult time.,2019-11-09 13:56:39+00:00,1082,8305,,,1193165507928698880
78,1193159523609063426,https://twitter.com/PresJGZuma/status/1193159523609063426,PresJGZuma,,Welcome home my brother @LulaOficial Aluta continua. See you soon #LulaLivre,2019-11-09 13:32:52+00:00,816,3107,@LulaOficial,#LulaLivre,1193159523609063426
78,1180776787535642624,https://twitter.com/PresJGZuma/status/1180776787535642624,PresJGZuma,,Magna est veritas et praevalebit #LulaLivre,2019-10-06 09:28:18+00:00,788,3130,,#LulaLivre,1180776787535642624
78,1160992682765950977,https://twitter.com/PresJGZuma/status/1160992682765950977,PresJGZuma,,"Kubi! Ongcwelengcwele abathi bafaka Impi yokulwa neNkohlakalo, yibo manje abamanaphanapha udaka lweNkohlakalo nobugebengu. Kazi iyozala nkomoni?",2019-08-12 19:13:20+00:00,3077,8302,,,1160992682765950977
78,1160857043315634177,https://twitter.com/PresJGZuma/status/1160857043315634177,PresJGZuma,,Webakwethu!! Kubi!Iyabhubhudl’inkezo. Iwa libheke Umoya. Sengathi bakhona abazoyikhotha imbenge yomile.,2019-08-12 10:14:21+00:00,3514,9422,,,1160857043315634177
78,1154290482211708928,https://twitter.com/PresJGZuma/status/1154290482211708928,PresJGZuma,,I’m not surprised by @Julius_S_Malema revelations regarding @Derek_Hanekom. It is part of the plan I mentioned at the Zondo Commission. @Derek_Hanekom is a known enemy agent.,2019-07-25 07:21:11+00:00,3285,7234,@Julius_S_Malema @Derek_Hanekom @Derek_Hanekom,,1154290482211708928
78,1150364378941837312,https://twitter.com/PresJGZuma/status/1150364378941837312,PresJGZuma,,I thought I should brighten up your day,2019-07-14 11:20:15+00:00,14127,41923,,,1150364378941837312
78,1149773487038488576,https://twitter.com/PresJGZuma/status/1149773487038488576,PresJGZuma,,"Lithatha osemsamo limbeke emnyango, lithathe osemnyango limbeke emsamo",2019-07-12 20:12:15+00:00,2081,6138,,,1149773487038488576
78,1147614852703240193,https://twitter.com/PresJGZuma/status/1147614852703240193,PresJGZuma,,Wonderful indeed. Congratulations Bafana Bafana,2019-07-06 21:14:37+00:00,2570,17112,,,1147614852703240193
78,1251518918658674688,https://twitter.com/DaranLittle/status/1251518918658674688,DaranLittle,GlenClancy2,"Jazz hands baby, jazz hands",2020-04-18 14:32:16+00:00,0,1,,,1251518918658674688
78,1251517578192666630,https://twitter.com/DaranLittle/status/1251517578192666630,DaranLittle,Gregs_Art,This.... I love...,2020-04-18 14:26:57+00:00,1,32,,,1251517578192666630
78,1251510926966022147,https://twitter.com/DaranLittle/status/1251510926966022147,DaranLittle,,I thought Thursday was Saturday. Yesterday I thought was Thursday. Today... who knows,2020-04-18 14:00:31+00:00,1,42,,,1251510926966022147
78,1251510234046017536,https://twitter.com/DaranLittle/status/1251510234046017536,DaranLittle,Beverleycallard,Have DMed you x,2020-04-18 13:57:46+00:00,0,2,,,1251510234046017536
78,1251510012830085121,https://twitter.com/DaranLittle/status/1251510012830085121,DaranLittle,LauriebrettX,"Sending a virtual hug, hoping something random happens today to make you laugh x",2020-04-18 13:56:53+00:00,0,2,,,1251510012830085121
78,1251222523150077954,https://twitter.com/DaranLittle/status/1251222523150077954,DaranLittle,realshanerichie,Miss you!,2020-04-17 18:54:30+00:00,0,5,,,1251222523150077954
78,1251135988019036165,https://twitter.com/DaranLittle/status/1251135988019036165,DaranLittle,realshanerichie,Made my day,2020-04-17 13:10:39+00:00,0,6,,,1251135988019036165
78,1250928478838378498,https://twitter.com/DaranLittle/status/1250928478838378498,DaranLittle,,"Listening to my neighbour’s phone conversation I’m lost for words: “yeah, I have a client coming over now, and another in an hour so I should be at yours on time and then we’ll head to the party, yeah?” I mean... seriously???",2020-04-16 23:26:05+00:00,1,39,,,1250928478838378498
78,1250859985560416257,https://twitter.com/DaranLittle/status/1250859985560416257,DaranLittle,leonlopez,I’m sure there’s a copy at the BFI!,2020-04-16 18:53:55+00:00,0,2,,,1250859985560416257
78,1250821430553407488,https://twitter.com/DaranLittle/status/1250821430553407488,DaranLittle,jonnylarkin,Everything’s shut,2020-04-16 16:20:42+00:00,1,2,,,1250821430553407488
78,1250805986761138176,https://twitter.com/DaranLittle/status/1250805986761138176,DaranLittle,,"Me, aged 20 at film school, still clinging to my New Romantic influences",2020-04-16 15:19:20+00:00,2,27,,,1250805986761138176
78,1250805048021405697,https://twitter.com/DaranLittle/status/1250805048021405697,DaranLittle,CorrieArt,"He gave such a great, measured performance as his father",2020-04-16 15:15:36+00:00,2,21,,,1250805048021405697
78,1250787550144290818,https://twitter.com/DaranLittle/status/1250787550144290818,DaranLittle,wordbobby,Many congratulations and well deserved on writing such an important and impactful book,2020-04-16 14:06:05+00:00,0,2,,,1250787550144290818
78,1250786339592667143,https://twitter.com/DaranLittle/status/1250786339592667143,DaranLittle,mustbejp,Sending virtual hug x,2020-04-16 14:01:16+00:00,0,1,,,1250786339592667143
78,1250479938936791040,https://twitter.com/DaranLittle/status/1250479938936791040,DaranLittle,jennarusselluk,one of my favs,2020-04-15 17:43:44+00:00,0,1,,,1250479938936791040
78,961170826350419968,https://twitter.com/NutritionBeck/status/961170826350419968,NutritionBeck,,"No, eating cannabis seeds won’t be getting you high http://www.news.com.au/lifestyle/health/diet/is-hemp-in-your-food-really-that-good-for-you/news-story/aacda1b90bd53063a38338fc8d4c3856#sharehash via @newscomauHQ",2018-02-07 09:32:37+00:00,0,1,@newscomauHQ,,961170826350419968
78,953511901123588096,https://twitter.com/NutritionBeck/status/953511901123588096,NutritionBeck,,"Ok, completely self-gratuitous post but completely thrilled (and more than a little bit stunned)… https://www.instagram.com/p/BeCk3okl5QT/",2018-01-17 06:18:47+00:00,0,0,,,953511901123588096
78,949829169218699265,https://twitter.com/NutritionBeck/status/949829169218699265,NutritionBeck,,"Head over to http://News.com.au today to read my comments on the best and worst diets of 2018 From KETO to DASH, these are the best and worst diets of 2018 http://www.news.com.au/lifestyle/health/diet/the-best-and-worst-diets-according-to-experts-revealed/news-story/ccffccfbb9efa22ba2e9b7bc8f7cbf24#sharehash via @newscomauHQ",2018-01-07 02:24:55+00:00,0,0,@newscomauHQ,,949829169218699265
78,947760933631172608,https://twitter.com/NutritionBeck/status/947760933631172608,NutritionBeck,,Happy New Year! Hope you had a great night last night. If you’re still suffering from a hangover… https://www.instagram.com/p/BdZtoeIlWxX/,2018-01-01 09:26:29+00:00,0,0,,,947760933631172608
78,945770778359926785,https://twitter.com/NutritionBeck/status/945770778359926785,NutritionBeck,,With the longer days and balmy nights calling for afternoon drinks almost every day in the lead… https://www.instagram.com/p/BdLknJOlBUb/,2017-12-26 21:38:19+00:00,0,0,,,945770778359926785
78,944381224721747970,https://twitter.com/NutritionBeck/status/944381224721747970,NutritionBeck,,"Sorry - ultimate kill-joy, but here’s an article featuring “expert” comments from yours truly… https://www.instagram.com/p/BdBstulFPkf/",2017-12-23 01:36:44+00:00,0,0,,,944381224721747970
78,821935123100672001,https://twitter.com/NutritionBeck/status/821935123100672001,NutritionBeck,,You’ll never guess how much of the jar is sugar compared to cocoa http://www.news.com.au/lifestyle/food/eat/reddit-image-claims-to-identify-exactly-what-ingredients-goes-into-a-jar-of-nutella/news-story/3bf3f47750cd1c72c5f43fad4e4d377f via @newscomauHQ,2017-01-19 04:19:38+00:00,2,0,@newscomauHQ,,821935123100672001
78,796212400802435073,https://twitter.com/NutritionBeck/status/796212400802435073,NutritionBeck,,@womenshealthaus December 2016 - The Naked Issue - I'm in this issue ..... but luckily for you… https://www.instagram.com/p/BMk5V9Hjo2T/,2016-11-09 04:46:43+00:00,0,0,@womenshealthaus,,796212400802435073
78,795796020076707840,https://twitter.com/NutritionBeck/status/795796020076707840,NutritionBeck,,Stressed-out rats drink more alcohol. A new study from University of Pennsylvania has found that… https://www.instagram.com/p/BMh7_sYjtfb/,2016-11-08 01:12:11+00:00,0,5,,,795796020076707840
78,795123027587567616,https://twitter.com/NutritionBeck/status/795123027587567616,NutritionBeck,,Sunshine matters. A lot. According to a new study from Brigham Young University looking at… https://www.instagram.com/p/BMdJ9Dkg32Q/,2016-11-06 04:37:57+00:00,0,1,,,795123027587567616
78,793599086263832576,https://twitter.com/NutritionBeck/status/793599086263832576,NutritionBeck,,Essays on health: how food companies can sneak bias into scientific research http://theconversation.com/essays-on-health-how-food-companies-can-sneak-bias-into-scientific-research-65873 via @ConversationEDU,2016-11-01 23:42:21+00:00,0,0,@ConversationEDU,,793599086263832576
78,760294766575755264,https://twitter.com/NutritionBeck/status/760294766575755264,NutritionBeck,,Check out the brand-spanking new edition of Women's Health Magazine @womenshealthaus with the… https://www.instagram.com/p/BIlr5ROgnqh/,2016-08-02 02:02:52+00:00,0,5,@womenshealthaus,,760294766575755264
