age,id,permalink,username,to,text,date,retweets,favorites,mentions,hashtags,geo,,,,
87,1.24985821750237E+018,https://twitter.com/QuincyDJones/status/1249858217502371840,QuincyDJones,chloexhalle,"Big-time props to my baby sis from anotha miss, @SheleaMusic, who played the role of Dorinda!!",2020-04-14 00:33:14+00:00,15,118,@SheleaMusic,,1.24985821750237E+018,,,,
87,1.24922127309737E+018,https://twitter.com/QuincyDJones/status/1249221273097367552,QuincyDJones,,"Executive Produced by my esteemed sistas @IAMQUEENLATIFAH @maryjblige &amp; @MissyElliott, and starring our very own @SheleaMusic as @DorindaTheRose, don’t miss #theclarksistersmovie on @lifetimetv ",2020-04-12 06:22:15+00:00,32,156,@IAMQUEENLATIFAH @maryjblige @MissyElliott @SheleaMusic @DorindaTheRose @lifetimetv,#theclarksistersmovie,1.24922127309737E+018,,,,
87,1.24914388465711E+018,https://twitter.com/QuincyDJones/status/1249143884657106945,QuincyDJones,lifetimetv,Starring our very own @SheleaMusic as the incredible @DorindaTheRose - premieres tonight on @lifetimetv! ,2020-04-12 01:14:44+00:00,14,68,@SheleaMusic @DorindaTheRose @lifetimetv,,1.24914388465711E+018,,,,
87,1.24792183043996E+018,https://twitter.com/QuincyDJones/status/1247921830439964674,QuincyDJones,EliTeplin,"Absolutely beautiful my brother, @EliTeplin. Sending &amp; thanks to all-a-y’awl out there risking your lives for ours. Some very special people in this video to me &amp; I don’t know what I’d do without ‘em ",2020-04-08 16:18:44+00:00,11,68,@EliTeplin,,1.24792183043996E+018,,,,
87,1.24766282720191E+018,https://twitter.com/QuincyDJones/status/1247662827201908736,QuincyDJones,donaldglover,"Thank-Q my brother, @donaldglover ...We meant it back in ‘89 &amp; still mean it today...”Now is the time to have faith in us all” ...Stay safe out there.",2020-04-07 23:09:33+00:00,60,800,@donaldglover,,1.24766282720191E+018,,,,
87,1.24629685725012E+018,https://twitter.com/QuincyDJones/status/1246296857250115584,QuincyDJones,,My brothers...No words...,2020-04-04 04:41:40+00:00,638,2153,,,1.24629685725012E+018,,,,
87,1.24446824533302E+018,https://twitter.com/QuincyDJones/status/1244468245333020672,QuincyDJones,,"Even though we were the same age, Polish composer Krzysztof Penderecki was one of my biggest inspirations of all time & it absolutely breaks my heart to hear about his passing... 2018 marked both of our http://bit.ly/2JqzOMg",2020-03-30 03:35:25+00:00,59,348,,,1.24446824533302E+018,,,,
87,1.24253908892366E+018,https://twitter.com/QuincyDJones/status/1242539088923656193,QuincyDJones,,...it absolutely breaks my heart to hear about this tremendous loss. Soul Makossa my brother!!…Thank U for your music & your light.,2020-03-24 19:49:38+00:00,220,485,,,1.24253908892366E+018,,,,
87,1.24253900504175E+018,https://twitter.com/QuincyDJones/status/1242539005041754112,QuincyDJones,,"I first crossed paths w/ the great Manu Dibango in Paris back in the 50’s & had the great honor of seeing him 1 last time this past summer when he came backstage after my concert (also in Paris)…His contributions to music as we know it today are unparalleled, &...",2020-03-24 19:49:18+00:00,869,1808,,,1.24253900504175E+018,,,,
87,1.24180757764354E+018,https://twitter.com/QuincyDJones/status/1241807577643540480,QuincyDJones,,"My sweet Pie, Kidada...Happy Happy Bday baby!!....I love U with all of my heart AND soul. Thank you for sharing your heart with us through your book, “@schoolofawake”, &amp; also through your everyday life. You’re a treasure to us all &amp; dontchu forget it!!...xxoo",2020-03-22 19:22:52+00:00,25,184,@schoolofawake,,1.24180757764354E+018,,,,
87,1.24119684554558E+018,https://twitter.com/QuincyDJones/status/1241196845545578496,QuincyDJones,,"7pm? @trvisXX who throws a party that early???...Anyway...not sure what I walked into, but thank-q for the sandwich. : @samlecca “Out West” ",2020-03-21 02:56:02+00:00,25,92,@trvisXX @samlecca,,1.24119684554558E+018,,,,
87,1.23923202196616E+018,https://twitter.com/QuincyDJones/status/1239232021966159872,QuincyDJones,,"It’s weird to turn 87 feelin’ like I’m 35! Who knew what no alcohol & treating your body well could do?! Let’s take care of what we have while we have it & spread instead of hate, especially during times (like this one!) that test our humanity. Thank-Q all for the bday wishes!",2020-03-15 16:48:32+00:00,458,4008,,,1.23923202196616E+018,,,,
87,1.23714250715616E+018,https://twitter.com/QuincyDJones/status/1237142507156156416,QuincyDJones,,“A ‘FIRST’ for a NEGRO in the recording industry.” We’ve come a long way...but don’t get comfy! Still got work to do...,2020-03-09 22:25:33+00:00,155,806,,,1.23714250715616E+018,,,,
87,1.23099621268736E+018,https://twitter.com/QuincyDJones/status/1230996212687360000,QuincyDJones,,RIP Clark Terry. I cannot believe it’s been 5 years since you left us. Miss and love you every day #keeponkeepinon,2020-02-21 23:22:22+00:00,27,142,,#keeponkeepinon,1.23099621268736E+018,,,,
87,1.22703679678716E+018,https://twitter.com/QuincyDJones/status/1227036796787163136,QuincyDJones,,"2/4…he not only took the time to learn & write lyrics about my life, but the lives of my mentors, & the experiences that shaped me into who I am...He studied the HISTORY, & that caught my ear because so many people (both young & old) are forgetting what came before them...",2020-02-11 01:09:04+00:00,5,9,,,1.22703679678716E+018,,,,
87,1.25336815057126E+018,https://twitter.com/yokoono/status/1253368150571261953,yokoono,,"They say that the dream you remember after you wake up, is a message to you.",2020-04-23 17:00:28+00:00,1515,6154,,,1.25336815057126E+018,,,,
87,1.25300570490404E+018,https://twitter.com/yokoono/status/1253005704904036353,yokoono,,Love can save the world. Keep changing negative energy into the positive energy using love.,2020-04-22 17:00:14+00:00,1842,5781,,,1.25300570490404E+018,,,,
87,1.25264339877276E+018,https://twitter.com/yokoono/status/1252643398772760591,yokoono,,"If you don't forgive, your health will be harmed. So, if anything, forgive for your sake.",2020-04-21 17:00:33+00:00,2027,7358,,,1.25264339877276E+018,,,,
87,1.25228099009083E+018,https://twitter.com/yokoono/status/1252280990090833921,yokoono,,Peace is not in a very distant future. It's right around the corner. Didn't you know?,2020-04-20 17:00:28+00:00,838,3865,,,1.25228099009083E+018,,,,
87,1.25191851756744E+018,https://twitter.com/yokoono/status/1251918517567438848,yokoono,,"We should have deep sympathy for all lives on earth. That includes men of our race, as well. But don't live a life you don't enjoy.",2020-04-19 17:00:08+00:00,499,2426,,,1.25191851756744E+018,,,,
87,1.25155617115835E+018,https://twitter.com/yokoono/status/1251556171158347777,yokoono,,Let's heal the world together.,2020-04-18 17:00:18+00:00,2191,7780,,,1.25155617115835E+018,,,,
87,1.25119370620565E+018,https://twitter.com/yokoono/status/1251193706205646848,yokoono,,"Make the world a better place by being your natural self - no lies, no hate, only love.",2020-04-17 17:00:00+00:00,2359,7190,,,1.25119370620565E+018,,,,
87,1.25083152510663E+018,https://twitter.com/yokoono/status/1250831525106630663,yokoono,,Be true to yourself. Life is as long as you make it. I want my sisters to remember that. Be patient with yourself and others.,2020-04-16 17:00:49+00:00,962,3706,,,1.25083152510663E+018,,,,
87,1.25046896927596E+018,https://twitter.com/yokoono/status/1250468969275961345,yokoono,,"Keep mending, keep healing, keep creating goodness. That's what the world needs now.",2020-04-15 17:00:09+00:00,2264,6577,,,1.25046896927596E+018,,,,
87,1.25010659086421E+018,https://twitter.com/yokoono/status/1250106590864211970,yokoono,,Be creative during your normal day and make yourself proud of yourself.,2020-04-14 17:00:11+00:00,1486,5624,,,1.25010659086421E+018,,,,
87,1.24974442686967E+018,https://twitter.com/yokoono/status/1249744426869669891,yokoono,,We have to spread peace. Start seeing all of us smiling together.,2020-04-13 17:01:05+00:00,913,3822,,,1.24974442686967E+018,,,,
87,1.24938183574811E+018,https://twitter.com/yokoono/status/1249381835748114433,yokoono,,Everything you think and do affects our society. So think peace. Start with that.,2020-04-12 17:00:16+00:00,1732,6773,,,1.24938183574811E+018,,,,
87,1.24901949331515E+018,https://twitter.com/yokoono/status/1249019493315153922,yokoono,,"I give thanks every day how wonderful it is to be still breathing. And you should, too.",2020-04-11 17:00:27+00:00,2336,8809,,,1.24901949331515E+018,,,,
87,1.2489932965983E+018,https://twitter.com/yokoono/status/1248993296598302721,yokoono,,,2020-04-11 15:16:21+00:00,177,1188,,,1.2489932965983E+018,,,,
87,1.24865711679521E+018,https://twitter.com/yokoono/status/1248657116795211778,yokoono,,Start with feeling love for the problem. You will then know what step you wish to take.,2020-04-10 17:00:30+00:00,858,3956,,,1.24865711679521E+018,,,,
87,1.11012394055761E+018,https://twitter.com/lordofrocknroll/status/1110123940557611008,lordofrocknroll,,RIP @ScottWalker,2019-03-25 10:19:07+00:00,0,1,@ScottWalker,,1.11012394055761E+018,,,,
87,1.1073433745694E+018,https://twitter.com/lordofrocknroll/status/1107343374569402369,lordofrocknroll,,"Oh, Rock'n'Roll, I gave you all the best years of my life",2019-03-17 18:10:08+00:00,1,8,,,1.1073433745694E+018,,,,
87,1.10509388752005E+018,https://twitter.com/lordofrocknroll/status/1105093887520051200,lordofrocknroll,,"This is just 59p you lovely people, @thebeatles once asked for my autograph yet I've never had a Top 40 hit, I'd love to see it happen https://itunes.apple.com/gb/album/got-a-match/996635071?i=996635330",2019-03-11 13:11:29+00:00,9,16,@thebeatles,,1.10509388752005E+018,,,,
87,1.09569093117141E+018,https://twitter.com/lordofrocknroll/status/1095690931171405824,lordofrocknroll,,https://www.youtube.com/watch?v=iq5eHAdv62c,2019-02-13 14:27:29+00:00,0,3,,,1.09569093117141E+018,,,,
87,1.06699630447006E+018,https://twitter.com/lordofrocknroll/status/1066996304470056960,lordofrocknroll,,,2018-11-26 10:05:17+00:00,0,2,,,1.06699630447006E+018,,,,
87,1.06699613726826E+018,https://twitter.com/lordofrocknroll/status/1066996137268260865,lordofrocknroll,,,2018-11-26 10:04:37+00:00,0,3,,,1.06699613726826E+018,,,,
87,1.05720377895962E+018,https://twitter.com/lordofrocknroll/status/1057203778959618049,lordofrocknroll,MrAlfredGarnett,"Times have changed Mr Garnett, we live in a time where people are searching for something to be offended about, where the music industry is run by Simon Cowell, footballers get paid more for getting stuck in less and the best telly is on UK Gold",2018-10-30 09:33:17+00:00,6,24,,,1.05720377895962E+018,,,,
87,1.04165217981009E+018,https://twitter.com/lordofrocknroll/status/1041652179810086913,lordofrocknroll,,https://www.youtube.com/watch?v=GXZ3KteMsYY,2018-09-17 11:36:47+00:00,0,3,,,1.04165217981009E+018,,,,
87,1.04165120890417E+018,https://twitter.com/lordofrocknroll/status/1041651208904171521,lordofrocknroll,,I reckon @paulwellerHQ could learn a thing or two from me,2018-09-17 11:32:55+00:00,0,2,@paulwellerHQ,,1.04165120890417E+018,,,,
87,1.04165023351038E+018,https://twitter.com/lordofrocknroll/status/1041650233510383616,lordofrocknroll,,Best of Wee Willie Harris Out NOW,2018-09-17 11:29:03+00:00,3,11,,,1.04165023351038E+018,,,,
87,1.04164874039687E+018,https://twitter.com/lordofrocknroll/status/1041648740396871685,lordofrocknroll,,Every time someone buys a copy of this book @piersmorgan gets a kick in the balls https://www.amazon.co.uk/APE-Wee-Willie-Harris-Story/dp/0957446225/ref=sr_1_1?s=books&amp,ie=UTF8&amp,qid=1537183246&amp,sr=1-1&amp,keywords=wee+willie+harris,2018-09-17 11:23:07+00:00,0,1,@piersmorgan,,1.04164874039687E+018
87,1.02100744290846E+018,https://twitter.com/lordofrocknroll/status/1021007442908459008,lordofrocknroll,Parky1919,"I recently was told that Percy is not Goddard but actually a young, unknown pretender",2018-07-22 12:21:58+00:00,0,0,,,1.02100744290846E+018,,,,
87,1.0198872275712E+018,https://twitter.com/lordofrocknroll/status/1019887227571200000,lordofrocknroll,LongLiveLocals,The solution is so simple it's frustrating - make beer cheaper in pubs and more expensive in supermarkets/corner shops or only sell it in pubs. Pubs are dying and it makes me unbelievably sad,2018-07-19 10:10:38+00:00,1,2,,,1.0198872275712E+018,,,,
87,1.01604321557994E+018,https://twitter.com/lordofrocknroll/status/1016043215579942913,lordofrocknroll,,,2018-07-08 19:35:54+00:00,0,1,,,1.01604321557994E+018,,,,
87,1.01604302993167E+018,https://twitter.com/lordofrocknroll/status/1016043029931667456,lordofrocknroll,,,2018-07-08 19:35:10+00:00,0,0,,,1.01604302993167E+018,,,,
87,1.22156415478136E+018,https://twitter.com/themichaelcaine/status/1221564154781360131,themichaelcaine,,1917 Best War Movie,2020-01-26 22:42:44+00:00,1151,7906,,,1.22156415478136E+018,,,,
87,1.20567544079231E+018,https://twitter.com/themichaelcaine/status/1205675440792309760,themichaelcaine,,Thank you to everyone who voted. Looking forward to a great 2020,2019-12-14 02:26:40+00:00,1885,11480,,,1.20567544079231E+018,,,,
87,1.2049092732827E+018,https://twitter.com/themichaelcaine/status/1204909273282699265,themichaelcaine,,Please Vote tomorrow.,2019-12-11 23:42:11+00:00,200,1637,,,1.2049092732827E+018,,,,
87,1.20202693562012E+018,https://twitter.com/themichaelcaine/status/1202026935620116480,themichaelcaine,,"Love my work, so great to continue after 100 years.",2019-12-04 00:48:48+00:00,264,3193,,,1.20202693562012E+018,,,,
87,1.20012087582939E+018,https://twitter.com/themichaelcaine/status/1200120875829387264,themichaelcaine,,Happy Thanksgiving. Peace Health and most of all Love.,2019-11-28 18:34:48+00:00,136,1450,,,1.20012087582939E+018,,,,
87,1.19982007255188E+018,https://twitter.com/themichaelcaine/status/1199820072551882753,themichaelcaine,,Christmas Carol Service for http://hospice.uk on 17th December St. Luke’s Sydney Street SW3,2019-11-27 22:39:31+00:00,24,264,,,1.19982007255188E+018,,,,
87,1.19971762532619E+018,https://twitter.com/themichaelcaine/status/1199717625326186496,themichaelcaine,,"Sprinkle some festive spirit on to a winter’s evening and join Fiona Dolman, Alison Steadman OBE, Oscar-winning actor Jim Broadbent and Sir Martyn Lewis on 17 December for @hospiceuk Christmas Carol Service: http://www.hospiceuk.org/carolservice",2019-11-27 15:52:26+00:00,40,188,@hospiceuk,,1.19971762532619E+018,,,,
87,1.19696775635422E+018,https://twitter.com/themichaelcaine/status/1196967756354215942,themichaelcaine,,Working with my friend Cassian Elwes @cassianelwes,2019-11-20 01:45:26+00:00,16,184,@cassianelwes,,1.19696775635422E+018,,,,
87,1.19613924668544E+018,https://twitter.com/themichaelcaine/status/1196139246685437953,themichaelcaine,,"My friend Terry O’Neill was one of the greatest photographer, he will be missed by everyone who were lucky to know and love him.",2019-11-17 18:53:14+00:00,84,957,,,1.19613924668544E+018,,,,
87,1.18596844163268E+018,https://twitter.com/themichaelcaine/status/1185968441632677889,themichaelcaine,,A great day working with my friends.,2019-10-20 17:18:05+00:00,130,1792,,,1.18596844163268E+018,,,,
87,1.15545586511099E+018,https://twitter.com/themichaelcaine/status/1155455865110986760,themichaelcaine,,"My biggest single piece of advice to anyone wanting to make a good impression, or feeling they have to perform in some way – would be this: be real. Don’t act. Don’t perform. Less is more. 50 years since The Italian Job keep #BlowingtheBloodyDoorsOff http://fal.cn/32WVB",2019-07-28 12:32:00+00:00,294,1726,,#BlowingtheBloodyDoorsOff,1.15545586511099E+018,,,,
87,1.15290379928521E+018,https://twitter.com/themichaelcaine/status/1152903799285211136,themichaelcaine,,"However full of stars a team is – a movie team, a football team – if those stars are too full of their own importance they are going to get beaten. 50 years since The Italian Job keep #BlowingtheBloodyDoorsOff http://fal.cn/32WVB",2019-07-21 11:31:00+00:00,149,1053,,#BlowingtheBloodyDoorsOff,1.15290379928521E+018,,,,
87,1.10732792945591E+018,https://twitter.com/themichaelcaine/status/1107327929455906819,themichaelcaine,,Food comes attached to such precious memories with our loved ones. @HospiceUK. Hold your own #TasteofHome event too. Here’s how: http://www.hospiceuk.org/taste-of-home or donate http://www.hospiceuk.org/open-up #OpenUpHospiceCare,2019-03-17 17:08:46+00:00,51,289,@hospiceuk,#TasteofHome #OpenUpHospiceCare,1.10732792945591E+018,,,,
87,1.10622673344604E+018,https://twitter.com/themichaelcaine/status/1106226733446037504,themichaelcaine,,Thank you for all your good wishes today. Will continue to Blow the Bloody Doors Off!,2019-03-14 16:13:00+00:00,1993,20595,,,1.10622673344604E+018,,,,
87,1.09972055857138E+018,https://twitter.com/themichaelcaine/status/1099720558571384833,themichaelcaine,,Hope you are enjoying these beautiful Spring days in London.,2019-02-24 17:19:47+00:00,164,2770,,,1.09972055857138E+018,,,,
87,1.25223905468862E+018,https://twitter.com/Chita_Rivera/status/1252239054688616448,Chita_Rivera,PRMerleF,So looking forward to this on Saturday....,2020-04-20 14:13:50+00:00,11,29,,,1.25223905468862E+018,,,,
87,1.25223823543611E+018,https://twitter.com/Chita_Rivera/status/1252238235436105730,Chita_Rivera,StarsInTheHouse,Thank you @SethRudetsky @JamesWesleyNYC soooo much for last night. So much fun! Special thanks to @VegasPhan for the surprise &amp, song. S,2020-04-20 14:10:35+00:00,3,13,@SethRudetsky @JamesWesleyNYC @VegasPhan,,1.25223823543611E+018,,,
87,1.25150069613604E+018,https://twitter.com/Chita_Rivera/status/1251500696136036353,Chita_Rivera,PRMerleF,Can't wait! ,2020-04-18 13:19:52+00:00,4,32,,,1.25150069613604E+018,,,,
87,1.2425594413855E+018,https://twitter.com/Chita_Rivera/status/1242559441385504773,Chita_Rivera,,A huge part of me is gone. But then it’s not. Terrence wouldn’t like that. He helped to make me who I am as a person. He is the epitome of love and friendship. Only God knows how much I will miss him. ,2020-03-24 21:10:31+00:00,92,1125,,,1.2425594413855E+018,,,,
87,1.24188115328133E+018,https://twitter.com/Chita_Rivera/status/1241881153281327106,Chita_Rivera,broadwaycom,Please donate now to http://www.give.actorsfund.org/Rosie My thanks to all especially @Rosie Be safe everyone,2020-03-23 00:15:14+00:00,26,236,@Rosie,,1.24188115328133E+018,,,,
87,1.24178534763532E+018,https://twitter.com/Chita_Rivera/status/1241785347635322881,Chita_Rivera,PRMerleF,Join us all tonight at 7PM ET/4 PM PT and please support @TheActorsFund now. ,2020-03-22 17:54:32+00:00,5,33,@TheActorsFund,,1.24178534763532E+018,,,,
87,1.2214987305763E+018,https://twitter.com/Chita_Rivera/status/1221498730576302081,Chita_Rivera,,"My thanks to everyone for the wonderful birthday wishes ! Wishing you all a happy, healthy and peaceful new year! ",2020-01-26 18:22:46+00:00,4,83,,,1.2214987305763E+018,,,,
87,1.21679433126633E+018,https://twitter.com/Chita_Rivera/status/1216794331266326529,Chita_Rivera,PRMerleF,Thank you @BroadwayWorld and to everyone who voted. Special thanks to my daughter Lisa and my amazing trio! ,2020-01-13 18:49:10+00:00,3,96,@BroadwayWorld,,1.21679433126633E+018,,,,
87,1.21066333466138E+018,https://twitter.com/Chita_Rivera/status/1210663334661382144,Chita_Rivera,,I'm heartbroken hearing of #JerryHerman's passing. He's gone to light the heavens for us as he did on earth. Honored to perform songs from his shows in #JerrysGirls on #Broadway &amp, sing for him @kencen Honors. His strong spirit will be with me forever. ,2019-12-27 20:46:46+00:00,40,398,@kencen,#JerryHerman #JerrysGirls #Broadway,1.21066333466138E+018,,,
87,1.19246311604032E+018,https://twitter.com/Chita_Rivera/status/1192463116040314880,Chita_Rivera,PRMerleF, ,2019-11-07 15:25:36+00:00,0,13,,,1.19246311604032E+018,,,,
87,1.19246272914094E+018,https://twitter.com/Chita_Rivera/status/1192462729140940801,Chita_Rivera,PRMerleF,.@StevieVanZandt You and your band blew me away! ,2019-11-07 15:24:04+00:00,3,9,@StevieVanZandt,,1.19246272914094E+018,,,,
87,1.19219031444807E+018,https://twitter.com/Chita_Rivera/status/1192190314448068608,Chita_Rivera,,This Sun. 11/10 is the #WorldPremiere of @MauriceHinesMov an intimate portrait of my friend from his #TapDancing childhood to today. For tix https://bit.ly/2oSz2AP Not to be missed! #Broadway #dancers,2019-11-06 21:21:35+00:00,3,9,@MauriceHinesMov,#WorldPremiere #TapDancing #Broadway #dancers,1.19219031444807E+018,,,,
87,1.18952550913638E+018,https://twitter.com/Chita_Rivera/status/1189525509136375808,Chita_Rivera,PRMerleF,We're gonna have a ball! see you there!,2019-10-30 12:52:36+00:00,5,27,,,1.18952550913638E+018,,,,
87,1.18481790522299E+018,https://twitter.com/Chita_Rivera/status/1184817905222987778,Chita_Rivera,PRMerleF,We had a fabulous 7 shows! Such wonderful audiences every single nite! Thx to everyone @54Below for a wonderful engagement. See ya next time!,2019-10-17 13:06:16+00:00,1,48,@54Below,,1.18481790522299E+018,,,,
87,1.1819307299719E+018,https://twitter.com/Chita_Rivera/status/1181930729971896320,Chita_Rivera,PRMerleF,"Thanks @StevieVanZandt @MVZaGoGo @BenVereen for being there last night. Lisa and I will be back @54Below Oct 10, 11, 12, 13, 15, 16.",2019-10-09 13:53:39+00:00,6,31,@StevieVanZandt @MVZaGoGo @BenVereen @54Below,,1.1819307299719E+018,,,,
