age,id,permalink,username,to,text,date,retweets,favorites,mentions,hashtags,geo
92,1253511758859419650,https://twitter.com/CBSNewsRadio/status/1253511758859419650,CBSNewsRadio,,Congress has passed a new relief bill to help the buckling economy. Listen: http://bit.ly/cbsnewscast,2020-04-24 02:31:07+00:00,0,0,,,1253511758859419650
92,1253415139262357505,https://twitter.com/CBSNewsRadio/status/1253415139262357505,CBSNewsRadio,,House to vote on coronavirus relief package. Listen: http://bit.ly/cbsnewscast,2020-04-23 20:07:11+00:00,0,1,,,1253415139262357505
92,1253403507518046208,https://twitter.com/CBSNewsRadio/status/1253403507518046208,CBSNewsRadio,,".@CBSNews Chief Washington Correspondent @MajorCBS is hosting a @reddit #AskMajorAnything 'til 4 pm EST! Join us to discuss his work, @TakeoutPodcast &amp; @CBSDebriefing, &amp; more: https://bit.ly/3eKoXLw Major on covering the White House and several presidential administrations ",2020-04-23 19:20:57+00:00,3,2,@CBSNews @MajorCBS @reddit @TakeoutPodcast @CBSDebriefing,#AskMajorAnything,1253403507518046208
92,1253396298675425286,https://twitter.com/CBSNewsRadio/status/1253396298675425286,CBSNewsRadio,,".@CBSNews Chief Washington Correspondent @MajorCBS is hosting a @reddit #AskMajorAnything 'til 4 pm EST! Join us to discuss his work, @TakeoutPodcast &amp; @CBSDebriefing , &amp; more: https://bit.ly/3eKoXLw Major on asking his first-ever question during a live presidential presser ",2020-04-23 18:52:19+00:00,3,3,@CBSNews @MajorCBS @reddit @TakeoutPodcast @CBSDebriefing,#AskMajorAnything,1253396298675425286
92,1253393080969039873,https://twitter.com/CBSNewsRadio/status/1253393080969039873,CBSNewsRadio,,"A much-needed story of recovery during the coronavirus pandemic. ""Reporter's Notebook"" anchor @DavidBegnaud has the details. Listen: http://bit.ly/2x7EK6c",2020-04-23 18:39:32+00:00,2,9,@DavidBegnaud,,1253393080969039873
92,1253390771274887176,https://twitter.com/CBSNewsRadio/status/1253390771274887176,CBSNewsRadio,,".@CBSNews Chief Washington Correspondent @MajorCBS is hosting a @reddit #AskMajorAnything 'til 4 pm EST! Join us to discuss his work, @TakeoutPodcast &amp; @CBSDebriefing, &amp; more: https://bit.ly/3eKoXLw His thoughts on being a @Padres fan &amp; if San Diego is a cursed sports town ",2020-04-23 18:30:21+00:00,12,23,@CBSNews @MajorCBS @reddit @TakeoutPodcast @CBSDebriefing @Padres,#AskMajorAnything,1253390771274887176
92,1253385630970716161,https://twitter.com/CBSNewsRadio/status/1253385630970716161,CBSNewsRadio,,Another 4.4 million filed for unemployment benefits last week. Listen: http://bit.ly/cbsnewscast,2020-04-23 18:09:55+00:00,1,1,,,1253385630970716161
92,1253384681481011206,https://twitter.com/CBSNewsRadio/status/1253384681481011206,CBSNewsRadio,,"NOW: @CBSNews Chief Washington Correspondent @MajorCBS is hosting a @reddit #AskMajorAnything until 4pm E.T. On working in news, the @Padres, his podcasts @TakeoutPodcast &amp; @CBSDebriefing, and more! Join us: https://bit.ly/3eKoXLw",2020-04-23 18:06:09+00:00,11,17,@CBSNews @MajorCBS @reddit @Padres @TakeoutPodcast @CBSDebriefing,#AskMajorAnything,1253384681481011206
92,1253378517007564800,https://twitter.com/CBSNewsRadio/status/1253378517007564800,CBSNewsRadio,,Deadly tornadoes in the South. Listen: http://bit.ly/cbsnewscast,2020-04-23 17:41:39+00:00,0,0,,,1253378517007564800
92,1253339612363149317,https://twitter.com/CBSNewsRadio/status/1253339612363149317,CBSNewsRadio,,House set to pass more small business aid. Listen: http://bit.ly/cbsnewscast,2020-04-23 15:07:04+00:00,0,0,,,1253339612363149317
92,1253332044735639552,https://twitter.com/CBSNewsRadio/status/1253332044735639552,CBSNewsRadio,,More than four million Americans filed first-time jobless claims last week. Listen: http://bit.ly/cbsnewscast,2020-04-23 14:36:59+00:00,1,1,,,1253332044735639552
92,1253292551110643712,https://twitter.com/CBSNewsRadio/status/1253292551110643712,CBSNewsRadio,,A new CBS News poll shows more Americans are worried about the health risks of reopening businesses too soon than the economic impact of the pandemic. Listen: http://bit.ly/cbsnewscast,2020-04-23 12:00:03+00:00,1,0,,,1253292551110643712
92,1253277590913155075,https://twitter.com/CBSNewsRadio/status/1253277590913155075,CBSNewsRadio,,President Trump is at odds with Georgia's governor over its aggressive plans to ease coronavirus restrictions. Listen: http://bit.ly/cbsnewscast,2020-04-23 11:00:37+00:00,1,1,,,1253277590913155075
92,1253262529058541569,https://twitter.com/CBSNewsRadio/status/1253262529058541569,CBSNewsRadio,,At least six people are killed in powerful storms in the central US. Listen: http://bit.ly/cbsnewscast,2020-04-23 10:00:46+00:00,0,0,,,1253262529058541569
92,1253247414754062341,https://twitter.com/CBSNewsRadio/status/1253247414754062341,CBSNewsRadio,,The doctor who led the federal agency developing a vaccine for the virus claims he was booted after questioning the use of a drug promoted by the president. Listen: http://bit.ly/cbsnewscast,2020-04-23 09:00:42+00:00,1,1,,,1253247414754062341
92,1253457814112079874,https://twitter.com/7eleven/status/1253457814112079874,7eleven,bonsignore_j,Hi Danilo! Thank you for reaching out to us regarding this matter. 7-Eleven is actively working to keep stores safe and stocked for our customers. Kindly send us a DM with more information.,2020-04-23 22:56:45+00:00,0,0,,,1253457814112079874
92,1253422913648091136,https://twitter.com/7eleven/status/1253422913648091136,7eleven,BrownBoston4809,"Thank you! We've made sure to forward the info/feedback provided to the appropriate team(s)! Additionally, learn more about 7-Eleven's enhanced safety & cleanliness efforts here: http://spr.ly/60101NFSn",2020-04-23 20:38:04+00:00,0,0,,,1253422913648091136
92,1253394551676469250,https://twitter.com/7eleven/status/1253394551676469250,7eleven,luccatavares,"Hi Lucca! We appreciate your feedback & will make sure this gets to the appropriate team. While the seasonal 7Rewards $1 coffee offer has ended as the weather warms up, the $0.69 cent Big Gulp summer promotion has begun! Mind providing w/ your 7Rewards member ID via DM's? Thanks! https://twitter.com/messages/compose?recipient_id=80102659",2020-04-23 18:45:22+00:00,0,0,,,1253394551676469250
92,1253389000829800450,https://twitter.com/7eleven/status/1253389000829800450,7eleven,ABanmoria,"Thanks, Avtar! ",2020-04-23 18:23:19+00:00,0,1,,,1253389000829800450
92,1253387792232648704,https://twitter.com/7eleven/status/1253387792232648704,7eleven,emmmahub,Happy to hear you love #7NOW as much as we do! ,2020-04-23 18:18:31+00:00,0,1,,#7NOW,1253387792232648704
92,1253360486286049286,https://twitter.com/7eleven/status/1253360486286049286,7eleven,,Want that Employee of the Month award while you’re sitting on the couch? Tip: Let the boss know about free #7NOW delivery until 4/30 with code “FREE4U”. You can thank us later #Delivery #OnlyAt7Eleven,2020-04-23 16:30:00+00:00,3,16,,#7NOW #Delivery #OnlyAt7Eleven,1253360486286049286
92,1253358507765702663,https://twitter.com/7eleven/status/1253358507765702663,7eleven,Mutrica87,"Thank you for reaching out to us regarding this urgent matter. 7-Eleven is committed to providing quality products at fair, honest prices. Any violations of federal, state, and local price-gouging laws will not be tolerated. Kindly send us a DM with more information. https://twitter.com/messages/compose?recipient_id=80102659",2020-04-23 16:22:09+00:00,0,1,,,1253358507765702663
92,1253346896095129603,https://twitter.com/7eleven/status/1253346896095129603,7eleven,Jenny20061988,"Saludos Jenny! Gracias por tus comentarios. Vemos que nos contacta desde fuera de los EE. UU. Dirígete al Facebook de 7-Eleven México, http://spr.ly/60101NaXM, o Twitter, http://spr.ly/60131NaXP, para obtener más ayuda con respecto a la información que nos presentastes. Gracias!",2020-04-23 15:36:00+00:00,0,0,,,1253346896095129603
92,1253344386861223936,https://twitter.com/7eleven/status/1253344386861223936,7eleven,jean_diamond,"We're sorry to hear about this experience. Would you be able to send us a private message, so we can look into this further? Thank you.",2020-04-23 15:26:02+00:00,0,0,,,1253344386861223936
92,1253333972492271616,https://twitter.com/7eleven/status/1253333972492271616,7eleven,BrownBoston4809,"We're sorry to hear about this experience. Would you be able to send us a private message, so we can look into this further? Thank you.",2020-04-23 14:44:39+00:00,0,0,,,1253333972492271616
92,1253094730939973634,https://twitter.com/7eleven/status/1253094730939973634,7eleven,,What better way to serve healthcare heroes and patients’ families than to bring our store to them! Our first-ever hospital pop-up store at Children’s Medical Center Dallas is doing just that.,2020-04-22 22:53:59+00:00,11,36,,,1253094730939973634
92,1253085511201292290,https://twitter.com/7eleven/status/1253085511201292290,7eleven,Tiscuit,"We're sorry to hear about this experience. Would you be able to send us a private message, so we can look into this further? Thank you.",2020-04-22 22:17:21+00:00,1,0,,,1253085511201292290
92,1253076649316438020,https://twitter.com/7eleven/status/1253076649316438020,7eleven,IsoDJo,"We do it all for you, D'Jovens! ",2020-04-22 21:42:08+00:00,1,1,,,1253076649316438020
92,1253072898287439873,https://twitter.com/7eleven/status/1253072898287439873,7eleven,ToBeGuided,BRB gonna go cry ,2020-04-22 21:27:14+00:00,0,1,,,1253072898287439873
92,1253070979686957067,https://twitter.com/7eleven/status/1253070979686957067,7eleven,allycatbaco,Our Big Bite hot dogs miss you more ,2020-04-22 21:19:37+00:00,0,1,,,1253070979686957067
92,1253454386442809345,https://twitter.com/ChineseTheatres/status/1253454386442809345,ChineseTheatres,iNCREDiPiNOY,it was a great day!,2020-04-23 22:43:08+00:00,0,1,,,1253454386442809345
92,1253407283033198593,https://twitter.com/ChineseTheatres/status/1253407283033198593,ChineseTheatres,RaWiltberger, ,2020-04-23 19:35:58+00:00,0,0,,,1253407283033198593
92,1253387280007311362,https://twitter.com/ChineseTheatres/status/1253387280007311362,ChineseTheatres,,One year ago today - #Avengers assemble!,2020-04-23 18:16:29+00:00,115,525,,#Avengers,1253387280007311362
92,1253363366413791232,https://twitter.com/ChineseTheatres/status/1253363366413791232,ChineseTheatres,,#TBT the #Avengers assembled in the forecourt one year ago today! @RobertDowneyJr @chrishemsworth @ChrisEvans @MarkRuffalo @JeremyRenner @Kevfeige #ScarlettJohanson,2020-04-23 16:41:27+00:00,191,847,@RobertDowneyJr @chrishemsworth @ChrisEvans @MarkRuffalo @JeremyRenner @Kevfeige,#TBT #Avengers #ScarlettJohanson,1253363366413791232
92,1253010169383927808,https://twitter.com/ChineseTheatres/status/1253010169383927808,ChineseTheatres,,Happy birthday Jack Nicholson! He's pictured at his imprint ceremony in 1974.,2020-04-22 17:17:58+00:00,4,22,,,1253010169383927808
92,1253006543160635392,https://twitter.com/ChineseTheatres/status/1253006543160635392,ChineseTheatres,,#AskLevi with @EmceeLeviTinker returns this Friday at 1 pm pt. Use #AskLevi to submit your @ChineseTheatres questions and join in.,2020-04-22 17:03:34+00:00,2,15,@EmceeLeviTinker @ChineseTheatres,#AskLevi #AskLevi,1253006543160635392
92,1252635948975718400,https://twitter.com/ChineseTheatres/status/1252635948975718400,ChineseTheatres,,.@RealHughJackman put his imprints in cement 11 years ago today!,2020-04-21 16:30:57+00:00,2,17,@RealHughJackman,,1252635948975718400
92,1252378230864015363,https://twitter.com/ChineseTheatres/status/1252378230864015363,ChineseTheatres,tcm,#LetsMovie!,2020-04-20 23:26:52+00:00,3,12,,#LetsMovie,1252378230864015363
92,1251965382769795072,https://twitter.com/ChineseTheatres/status/1251965382769795072,ChineseTheatres,,Here's Debbie Reynolds at her imprint ceremony in 1965. You can watch her in Singin' in the Rain on @TCM today at 3 pm pt as part of #TCMFF. You might recognize the movie theatre too!,2020-04-19 20:06:22+00:00,37,227,@tcm,#TCMFF,1251965382769795072
92,1251661625951543296,https://twitter.com/ChineseTheatres/status/1251661625951543296,ChineseTheatres,denker,can't wait for next year! #TCMFF,2020-04-18 23:59:21+00:00,0,2,,#TCMFF,1251661625951543296
92,1251634875389509632,https://twitter.com/ChineseTheatres/status/1251634875389509632,ChineseTheatres,,Here's looking at Humphrey Bogart putting his imprints in cement in 1946. Casablanca is showing tonight at 5 pm pt on @TCM as part of this year's #TCMFF,2020-04-18 22:13:03+00:00,44,238,@tcm,#TCMFF,1251634875389509632
92,1251353416338599941,https://twitter.com/ChineseTheatres/status/1251353416338599941,ChineseTheatres,EliseCD,definitely!,2020-04-18 03:34:38+00:00,0,1,,,1251353416338599941
92,1251316488159428608,https://twitter.com/ChineseTheatres/status/1251316488159428608,ChineseTheatres,,#FBF to Burt Reynolds putting his imprints in cement in 1981. You can watch Deliverance tonight at 7:00 pm pt on @TCM as part of this year's #TCMFF,2020-04-18 01:07:53+00:00,20,105,@tcm,#FBF #TCMFF,1251316488159428608
92,1251245310354919424,https://twitter.com/ChineseTheatres/status/1251245310354919424,ChineseTheatres,RaWiltberger,@EmceeLeviTinker #AskLevi,2020-04-17 20:25:03+00:00,0,0,@EmceeLeviTinker,#AskLevi,1251245310354919424
92,1251244036637118465,https://twitter.com/ChineseTheatres/status/1251244036637118465,ChineseTheatres,RaWiltberger,good one!,2020-04-17 20:19:59+00:00,0,1,,,1251244036637118465
92,1253277462835806208,https://twitter.com/varsitarianust/status/1253277462835806208,varsitarianust,,Several Thomasian alumni donated Covid-19 test booths to local health departments and personal protective equipments to medical frontliners.,2020-04-23 11:00:06+00:00,23,38,,,1253277462835806208
92,1253159175368044544,https://twitter.com/varsitarianust/status/1253159175368044544,varsitarianust,,A heartwarming song was written by a Conservatory of Music senior to extend his appreciation to healthcare frontliners amid the outbreak of coronavirus disease.,2020-04-23 03:10:04+00:00,19,26,,,1253159175368044544
92,1252560576342982656,https://twitter.com/varsitarianust/status/1252560576342982656,varsitarianust,,"#Editorial: If Philippines has become a sitting duck and a very clear target by the worsening global pandemic, it is simply because the foremost resident of Malacañang by the dirty waters of the Pasig is Peking’s Duck.",2020-04-21 11:31:27+00:00,39,52,,#Editorial,1252560576342982656
92,1252495082004951040,https://twitter.com/varsitarianust/status/1252495082004951040,varsitarianust,,"JUST IN: Manila Mayor Isko Moreno has ordered a 48-hour “hard lockdown” of the entire Sampaloc district from April 23 to April 25 for disease surveillance, rapid risk assessment and testing operations amid the Covid-19 crisis. (Source: Manila Public Information Office)",2020-04-21 07:11:12+00:00,58,125,,,1252495082004951040
92,1252492280587522049,https://twitter.com/varsitarianust/status/1252492280587522049,varsitarianust,,"Aegis Juris fraternity members indicted in the hazing death of Horacio “Atio” Castillo III have filed motions for temporary release, citing the supposed risk of contracting Covid-19 in the congested Manila City Jail.",2020-04-21 07:00:04+00:00,38,50,,,1252492280587522049
92,1252084957536612353,https://twitter.com/varsitarianust/status/1252084957536612353,varsitarianust,,#TOMASining: “Dead stars” https://bit.ly/3anvo3u (Art by Catherine Paulene A. Umali/ The Varsitarian),2020-04-20 04:01:31+00:00,29,67,,#TOMASining,1252084957536612353
92,1251797693225025538,https://twitter.com/varsitarianust/status/1251797693225025538,varsitarianust,,See the latest Thomasian news over the past week in the Varsitarian's #NewsWrap.,2020-04-19 09:00:01+00:00,20,30,,#NewsWrap,1251797693225025538
92,1251713380236156930,https://twitter.com/varsitarianust/status/1251713380236156930,varsitarianust,,"#ICYMI: A College of Science alumnus has formed a team to deliver free mental health and psychosocial support services, open to all who experience heightened anxiety, fear and stress caused by the global pandemic.",2020-04-19 03:25:00+00:00,29,55,,#ICYMI,1251713380236156930
92,1251162478370648070,https://twitter.com/varsitarianust/status/1251162478370648070,varsitarianust,,The UST Central Student Council on Friday appealed to administrators to end or freeze the term amid the Covid-19 pandemic.,2020-04-17 14:55:54+00:00,179,798,,,1251162478370648070
92,1251103136351043590,https://twitter.com/varsitarianust/status/1251103136351043590,varsitarianust,,"READ: Former UST vice rector Fr. Virgilio Ojoy, O.P. wrote a personal reflection on the Covid-19 pandemic.",2020-04-17 11:00:06+00:00,23,29,,,1251103136351043590
92,1250740723814551553,https://twitter.com/varsitarianust/status/1250740723814551553,varsitarianust,,"A College of Science alumnus has formed a team to deliver free mental health and psychosocial support services, open to all who experience heightened anxiety, fear and stress caused by the global pandemic. https://varsitarian.net/features/20200416/thomasian-psychologists-offer-free-mental-health-supporta",2020-04-16 11:00:00+00:00,48,75,,,1250740723814551553
92,1250627482337701888,https://twitter.com/varsitarianust/status/1250627482337701888,varsitarianust,,#Tomasalitaan: Paano nasisikmurang pasipikáhin ng makapangyarihan ang mga walang sala kahit na alam nilang mali ito? (Dibuho ni Rae Isobel N. Tyapon/ The Varsitarian),2020-04-16 03:30:01+00:00,123,373,,#Tomasalitaan,1250627482337701888
92,1250321724693872641,https://twitter.com/varsitarianust/status/1250321724693872641,varsitarianust,,#ICYMI: A Thomasian physician and health reform advocate has been tapped to provide medical expertise for the National Action Plan to combat the Covid-19 outbreak.,2020-04-15 07:15:03+00:00,22,38,,#ICYMI,1250321724693872641
92,1250022403154915328,https://twitter.com/varsitarianust/status/1250022403154915328,varsitarianust,,"Isinalin ng UST Sentro sa Salin at Araling Salin ang ilang kautusan ng gobyerno, kabilang na ang “emergency powers” ng Pangulong Duterte kaugnay sa coronavirus disease, upang lubusang maintindihan ng mga mamamayan.",2020-04-14 11:25:39+00:00,30,39,,,1250022403154915328
92,1249970678024908800,https://twitter.com/varsitarianust/status/1249970678024908800,varsitarianust,,The University announced that it would continue online classes until the end of the second term. Here is the schedule of online classes and final exams for graduating and non-graduating students. (Art by Jan Kristopher T. Esguerra/ The Varsitarian),2020-04-14 08:00:07+00:00,313,1144,,,1249970678024908800
92,1253323624032813060,https://twitter.com/TilburgU/status/1253323624032813060,TilburgU,,Door het coronavirus worden colleges op afstand gegeven. Maar bij hoogleraar Anne Rutkowski zitten de collegebanken nog bomvol. Via Second Life geeft ze colleges. Studenten kunnen met vragen bij haar langskomen in haar kantoor met uitzicht op zee.,2020-04-23 14:03:32+00:00,2,7,,,1253323624032813060
92,1253298301866213377,https://twitter.com/TilburgU/status/1253298301866213377,TilburgU,,"Onderzoekers van #TilburgU zijn op zoek naar ouders met kinderen tussen de 1 en 10 jaar die interesse hebben om al hun ervaringen, zowel positieve als negatieve, rondom opvoeden tijdens de COVID-19 uitbraak met ons te delen. Wil je meedoen? ",2020-04-23 12:22:54+00:00,5,6,,#TilburgU,1253298301866213377
92,1253249997526704128,https://twitter.com/TilburgU/status/1253249997526704128,TilburgU,,"Ranking news! In @timeshighered Impact rankings 2020, #TilburgU is ranked 9th worldwide on Sustainable Development Goal 16 – Peace, Justice, and Strong Institutions. We perform especially well on SDG 16 related research and university governance measures. https://www.tilburguniversity.edu/current/news/more-news/tilburg-university-ranks-high-peace-justice-and-strong-institutions",2020-04-23 09:10:58+00:00,3,14,@timeshighered,#TilburgU,1253249997526704128
92,1252977931682557957,https://twitter.com/TilburgU/status/1252977931682557957,TilburgU,,Met het COVID-19 Resilient Society Platform kijken we samen naar urgente knelpunten en toekomstige vraagstukken in deze #coronacrisis. Nieuwsgierig? Volg het platform op Twitter @resilientnowNL en bekijk het initiatief via http://www.resilientsociety.nl #connecteduniversitiesNL,2020-04-22 15:09:52+00:00,0,0,@resilientnowNL,#coronacrisis #connecteduniversitiesNL,1252977931682557957
92,1252974180041134080,https://twitter.com/TilburgU/status/1252974180041134080,TilburgU,,'Met het Oog op Morgen' met @TilburgU hoogleraar Ton @Wilthagen: Wat betekent de coronacrisis voor veertigers? https://www.nporadio1.nl/nos-met-het-oog-op-morgen/onderwerpen/535527-wat-betekent-de-coronacrisis-voor-veertigers via @nporadio1,2020-04-22 14:54:58+00:00,1,2,@TilburgU @Wilthagen @NPORadio1,,1252974180041134080
92,1252956571149180929,https://twitter.com/TilburgU/status/1252956571149180929,TilburgU,koenvdrkrieken,"Beste Koen, Je kunt proberen om de browser af te sluiten (sluit alle browser-sessies), hem opnieuw te starten en dan Pure opnieuw te starten. Bij blijvende problemen, kun je contact opnemen met je Pure-coordinator (https://www.tilburguniversity.edu/tiu_contact/609). ^PS",2020-04-22 13:45:00+00:00,0,1,,,1252956571149180929
92,1252940842161115136,https://twitter.com/TilburgU/status/1252940842161115136,TilburgU,,'Met het Oog op Morgen' met @TilburgU hoogleraar Margriet Sitskoorn: Hoe de coronacrisis de 50-plusser beïnvloedt https://www.nporadio1.nl/nos-met-het-oog-op-morgen/onderwerpen/535595-hoe-de-coronacrisis-de-50-er-beinvloedt via @nporadio1,2020-04-22 12:42:29+00:00,1,3,@TilburgU @NPORadio1,,1252940842161115136
92,1252862884683472896,https://twitter.com/TilburgU/status/1252862884683472896,TilburgU,deVSNU,Nieuwe Corona-update van @deVSNU Houd onze website in de gaten met betrekking tot @TilburgU http://www.tilburguniversity.edu/coronavirus,2020-04-22 07:32:43+00:00,0,0,@deVSNU @TilburgU,,1252862884683472896
92,1252560358398660608,https://twitter.com/TilburgU/status/1252560358398660608,TilburgU,,"Research @TilburgU indicates that high-skilled workers spend more time in the home office, while less-skilled workers are more likely to work reduced hours or lose their jobs. http://tilburguniversity.edu/current/news/more-news/low-income-earners-suffer-most-covid-19-crisis",2020-04-21 11:30:35+00:00,0,0,@TilburgU,,1252560358398660608
92,1252194468209594368,https://twitter.com/TilburgU/status/1252194468209594368,TilburgU,,There are many questions about online examinations. Rector Magnificus Klaas Sijtsma explains @universtweet about the introduction of proctoring. Also read the statement of @VSNU (in Dutch) https://vsnu.nl/nl_NL/nieuwsbericht/nieuwsbericht/587-statement-vsnu-over-proctoring.html,2020-04-20 11:16:40+00:00,2,10,@universtweet @vsnu,,1252194468209594368
92,1252190391203495938,https://twitter.com/TilburgU/status/1252190391203495938,TilburgU,,"Lokke Moerel @LMoerel, professor of Global ICT Law, is zeer kritisch op corona-apps. ""Ook als de app vrijwillig is, zullen werkgevers een ‘groene code’ eisen voor je naar kantoor mag."" http://volkskrant.nl/nieuws-achtergrond/deze-techhoogleraar-zelf-herstellende-van-het-virus-is-zeer-kritisch-op-corona-apps-en-niet-eens-zozeer-vanwege-privacy~b68b7454/",2020-04-20 11:00:28+00:00,1,4,@LMoerel,,1252190391203495938
92,1252190144632938497,https://twitter.com/TilburgU/status/1252190144632938497,TilburgU,,Er zijn veel vragen over online tentaminering. Rector magnificus Klaas Sijtsma vertelt aan @universtweet over de invoer van proctoring. (Engelse vertaling volgt) Lees ook de verklaring van @VSNU: http://vsnu.nl/nl_NL/nieuwsbericht/nieuwsbericht/587-statement-vsnu-over-proctoring.html,2020-04-20 10:59:29+00:00,0,0,@universtweet @vsnu,,1252190144632938497
92,1251146067229372417,https://twitter.com/TilburgU/status/1251146067229372417,TilburgU,,Hora Est! De eerste digitale promotie @TilburgU is een feit! Gefeliciteerd Chris Hartgerink !,2020-04-17 13:50:42+00:00,2,22,@TilburgU,,1251146067229372417
92,1250774419103981568,https://twitter.com/TilburgU/status/1250774419103981568,TilburgU,,Nine #TilburgU researchers received NWO grant for research into corona crisis issues. The data can be only collected during this crisis and the issues must arise during the crisis in society. More info about the applications. ,2020-04-16 13:13:54+00:00,8,22,,#TilburgU,1250774419103981568
92,1250418184512917514,https://twitter.com/TilburgU/status/1250418184512917514,TilburgU,Fjedew,Je kunt daarvoor het volgende e-mailadres gebruiken: psychology-numerusfixus@tilburguniversity.edu. Zie ook de volgende pagina voor meer informatie: https://www.tilburguniversity.edu/nl/onderwijs/bacheloropleidingen/psychologie/toelating-en-aanmelding Vriendelijke groet ^PS #TilburgU,2020-04-15 13:38:21+00:00,0,0,,#TilburgU,1250418184512917514
92,1251098965027762176,https://twitter.com/nuerburgring/status/1251098965027762176,nuerburgring,,"Virtual racing on the Nordschleife - here we go again! Race 3 of the Digital Nürburgring Endurance Series Saturday, from 11:00 pm LIVE on YouTube 60 race cars in four classes On the grid: @BrunoSpengler, @edomortara, @MartinTomczyk and many more #nring @vln_de",2020-04-17 10:43:32+00:00,15,83,@BrunoSpengler @edomortara @MartinTomczyk @vln_de,#nring,1251098965027762176
92,1250711193490251777,https://twitter.com/nuerburgring/status/1250711193490251777,nuerburgring,,"@rockamring will be back in 2021 The ban on all major events until 31 August also affects our favorite rock festival at the Nürburgring. New date: June 11-13, 2021 The organizer will soon provide details on the processing of tickets",2020-04-16 09:02:40+00:00,1,1,@rockamring,,1250711193490251777
92,1248556562240679938,https://twitter.com/nuerburgring/status/1248556562240679938,nuerburgring,,See you soon! #nring,2020-04-10 10:20:56+00:00,21,337,,#nring,1248556562240679938
