age,id,permalink,username,to,text,date,retweets,favorites,mentions,hashtags,geo
92,1247873597693210625,https://twitter.com/nuerburgring/status/1247873597693210625,nuerburgring,,We go full throttle for good news! New dates for @vln_de Nürburgring endurance series . Start of the season is planned for June 27 Races 2 and 3 on one weekend Season finale on November 21st Overview of the dates: http://nuerburgring.de #nring #nls,2020-04-08 13:07:04+00:00,17,76,@vln_de,#nring #nls,1247873597693210625
92,1246367679218364416,https://twitter.com/nuerburgring/status/1246367679218364416,nuerburgring,,LIVE: Nürburgring Experten-Talk on YouTube 01:00 PM: RACE 2 | Digital Nürburgring Endurance Series https://youtu.be/UM7Q0i9_R-4,2020-04-04 09:23:05+00:00,2,29,,,1246367679218364416
92,1245657656594796545,https://twitter.com/nuerburgring/status/1245657656594796545,nuerburgring,,Support your favorite racetrack Green lights for Team #Nürburgring! Support our team on Saturday at the race of the Digital Nürburgring Endurance Series. @AndreasGuelden and @ScheiderTimo share the cockpit in the TCR class @vln_de,2020-04-02 10:21:43+00:00,6,59,@AndreasGuelden @ScheiderTimo @vln_de,#N,1245657656594796545
92,1242539905831616519,https://twitter.com/nuerburgring/status/1242539905831616519,nuerburgring,,"""Car of the Year 2020"" spotted on the #Nordschleife +++ Available in your supermarket +++ Also for your neighbor if you leave him anything left +++",2020-03-24 19:52:53+00:00,417,1745,,#Nordschleife,1242539905831616519
92,1241338064808615936,https://twitter.com/nuerburgring/status/1241338064808615936,nuerburgring,,Green lights for the digital season start at the #Nurburgring! Livestream: http://nri.ng/seasonstart2020 @vln_de #nring,2020-03-21 12:17:12+00:00,10,62,@vln_de,#Nurburgring #nring,1241338064808615936
92,1241302201185775616,https://twitter.com/nuerburgring/status/1241302201185775616,nuerburgring,,Virtual season start at the Nürburgring! Join us: https://youtu.be/765aQ1UNDTI @vln_de,2020-03-21 09:54:41+00:00,14,96,@vln_de,,1241302201185775616
92,1241056678549827585,https://twitter.com/nuerburgring/status/1241056678549827585,nuerburgring,,#StayAtHome - Nürburgring Edition,2020-03-20 17:39:04+00:00,46,237,,#StayAtHome #StayAtHome,1241056678549827585
92,1240283602849599490,https://twitter.com/nuerburgring/status/1240283602849599490,nuerburgring,,"Tourist drives and all other driving courses at the #Nürburgring are cancelled until April 19th! This includes our formula courses, co-pilot rides and other offers. To be up to date, please can check the opening hours on our website.",2020-03-18 14:27:08+00:00,17,69,,#N,1240283602849599490
92,1239953632604360704,https://twitter.com/nuerburgring/status/1239953632604360704,nuerburgring,,#nringNews : Infos about the @24hNBR postponement to September ,2020-03-17 16:35:57+00:00,14,27,@24hNBR,#nringNews,1239953632604360704
92,1239947620103139333,https://twitter.com/nuerburgring/status/1239947620103139333,nuerburgring,,ADAC TOTAL 24h race in September! New date for our famous @24hNBR: 24th to 27th September 2020. Your tickets remain valid. The #Nürburgring Endurance Series which was planned on this weekend will take place on November 7th. Further info: https://www.nuerburgring.de/,2020-03-17 16:12:04+00:00,134,222,@24hNBR,#N,1239947620103139333
92,1236190166466924544,https://twitter.com/nuerburgring/status/1236190166466924544,nuerburgring,,Touristenfahrten 2020 - here we go! #nring #nurburgring,2020-03-07 07:21:17+00:00,44,393,,#nring #nurburgring,1236190166466924544
92,1235971884522647552,https://twitter.com/nuerburgring/status/1235971884522647552,nuerburgring,,Ready for #Nürburgring Touristenfahrten 2020! Tomorrow the first session of the year will start! #nring,2020-03-06 16:53:55+00:00,13,124,,#N #nring,1235971884522647552
92,1251220733856043015,https://twitter.com/SecDef19/status/1251220733856043015,SecDef19,,It is rather itchy.,2020-04-17 18:47:24+00:00,3,34,,,1251220733856043015
92,1251220246549102593,https://twitter.com/SecDef19/status/1251220246549102593,SecDef19,,Pleased to report that I am winning my family's quarantine beard competition. My first beard since 1987.,2020-04-17 18:45:27+00:00,8,168,,,1251220246549102593
92,1248380326985924613,https://twitter.com/SecDef19/status/1248380326985924613,SecDef19,jteurope,"That same daughter, Robin Perry, is the editor for my upcoming book. A wonderful editor, although I may be biased.",2020-04-09 22:40:38+00:00,0,3,,,1248380326985924613
92,1248379624767152130,https://twitter.com/SecDef19/status/1248379624767152130,SecDef19,arflynn23,Gardening season starts much earlier here than in Butler!,2020-04-09 22:37:50+00:00,0,1,,,1248379624767152130
92,1248006067704836097,https://twitter.com/SecDef19/status/1248006067704836097,SecDef19,arflynn23,"Peas and lettuce growing strong, should be transplanting the tomato, cucumber, and squash seedlings outside later this week.",2020-04-08 21:53:28+00:00,0,6,,,1248006067704836097
92,1247998351175487489,https://twitter.com/SecDef19/status/1247998351175487489,SecDef19,,"And if you are eager to get a jump on your summer reading, you may pre-order the new book I have co-authored with @TomCollina, ""The Button: The New Nuclear Arms Race and Presidential Power from Truman to Trump,"" here:",2020-04-08 21:22:48+00:00,15,44,@TomCollina,,1247998351175487489
92,1247996548182654976,https://twitter.com/SecDef19/status/1247996548182654976,SecDef19,,"If you are a fellow Opera fan, I can highly recommend @MetOpera on Demand, although at my current pace I fear I will have watched every video before the year is out.",2020-04-08 21:15:38+00:00,3,21,@MetOpera,,1247996548182654976
92,1247981833821839360,https://twitter.com/SecDef19/status/1247981833821839360,SecDef19,,"In these unusual times I have taken some time away from social media and instead busied myself with my upcoming book, my garden, and a steady diet of opera to keep up the spirits.",2020-04-08 20:17:10+00:00,14,174,,,1247981833821839360
92,1247979500777979904,https://twitter.com/SecDef19/status/1247979500777979904,SecDef19,PeterANewell,And debuting my quarantine beard,2020-04-08 20:07:53+00:00,0,6,,,1247979500777979904
92,1245477590170832897,https://twitter.com/SecDef19/status/1245477590170832897,SecDef19,,"""The COVID-19 pandemic is no longer a question of public health; it is a matter of national security and respect for human life and dignity.""",2020-04-01 22:26:12+00:00,39,100,,,1245477590170832897
92,1243273360500494352,https://twitter.com/SecDef19/status/1243273360500494352,SecDef19,,My beautiful companions these past few weeks,2020-03-26 20:27:22+00:00,8,135,,,1243273360500494352
92,1232839157128536065,https://twitter.com/SecDef19/status/1232839157128536065,SecDef19,LSRTweets,"Thank you @LSRTweets, it has been an honor and a privilege to work alongside so many brilliant and capable women throughout my career.",2020-02-27 01:25:34+00:00,0,0,@LSRTweets,,1232839157128536065
92,1232838009982197761,https://twitter.com/SecDef19/status/1232838009982197761,SecDef19,LisaAtTheBrink,Very excited as well - keep up the good work!,2020-02-27 01:21:01+00:00,0,0,,,1232838009982197761
92,1220398414418075649,https://twitter.com/SecDef19/status/1220398414418075649,SecDef19,tedlieu,"It can be easy to feel despair when the scientists behind the #DoomsdayClock say we are closer to Midnight than ever before - but there are direct actions we can take to turn back the clock, like passing legislation to require congressional approval for a nuclear first strike",2020-01-23 17:30:30+00:00,23,38,,#DoomsdayClock,1220398414418075649
92,1220387787960147968,https://twitter.com/SecDef19/status/1220387787960147968,SecDef19,,"The #DoomsdayClock has moved closer to Midnight than ever before, but that does not mean that we are doomed - there are real, concrete actions that we can take to turn back the clock. Learn what we can do and how we got here from my new podcast @AtTheBrinkPod launching in March",2020-01-23 16:48:17+00:00,32,50,@AtTheBrinkPod,#DoomsdayClock,1220387787960147968
92,1182665020792025088,https://twitter.com/South/status/1182665020792025088,South,,Why I ditched DropBox:,2019-10-11 14:31:28+00:00,0,0,,,1182665020792025088
92,1158336471314718720,https://twitter.com/South/status/1158336471314718720,South,,New ‘Rest’ module goes live into The Workout Coach:,2019-08-05 11:18:30+00:00,0,0,,,1158336471314718720
92,1156152574174793728,https://twitter.com/South/status/1156152574174793728,South,,The Workout Coach: Additional Payment Options:,2019-07-30 10:40:28+00:00,0,1,,,1156152574174793728
92,1101519511730176000,https://twitter.com/South/status/1101519511730176000,South,,Why I created the The Workout Coach,2019-03-01 16:28:11+00:00,0,0,,,1101519511730176000
92,1096077944827596800,https://twitter.com/South/status/1096077944827596800,South,,New MediRegs full demo video:,2019-02-14 16:05:20+00:00,0,0,,,1096077944827596800
92,1087738525968154624,https://twitter.com/South/status/1087738525968154624,South,,What are Progressive Web Apps?,2019-01-22 15:47:28+00:00,1,0,,,1087738525968154624
92,1087738461082304512,https://twitter.com/South/status/1087738461082304512,South,,Our new PWA: The Workout Coach:,2019-01-22 15:47:12+00:00,0,0,,,1087738461082304512
92,1070654361221652480,https://twitter.com/South/status/1070654361221652480,South,,A Japanese influenced site design for http://a24.io including a responsive CMS development,2018-12-06 12:21:06+00:00,0,0,,,1070654361221652480
92,1070654303419936772,https://twitter.com/South/status/1070654303419936772,South,,"A highly visual and fully-responsive, content-managed website for a ground-breaking image server provider.",2018-12-06 12:20:52+00:00,0,0,,,1070654303419936772
92,899964593270861824,https://twitter.com/South/status/899964593270861824,South,,"""MediRegs includes MHRA Licensed Wholesale numbers in search results"" https://www.linkedin.com/pulse/mediregs-includes-mhra-licensed-wholesale-numbers-search-houlden on @LinkedIn",2017-08-22 12:00:54+00:00,1,0,@LinkedIn,,899964593270861824
92,748215925766262788,https://twitter.com/South/status/748215925766262788,South,,"""MediRegs and the MHRA – How SaaS reacts to changes."" https://lnkd.in/e7MEah5 on @LinkedIn",2016-06-29 18:05:52+00:00,0,4,@LinkedIn,,748215925766262788
92,717021162967080960,https://twitter.com/South/status/717021162967080960,South,,New software from South˚ Manage Your Regulatory Responsibilities in a Few Clicks https://www.linkedin.com/pulse/manage-your-regulatory-responsibilities-few-clicks-martin-houlden,2016-04-04 16:09:01+00:00,0,0,,,717021162967080960
92,715484077789306880,https://twitter.com/South/status/715484077789306880,South,,Brexit effect on the Pharmaceutical industry.,2016-03-31 10:21:11+00:00,0,0,,,715484077789306880
92,694849839528591360,https://twitter.com/South/status/694849839528591360,South,,7 Easy Ways To Achieve A 7% Response Rate https://www.linkedin.com/pulse/7-easy-ways-achieve-response-rate-martin?trk=mp-reader-card,2016-02-03 11:48:06+00:00,0,2,,,694849839528591360
92,694847007962300416,https://twitter.com/South/status/694847007962300416,South,,"""Ding dong the Desktop’s dead…"" https://www.linkedin.com/pulse/ding-dong-desktops-dead-martin-houlden-digital-marketing-consultant?trk=prof-post",2016-02-03 11:36:50+00:00,1,1,,,694847007962300416
